,Text
682,Basta con queste dirette Facebook! Bastaaaaaa #coronavirus
683,"Coronavirus, dottoressa nel mirino di un condominio. L'ospedale: ""Atto vergognoso"" https://iltirreno.gelocal.it/pisa/cronaca/2020/03/24/news/coronavirus-dottoressa-nel-mirino-di-un-condominio-1.38630775 via @iltirreno"
684,"Non so quale sia la fonte che indica che gli immigrati non muoiono di coronavirus, però in buona parte è spiegabile con l'età: chi muore di coronavirus ha un'età media di 80 anni, mentre l'età mediana degli immigrati è di 32,5 anni (contro gli 44,3 degli italiani)."
685,"Ma se non fanno tamponi neppure a chi presenta sintomi, come fanno a dire che diminuiscono i contagi? #coronavirus @Quirinale #Mattarella #coronavirus @Corriere @ilgiornale @LaVeritaWeb @LaStampa @ilmessaggeroit @SkyTG24 @MediasetTgcom24 @TgLa7 @DPCgov"
686,Parole che propongo di abolire finita questa emergenza: Smartworking Tampone Assembramenti #COVID2019 #tampone #coronavirus #accademiadellacrusca
687,"Coronavirus. Falcomatà: “Rientrano in Sicilia 150 persone, la politica non è uno show” "
688,CORONAVIRUS - La Golden Laundry di Giovanni e Antonio Lavornia confeziona e dona mascherine per uso personale ai cittadini di Dragoni GUARDA LE FOTO https://www.casertafocus.net/home/index.php?option=com_content&amp;view=article&amp;id=34279:coronavirus-la-golden-laundry-di-giovanni-e-antonio-lavornia-confeziona-e-dona-mascherine-per-uso-personale-ai-cittadini-di-dragoni-siamo-cresciuti-con-i-valori-del-lavoro-e-della-solidarieta-ed-e-per-questo-motivo-che-raccogliamo-e-condividiamo-gli-svariati-appelli-di-questi-drammatici-giorni-da-piu-parti-giustamente-rivolti-anche-a-noi-imprenditori&amp;catid=8:notizie&amp;Itemid=130
689,"I miei genitori a 14 anni non sono mai riusciti a tenermi in casa, ci stanno riuscendo adesso che ne ho 50. #coronavirus #quarantena #anziani #bovalcafelatevaalet"
690,A mi también me han llegado esos correos falsos de Paypal con encabezado de Coronavirus.
691,"Elena, la figlia del medico morto di Coronavirus: 'Ora ho capito davvero chi era mio padre' https://www.trapani-24h.it/elena-la-figlia-del-medico-morto-di-coronavirus-ora-ho-capito-davvero-chi-era-mio-padre/"
692,"Coronavirus Lombardia, tornano a salire i contagiati e le vittime "
693,Coronavirus si è spento il drammaturgo Terrence McNally - #Coronavirus #spento #drammaturgo
694,"LILT ha messo a disposizione il numero verde per dare assistenza psicologica a coloro che lottano contro il cancro. Chiama l'800.998877 dal lunedì a venerdì, dalle 10 alle 15. Il servizio è anonimo e gratuito. http://www.legatumoripiacenza.it/Notizia/104/Coronavirus-LILT-fornisce-assistenza-psicologica-ai-malati-di-tumore.aspx?Lang=ITA #coronavirus #iorestoacasa #lilt #oncology"
695,L’Italia in agonia per il coronavirus offre il suo aiuto alla Croazia colpita dal terremoto 
696,Sentiamo un Sindaco @diMartedi #coronavirus #dimartedì
697,De cada 100 casos de coronavirus entra na estatística do ministério 14. Ainda acho alto
698,"#dimartedi Coronavirus, Ignazio Visco (Banca d'Italia): ""Più saranno tutelate le famiglie, più saranno tutelate le imprese, più saremo capaci di dare risposte rapide"" "
699,"Mettere in galera questa gentaglia!!!! Coronavirus, sequestrati respiratori in partenza per la Grecia "
700,Anche in questa opinione si avanzano seri dubbi sulla gestione dell’emergenza in #Lombardia e su quali siano state le vere priorità della classe politica in carica ... con tanti amici e conoscenti in tutta la regione “posso essere un po’ incazzato”? #COVID19 #coronavirus 
701,Hellas Verona in campo per il Coronavirus: l’iniziativa del club - #Hellas #Verona #campo #Coronavirus: https://www.zazoom.it/2020-03-25/hellas-verona-in-campo-per-il-coronavirus-liniziativa-del-club/6421672/
702,"Coronavirus, in Spagna contagi record e 2700 morti. Francia quinto Paese a superare i mille decessi. Oms: Usa possono superare Europa"
703,"Coronavirus, Augias su La7: “Conte sta facendo cose che nessun presidente del Consiglio ha mai dovuto fare dal 1948 a oggi” https://www.ilfattoquotidiano.it/2020/03/24/coronavirus-augias-su-la7-conte-sta-facendo-cose-che-nessun-presidente-del-consiglio-ha-mai-dovuto-fare-dal-1948-a-oggi/5747262/ di @fattoquotidiano"
704,"#Coronavirus, maturità light. Ipotesi: commissioni interne, no seconda prova #scuola"
705,What will happen to: Prisoners People in nursing homes Immigrants The homeless The elderly who live alone ❓ #coronavirus
706,"Coronavirus Lombardia, tornano a salire i contagiati e le vittime "
707,"Coronavirus, braccio di ferro sullo Stretto. La Sicilia continua a dire no ai rientri, oltre 100 persone bloccate all'imbarco [aggiornamento delle 22:57] "
708,#COVID19 #coronavirus #parma
709,"Coronavirus: Attività essenziali devono andare avanti, il resto si fermi "
710,"Coronavirus, Iglesias: denunciato perché uscito di casa senza motivo esce di nuovo e ruba "
711,Los libros de deportes para leer durante la cuarentena por el coronavirus https://www.marketingregistrado.com/ar/noticias/2020/03/29976_los-libros-de-deportes-para-leer-durante-la-cuarentena-por-el-coronavirus/
712,"#Ruffini su #coronavirus: ""Le cartelle di pagamenti sono sospese per tutti. I pagamenti in scadenza a marzo sono sospesi per alcune categorie. Le multe dipendono dagli enti locali, noi non stiamo inviando più nulla in questa fase così difficile"" #dimartedì"
713,«Coronavirus: c’è un depistaggio di Stato sugli sbarchi a Messina» 
714,"24/03/2020 Anita, mamma in prestito per tutti i nostri cuccioli, non fa eccezione per il nostro Benji, e se lo lava tutto con tanto tanto affetto!! Ricordiamo che il coronavirus non è trasmesso all'uomo da gatti e… https://www.instagram.com/p/B-Iio9CKikY/?igshid=y96ra7k40rgd"
715,#FacciamoRete #FacciamoInformazione #Coronavirus #Russia #Italia
716,"Compiti delle vacanze: trova il tuo personalissimo ordine nel caos. Decreto: non copiare, ora si vede 🌏❤🎻 @diMartedi #coronavirus"
717,"Coronavirus, De Luca lancia i droni con la sua voce: 'Dove ca….o vai? Torna a casa', "
718,il regime di Mullah sta approfittando del #coronavirus usando come scudo umano le vite del popolo. Non accetta aiuti medici e i medici senza frontiere sono stati espulsi dall'Iran. I lobbisti di @NIACouncil sostengono che le sanzioni siano la causa del decessi #COVIDSanctionsLie
719,Complimenti a @Aifa_ufficiale che invece di seguire l'evidenza scientifica cede alle pressioni di @zaiapresidente. #COVID19 #coronavirus #COVID19italia #coronvirusitalia
720,"Annunciato il primo caso, ovvero il #coronavirus circola indisturbato (da quanto tempo e quanto diffusamente non possiamo saperlo) anche in #Libia. Questo si aggiunge agli ""orrori indicibili"" che, purtroppo, non vengono sospesi. Quale protezione per cittadini e #migranti? https://twitter.com/Abd0Assad/status/1242574850427944960"
721,"24/03/2020 Anita, mamma in prestito per tutti i nostri cuccioli, non fa eccezione per il nostro Benji, e se lo lava tutto con tanto tanto affetto!! Ricordiamo che il coronavirus non è trasmesso all'uomo da gatti e… https://www.instagram.com/p/B-IikEbKV0p/?igshid=8ju5ax64de9p"
722,Il Comitato Scientifico francese consiglia a Macron di attuare un isolamento di almeno 6 settimane. #CoronaVirus #Covid_19 #COVID19 #COVIDー19
723,Gli #infermieri della #AsldiFrosinone impegnati nell'emergenza #coronavirus invitano i cittadini a restare a casa...ognuno di noi responsabilmente è chiamato a fare la sua parte 
724,#Libia Primo caso ufficiale di coronavirus a Tripoli.
725,"Che persona triste, un perdente. Guardi non sono medico, ma con me non fa il gradasso, sono laureato in scienze politiche... Ascolti persona triste, oggi è partita la sperimentazione di questi due farmaci a NY, aspettiamo i risultati, idiota. #coronavirus "
726,"#Coronavirus, #DonaldTrump: ""Obiettivo è America aperta a Pasqua"" https://tinyurl.com/yx2ekjpd"
727,@AccademiaCrusca ci auguriamo presto di allentare... o ci auguriamo di allentare presto...? una volta era un giornale @Quirinale #Mattarella #coronavirus @ilgiornale @LaVeritaWeb @LaStampa @SkyTG24 @MediasetTgcom24 @TgLa7 @ilmessaggeroit
728,Se non mi ammazza il coronavirus lo faccio io
729,"Conte ha agito tardi e male. Ma appena scoppiata la crisi poteva salvarsi coinvolgendo le opposizioni. Mattarella doveva farsi garante della continuità dei lavori parlamentari. Nulla è stato fatto, e oggi ci troviamo con la più grave crisi istituzionale dal 1943. #coronavirus"
730,"Coronavirus, altri due casi positivi ad Agrigento "
731,"Le cazzate di #BiniSmaghi al #TG5, si esce dalla crisi avendo capacità di indebitarsi. Noooo, si deve nazionalizzare #BancaItalia e si deve stampare moneta per un rilancio economico. Cazzaro! #coronavirus"
732,Linda Lusardi in lotta tra la vita e la morte l’attrice colpita da Coronavirus - #Linda #Lusardi #lotta #morte
733,"Coronavirus Lazio, 40 guariti nelle ultime 24 ore, 188 nuovi casi. Altri 15 anziani positivi in casa di riposo. Infetti 94 medici, Omceo: ""Tamponi a tutti"" [aggiornamento delle 23:25] "
734,Ma se miracolosamente si dovesse trovare e rendere disponibile il #vaccino contro #coronavirus...i #novax cosa decideranno di fare? No mi chiedevo...
735,"Così giusto per dire: non è vietato uscire di casa. È vietato uscire senza un motivo valido. Questo non significa trovare motivi validi, ma cercare di uscire solo se indispensabile. Non state affacciati a controllare chi esce, ma leggetevi un libro. #CoronaVirus #pensierivirali"
736,"#Equipe, la prima pagina che riassume la giornata #coronavirus #Tokyo2020 #Uderzo #Asterix"
737,"Capite perché era importante bloccare la politica economica basata sul debito? Adesso ne abbiamo bisogno e quando ci rialzeremo avremo un debito così grosso che impedirà alla nostra economia di camminare, non correre. Camminare #coronavirus @antonluca_cuoco @GuidoCrosetto"
738,"Tamponi a tappeto a tutta la popolazione,altrimenti non ne veniamo più fuori! Ma quando lo volete capire!!!!! #Conte #coronavirus"
739,"Coronavirus, il bollettino serale della Regione Campania: +91 i contagiati http://sscalcionapoli1926.altervista.org/?p=294518"
740,"Io che parlo con @KekeDirectioner del coronavirus, immaginando una tragica storia d’amore: «Fu una relazione più triste di titanic, separati dalla quarantena, e lui morì. Lei, a novanta anni (come Rose), poco prima di uscire dalla quarantena, disse:"
741,A LO MEJOR NO SE HABIAN ENTERADO. Denunciadas seis personas que llevaban una semana de fiesta en un prostíbulo de Tetuán por infringir el estado de alarma por el coronavirus 
742,"Loro probabilmente sanno già chi fra i malati di coronavirus ha fatto i vaccini e chi no. Se i vaccinati fossero più protetti, ce l'avrebbero detto. Ma non ce l'hanno detto, quindi..."
743,"In tempi di coronavirus una startup delle ciclabili “solari”, BYS, è andata in overfunding http://dlvr.it/RSVPZs"
744,"Coronavirus, informativa del Presidente Conte al Parlamento "
745,"#Pregliasco su #coronavirus: ""Nelle prossime settimane capiremo se le restrizioni stanno funzionando. Per tornare alla normalità ci vorrà ancora un po': io vedo la luce in fondo al tunnel non prima della fine maggio o inizio giugno"" @preglias #dimartedì"
746,"Coronavirus, braccio di ferro sullo Stretto. La Sicilia continua a dire no ai rientri, oltre 100 persone bloccate all'imbarco https://www.repubblica.it/cronaca/2020/03/24/news/coronavirus_40_auto_bloccate_dalle_forze_dell_ordine_sullo_stretto_di_sicilia-252158512/ via @repubblica"
747,"""Sospensione Degli Affitti Per Abitazioni E Negozi E Divieto Di Licenziamento: Il #Venezuela Risponde Alla Crisi #Coronavirus."" #Maduro"
748,"(Coronavirus, Spagna: oltre 2600 morti. Mille in Francia. Boom di contagi in Uk, Usa e Germania. Ma in Svezia bar e negozi ancora aperti. Un terzo della popolazione mondiale chiusa in casa) Playhitmusic - "
749,L'ultima #crisi globale non ha cambiato il mondo. Questa potrebbe? #Coronavirus 
750,"Montesilvano. Quando dal balcone ti metti a dare la caccia a l’untore (che non esiste), devi mettere nel conto che qualcuno potrebbe incazzarsi. 👍#Coronavirus , ripreso dal vicino perché corre gli sfascia la macchina a martellate - Corriere TV "
751,"Está diciendo la verdad....prefieren vivir en una patetica mentira? somos primer mundo y el corona virus no está goelpando duro ..pero estamos resistiendo aquí en Italia, que va a pasar en EU o en Mexico"
752,"#Esteri Coronavirus, come cambia Milano: la «dolce vita» che dovrà scomparire "
753,"#Cronache Coronavirus, Sileri: «Ho temuto di lasciare solo mio figlio. Ora donerò il sangue per la ricerca» "
754,"Fatih Terim positivo al coronavirus, il tecnico del Galatasaray è in ospedale: ""Sono in buone mani"" "
755,"L'ex tecnico di Fiorentina e Milan Fatih Terim, positivo al Coronavirus "
756,"Ci sono ben 69 persone positive al coronavirus tra assistiti e personale di una casa riposo di Villafrati, ne "
757,"Coronavirus, Galli: alcune etnie sono immuni? “E' un'ipotesi” "
758,"Coronavirus, dentro la zona rossa di Villafrati: 69 persone positive in una casa di cura "
759,"Coronavirus, sedici anziani positivi in una Residenza sanitaria assistita: si teme un nuovo focolaio "
760,"Coronavirus, Oms: “Pandemia accelera, 300mila casi in tutto il mondo. Ma possiamo vincere” "
761,"Grecia, coronavirus e nuovi venti di crisi https://www.balcanicaucaso.org/aree/Grecia/Grecia-coronavirus-e-nuovi-venti-di-crisi-200375 di @BalcaniCaucaso"
762,"Coronavirus, l'annuncio dell'OMS: ""La pandemia sta accellerando"" • "
763,"ULTIM’ORA – Coronavirus, l’Oms: “La pandemia accelera in tutto il mondo” "
764,"Coronavirus, Oms: barlume di speranza in Italia "
765,"Coronavirus, l’Oms:”Possiamo cambiare la traiettoria di questa pandemia” "
766,OMS: la pandemia di coronavirus accelera 
767,"Coronavirus: Oms, la pandemia sta accellerando "
768,"Coronavirus, Boris Johnson ordina il lockdown nel Regno Unito "
769,"Coronavirus nel mondo, più di 400mila casi. In Usa 50mila, ma Trump: ""Riapriamo a Pasqua"" "
770,"Too late, coronavirus proved Bernie Sanders was right all along "
771,Coronavirus aggiornamenti Campania del 24 marzo alle ore 22:30: positivi 1194 https://ift.tt/2JboOCb
772,"Coronavirus, Olympics, Canned Tomatoes: Your Tuesday Evening Briefing http://dlvr.it/RSVPQY"
773,"-ci mandiamo sieben makkaroni tortelloni lukatoni, prima fare inkredibile pubblicità come crande regalo a miserabili, loro poi muoiono, essere loro destinen, ma europa salfa -sei un genio Angela ! boi barleremo di guel bosticino a bruxelles #coronavirus #CONTEDIMETTITI"
774,"Coronavirus, videoconferenza tra i vertici di FIGC e Leghe: il comunicato http://twib.in/l/r6M8zq7prKeA via @Fantacalcio #Fantacalcio"
775,Coronavirus: Bertolaso positivo al Covid-19.L'Oms: 'C'è un barlume di speranza per l'Italia' - Sanità - http://ANSA.it
776,I'm gonna see if i can speak to a doctor on base first to see what they suggest. I expose myself even more being in coronavirus triage. Its a scary place to be.
777,sonhei que eu estava com sintomas do coronavírus /bato na madeira.
778,"Coronavirus: Germany 'flattens the curve' as Italy deaths rise to more than 6,000 | World News | Sky News "
779,@ilariacapua lei sa che le complicanze polmonari dell'infezione da Coronavirus sono legate alla produzione anomale della IL-6. La vitamina D ne regola la produzione e si potrebbero salvare molte vite. Disponibile per chiarimenti e lavori scientifici dimostrativi. Cordiali saluti
780,"Coronavirus, 292 scienziati a Conte: ""Ecco nostro piano anti-contagio"" "
781,Ma solo io trovo insopportabile questa retorica del:” il coronavirus ci ha permesso di riscoprire l’importanza dei rapporti umani”? Ecc. Sincermente penso proprio il contrario: ci saranno un bel pó di divorzi proprio come in Cina 1/
782,Coronavirus Reggio Calabria – Il dato del Gom: 1 positivo e due da confermare. 95 i contagiati accertati. Altro morto oggi (4 in totale) http://dlvr.it/RSVPL7
783,"Comprendo la fervida ignoranza dei giornalisti italiani in #economia, ma prima o poi qualcuno dovrà chiedere a #Conte quali misure di sostegno ha intenzione di introdurre nel mese di aprile. #Coronavirus. #Covid19. #Covid19Italia."
784,Coronavirus: Positivi 4 soldati italiani in Afghanistan 
785,"On a separate note, do you expect your Italian adventure, that was recently cut short by the Coronavirus emergency, to resume any time soonish?"
786,"Intervista a Renzi: ""Non vogliamo morire di coronavirus ma nemmeno di fame"" - Il Riformista "
787,"#codiv19 #portaaporta @BrunoVespa #coronavirus Bene, anche questa sera l’avvoltoio fa spettacolo sulle disgrazie altrui. Chissà chi lo sa cosa un giorno accadrà. Quello che si fa si riceve, sempre."
788,Follia PD in Emilia-Romagna: i medici positivi al coronavirus ma asintomatici possono lavorare in ospedale: 
789,"Nel periodo più difficile che il paese sta vivendo dal secondo dopoguerra, abbiamo perso l’ennesima occasione per essere una nazione unita. Nello speciale TG5 nemmeno un accenno alla cura somministrata dal professor @PAscierto ai pazienti infetti da Covid-19. #coronavirus"
790,Coronavirus: le news 
791,"Coronavirus: calano i contagi, ma crescono le vittime. Positivi quattro militari italiani in Afghanistan [aggiornamento delle 22:04] "
792,Dr. Deborah Birx from the White House coronavirus task force issues the advice and says about 56% of all US cases are coming out of that metro area http://dlvr.it/RSVPDs #watches #time #job #trumprussiacollusion #collusion
793,"Coronavirus, le ultime notizie in Italia [aggiornamento delle 22:03] "
794,New Rochelle was a major coronavirus cluster two weeks ago. Here's where it stands now http://dlvr.it/RSVPDj #trumprussiacollusion #donaldtrump #msnbc #media #news
795,"Caltanissetta, seconda vittima per coronavirus: è un medico di 69 anni "
796,Coronavirus: l’apericena è l’unica vittima che non piangeremo 
797,#FacciamoRete #FacciamoInformazione #Coronavirus #Italia Test rapido per diagnosi Covid 19 in 5 minuti. In consegna alle strutture italiane https://www.repubblica.it/salute/medicina-e-ricerca/2020/03/24/news/coronavirus_test_rapido_per_diagnosi_covid-19_in_5_minuti_in_consegna_alle_strutture_italiane-252165414/ di @repubblica
798,Grey's Anatomy and Other Medical Shows Are Donating Their Supplies to Help Fight Coronavirus https://www.elle.com/culture/movies-tv/a31918589/medical-shows-greys-anatomy-donate-supplies-coronavirus/
799,"#dimartedi Coronavirus, Ignazio Visco (Banca d'Italia): ""Il risparmio è fondamentale. Bisogna mantenere il valore della moneta, questo è l'obiettivo della Banca centrale"" "
800,Coronavirus: Conte Oms ha definito nostre misure efficaci e tempestive - #Coronavirus: #Conte #definito #nostre
801,Coronavirus Bergamo e Brescia le più colpite in Lombardia: medici in arrivo dalla Russia - #Coronavirus #Bergamo #Brescia
802,Coronavirus Italia bollettino: in Italia 69.176 casi (+3.612) e 6.820 morti (+743). I guariti aumentano sono 8.326 (+894) - #Coronavirus #Italia #bollettino:
803,"Coronavirus, Sconcerti: “Si è capita la gravita del momento. Olimpiadi? Giusto il rinvio” http://sscalcionapoli1926.altervista.org/?p=294512"
804,Grazie al ministro @luigidimaio per l'incessante lavoro di raccordo e coordinamento che sta svolgendo con tutta la Farnesina per far giungere aiuti da tanti paesi stranieri e amici dell'Italia. Chi fa polemiche ora sterili si concentri sulle cose da fare #coronavirus 
805,Ora o mai più! PROPOSTA D'ISTITUZIONE DI UNA COMMISSIONE BICAMERALE D'INCHIESTA SULLA PANDEMIA IN ATTO DETTA DA CORONAVIRUS - https://www.maurizioblondet.it/proposta-distituzione-di-una-commissione-bicamerale-dinchiesta-sulla-pandemia-in-atto-detta-da-coronavirus/ via @MaurizioBlondet
806,"GRAZIE! Nonostante cardi sia un soggetto, ha sicuramente più testa di molte altre galline in questo momento #coronavirus "
807,"Coronavirus, tamponi-lampo ai calciatori. L'ira dei medici https://www.quotidiano.net/cronaca/coronavirus-tamponi-italia-1.5079873 #coronavirus #COVID19"
808,Directory #Covid19 #CoronaVirus #Crowdsearcher: American Society for Microbiology
809,"Coronavirus: in Campania 56 morti, 53 i guariti. Oggi 91 nuovi casi [aggiornamento delle 23:16] "
810,"Il giudice non ha ancora parlato perché huco ha preferito evitare il discorso con l idea che mentre lui è SV lei è costretta a stare a Mallorca, ma non aveva contato con il corona virus e il destino visto che lei nel momento della quarantena era a Madrid."
811,L’#Africa si prepara al #Coronavirus: può avere effetti devastanti https://www.tpi.it/esteri/coronavirus-africa-emergenza-conseguenze-devastanti-20200324572054/ via @tpi
812,"Un lavoratore ha avuto la febbre 10 giorni fa, ma solo da poco si ha avuto la certezza che fosse #coronavirus "
813,"#Ruffini su #coronavirus: ""In questo momento Agenzie di riscossione ha gli sportelli chiusi mentre Agenzia delle Entrate ha uffici aperti ma solo per specifici servizi"" #dimartedì"
814,"Coronavirus, bilancio vittime Lombardia sale di 400 persone in un... "
815,Non sono stati aiutati i terremotati figuratevi una nazione intera. #COVID19 #coronavirus
816,"#Coronavirus, #Zuckerberg e l'allarme su #Whatsapp https://tinyurl.com/qkxzd89"
817,Britain entered lockdown on Tuesday after Prime Minister Boris Johnson ordered people to stay at home to halt the spread of the #coronavirus. 
818,Florida's jobless residents struggling to file for unemployment amid coronavirus pandemic 
819,"Il virologo Lopalco: ""Sì, è probabile che i contagiati dal coronavirus siano 500 mila"" #Coronavirusitalia"
820,"#Coronavirus, #testrapido per Covid in arrivo negli ospedali. E nelle Marche già c'è - Corriere dell'Umbria"
821,"Galatasaray, Terim positivo al Coronavirus: 'Ma sono in buone mani' "
822,"Coronavirus, figlia Terim: “Mio padre in ospedale, ma sta bene” "
823,"Coronavirus, lo stadio Pacaembu di San Paolo in Brasile diventa un ospedale. FOTO "
824,"Coronavirus, Brasile: stadio diventa ospedale a cielo aperto. Come a Wuhan: ""Pronto in 10 giorni"" "
825,"Coronavirus, in marcia verso la Sicilia: centinaia di auto dal Nord sullo Stretto "
826,"Coronavirus, in Campania lo scenario potrebbe peggiorare: ci sono due misure da attuare subito https://www.trendynet.it/coronavirus-in-campania-lo-scenario-potrebbe-peggiorare-ci-sono-due-misure-da-attuare-subito/"
827,"Coronavirus, multe e sanzioni da 500 a 4 mila euro: il Viminale spiega le regole per aziende e spostamenti https://www.trendynet.it/coronavirus-multe-e-sanzioni-da-500-a-4-mila-euro-il-viminale-spiega-le-regole-per-aziende-e-spostamenti/"
828,"Coronavirus, Musumeci parla alla cittadinanza: “Nessuno deve più entrare in Sicilia!” "
829,"Coronavirus, 1,3 miliardi per cassa integrazione in deroga. Gualtieri: soldi entro 30 giorni "
830,"ULTIM'ORA CORONAVIRUS – Regione, oggi record di guariti: 40 in 24h "
831,"Coronavirus, 94 medici contagiati nel Lazio. Firmato protocollo d'intesa per vaccino contro il Covid-19 "
832,"Coronavirus, nel Lazio oggi record di guariti: 40 in 24 ore "
833,"Coronavirus, Conte: multa da 400 a 3000 euro per violazioni "
834,Il nostro aiuto durante l'emergenza coronavirus 
835,"Alla fine della quarantena, mio figlio non avrà avuto una bicicletta, un cellulare, un motorino. Brucerà tutto in droga. #coronavirus"
836,"the coronavirus on april 12, according to trump "
837,"Coronavirus, l'accusa di un medico: ""Il governo è in gran parte responsabile di questi morti"" https://www.liberoquotidiano.it/video/italia/21566673/coronavirus_accusa_medico_governo_gran_parte_responsabile_morti.html#.XnqJgxb-bGI.twitter"
838,Gli anziani e il coronavirus: se ne sta andando in silenzio una generazione 
839,"Coronavirus, la sudcoreana Celltrion promette entro l’estate un kit di autoanalisi rapida "
840,"Mastella: lotta coronavirus, basta speculatori alla ribalta #Benevento"
841,"Coronavirus, l’antimalarico e gli altri due farmaci che ci stanno aiutando nella lotta al COVID-19 di @VanityFairIt"
842,@Lasintomatico: I took #Hantavirus before It was cool #coronavirus #CoronaVirusitaly #dimartedì
843,These times #Coronavirus #strangetimes #italy #coviditalia https://www.instagram.com/p/B-IhUfWJjsD/?igshid=1njyn343bvp48
844,Coronavirus spreading in New York like 'a bullet train' - BBC News 
845,"Coronavirus:paziente 27 anni estubata, curata nuovi farmaci: Al Galliera di Genova, trasferita in area critica Medicina "
846,وفجأة تنقطع عن شرود الذهن وتُدعى إلى الداخل فلا تجد من الوجوه غير العيون بدون تعبيرات ، عيون من خلف الاقنعه في صمت متحركة تبحث عن النجاة.#٢ #Italia #ItalyCoronavirus #ايطاليا_كورونا #COVID19 #coronavirus
847,I meriti al posto giusto grazie alla pandemia ? Con questo dramma del coronavirus ti sarai reso conto che i tuoi tanto amati calciatori e vip da salotto non servono assolutamente a nulla; sono solo un contorno nel momento del benessere. https://www.bombagiu.it/i-meriti-al-posto-giusto-grazie-alla-pandemia/ #coronavirus
848,Milan: gli stipendi con i tagli da coronavirus. Le cifre -) http://www.milanworld.net/milan-gli-stipendi-con-i-tagli-da-coronavirus-vt87708.html#post2032633 #MIlan #Acmilan #Donnaruamma
849,"Niente raga, non bastava il Coronavirus, il mio spasimante è tornato. Mi ha scritto ""Sai, mi mancava parlare con te"" Quando il mio ultimo messaggio è stato ""facciamo che ci sentiamo in un'altra vita"" Non lo blocco solo perché mi sto quasi divertendo. Sarà la quarantena."
850,"Coronavirus: Conte domani alle 18 alla Camera, giovedì alle 10 al Senato "
851,Coronavirus oltre 54.000 casi. 4 soldati italiani positivi – DIRETTA - #Coronavirus #oltre #54.000 #casi.
