,Text
0,#coronavirus #COVID19 #StayHome #iostoacasa #iorestoacasa
1,"@PFPAOfficial Goodmorning From Italy. After have give alert to Usa for the danger of #coronavirus, I have been attacked by ad non -conventional arm to my person. It's invisibile like wind and It's entered into my-self for make me dying. Haw can I do to free my-self? t 's an arm"
2,"Coronavirus, da questo mercoledì chiudono i distributori http://dlvr.it/RSVYY7"
3,"Videonews - CORONAVIRUS, IL CASO BRESCIA "
4,Emergenza Covid-19: breccia nella sanità americana: Fonte: Flickr Covid 19 è ormai pandemia. La diffusione del Coronavirus nel mondo è dilagata e tutti gli enti sanitari stanno seguendo la linea stabilita dall’ Organizzazione Mondiale della Sanità (OMS).… http://dlvr.it/RSVYXJ
5,Messi dona un millón de euros para combatir el coronavirus 
6,#coronavirus #coronavirusitalla #coronavirusitalia #COVID2019 #COVIDー19 #Covid_19 #COVID2019italia #pandemia #iostoacasa #iorestoacasa
7,Just read this ... If 80% of us stay home it can be flattened ... Think people ... Confused about what to do about coronavirus? This data says just stay home 
8,"Coronavirus, positivo Sportiello: giocò titolare in Valencia-Atalanta "
9,"Olimpiadi di Tokyo rinviate all'anno prossimo, il premier giapponese: ""Ospitarle sarà la vittoria contro il Coronavirus"" "
10,"Coronavirus e Sampdoria, Ranieri: ""Peccato lo stop, eravamo in gran forma"" "
11,"Coronavirus, Olimpiadi slittano al 2021. Trump: «Dobbiamo riaprire gli Usa» "
12,"Coronavirus, l’Italia ha un piano pandemico ma perché non è stato adottato? "
13,"Coronavirus, nel mondo 380 mila casi. Rinviate le Olimpiadi "
14,"Uomini e Donne, ex tronista positivo al Coronavirus? Le sue parole "
15,"Non solo Coronavirus, nei campi è strage per gelo https://ferrara.press/news/non-solo-coronavirus-nei-campi-e-strage-per-gelo?uid=11602"
16,Papa Francesco preghi meno e faccia i FATTI! Che ha fatto ad oggi x l'emergenza Coronavirus? Ha donato 100.000 Euro alla Caritas (DIOCESANA) ...praticamente i soldi rimangono in famiglia😂 E la Banca Vaticana il cui tesoro in oro supera i 7 miliardi di euro.. CHE FA???😎 
17,Untori! Are these people trying to spread deadly coronavirus through THIS disgusting act? 
18,Coronavirus Lady Gaga posticipa l’uscita dell’album - #Coronavirus #posticipa #l’uscita
19,Coronavirus: Romano (Pd) entusiasmo Di Maio per Cina imbarazzante - #Coronavirus: #Romano #entusiasmo
20,Cina uomo muore all’improvviso su autobus: negativo al Coronavirus ma positivo a un raro hantavirus - #muore #all’improvviso #autobus:
21,Forza Italia ♥️♥️🇮🇹🇵🇰 #coronavirus #iorestoacasa #StayHome #COVID19
22,"41 milioni? È il fatturato annuo di una delle migliaia di PMI che avete chiuso per decreto. Diteci, il problema qual è: 1) la carta è una risorsa scarsa? 2) l’inchiostro è stato lasciato al sole senza tappo? 3) temete la fiammata inflattiva da coronavirus?"
23,.@govbr @jairbolsonaro @minsaude não é DO COVID-19. pelo amor de deus dê o exemplo. SARS-CoV-2 é o NOME do virus. Covid-19 é Coronavirus Disease (20)19. O MÍNIMO É USAR O TERMO CORRETO!
24,"#coronavirus, #rezza: «Prudenza, il numero dei morti resta alto a fine mese capiremo come sta andando»"
25,Acclaimed Tony-winning playwright Terrence McNally dies from coronavirus complications at Sarasota Memorial Hospital 
26,میری طرفhttp://Police.Rangers.Army والوں کو شاباش جو لوگcoronavirus مہلک وبا کو مذاق سمجھ رہےہیں اور گھروں سےباہر رہ کر قانون کا مذاق آڑا رہےہیں انکو اتنےزیادہ لیترمارے جائیں کہ ان سب کو نانی یاد آجائے کا مطلب گھروں میں رہناہےباہر تفریح کرنا نہی 
27,#coronavirus #COVID19 #COVID19italia #coronavirusItalia #CoronaVirusitaly #covid19italy #Coronavirustruth #COVIDー19 #Covid_19 #CoronavirusOutbreak #CoronaVirusUpdate #coronavirusEspana #CoronavirusESP #COVID19spain #stayhomechallenge #StayHome #DiMartedi #24marzo
28,Disposizioni organizzative per lo svolgimento delle sedute collegiali in videoconferenza a causa dellemergenza Coronavirus - Decreto del Presidente del Consiglio Comunale del 23/03/20 http://dlvr.it/RSVYBW
29,"#dimartedi Coronavirus, il dott. Luciano Gattinoni: ""Questo tipo di polmonite dura 2/3 settimane, e in questo tempo dobbiamo assicurare la vita con la ventilazione meccanica"" "
30,Ive been going through same thing here in Italy for 6 days. I went to coronavirus triage when they told me to come in and they checked my lungs. Said my lungs looked healthy right now so they weren't gonna test me but if it got worse to come back. Then they put me
31,"EMERGENZA CORONAVIRUS, A. CESARO (FI): FAMIGLIE IN GINOCCHIO, SERVE FONDO DI SOLIDARIETA’ DA 100 MLN DI EURO PER GLI AFFITTI | MezzoStampa - l'informazione di Scafati e dintorni http://www.mezzostampa.it/cronaca/22401_emergenza-coronavirus-a-cesaro-fi-famiglie-in-ginocchio-serve-fondo-di-solidarieta-da-100-mln-di-euro-per-gli-affitti.xhtml#.XnqdsI_Jvnk.twitter"
32,"Coronavirus, una proposta per vederci più chiaro: contiamo i ricoveri | Rep https://rep.repubblica.it/pwa/commento/2020/03/24/news/coronavirus_indice_ospedalizzati-252184956/ @repubblica"
33,"Coronavirus, all’Eurogruppo fumata grigia: “E’ choc che colpisce tutti. Consenso sul Mes ma serve più lavoro”. La palla ai capi di Stato http://www.forzaecoraggio.it/coronavirus-alleurogruppo-fumata-grigia-e-choc-che-colpisce-tutti-consenso-sul-mes-ma-serve-piu-lavoro-la-palla-ai-capi-di-stato/"
34,"È chiaro che Marco #Travaglio accetti di buon grado ogni misura restrittiva del governo #Conte. Rientra, del resto, nella sua visione da giacobino invecchiato male. Ancora vi stupite? #Coronavirus. #Covid19. #Covid19Italia."
35,"Coronavirus, Nocerino: “Medici nostri eroi. Quarantena? Serve intelligenza” "
36,Giulio Gallera (Assessore Welfare Lombardia) a #Patriae: “C’é un abbassamento dell’età dei contagiati che però hanno maggiori risorse per contrastare il #coronavirus. I giovani reagiscono bene.” Su @RaiDue 📺 e in diretta streaming: http://raiplay.it/dirette/rai2
37,Coronavirus: ecco il messaggio dalla divisione Xbox di Microsoft 
38,Coronavirus: Secondo l’OMS il nuovo epicentro della crisi potrebbe diventare gli Stati Uniti 
39,"Coronavirus, parla l'Oms: ""In Italia barlume di speranza"" "
40,Coronavirus. Sequestrato ad Ancona un carico di attrezzature per terapia intensiva diretto in Grecia 
41,"Coronavirus, crisi economica e conseguenze. L' analis dell'economista Bruni "
42,Coronavirus: droni per i controlli a Sassari e Cagliari 
43,"#Video #Coronavirus, ""Call me Carlo"": Ancelotti chiama un fan dell'Everton in quarantena https://bit.ly/39arfQ4 #Curiosità #PremierLeague"
44,"Pero todas las camas y camas de urgencia no se dan abasto de por sí sin coronavirus, sin contingencia no alcanzan ahora menos"
45,"Coronavirus, in arrivo nuove attrezzature nelle terapie intensive di Trapani https://www.trapani-24h.it/coronavirus-in-arrivo-nuove-attrezzature-nelle-terapie-intensive-di-trapani-5/"
46,"imagine me not going to the postponed date cause if the problem this year was coronavirus, in september or next year it will be uni and the exams so i'll be unlucky anyway bye"
47,#ShutdownsInstitutional #Coronavirus2019nCoV Coronavirus Is Advancing. All Americans Need to Shelter in Place. http://dlvr.it/RSVXtb
48,Shame on you This Footage is not of italy 🇮🇹 #coronavirus #COVID19 #StayHome
49,Io ho attaccato le Lega e Fratelli d'Italia ma er il #Coronavirus mi sono fermata per rispetto della situazione...sa come ci si libera di armi non convenzionali? Ho scritto anche al Quirinale per una questione grave su Castellammare di Stabia
50,#SupermarketsandGroceryStores #ServiceIndustries Coronavirus Advice from a Grocery Store Worker http://dlvr.it/RSVXsR
51,Coronavirus Galli a Sky Tg24: &amp;#034;Le attuali misure non bastano ancora&amp;#034; - #Coronavirus #Galli #Tg24: #&amp;#034;Le
52,LIVE Coronavirus Ultime notizie. Sciopero dei benzinai in vista Conte prova a scongiurarlo - #Coronavirus #Ultime #notizie.
53,Coronavirus: le misure del decreto legge approvato dal Consiglio dei ministri (2) - #Coronavirus: #misure #decreto #legge
54,Coronavirus in Italia e nel mondo le ultime notizie in diretta - #Coronavirus #Italia #mondo #ultime
55,Coronavirus il cuore grande di Kakà: “Voi italiani siete un grande popolo se avete costruito un Paese così bello è perchè siete speciali” - #Coronavirus #cuore #grande #Kakà:
56,Coronavirus spesa on line e consegne a domicilio: ritardi e disagi - #Coronavirus #spesa #consegne
57,In Francia la combinazione di #azitromicina e #idrossiclorochina ha fornito dati significativi per la cura del #coronavirus. Tuttavia persistono dubbi e aspetti da verificare. Il parere dell'#infettivologo @istsupsan @PAscierto
58,#dimartedi Il sindaco di Roma Virginia Raggi spiega come Roma sta affrontando l'emergenza #coronavirus 
59,Coronavirus tra alberghi e braccialetti. Ecco la nuova strategia della Regione https://www.sardiniapost.it/politica/coronavirus-tra-alberghi-e-braccialetti-ecco-la-nuova-strategia-della-regione/ #Sardegna
60,#Conte In odore di santità. #GiuseppeConte #coronavirus Il giusto insegnamento. #Riflessioni e #genuflessioni
61,"Marsala: AGENDA URBANA: PUBBLICATI I PRIMI DUE AVVISI ""Nonostante i problemi creati dal Coronavirus continuiamo a lavorare https://www.trapani-24h.it/marsala-agenda-urbana-pubblicati-i-primi-due-avvisi-nonostante-i-problemi-creati-dal-coronavirus-continuiamo-a-lavorare-5/"
62,"Please, please, please: we repeat again that you have not to abandon #dogs and #cats. They spread #love, not coronavirus https://www.fanwave.it/en/news/888-do-not-abandon-dogs-and-cats-they-transmit-affection-not-coronavirus.html"
63,Great work #govtsindh #MuradAliShah #coronavirus #COVID19 #StayHome #COVIDIDIOTS
64,"Il vaccino è sicuramente la soluzione al #coronavirus , nell'attesa che sia pronto, speriamo la ricerca arrivi ad un farmaco che lo contrasti"
65,Alessia rotta sei una sardina del PD ma cosa avete fatto voi x questo corona virus ... avete solo brindato con zingaretti .... quando tutti gli altri si danno da fare x bebelare questo virus
66,Il complottista novax #M5s #Barillari espulso dal Movimento degli sciachimicari per le sue posizioni sul #coronavirus. 😳 
67,Consiglio ai giornalisti sportivi Ma non vi bastava dire cazzate su calcio e sport? No anche puttan4te sul coronavirus e il numero dei morti State muti. Libertà di parola ok na qui è coltivazione a strascico di complottismo Sempre i soliti nomi poi oh
68,"#Coronavirus, Nuovo #Decreto di #Conte. #Manciolandia #coronavirusitalia #decretocoronavirus #24marzo #COVID19italia #IBDM https://www.manciolandia.com/2020/03/coronavirus-nuovo-decreto-di-conte.html?spref=tw"
69,Coronavirus: Guardiola dona 1 milione di euro per forniture mediche 
70,Coronavirus Fontana: “Evento tremendo ci cambierà la vita” - #Coronavirus #Fontana: #“Evento https://www.zazoom.info/ultime-news/6421706/coronavirus-fontana-evento-tremendo-ci-cambiera-la-vita/
71,"Stai a vedere che si rimediando un po' di soldi per Sanità e Protezione Civile! Coronavirus, Cdm vara la nuova stretta: multe di 3 mila euro, fino a 5 anni di carcere per chi viol… https://www.repubblica.it/politica/2020/03/24/news/coronavirus_multe_fino_a_4mila_euro_per_chi_non_rispetta_i_divieti_ecco_la_bozza_all_esame_del_cdm-252168876/ via @repubblica"
72,"non ha fatto nessun accenno al fatto che l'area tra Bergamo e Brescia è quella più colpita dal #coronavirus dove c'è la più alta concentrazione industriale d'Italia. Non può dirlo, sennò scontenterebbe i suoi amichetti di Scelta Civica, gli stessi dei tagli selvaggi alla sanità"
73,Ho da segnalare come al solito qualcosa che non va se è capitato il Cidid-19 a lei e il Generale Farina hanno attaccato anche me ma con armi differenti del #coronavirus poiché ho parlato con Trump e Pelosi circa il #coronavirus
74,caro coronavirus mi stai: compromettendo l’esistenza
75,"Coronavirus, il San Martino: «Grazie a Genoa e Sampdoria» "
76,Non è così @GiuseppeConteIT ? #coronavirus #coronvirusitalia #iorestoacasa
77,CORONAVIRUS / Maxi sequestro di componenti respiratori per terapia intensiva 
78,"Coronavirus, la centrale della Protezione civile in Campania: ""A lavoro h24 per l'emergenza"" "
79,"Coronavirus, Ciarambino: ""Campania ultima per numero tamponi in relazione ai residenti"" "
80,"Coronavirus negli Stati Uniti, molte vie ma una sola idea Prima di tutto viene l’economia "
81,"Coronavirus, Trump da non credere: 'Aprire entro Pasqua, la recessione può fare più vittime' "
82,"Coronavirus, Trump: ""Obiettivo è America aperta a Pasqua"" "
83,"Coronavirus Ancona, centinaia di strumenti per la respirazione sequestrati al porto STRONZI,IN LOMBARDIA SI MUORE ,E QUESTI PORTANO FUORI MATERIALE MEDICO UTILE,VERGOGNA.. "
84,"“Non abbandonateli, non lasciate che muoiano là dentro”, Sos per i casi di coronavirus nella Casa di riposo "
85,"Sicilia, Coronavirus. Sbarchi Messina, Polizia precisa: “Controlli su tutti imbarchi” "
86,"Coronavirus, si è spento il drammaturgo Terrence McNally "
87,"Coronavirus, Terrence McNally è morto: ha fatto la storia del cinema "
88,Out Now https://youtu.be/D2l6mFLKN-E #Hantavirus #24marzo #DiMartedi #Asterix #cartabianca #albertosordi #XOTAAWARDS #PEITOAWARDS #Κορωναιος #Dubai #coronavirus #HarryPotter #coronvirusitalia #coronvirusitalia #SocialDistance #Spain #SuperTuesday #Turkey #TheWalkingDead
89,"Dr. Birx from the White House coronavirus task force issues the advice as nationwide cases top 50,000 http://dlvr.it/RSVXRD #fakenews #twitter #president #news #cnn"
90,Le foot me manque. @coronavirus rend moi tous les matchs de Messi que tu m’as pris !!!!
91,"Coronavirus, in Germania superati i 30.000 casi "
92,"#Montanari su #coronavirus: ""Sono ore in cui usiamo molto il registro eroico e la retorica patriottica, però dobbiamo anche ricordarci dell’importanza della tenerezza. Diceva Che Guevara: bisogna essere rivoluzionari e forti senza perdere la tenerezza"" @tomasomontanari #dimartedì"
93,"#coronavirus e crisi economica : ""O lo stato torna dirigista o avremo la barbarie lo #ScioperoGenerale del #25marzo è per la vita “ @Lantidiplomatic⁩"
94,Coronavirus il confronto fra Hubei e la Lombardia - #Coronavirus #confronto #Hubei
95,Scoveró tutti i vostri #ashtag #Milanononsiferma ! Questa volta non riuscirete nel vostro solito doppio ruolo di carnefici e salvatori!!! #COVID2019 #coronavirusitalIa #coronavirus #CoronaPandemie #pandemia #coronvirusitalia
96,Hi @GretaThunberg Have you infected by Coronavirus? What is your virus test result? I hope it's negative. The world needs you as environmental activist.
97,Infographic: Coronavirus - 
98,L'India vuole combattere (assurdamente) il coronavirus con l'omeopatia https://www.wired.it/scienza/medicina/2020/01/30/coronavirus-omeopatia-india/ di @wireditalia
99,UNICEF: consejos para adolescentes ante la emergencia del coronavirus http://dlvr.it/RSVXH1
100,Chi sono i 24 medici morti per il coronavirus https://www.zazoom.info/ultime-news/6421605/chi-sono-i-24-medici-morti-per-il-coronavirus-2/
101,"Blog Post: Coronavirus, sarà sciopero generale: sanitari si fermano simbolicamente per un minuto - "
102,"Coronavirus, a Castelvetrano la pizzeria Zodiaco dona 186 pizze https://www.trapani-24h.it/coronavirus-a-castelvetrano-la-pizzeria-zodiaco-dona-186-pizze/"
103,RT @CessionedelQ: RT @CessionedelQ: RT @CessionedelQ: RT @CessionedelQ: RT @CessionedelQ: RT @CessionedelQ: RT @EurofinLecco: #mutuicasa #finanziamenti #coronavirus #regionelombardia #prevenzione #salute #comunedilecco #iorestoacasa #prestitipersonali #c…
104,The virus is passing like crazy here so I worry. They put me in coronavirus triage due to my symptoms. We have to have consultants first then they send an ambulance to get you and take you. Its a crazy process. I can go back to get a test since it got worse but i debate.
105,That biological bomb - football in the time of Corona Virus 
106,"Se provano a tenere in casa 1,3 miliardi di indiani... #siamoinguerra e #coronavirus"
107,"Noi ""non siam pronti alla morte""...ma a combattere fino alla fine!💪🏽 #coronavirus"
108,"O presidente do Brasil usou o pronunciamento para minimizar uma pandemia que já infectou mais 300 mil pessoas no mundo e debochar da imprensa, de um profissional de saúde renomado e da dor daqueles que perderam pessoas queridas para o #coronavirus. O País está à deriva."
109,"Coronavirus, Conte: «Falsa la proroga delle misure fino al 31 luglio» "
110,"Coronavirus, che fare per uscire dalla crisi? Tre fasce d’età e tempi certi "
111,Ahí tenemos!! Por lo mala raza que somos merecemos esto y mucho más !!! .. humanidad culia !!!
112,"Calcio e Coronavirus, si fa strada l'idea del taglio del 30% degli stipendi dei giocatori "
113,Certa persone se neppure questo periodo del coronavirus è riuscito al cambiarle allora davvero non cambieranno mai.
114,"Coronavirus, l'ex medico Genoa: ""Serie A? Difficile ripartire"" "
115,"Emergenza Coronavirus. Weah: ""L'Africa deve stare attenta. Chiamerò presto Maldini"" "
116,"Coronavirus, Weah: ""Prego per il bene dell'Italia. L'Africa deve stare molto attenta"" "
117,Mentre #Conte 600 euro di CALCI IN CULO ci dà .... #coronavirus #COVID19
118,"Cerchiamo di far chiarezza, dunque, #Italia riparti il 3 Aprile oppure il 1 Agosto? Così ci si organizza le #ferie. Si, quelle all'aria aperta però. #COVIDー19 #coronavirus #COVID19"
119,"Antitrust oscura sito internet su test coronavirus ""fai-da-te"" - Roma, 24 mar. (askanews) - L'Antitrust ha annunciato di aver avviato un procedimento e disposto in via cautelare sia l'oscuramento di un sito web ..."
120,"Cinisi, il sindaco Palazzolo denuncia ritardi nell’indagine epidemiologica sull’ultimo caso di coronavirus "
121,"#dimartedi Coronavirus, Silvio Brusaferro (Iss): ""Il vaccino sarà la soluzione, ma fino a quando non sarà pronto bisogna adottare queste misure di protezione"" "
122,"#Coronavirus, 52 morti tra gli anziani di una casa di riposo a Mediglia. I parenti: ""Vogliamo verità"" "
123,"No que se refere ao Coronavirus não é uma questão de Esquerda ou Direita. Se o Obrador disse isso mesmo está sendo mais um irresponsável pelo cargo que ocupa. Agora, a questão do Bolsonaro, é que o corona está provando que ele é um idiota que sempre sabíamos que era, só isso."
124,"Coronavirus, Weah: ""Mio figlio in quarantena, temo per l'Africa"" "
125,IRRESPONSÁVEL!!! FROUXO! INCONSEQUENTR!!! FONTE DE CORONAVIRUS PARA TODO O GABINETE!!!! e ainda flaa que é histeria 
126,"Coronavirus: in Campania 56 morti, 53 i guariti. Oggi 91 nuovi casi "
127,Coronavirus. Aumentano i casi in Campania: ecco i numeri 
128,"Coronavirus Ancona, maxi-sequestro di respiratori per terapia intensiva al porto. Imprenditore milanese voleva esportarli in Grecia "
129,"Coronavirus, chi entra in Campania sarà isolato per 14 giorni "
130,"Coronavirus, altri due morti in Campania: 956 il numero dei contagiati nella nostra Regione "
131,"Coronavirus, finalmente arrivati in Campania primi kit per test rapidi. Presto fornitura completa "
132,Campania: arrivano i primi test rapidi per il coronavirus 
133,"Coronavirus, il bollettino della Regione Campania: oggi solo 20 tamponi positivi [FOTO] "
134,Coronavirus Campania: superati i mille contagi 
135,Coronavirus: superata quota mille contagi in Campania 
136,"Coronavirus: 1013 casi positivi in Campania, primo calo di contagi "
137,"Campania, c'è un nuovo focolaio di Coronavirus. I comuni interessati "
138,"Coronavirus, nuova ordinanza della Regione Campania - Napoli ZON "
139,"Coronavirus in Campania, 956 contagiati: la metà nella provincia di Napoli "
140,"Coronavirus in Campania, aggiornamento delle 17 del 22 marzo 2020 "
141,"Coronavirus, isolata la casa di riposo Giovanni XXIII: morta un'anziana e 18 casi positivi totali "
142,"Emergenza Coronavirus, Borrelli: ""Nei prossimi giorni avremo flusso continuo di mascherine"" "
143,"Coronavirus, Barcellona: no dei giocatori al taglio del 70% dello stipendio durante lo stop https://www.repubblica.it/sport/calcio/esteri/2020/03/24/news/coronavirus_barcellona_no_dei_giocatori_al_taglio_del_70_dello_stipendio_durante_lo_stop-252225582/ via @repubblica"
144,Aflora el fantasma de la depresión del 1930 en EEUU como consecuencia del coronavirus 
145,Coronavirus lunghe code fuori dai supermercati. FOTO - #Coronavirus #lunghe #fuori
146,Carcere fino a 5 anni se qualcuno positivo al Coronavirus esce di casa violando la quarantena - #Carcere #qualcuno #positivo
147,Crisi Coronavirus compagnie aeree al collasso: la perdita è da record - #Crisi #Coronavirus #compagnie #aeree
148,"Coronavirus: Juventus-Inter, club bianconero rimborsa i suoi tifosi "
149,Coronavirus il governatore della Calabria Santelli risolve il caos di Villa San Giovanni: “si imbarcano donne bambini e anziani” - #Coronavirus #governatore #della
150,Coronavirus spesa on line e consegne a domicilio: ritardi e disagi - #Coronavirus #spesa #consegne
151,"Coronavirus, il Comune di Montebelluna attiva solo i servizi essenziali http://dlvr.it/RSVWwt"
152,"Coronavirus, chiesta sospensione del bollo auto: prorogata scadenza rottamazioni http://dlvr.it/RSVWvn"
153,vorrei porgerle anche io una domanda: quale sarà l'ammenda per chi era già a conoscenza dal 21 gennaio(primo rapporto epidemico #OMS) della pericolosità del #coronavirus e ha aspettato fino al 9 marzo per mettere in isolamento gli italiani?
154,"Coronavirus, Messi scende in campo per aiutare il Clinic de Barcelona https://ift.tt/2Ue2nT8 #calcio"
155,Mentono sapendo di mentire! #mascherine #coronavirus 
156,so um eat jin pode salvar o mundo do coronavírus
157,#Coronavirus secondo il governo ed i media italiani 
158,"Bollettino coronavirus, i dati sui casi a Gravina e in Puglia http://dlvr.it/RSVWsW"
159,Jajjajajaj😂😂😂😂😂
160,"Berlusconi commosso dagli aiuti russi elogia Putin: “Coronavirus, un sacrificio che non dimenticheremo”: "
161,"Sin Súper Rugby por el coronavirus, en Sudáfrica planean crear una liga local https://marketingregistrado.com/za/rugby/2020/03/29995_sin-super-rugby-por-el-coronavirus-en-sudafrica-planean-crear-una-liga-local/"
162,La Puglia che si prepara ad affrontare il coronavirus: quasi tutto pronto ma non c'è una cazzo di protezione per i medici. #portaaporta
163,Capitalism's failures exposed by the Coronavirus - Richard Wolff https://youtu.be/W9NKe2OiNgA via @YouTube
164,"Hammamet, città (quasi) fantasma Le rigide misure prese per contrastare il contagio da coronavirus hanno cambiato il volto della città di Hammamet. Proibito uscire dal Comune di residenza, non più di tre persone in auto. La propria… "
165,"Hammamet, città (quasi) fantasma Le rigide misure prese per contrastare il contagio da coronavirus hanno cambiato il volto della città di Hammamet. Proibito uscire dal Comune di residenza, non più di tre persone in auto. La propria… https://fai.informazione.it/AC1099B3-CDF9-4363-B76E-B78A94A46349/Hammamet-citta-quasi-fantasma"
166,#Coronavirus2019nCoV #FamiliesandFamilyLife What I Learned When My Husband Got Sick With Coronavirus http://dlvr.it/RSVWlf
167,Positivo al Coronavirus porta a spasso il cane: fermato e denunciato http://twib.in/l/94MGXe6y665g
168,"Coronavirus, è morto il drammaturgo Terrence McNally "
169,CI SIAMO. TROVATO IL VACCINO CONTRO IL CORONAVIRUS https://almaghrebiya.it/2020/03/24/ci-siamo-trovato-il-vaccino-contro-il-coronavirus/ via @@lmanews24
170,"Italia ha pasado a fase 4, no pudo controlar la transmisión del #Coronavirus😷. Los ciudadanos no tomaron con seriedad esta pandemia y pese a las constantes recomendaciones del gobierno, no acataron las instrucciones. #ForzaItalia 🙏"
171,"Coronavirus, Mattia il paziente uno: ""Essere simbolo della tragedia è un peso che mi tormenta"" che tenerezza 😭😭😭🤝❤️ https://www.liberoquotidiano.it/news/italia/21565068/coronavirus_mattia_paziente_uno_simbolo_tragedia_peso_tormenta.html"
172,Dio chiama alla prova ma non dà alcuna chance. Chi mette alla prova dà saggiamente e umanamente delle chances. La chance per il coronavirus è un camion militare che porta al cimitero in totale solitudine dei poveri Cristi che non meritano questa fine.Per cui hai poco da sfottere
173,Es más sicodelico!!
174,"Auguri vivissime. È una cosa bella nonostante la presenza della ""Carogna"" Coronavirus."
175,"Coronavirus, alcune etnie sarebbero immuni: l'ipotesi di Galli | Virgilio Notizie "
176,"Capisco. La torta è un gentile omaggio di mia moglie per rendermi meno amara la detenzione in casa da #coronavirus. Tra l'altro le fa solo per me, lei non è golosa. Sarà sospetta la cosa, dici? 🤔"
177,The latest micheledisalvo reports! https://paper.li/micheledisalvo/1363307593?edition_id=6dbe0ba0-6e28-11ea-b977-0cc47a0d15fd Thanks to @LidiaPaolillo @AnnaMariaCastel #coronavirus #vaccini
178,"no dia sla qual da quarentena eu chego a conclusão que se esse coronavírus não me matar, a saudade dos meus migos me mata 🤧"
179,"Sto guardando Edward mani di forbice, la storia di un parrucchiere che durante un'epidemia guadagnò un sacco di soldi. [@SalvatoreSalim1] #autocertificazione #coronvirusitalia #runner #Iorestoacasa #coronavirus #quarantena #COVID19 #Conte #salvinisciacallo #andratuttobene"
180,"🔴 Il ministro delle finanze olandese definisce un ""successo"" la ""combinazione di finanziamenti e riforme"" del MES. Quella combinazione che ha portato la Grecia a restare ancora oggi addirittura con aree prive di assistenza sanitaria di base 👈 #STOPMES #coronavirus #COVID19"
