,Text
339,1er muerto en #Cúcuta 💀 por #coronavirus #Colombia https://bit.ly/33L0VLq https://www.instagram.com/p/B-InBNZgYNL/?igshid=k2c607qiqx3b
340,"Terrence McNally, Tony award-winning playwright, dies of coronavirus complications http://dlvr.it/RSVTql #news #trumprussiacollusion #russia #fox #cnn"
341,Studiare il coronavirus con World of Warcraft 
342,Early Drug Trials Show Promise of Coronavirus Recovery | OZY ⁦@1926Azzurro⁩ ecco l’articolo di cui ti parlavo.
343,Bentornati a #patriae con @AnnalisaBruchi @a_g_giuli e #AldoCazzullo L’#Italia in prima linea nella guerra al #coronavirus: quanto gli italiani potranno resistere? Quanto l’economia potrà resistere? Ne parliamo a #Patriae su @RaiDue 📺 e in diretta streaming
344,"Coronavirus, ecco come cambia Milano: una «dolce vita» destinata a scomparire "
345,Anche noi integrati nella Coronet Lab Campania. Il nostro duro lavoro ha raccolto i suoi frutti!💪🏽 #coronavirus 
346,Coronavirus Fontana: “Evento tremendo ci cambierà la vita” - #Coronavirus #Fontana: #“Evento https://www.zazoom.it/2020-03-25/coronavirus-fontana-evento-tremendo-ci-cambiera-la-vita/6421706/
347,"Coronavirus, 52 morti tra gli anziani di una casa di riposo a Mediglia. I parenti: ""Vogliamo verità"" "
348,Canada coronavirus aid stalled over concerns about Trudeau bid for more spending powers | Article [AMP] | Reuters https://www.reuters.com/article/us-health-coronavirus-canada-idUSKBN21B2E3 #cdnpoli
349,"Siamo sempre in prima linea per voi e con voi. Soprattutto in questo periodo di emergenza ed intenso lavoro, con situazioni difficili da gestire vista la scarsità di dispositivi di protezione. #Aiutateci ad #aiutare #coronavirus #COVID19 #StayHome #lockdown #RegioneLazio #Roma"
350,#Vespa a #portaaporta ! La #Rai non può parlare 24 ore al giorno di #coronavirus perché poi la gente ha anche bisogno di stendersi...
351,Il DURC ai tempi del coronavirus Anche il DURC (Documento Unico di Regolarità Contributiva) è stato coinvolto dall’emergenza Coronavirus. Le procedure messe in atto nel Decreto «Cura Italia» hanno cambiato anche la sua scadenza. #coronavirus #COVID19 #https://www.2020revisione.it/durc-e-coronavirus/
352,"Wefunder launches campaign to help coronavirus-impacted small businesses crowdfund loans - https://todnet.altervista.org/wefunder-launches-campaign-to-help-coronavirus-impacted-small-businesses-crowdfund-loans/With the COVID-19 crisis, startups across Silicon Valley are looking for opportunities where they can both increase the visibility of their services and be helpful to ..."
353,Coronavirus l’allarme dell’Oms: la pandemia sta accelerando - #Coronavirus #l’allarme #dell’Oms:
354,Coronavirus: Fontana ‘tempi per ospedale Fiera Milano saranno rispettati’ - #Coronavirus: #Fontana #‘tempi
355,Coronavirus: l’epidemia in Toscana si studia come in Guandong - #Coronavirus: #l’epidemia #Toscana
356,"Mutuals suspendieron la venta de las entradas del show de the driver era en milan por coronavirus y van a elegir otra fecha, estoy feliz porque tendré igualmente mi posibilidad de ir ❤️"
357,Coronavirus: le misure del decreto legge approvato dal Consiglio dei ministri (2) - #Coronavirus: #misure #decreto #legge
358,#Campania i positivi di oggi sono 91 (47 della sessione mattutina + 44 delle sessioni del pomeriggio/sera) Tamponi di oggi: 532. Positivi complessivi ad oggi in Regione Campania: 1194. Test complessivi ad oggi: 7587. #coronavirus
359,Fronte-retro #Scorci di una #palermo al tempo del #coronavirus #CoronavirusSicilia #CoronavirusItalia #Covid19 #Covid19Italia #fronteretro #primavera2020 #silence
360,"Agradecemos al presidente ruso Vladimir Putin así como los miembros de la Orden del Temple Jacques de Molay por toda la ayuda y apoyo a Italia. ""Acordamos una estrecha interacción en la lucha contra el coronavirus"". https://www.facebook.com/JacquesMolayAmerica/posts/2788783097841445"
361,"Coronavirus, 15 giorni congedo docenti e ATA al 50%, ecco le ultime Novità "
362,"Coronavirus, protesta in casa di riposo: per calmare gli anziani arriva il 112 "
363,"Messina, positivi al coronavirus 20 anziani di una casa di riposo "
364,"Coronavirus: lettera a premier Federauto, modifiche al dl "
365,"#dimartedi #Coronavirus, @PSenaldi: ""Continuiamo a dire che siamo il modello, ma abbiamo più morti di tutti"""
366,Che belli coloro che ascoltano #coronavirus #COVID19 #tamponi #professoroni #italia #coronavirusitalianews
367,#WHO Initially Echoed False Chinese Propaganda on Coronavirus 
368,Coronavirus: Fontana tempi per ospedale Fiera Milano saranno rispettati - #Coronavirus: #Fontana #tempi https://www.zazoom.info/ultime-news/6421678/coronavirus-fontana-tempi-per-ospedale-fiera-milano-saranno-rispettati-2/
369,Coronavirus: l'Organizzazione Mondiale della Sanità ci consiglia di giocare per superare questo periodo | Game Division 
370,"#Rocca su #coronavirus: ""In questo momento sta mancando una cosa a tutta Italia: l'abbraccio. Noi siamo cresciuti con l'abbraccio della mamma, il contatto umano è fondamentale"" @Francescorocca #dimartedì"
371,Coronavirus Madrid | La Comunidad de Madrid mantiene cerrada una UCI totalmente equipada en el Hospital Público Infanta Sofía 🤦🏻‍♀️ 
372,Emergenza coronavirus: il servizio di aiuto di psicologi e psicoanalisti 
373,"Hoy he sabido que hay un grupo de apoyo para enfermos de coronavirus que presentan síntomas de anosmia (falta de olfato, a veces tb de gusto) que se llama SABUESOS SIN OLFATO. De verdad os digo que la realidad es la mejor cosa."
374,"Vox, El corona virus tardará mucho en desaparecer de Europa, un pequeño foco que quede sin curar, puede causar de nuevo estragos. Italia ha cerrado todo, menos las actividades productivas para la nación italiana.Sean cautos han suspendido los Juegos Olímpicos esto es una pandemia"
375,Coronavirus: ecco quando è possibile sospendere le rate del mutuo sulla prima casa 
376,Tra non molto la #Panini farà l'album delle figurine dei #decreti. #coronavirus
377,“Momenti buii ci attendono presto dovremmo affrontare la scelta tra ciò che è giusto e ciò che è facile” la #Quarantena in una cazzo di frase ! #HarryPotter #Coronavirus #COVID19 #coronvirusitalia #harrypottereilcalicedifuoco
378,"#Giorgino su #coronavirus: ""C'è fiducia nei confronti delle Istituzioni, credo che gli italiani stanno dimostrando di avere paura ma non ansia. La responsabilità può essere o sollecitata attraverso le prescrizioni oppure viene dal basso"" @frangiorgino #dimartedì"
379,Ma se ti dicevano a dicembre 2019 che il mondo a marzo 2020 si sarebbe fermato tu ci avresti creduto? #coronavirus #coronvirusitalia #CoronaVirusDE #COVID19 #COVID19italia #virus #Hantavirus #ACNH
380,Coronavirus: cosa cambia per poste e comunicazioni http://dlvr.it/RSVTKz
381,#Coronavirus2019nCoV #MedicalDevices #VentilatorsMedical Slow Response to the Coronavirus Measured in Lost Opportunity http://dlvr.it/RSVTKH
382,"Our tests are free. Our treatments are free. Our people isn’t scared to go to the doctor, to go to the hospital, to call an ambulance, to freaking care about themselves. This is what public healthcare does, without that, numbers about coronavirus would go up non-stop!"
383,"San Severino, dal 25 marzo sarà chiusa la fontana pubblica per emergenza Coronavirus #marchenews24 #notiziemarche https://ift.tt/2QDwwt1"
384,"La Sanità universitaria non si tira indietro e siamo pronti a fare la nostra parte! 💪🏽 Coronavirus a Napoli, in campo il Policlinico Federico II: «Liberati due piani» https://www.ilmattino.it/napoli/cronaca/coronavirus_a_napoli-5130929.html @mattinodinapoli"
385,"Instagram e Coronavirus, ecco Co-Watching e altre iniziative https://www.franzrusso.it/condividere-comunicare/instagram-coronavirus-co-watching-iniziative/ #socialmedia"
386,"Certo che è possibile, la TAC da un risultato in poco tempo (e probabilmente ne riesci a fare anche di più). Infatti in situazioni come quelle lombardi dove i casi sono troppi, usano i tamponi per escludere, perché tratta tutti i casi con sintomologia simile come coronavirus."
387,"Coronavirus, il comandante Alfa 👏👏👏👏https://www.tpi.it/cronaca/coronavirus-invoca-golpe-contro-governo-20200323571656/ via @tpi"
388,"Una cosa è certa, il coronavirus avrà distribuito e ridistribuito le carte a tutti: chi siamo? Quanto valiamo? Cosa possiamo fare per questo coronavirus? Sperando nella misericordia di Dio, ammettiamolo! "
389,Coronavirus. Dall’Ema un warning per tutti i cittadini europei: “Non acquistate farmaci da siti internet non autorizzati che promettono cure e terapie che non esistono” - Quotidiano Sanità http://www.quotidianosanita.it/scienza-e-farmaci/articolo.php?articolo_id=83052&amp;fr=n di @QSanit
390,"🇺🇸 The number of confirmed #coronavirus cases in the U.S. has surpassed 50,000, or 12.3% of all known cases worldwide."
391,"Coronavirus, per il terzo giorno consecutivo rallenta la crescita del numero di contagi."
392,1er muerto en #Cúcuta 💀 por #coronavirus #Colombia https://bit.ly/33L0VLq https://www.instagram.com/p/B-ImRC2AQEf/?igshid=1ijb489my61vm
393,Coronavirus Sicilia: il bilancio al 24 marzo https://www.trapani-24h.it/coronavirus-sicilia-il-bilancio-al-24-marzo/
394,"🔴 EMERGENZA #CORONAVIRUS ‼️ ❌❌❌CI SONO AZIENDE CHE STANNO CHIUDENDO E IL #GOVERNO SI PREOCCUPA DEGLI EVASORI? 🤔 🤔 🤔 🤔 BASTAAA, BASTAAA O vi mettete a lavorare ber il bene del paese o questa volta ci sarà UNA RIVOLTA , LA PAZIENZA E FINITA. AVETE ROTTO I COGLIONI. 😠"
395,"Il discorso di Silente è Conte nella diretta serale che ci dice di stare uniti a distanza, Voldemort come il Coronavirus #harrypottereilcalicedifuoco"
396,#harrypottereilcalicedifuoco il discorso di Silente non è mai stato così attuale. #COVIDー19 #coronavirus #StayHome
397,Coronavirus i benzinai iniziano a chiudere da mercoledì: «Noi dimenticati». Conte: «Non lo possiamo consentire» - #Coronavirus #benzinai #iniziano
398,Coronavirus: Amnesty per la sicurezza sanitaria nei CPR - #Coronavirus: #Amnesty #sicurezza
399,Coronavirus il confronto fra Hubei e la Lombardia - #Coronavirus #confronto #Hubei
400,Hellas Verona in campo per il Coronavirus: l’iniziativa del club - #Hellas #Verona #campo #Coronavirus: 
401,Coronavirus Terrence McNally è morto: ha fatto la storia del cinema - #Coronavirus #Terrence #McNally
402,hope the coronavirus reaches to mr neale
403,"Coronavirus, 69.176 casi totali. Oltre 8mila i guariti "
404,"Anziana positiva al Coronavirus in una casa di riposo, ora in 23 su 71 hanno la febbre "
405,"Coronavirus, dipendenti Pirelli donano 7mila ore di lavoro "
406,🇺🇸 Los Angeles County reports first child death in the U.S. linked to #coronavirus; no further details.
407,Le norme di sicurezza di Azkaban come le direttive di Conte in queste settimane per il coronavirus. #harrypottereilcalicedifuoco
408,"#Pregliasco su #coronavirus: ""In Italia sicuramente non si tratterà di un picco unico ma di un’onda. Nelle zone che sono state investite per prime c’è stata una difficoltà di controllo. Riteniamo che nel Nord i casi reali siano dieci volte quelli notificati""@preglias #dimartedì"
409,"#Conte non ha alcuna strategia e gestisce l'emergenza #Coronavirus con la sola tattica: naviga a vista e firma decreti restrittivi a raffica. Sono decisioni drastiche, dettate dall'evidenza dei fatti, che non possono essere protratte per lungo tempo. #Covid19. #Covid19Italia."
410,"Coronavirus, Roby Facchinetti è devastato dal dolore "
411,Coronavirus disease (COVID-2019) situation reports » https://www.who.int/docs/default-source/coronaviruse/situation-reports/20200324-sitrep-64-covid-19.pdf?sfvrsn=703b2c40_2 #Coronavirus disease 2019 (#COVID19) WHO Situation report - 64 24 March 2020
412,"#Coronavirus, Guardiola e Messi cuore d'oro: generosa donazione per la Catalogna https://bit.ly/2QHQB1m #Notizie"
413,"Lo que no pudo el Coronavirus lo hizo Rina, acabó con mi matrimonio. Ese era tu plan, yo lo sé pero Damián se queda conmigo."
414,Un supercomputer contro il coronavirus. 
415,"Coronavirus (COVID-19): ultimi articoli, news – 24 marzo.: Segnaliamo articoli, linee guida… "
416,Cari @Quirinale @Montecitorio @SenatoStampa @Roberto_Fico @Palazzo_Chigi se sole fosse vero... ! Che ne pensate @CottarelliCPI @diMartedi @OGiannino @Corriere @sole24ore @CarloCalenda @Giangimerlo @GiancarloNocera #coronvirusitalia #coronavirus 
417,"Coronavirus, quanti sono i casi e i morti nel mondo: i numeri da Spagna a Germania, da Uk a Usa https://www.fanpage.it/attualita/coronavirus-quanti-sono-i-casi-e-i-morti-nel-mondo-i-numeri-da-spagna-a-germania-da-uk-a-usa/ via @fanpage"
418,"Un homme de 35 ans, verbalisé à huit reprises pour ne pas avoir respecté les obligations de confinement liées au coronavirus, a été condamné mardi à quatre mois de prison ferme et écroué dans la Loire (Le Figaro)"
419,Coronavirus: al Civile un laboratorio cinese chiavi in mano 
420,"Coronavirus Messico, presidente Obrador: «Andate a mangiare fuori, continuate la normale vita» https://www.ilmessaggero.it/mondo/coronavirus_messico_vita_normale_presidente_obrador_24_marzo_2020-5130880.html @ilmessaggeroit"
421,"Bella notizia e auguri per tutto,con la speranza che possano ritornare nelle loro case e con i loro affetti tutti gli italiani e tutte le persone nel mondo che in questo momento sono ricoverati negli Ospedali per causa del ""Coronavirus"".E che il vile sia al più presto sconfitto."
422,1er muerto en #Cúcuta 💀 por #coronavirus #Colombia https://bit.ly/33L0VLq
423,"To conceal the actual dimensions of the spread of the virus, its fatalities, and regime’s incompetence, the clerical regime expelled the team of @MSF who had traveled to #Iran to set up a field hospital in Isfahan #coronavirus #COVID19 #COVID2019"
424,"CASTEL VOLTURNO - Cesare Diana: “Non solo problema Coronavirus, territorio rischia di diventare far west” https://www.casertafocus.net/home/index.php?option=com_content&amp;view=article&amp;id=34255:castel-volturno-cesare-diana-non-solo-problema-coronavirus-territorio-rischia-di-diventare-far-west&amp;catid=10:politica&amp;Itemid=132"
425,"@GiuseppeConteIT forse sarebbe ora di imparare qualcosa di nuovo, per esempio a essere Presidente di una Nazione Sovrana e serva solo del POPOLO ITALIANO, che ne dice? @vitocrimi @luigidimaio @LaCastelliM5s @SPatuanelli #COVID19italia #COVID2019italia #coronavirus In UK accade : "
426,"GRAZIE RAGAZZI 🇮🇹 Insieme possiamo fare tante cose buone, ora che la parta più dura è andata concentriamoci sul coronavirus! "
427,Coronavirus. Ecco perché anche una passeggiata o una corsa possono essere pericolose. Lo spiega un video della Polizia - Quotidiano Sanità https://dev.twitter.com/web/tweet-button di @QSanit
428,creative use of technology to fight coronavirus
429,"Guido Bertolaso positivo al Coronavirus: lunedì ha incontrato Ceriscioli. ""Continuo a lavorare per le Marche"" http://dlvr.it/RSVSgW"
430,"#DiMarco su #coronavirus: ""A Bergamo solo negli ultimi giorni è sceso il numero dei pazienti che arrivano in ospedale: abbiamo 7 reparti Covid. Ci aspettiamo gli esiti favorevoli dell'isolamento"" #dimartedì"
431,"Coronavirus, si riscopre la lettura: gli animali https://ladiscussione.com/?p=30478"
432,"Emergenza Coronavirus, Diocesi in prima linea https://ladiscussione.com/?p=30314"
433,Coronavirus “basta inseguire il virus: pianifichiamo insieme la riapertura dell’Italia” - #Coronavirus #“basta #inseguire
434,Coronavirus si è spento il drammaturgo Terrence McNally - #Coronavirus #spento #drammaturgo
435,Coronavirus tra i sintomi ci sarebbe anche la perdita dell’olfatto - #Coronavirus #sintomi #sarebbe #anche
436,Coronavirus Cdm approva la stretta anti-furbetti: carcere per chi viola quarantena. Domani Conte riferirà alla Camera - #Coronavirus #approva #stretta
437,Coronavirus il dramma delle prostitute: “Non sappiamo come fare” - #Coronavirus #dramma #delle
438,Coronavirus il governatore della Calabria Santelli risolve il caos di Villa San Giovanni: “si imbarcano donne bambini e anziani” - #Coronavirus #governatore #della
439,"L’Italia in agonia per il coronavirus offre il suo aiuto alla Croazia colpita dal terremoto Esercito e Protezione civile inviano uomini, mezzi e tende a Zagabria, dove il sisma ha provocato molti danni e parecchi feriti"
440,#Coronavirus #COVID19 Global Cases @JHUSystems 3/24/2020 10:40:43 PM » https://gisanddata.maps.arcgis.com/apps/opsdashboard/index.html#/bda7594740fd40299423467b48e9ecf6 Novel Coronavirus COVID-19 @UW HGIS Lab 2020-03-24 13:43:32 PST » https://hgis.uw.edu/virus/ COVID-19 #Italia - @DPCgov Ultimo aggiornamento 24/03/2020 17:00 » https://datastudio.google.com/u/0/reporting/91350339-2c97-49b5-92b8-965996530f00/page/RdlHB
441,#CARABINIERI CARABINIERI • Re: corona virus - Decreto Legge http://dlvr.it/RSVSbQ
442,El Mercado Armonía cierra sus puertas para evitar la propagación del coronavirus | Santiago Ya! http://www.santiagoya.com/?p=11774
443,"Coronavirus, il dietrofront di Nieddu: “Faremo i test rapidi, presi 20mila kit” https://www.sardiniapost.it/politica/coronavirus-il-dietrofront-di-nieddu-faremo-i-test-rapidi-presi-20mila-kit/ #Sardegna"
444,"Coronavirus: Anm ""gravissimo sovraffollamento carceri"" https://ladiscussione.com/?p=30470"
445,"Coronavirus, 125 casi in più in Sicilia Musumeci: 'Qui non si sbarca, quarantena in hotel' https://www.trapani-24h.it/coronavirus-125-casi-in-piu-in-sicilia-musumeci-qui-non-si-sbarca-quarantena-in-hotel/"
446,Per il Coronavirus possibili meno emissioni di gas serra https://ladiscussione.com/?p=30467
447,"Coronavirus: primo operaio positivo all'Electrolux, chiude la Sole di Oderzo "
448,"Coronavirus, ""nuovo positivo all'Electrolux di Susegana"" | Oggi Treviso | News | Il quotidiano con le notizie di Treviso e Provincia "
449,Coronavirus: un altro caso positivo allo stabilimento Electrolux di Susegana 
450,"Coronavirus, primo operaio positivo all'Electrolux: chiude la Sole di Oderzo https://www.informazione.it/a/99EFC0A3-6DF1-4BAE-BC5F-133A3B5FF40C/Coronavirus-primo-operaio-positivo-all-Electrolux-chiude-la-Sole-di-Oderzo"
451,"Coronavirus, il sindaco di Messina controlla gli sbarchi in diretta "
452,"Coronavirus, assalto ai traghetti per la Sicilia: l’ira dei politici "
453,"Coronavirus, prosegue la flessione in Italia. Oggi 3780 nuovi contagi e 601 morti "
454,"Coronavirus: come aiutare le imprese siciliane? Per questo motivo chiedo scusa se il mio non sarà un linguaggio tecnico, ... disciplinarmente, per l' impiego e l' utilizzazione, dal governo regionale. ... non si può considerare possibile che chi viene so… https://ift.tt/3bmHwCY"
455,Coronavirus: anziani casa riposo protestano per isolamento 
456,"Milano, la strage degli anziani nella casa di riposo: 50 morti di coronavirus "
457,"Coronavirus, 14 anziani positivi alla Casa di Riposo di via Primo Settembre "
458,"Messina, anziana con coronavirus in casa di riposo: adesso in 23 con sintomi e febbre "
459,"Coronavirus, saliti a 22 i casi positivi alla Casa di Riposo: un Covid anche alla clinica Cristo Re "
460,"Coronavirus, tutto sull'Avigan. L'azienda che lo produce: “Nessuna prova che funzioni” ... tra fake news, notizie potenzialmente reali, ipotesi, voci di lavoro su un vaccino e altro di questo ... In sostanza, un medicinale progettato con l'obiettivo di b… https://ift.tt/3bpbF4x"
461,"Messina, morta una donna di 97 anni positiva al Coronavirus "
462,"Coronavirus, il pediatra: «Questa epidemia durerà tre mesi» "
463,Coronavirus/Pirelli dona 65 respiratori e 20mila mascherina alla Lombardia 
464,#Autodichiarazione #covid19 #coronavirus 
465,Coronavirus: Pirelli al fianco di Regione Lombardia con 65 respiratori 
466,Coronavirus: Pirelli sostiene Lombardia con 65 respiratori e dispositivi medici 
467,#dimartedì #coronavirus #smartschool @diMartedi
468,#CORONAVIRUS Buonanotte con i dati della giornata. Restate a casa. https://www.instagram.com/p/B-IllzEBp4U/?igshid=3omp1a7istlx
469,"Cosi saranno contenti i fenomeni che sorridevano Vermi schifosi Ricoverato per coronavirus il medico che aveva denunciato le ""mascherine-fazzoletto"" ad Aosta "
470,E a pior parte é que vc destrói a auto-estima da outra pessoa
471,"L'espertone non è molto in forma. Attribuiva al coronavirus la qualità di marker della inefficienza, richiamando le gravi crisi in Iran e in Italia. Poi il virus è sbarcato everywhere ed è rimasto senza parole. "
472,"Coronavirus. LA CALABRIA SI AFFIDA AL SUO PATRONO. I suoi abitanti invocano San Francesco di Paola: LA CALABRIA SI AFFIDA AL SUO PATRONO Nella nostra terra di Calabria, in questi giorni di prova e sofferenza per il dilagare del coronavirus, i suoi… http://dlvr.it/RSVSNs"
473,"CORONAVIRUS - Atalanta: Hateboer, torneo Fifa20 per beneficenza "
474,"Andamento dei contagi nei vari paesi, via @FinancialTimes (Newsletter @ilpost) #Coronavirus "
475,Re: March 24th #QAnon drops #WWG1WGA #coronavirus 
476,Perché non viene a casa mia ad intrattenere i bambini? Sa fare terapia ABA per gli autistici? Mia figlia grazie al coronavirus ha dovuto interrompere il percorso terapeutico ed ho la necessità e l urgenza che riprenda.
477,"Emergenza Coronavirus, i consigli di Ashley Young agli inglesi http://twib.in/l/88LyrrXje6aq via @Fantacalcio #Fantacalcio"
478,Is this a cousin of the hurricane party? Cuz...unlike hurricanes the coronavirus is contagious AF. What is wrong with people? 
479,- Fai qualcosa o no per combattere il Coronavirus? - Lo sto facendo. (Sul giornale) «#StaiACasa». http://cagle.com #StayHomeSaveLives #CoronavirusLockdown #21daysLockdown #COVIDー19
480,Libya records the first case of corona virus infection https://www.mbs.news/a/2020/03/libya-records-the-first-case-of-corona-virus-infection.html via @MbS News
481,"Buongiorno. Ora https://giampierogramaglia.eu/gpnewsusa2020/ @AffInt @formichenews: #usa2020 - 224, mentre #coronavirus fa sparire @JoeBiden #WhereIsJoe, @BernieSanders vince primarie #DemocratsAbroad (me poco gli serve)"
482,"Coronavirus, Cdm vara la nuova stretta: multe di 3 mila, fino a 5 anni di carcere per chi viola la quarantena [aggiornamento delle 23:55] "
483,Quando una telefonata ti rallegra la giornata. Il #Bologna insegna che basta un piccolo gesto per distrarci un po’ in uno dei periodi più neri della storia italiana: telefonata dei protagonisti rossoblu ai tifosi che vivono da soli. #coronavirus 💪🇮🇹💪🇮🇹 
484,La vitamina C cura il Covid? E mangiare proteine e aglio aiuta? No ⚠️⛔ Ecco le 12 più diffuse #fakenews sul #coronavirus smentite punto per punto dal Ministero della Salute 
485,"Coronavirus, in arrivo nuovi presidi di sicurezza http://www.notiziemolise.it/index.php/2020/03/25/coronavirus-in-arrivo-nuovi-presidi-di-sicurezza/"
486,Bimbo di 5 anni scopre di avere il Coronavirus: “Mamma sto morendo?” - #Bimbo #scopre #avere #Coronavirus: 
487,Coronavirus nuovo aggiornamento: oggi 91 tamponi positivi in Campania - #Coronavirus #nuovo #aggiornamento:
488,Piero Chiambretti rompe il silenzio sulla madre morta di Coronavirus - #Piero #Chiambretti #rompe #silenzio
489,Coronavirus Cdm approva la stretta anti-furbetti: carcere per chi viola quarantena. Domani Conte riferirà alla Camera - #Coronavirus #approva #stretta
490,LIVE Coronavirus Ultime notizie. Sciopero dei benzinai in vista Conte prova a scongiurarlo - #Coronavirus #Ultime #notizie.
491,Coronavirus Naomi Campell parla di Vincenzo De Luca agli americani - #Coronavirus #Naomi #Campell #parla
492,"io ho studiato statistica demografica il secolo scorso, ho dato anche statistica medica nel 1984, é quello dei 107 maschi nati vivi per 100 femmine è il dato più strano che ho studiano, non varia dalla notte dei tempi, è una caratteristica genetica della razza umana #coronavirus"
493,"Without Urgent Action, Coronavirus Could Overwhelm U.S., Estimates Say "
494,No quella è la pubblicità avviso del corona virus
495,Hong Kong Faces New Coronavirus Crisis 
496,The battle begun! My calculation potency is already at @foldingathome service! Let's defeat this Corona virus once and for all! 
497,Da #Whan il vaccino che sconfigge il #Coronavirus... 
498,Ulteriore speranza In Calabria creati anticorpi sintetici contro Coronavirus 
499,"#coronavirus sono sempre più convinto che dovremmo assumere qualche adolescente siriano o palestinese o israeliano o di qualunque nazione in guerra... e chiedergli di insegnarci la forza con la quale hanno vissuto nella loro ""unica"" vita passata sotto le bombe e la distruzione."
500,Coronavirus cambia parere degli anti-spesa pubblica: cosa dicono oggi da Monti a Friedman 
501,#Foldingathome #reasearch #coronavirus #COVIDー19 come offrire il proprio contributo dal proprio pc / how to help research staying at home! #iorestoacasa @NoNameFoundTV @foldingathome
502,Aiuti russi per fronteggiare il coronavirus. Sinceri e senza doppi fini. La gratitudine di Liguria Russia 
503,"Coronavirus, Maldini avverte: &amp;#8220;Sto bene ma non è una semplice influenza&amp;#8230;&amp;#8221; https://www.blitzquotidiano.it/blitztv/coronavirus-maldini-influenza-3165690/ Lo dica a una certa sciocchina (fa rima con gallina)."
504,#Coronavirus2019nCoV #MedicalDevices #VentilatorsMedical Slow Response to the Coronavirus Measured in Lost Opportunity http://dlvr.it/RSVRv4
505,#EmergencyMedicalTreatment #PoetryandPoets #Coronavirus2019nCoV A Boston E.R. Doctor's Poem About the Coronavirus http://dlvr.it/RSVRv1
506,Coronavirus dejó en claro que los chetos es la peor raza humana que existe... #coronavirus #CuarentenaObligatoria #QuedateEnTuCasa #CoronavirusArgentina
507,"Coronavirus: aumentano i guariti, i dati dell'ultimo bollettino "
