,Date,Text
618,2020-03-19 07:42:21+00:00,"This training is intended for healthcare workers and public health professionals, as it is focused on infection prevention and control. Be enrolled in the #OpenWHO course Infection Prevention and Control (IPC) for Novel Coronavirus (COVID-19) "
619,2020-03-19 06:40:12+00:00,"#Coronavirus: Air pollution and CO2 fall rapidly as #COVID19 virus spreads affecting industrial output, aviation and ground transport #ClimateEmrrgency"
620,2020-03-19 06:09:02+00:00,"My heart aches at seeing military convoys transporting dead bodies to cemeteries in #Italy. Pity for those souls who died alone, gasping for air in far away hospitals &amp; who will be buried alone without relatives around them. Heartbreaking. #COVID19 #covid #coronavirus @ifrc"
621,2020-03-18 17:46:42+00:00,"With #Iran facing a #coronavirus catastrophe because of illegal #US Sanctions, where is the outrage from European countries? The American treatment of Iran is developing into a form of Genocide, and still the #EU stays silent. Do Iranian lives not matter...?"
622,2020-03-18 17:18:16+00:00,"BREAK: Italy reports 4,207 new cases AND 475 new deaths in past 24 hours Total now 37,513 coronavirus infections in the country and 2,978 Worst numbers to date 😢"
623,2020-03-18 17:04:10+00:00,"So now that George R.R. Martin is in isolation because of the coronavirus, CAN HE FINALLY FINISH WRITING THAT GOD DAMN BOOK??????"
624,2020-03-18 16:29:14+00:00,On t’a dit #ResteChezToi ! 😅 #confinementjour2 #RestezChezVousBordel #RESTEZCHEZVOUS #coronavirus #CoronaVirusChallenge #CoronavirusFrance #TikTok
625,2020-03-18 16:23:30+00:00,NEW: 32 more people die in England after testing positive for #coronavirus - taking the total throughout U.K. to 104 #CoronaVirusUpdate
626,2020-03-18 16:04:15+00:00,BREAK: Ryanair says it will ground nearly all its flights from next week due to the coronavirus crisis gripping Europe #CoronaVirusUpdate
627,2020-03-18 14:39:32+00:00,"Quinine: what happens if it turns out to be highly effective against the current Corona virus? What are Lammy, Alibhai wossername and the other race baiters going to do? Quinine was instrumental in permitting the colonisation of Africa. Will Lammy take it, or refuse in protest?"
628,2020-03-18 14:07:08+00:00,"#StayAtHome @JY_LeDrian “Limiting our social interactions as much as possible, as prescribed by the scientific community, also means limiting our international #travel.” #Coronavirus "
629,2020-03-18 12:52:51+00:00,"#US should not be allowed sacrifice global public health to suit it's pathetic agenda, by imposing Sanctions on so many countries like #Iran #Venezuela #Nicaragua #Syria - world community must help these countries fight #Coronavirus by pressuring US to end this inhuman action.. "
630,2020-03-18 12:05:50+00:00,"All of us, especially political leaders, should stop criticising and blaming other countries regarding #coronavirus responses. Looking for scapegoats will not help. This is not about winning the next elections but fighting a collective battle through international cooperation. "
631,2020-03-18 10:46:19+00:00,"While humanity hits the pauze button, Nature obviously doesn’t 🌸 🐝 #coronavirus #COVID19 #COVID19BE"
632,2020-03-18 09:17:32+00:00,"❤️ We want to express our heartfelt gratitude to those in the front line of the fight against #Coronavirus. 👉 To all medical 👨🏻‍⚕️👩🏾‍⚕️&amp; civil protection staff across the EU 🇪🇺, who are working tirelessly to combat #COVID19, we want to say: thank you! #StayAtHome #WeStandTogether – at Brussels | Bruxelles | Brussel"
633,2020-03-18 08:06:04+00:00,“Osborne/Cameron tore down the roof before the storm” #coronavirus #Corvid19uk
634,2020-03-18 07:09:27+00:00,"Differentiating between cold, flu and coronavirus. "
635,2020-03-18 07:03:19+00:00,In response to increasing concerns of COVID-19(Coronavirus) with heavy heart we will be closing B R E W for eat in but we’ll be still doing take out for collection until further notice! (9-4pm) All you need to do is… https://www.instagram.com/p/B93av2rARwI/?igshid=nucexw3vbvgp
636,2020-03-18 05:18:27+00:00,#Repost @tomellis17 IG This video by @JOSHSTYLELA helps illustrate what #socialdistancing will eventually do to the #Coronavirus. Get it under control and smash it out of our lives. Stay home. Stay safe. We can do this. Sending all of you lots of love 🙏🏽😈 #tomellis #lucifer
637,2020-03-18 02:29:01+00:00,Resistance is... NVM 😷🖖#coronavirus 
638,2020-03-18 00:09:34+00:00,"The pace of the spread of #coronavirus will see the Government get to where they should be soon - but it's unfortunate that they started behind the curve, and are still behind the curve. The lessons of China, S Korea and Italy need to be acted on with greater speed... "
639,2020-03-17 21:49:56+00:00,"French Prime Minister Edouard Philippe said in an interview with France 2 tonight that though UK citizens are exempted from this EU ban for now, this could change if the UK doesn’t quickly align its #CoronaVirus protections with the rest of Europe."
640,2020-03-17 20:01:21+00:00,Animal shelters are asking for foster homes to help them house pets as coronavirus necessitates big changes in the way they operate. https://www.huffpost.com/entry/foster-adopt-pet-coronavirus-covid-19-cat_n_5e6e9c26c5b6bd8156f9cd7e?ncid=engmodushpmg00000004 #via @HuffPost
641,2020-03-17 18:17:39+00:00,Happy St Patrick’s Day to all around the world... just having a small glass to cheer you all in this crazy uncertain time.. stay safe everyone ☘️🇮🇪🥂 #StPatricksDay #France #ChateauLife #CoronaVirus – at Château de La Chênaie
642,2020-03-17 16:25:38+00:00,#coronavirus #confinementtotal pour tout comprendre cliquez ⬇️
643,2020-03-17 12:12:12+00:00,Have you missed @myESR organised lecture on #COVID2019 by leading geneticist and molecular immunologist Prof. Dr. Penninger ? 📽 You can still watch it ! Click link below to discover how his research can be a turning point in treatment of #coronavirus 
644,2020-03-17 10:12:26+00:00,"#China exports medical equipment to deal with #Coronavirus around the world - Meanwhile for many years the #US has exported Military and Financial Imperialism at a terrible cost for millions,+ continues to do so - Maybe it's time to start a #BDS Movement against United States..."
645,2020-03-17 10:05:44+00:00,Please read this thread showing how containment is the only viable strategy to fight #COVID19 at the moment In simple words:”throw the kitchen sink at this #COVID2019 epidemic. And do it now.” #coronavirus #COVIDー19 @IFRC_Europe @IFRCAfrica @IFRC_es @IFRC_MENA @IFRCAsiaPacific
646,2020-03-17 09:56:05+00:00,To all our followers around the world: if you are in quarantine: #StayAtHome if you still go out: follow @WHO's recommendations below to prevent the spread of #coronavirus. Stay strong💪 and healthy 😷 
647,2020-03-17 08:44:27+00:00,"A MASSIVE thank you to the thousands of #NHS, public health and care staff who are working SO hard to protect people across the UK from the Coronavirus #TeamNHS #Coronavirus #Covid19 👏👏👏👏👏👏👏"
648,2020-03-17 08:23:35+00:00,Empty paris #empty _____ @QueFaireAParis @ParisZigZag @ParisJeTaime @paris @ParisBouge @parisvisites @VisitParisIdf @visitparisreg @vivreparis @VIParis @Doitinparis #streetphotography #photography #Photographie #photooftheday #Paris #France #coronavirus #COVID19 #COVID19france
649,2020-03-17 08:22:25+00:00,Wishing all my friends and family around the world a very Happy #StPatricksDay. Sending an Irish blessing to all our amazing healthcare workers who are hard at work fighting #coronavirus #COVID19 Lá Fhéile Pádraig sona duit.
650,2020-03-17 08:17:57+00:00,Some powerful straight talking from #Serbia who have to look to #China for help with #coronavirus - Exposing the hypocrisy of the #EU - We have a lot to learn about #Solidarity from China and others. Europe needs to wake up to reality that the virus doesn't recognize borders...
651,2020-03-17 08:03:02+00:00,"It is appropriate to focus public attention on the corona virus at the moment. But the climate crisis will not go away, and the European Green Deal is the best possible plan to revive the economy and European solidarity during and following the pandemic. "
652,2020-03-17 06:12:08+00:00,"#Coronavirus: Europe plans full border closure in virus battle. ""Concretely, all trips between non-European countries and EU countries will be suspended,"" French President Macron said in a televised address on Monday. #COVID19"
653,2020-03-16 23:12:05+00:00,Wishing u all the best in times like these ! ❤️ Stay home and safe lives please .. 🤘🏻💞 Together we can do this !! 👊🏻 Love Dee Dee xx #coronamovement #coronavirusBE #samentegencorona #staythefuckhome #coronavirus pic.twitter.com/Uekss6WQig
654,2020-03-16 23:04:31+00:00,Unfortunately the people who are elder and have key #NCDs are most likely infected and died of #coronavirus. They should take stricter measures to be self protected in the family and community. #LeaveNoOneBehind #HealthForAll
655,2020-03-16 22:41:19+00:00,First successful lab meeting using @zoom_us . Great app! Highly recommend! @SalehLabParis is ready to fight #coronavirus with one simple strategy: #StayAtHome
656,2020-03-16 22:36:45+00:00,"This should actually be a thing, everyone making music to pass the time and releasing a « Quarantine EP » when Coronavirus is out of the way"
657,2020-03-16 22:20:13+00:00,"#Estonia, the leading education nation in Europe (No 1. in PISA test in Europe), announced that it is humbled to share all of its digital #education tools to support other countries’ education systems during the #coronavirus crisis: https://www.hm.ee/en/news/estonia-offers-its-digital-education-solutions-free-support-other-countries"
658,2020-03-16 21:37:39+00:00,New experience: homeoffice. The Olympic pin collection reminds me what I am working for. #COVID19 #coronavirus 
659,2020-03-16 21:27:31+00:00,French Interior Minister right now giving details of lockdown. Basically like in Italy. If you go out you need to go online and fill out a form saying why. If you don’t have it and cops catch you you will be fined. Checkpoints and mobile units to be set up #COVID19 #coronavirus
660,2020-03-16 20:56:19+00:00,Hey all you greedy bulk panic buyers in #London #coronavirus My daughter went after work to get her normal weekly shop! YOU'VE CLEANED THE SHELVES😤 At least here in France people have some DIGNITY in crisis! So much for UNITED! 
661,2020-03-16 20:44:50+00:00,"Shocking report on Sky News about the reason behind the UK government’s sudden switch its from controlled spread approach to suppression of the coronavirus: experts told them that a best case scenario under the existing model was 250,000 deaths."
662,2020-03-16 20:18:15+00:00,It's 9pm in #Brussels and it's so quiet you could hear the robins sing #coronavirus 
663,2020-03-16 19:41:33+00:00,"Lack of investments in epidemic preparedness & lack of speed have delayed the #COVID response in many European countries: the consequences have been severe. Now it’s time to catch up, together &amp; until the very last case. #COVID19 #COVID2019 #coronavirus @ifrc @IFRC_Europe"
664,2020-03-16 19:38:00+00:00,"Coronavirus: ""The borders of the Schengen zone will be closed for 30 days"", announces Macron https://health.liveuamap.com/en/2020/16-march-coronavirus-the-borders-of-the-schengen-zone-will via @Europe1"
665,2020-03-16 19:26:58+00:00,"Dear Anti-Fragilistas, you got an email featuring our first Bagatelle conversation Luca/Stefan/George/Sindre/Nacho https://anti-fragilista.com/f/bagatelle-conversation-1-lucastefangeorgesindrenacho featuring lots of info on coronavirus by non experts @DellAnnaLuca @STrosterud @NonMeek @GeorgeJNasr and @NachoOliveras. Enjoy it as we did!"
666,2020-03-16 19:10:41+00:00,Idris Elba finding out he has #coronavirus 
667,2020-03-16 18:19:44+00:00,"Thanks the urgent call from Ugo to me to buy some food and wine 30 mins before Swiss Nationanal Emergency lauched when I was working on Covid-19 Voxeu EBook chapter #swisslockdown, #coronavirus @upanizza @BaldwinRE @voxeu"
668,2020-03-16 17:43:13+00:00,Get your socks and wiggly eyes ready 😂 #coronavirus #COVID19
669,2020-03-16 17:21:01+00:00,"""Tonight at the supermarket"" #streetphotography #Brussels #Belgium #blackandwhite #monochrome #dailylife #iphoneography #mobilephotography #iphoneX #street #Bruxelles #belgique #photographie #photography #COVID19 #COVID19Belgium #coronavirus #CoronavirusPandemic #StayHomeBelgium"
670,2020-03-16 16:42:38+00:00,@ISICEM would like to thank all the #ICU staff around the world who are doing such an amazing job in such difficult times. They are today’s heroes ! Pic credit to Josef Lee #COVID19 #coronavirus #isicem20 #ICU #intensivecare #EmergencyMedicine
671,2020-03-16 15:43:58+00:00,So many people misinformed about the virus. Governements ask to cancel and avoid mass concentrations of people yet everyone rushes to the supermarkets in close contact with eachother. 🤡 Guys this is not the walking dead. @geant_casino #coronavirus 
672,2020-03-16 14:15:43+00:00,"🚯Alarming news: Masses of surgical masks found on the beaches of Soko Islands, Hong Kong. ""Due to the current COVID-19 corona virus, the general population have all taken the precaution(...)wearing one to two masks per day."" More information here👇 http://oceansasia.org/beach-mask-coronavirus/"
673,2020-03-16 13:38:22+00:00,A total disgrace that Irish Gov's ever allowed #US Military use #Shannon to destroy the lives of millions. @LeoVaradkar Are we going to risk the lives of Irish people now by allowing US Military troops to come to Ireland from the US when #Trump was in denial about #coronavirus..? 
674,2020-03-16 13:14:32+00:00,"#Coronavirus is very dangerous + contagious, can infect all Human Society, and doesn't stop at borders. While the people of #Iran grapple with the virus, #US is worsening the problem. US Sanctions are killing Iranians + endangering Global Public Health - Please sign petition..."
675,2020-03-16 13:02:47+00:00,Who would have thought paring the NHS to the bone would negatively affect our capacity to respond to a health crisis? #coronavirus
676,2020-03-16 12:52:13+00:00,TO ALL PANIC BUYERS : When the coronavirus crisis is over some of you will eat pasta for 2 years and make Christmas decorations with toilet paper. Behave please. Thanks. #COVID19
677,2020-03-16 12:44:54+00:00,#TeleEducation works very well: my 13 yrs old worked enthusiastically at math the whole morning; teacher explained the subject by videoconference and mates did their homework together on Insta. Extension activity : Find the surface area of an empty toilet paper roll! #coronavirus
678,2020-03-16 10:23:17+00:00,Anyone in Paris who needs to get to the UK: GO NOW. They're cancelling trains without warning in preparation for total lockdown. Stay safe everyone. #coronavirus #CORONAVIRUSENFRANCE #COVID19 #lockdown #Quarantine
679,2020-03-16 08:53:38+00:00,"A MASSIVE thank you to the thousands of #NHS, public health and care staff who are working SO hard to protect people across the UK from the Coronavirus #TeamNHS #Coronavirus #Covid19 👏👏👏👏👏👏👏"
680,2020-03-15 23:48:38+00:00,"One year ago today. @l0_da, I did not expect us to be separated by coronavirus on our first wedding anniversary! But this will pass and we'll be together again. ❤️ "
681,2020-03-15 19:33:27+00:00,No interpreters yet for #coronavirus press conferences in Belgium🇧🇪 . The language situation is complex: we have two signed languages (VGT and LSFB) and during the last press conf the PM switched between Dutch and French not necessarily saying the same thing in both languages/1
682,2020-03-15 19:26:08+00:00,"Paris, France - Coronavirus Shutdown Sunday: cinemas, spectacles, cafes are closed, so are parks - even the Tuileries! People cannot resist the beautiful day, even so. But we have yet a long way to go. @Paris, France https://www.instagram.com/p/B9xBXaVqwZ0/?igshid=ztf7nfgnv08t"
683,2020-03-15 18:36:37+00:00,Corona virus is following me! This is not good! 😂😂 i will not follow back! 😅 #cardiotwitter @CardioIAN @DBelardoMD @CMichaelGibson @MihaiTrofenciuc @iamritu @AnastasiaSMihai @HanCardiomd @DrHaniMahmoud @KemalogluOz
684,2020-03-15 18:22:44+00:00,Anastacia as hand sanitizers. An anti-coronavirus thread: 
685,2020-03-15 18:08:50+00:00,"😢It was not a good Sunday for my country 🇮🇹 ▶️ +369 dead (total = 1.4k) ▶️ ~10 Intensive Care beds left in my Region (Lombardy) ▶️ 10+ days waiting times at the Brescia crematorium What to say? If you still didn’t get it: #stayhome, it’s your duty as a citizen #coronavirus"
686,2020-03-15 18:02:08+00:00,Let’s have some fun: Replace ESC titles with ‘coronavirus’ “Coronavirus My Heart” 🇦🇿
687,2020-03-15 17:02:06+00:00,"Resident Evil, Coronavirus City DLC 👀🧻😷 #ResidentEvil #COVIDー19"
688,2020-03-15 14:54:11+00:00,"#Coronavirus - Maybe people will start to realise that #US behaviour and decision making is rarely disconnected from it's business interests. For many years now, they have relentlessly and recklessly driven US Financial Imperialism regardless of the trail of destruction..."
689,2020-03-15 14:18:10+00:00,Signed! 🖌🖌🖌 Prominent Europeans call for a European answer to the coronavirus threat 
690,2020-03-15 13:51:23+00:00,The Legend of #Coronavirus ⚔🧻👀 
691,2020-03-15 13:08:02+00:00,"Deutschlandfunk reports on COSMO project: Monitoring knowledge, risk perceptions, preventive behaviours, and public trust in the current coronavirus outbreak in Germany: https://www.deutschlandfunk.de/covid-19-bereitschaft-zur-einschraenkung-wegen-coronavirus.2850.de.html?drn:news_id=1110631 @CorneliaBetsch @rki_de @ZPID @BNITM_de @smc_germany @YaleGH #coronadeutschland"
692,2020-03-15 11:41:44+00:00,She couldn't even answer a straightforward question from Morgan during the week re if a 6ft 4 hairy arsed ( and chest no doubt ) ex male weighlifter should be allowed to compete against women ...christ knows how she'd deal with the Corona virus ...🙄🙄🙄
693,2020-03-15 11:05:18+00:00,Your grandparents were called to war. You’re being called to sit on a couch. You can do this! 💪🏻 #Coronavirus #lockdown
694,2020-03-15 10:03:32+00:00,We don’t care about the coronavirus in France. We care about our bakeries 😂 
695,2020-03-15 08:58:15+00:00,"A doctor in a hospital in Toulouse explains that they had 4 cases of young people without health concerns with a case of Coronavirus aggravated because they took anti-inflammatory drugs. As a precaution, avoid taking anti-inflammatory drugs while the epidemic passes"
696,2020-03-15 07:39:15+00:00,"As #COVID19 comes to Africa, these questions are legitimate. Local humanitarian organizations, grounded in communities, like #RedCross will be critical for the response. They need to be adequately funded. @ifrc @IFRCAfrica #COVIDー19 #coronavirus "
697,2020-03-15 07:28:40+00:00,Saving lives has never been easier. Just stay at home. Work. Read books. Play video games. Watch movies. Draw. Think. Write. Cook. Sleep. Play Music. Dance in your living room. Sing. Listen to Music. Phone old friends. Well done @mathieupersan #coronavirus #Covid_19 #stayhome
698,2020-03-15 07:14:58+00:00,No comment #COVIDー19 #coronavirus #RESTEZCHEZVOUS #restecheztoi
699,2020-03-15 04:05:50+00:00,The headline says they're all being tested for Coronavirus. Did you not read that far?
700,2020-03-15 01:20:01+00:00,Don’t let the coronavirus distract you from the fact that Apple downloaded that U2 album on all our phones six years ago
701,2020-03-14 23:43:13+00:00,"Am just copying this beautiful message! #If the coronavirus has taught us anything it is lengths ppl will go to when desperate. Next time you want to judge boat people, refugees, migrants fleeing war torn lands remember we fought over toilet paper. "
702,2020-03-14 22:20:42+00:00,"Just found out that my ski holiday at Easter is off as French ski resorts are closing for the season due to #coronavirus. Although gutted my thoughts are with businesses and staff in the Alps losing a quarter of their season and income. Keep safe, see you next winter @LaPlagne"
703,2020-03-14 20:37:41+00:00,"“Staying at home well respected tonight”, Brussels, Belgium #streetphotography #Brussels #Belgium #blackandwhite #monochrome #dailylife #fujifilm_xseries #fujifilmxe3 #fujinon35mm #fujifilm #fujifilm_street #photographie #photography #StayHomeBelgium #COVID19BE #coronavirus – at Brussels | Bruxelles | Brussel"
704,2020-03-14 20:19:18+00:00,"That is exactly what the @EU_Commission proposed yestarday ""European coordinated response to counter the economic impact of the Coronavirus"" 👉🏻 https://bit.ly/3aXeSrW https://twitter.com/Bruegel_org/status/1237981670617362432"
705,2020-03-14 19:38:05+00:00,"France goes into lockdown at midnight tonight. I am a 2X cancer survivor with compromised immune system. If for some reason I were to pass from coronavirus, know that I love each and everyone of you and I will visit &amp; watch over you and all those whom you love. Peace be with you."
706,2020-03-14 19:33:39+00:00,"Breaking News : Bars, Restaurants and Cinemas in all of France are to stay closed. Health Minister announced we are now in stage 3 with 4,500 cases and 91 dead. #CoronaVirusUpdates #coronavirus #CoronavirusFrance"
707,2020-03-14 18:38:14+00:00,Bahrain GP has been postponed due to CoronaVirus for F1 &amp; F2. Obviously very disappointed not to be able to race but the right decision to take. Health goes first. The faster we beat coronash*t the faster we can have our normal life back. Stay safe everyone🦠 #BahrainGP #COVID-19
708,2020-03-14 17:13:14+00:00,"Everyday at 15:00 we will sing and play. Our first song will be at 3 PM on Sunday, where we would like to sing back to the Italian Tenor who was singing Nessun Dorma. We feel your passion and hope our music will send love your way. http://www.2ofharps.com #love #coronavirus"
709,2020-03-14 15:49:56+00:00,Don’t neglect your mental health during the #COVID19 outbreak. Some guidance and support ⬇️ #coronavirus 
710,2020-03-14 15:40:05+00:00,in case you need entertainment during #CoronaVirus #lockdown ...here you go:#brexit
711,2020-03-14 14:36:35+00:00,An intriguing thread about #UK approach to #Covid_19. Totally different from the approach adopted by Asian &amp; European countries. Definitely worth a read. #COVID19 #coronavirus #CovidUK
712,2020-03-14 14:30:03+00:00,You may or may not believe the government's scientific advisers on the UK's coronavirus plans but Jesus there's some mad shit conspiracy theories going around on Twitter. Get a grip you mad fools.
713,2020-03-14 14:21:18+00:00,"In challenging moments like the ones we are confronted to because of coronavirus, music remind us that ‘the union makes us stronger’ #StaySafe"
714,2020-03-14 13:27:04+00:00,"All Pubs and restaurants in Belgium closed last night for at least 3 weeks. We have to learn from #China and #Italia - reducing contact with others to the absolute minimum, is one of the key factors in tackling the spread of #coronavirus ... "
715,2020-03-14 13:14:46+00:00,"🔈🚨 European Commission dedicated 164€ Million in funding to startups and SMEs that ""could help treating, testing, monitoring or other aspects of the Coronavirus outbreak."" The funding is managed via the EIC Accelerator "
716,2020-03-14 12:12:04+00:00,"A member of Cabin Crew arrived in Dublin yesterday, on an Aer Lingus flight back from #Spain , no tests for #coronavirus for staff, back out today. Airline staff being told restrictions don't apply to them - sounds a bit reckless... And were passengers on same flight tested? "
717,2020-03-14 12:09:44+00:00,"Britain's journalists, from left, right and centre, are collectively failing to question the government's coronavirus response. I am really disappointed in people I once had some regard for."
718,2020-03-14 11:58:21+00:00,Is the corona virus showing us what we can digitalize efficiently and what we cannot?
719,2020-03-14 10:26:31+00:00,In light of the coronavirus situation during my trip...🤍 
720,2020-03-14 10:00:04+00:00,#3D realistic modeling of a #coronavirus. We’re doomed. #Covid_19 #COVIDー19
721,2020-03-14 08:05:29+00:00,WATCH this min clip❗️ THIS is ALL you need to KNOW about #Corona❗️ #FlattenTheCurve ‼️ ✅ #coronavirus #coronapocalypse #CoronaOutbreak #CoronaVirusUpdates #CoronaVirusDE #coronarvirusitalia #CoronavirusPandemic
722,2020-03-14 07:30:58+00:00,"I wish we had tons of MDs like Dr Leung. When he made this call 7 weeks ago, there were not even 10 cases of coronavirus in Hong Kong. Two weeks later, my colleagues there who could self-quarantined. For 5 weeks! Now, with a bit more than 100 cases, they are going back in office. "
723,2020-03-14 07:21:59+00:00,Applications welcome from startups and SMEs with innovative solutions to tackle Coronavirus outbreak | European Commission https://europa.eu/!Ht67xK via @EU_Commission @CoR_President @RegMurciaBrux @FGaliciaEuropa @abruZZelles @ToscanaBXL @LawSchmitz @M_Gaudron @WolfgangPetzold
724,2020-03-14 00:53:23+00:00,"This is how #Italy, my home, my beloved country, is fighting #coronavirus: staying at home but finding a way to stick together and warm up each others’ hearts. Italia mia, ce la farai, d’altronde, come potresti non farcela? ❤️ #Covid_19 #litaliachiamo"
725,2020-03-13 22:49:16+00:00,"I tried to warn everyone of my followers and friends about the #coronavirus while I was living in Wuhan during the #CoronaOutbreak , I bet now they wish they listened to me earlier smh 🤦🏽‍♂️"
