,Date,Text
0,2020-02-17 16:45:25+00:00,"Ho starnutito sul telefono, scusate!!! Ps non sono infetta è allergia !!!#coronavirus"
1,2020-02-16 17:45:40+00:00,"Questa notizia è stata data con poca rilevanza, come se fosse più importante l'aggiornamento continuo fornito circa il Corona Virus. Va bene tutto, ma ci stanno facendo una vicenda sproporzionata sopra: in Italia non è morto alcuno per il virus, ma quanti femminicidi avvengono?"
2,2020-02-16 16:12:30+00:00,"Alors @agnesbuzyn , l’épidémie du coronavirus s’est arrêtée depuis 2 jours ? La crise des hôpitaux est réglée ? Vous nous en voyez ravis ! "
3,2020-02-16 09:21:52+00:00,How did China's state media cover the #coronavirus outbreak and what role are they playing? - Interesting piece by @AJEnglish including @MariaRepnikova @muyixiao @Jane_Li911
4,2020-02-15 17:07:17+00:00,"Check out this article: Coronavirus, la World Evangelical Alliance chiede preghiere per i malati - "
5,2020-02-15 10:15:09+00:00,⛔EMERGENZA CORONAVIRUS⛔: L’IMPATTO SULL'ECONOMIA E SULLE IMPRESE Una breve indagine online per valutare l’impatto economico dell’emergenza #coronavirus e sapere quali possono essere gli interventi utili per le imprese. ✅ CLICCA QUI PER RISPONDERE: 
6,2020-02-15 08:46:49+00:00,"Coronavirus: Beijing orders two-week quarantine for returnees as death toll passes 1,500. People returning to the city from holidays have to quarantine themselves for 14 days to try to contain the coronavirus spread https://www.theguardian.com/world/2020/feb/15/coronavirus-cases-pass-66000-as-beijing-orders-14-day-quarantine-for-returnees?CMP=Share_AndroidApp_Tweet #coronavirus #CoronaOutbreak #Epidemic"
7,2020-02-14 20:07:44+00:00,Important step to stop the spread of #fakenews about the #coronavirus. Please also discuss #immunization misinformation while you are at it!
8,2020-02-14 13:18:53+00:00,It would seem that the Corona virus is the least of our worries here... @Top of Gornergrat 3112m/10310ft https://www.instagram.com/p/B8jHf6ll-U1/?igshid=1axsjloj0bf0q
9,2020-02-14 12:44:44+00:00,Algunas personas piensan que el #CoronaVirus tiene que ver con la #CervezaCorona 🤦🏻‍♂️ El nivel de ignorancia es preocupante
10,2020-02-14 05:00:56+00:00,#Gold steadies near one-week high as #Coronavirus stalls stock markets. Do you think trend will continue? 
11,2020-02-13 12:58:06+00:00,"BREAKING: Washington Doctors SUCCESSFULLY Treat Coronavirus Patient with Experimental Anti-viral Medication -- ""Significantly"" Improved in Hours (VIDEO) https://www.thegatewaypundit.com/2020/02/breaking-washington-doctors-successfully-treat-coronavirus-patient-with-experimental-anti-viral-medication-significantly-improved-in-hours-video/ Download Now https://opr.as/share"
12,2020-02-12 19:10:10+00:00,BREAKING -> Mobile World Congress in Barcelona cancelled by @GSMA over #coronavirus 
13,2020-02-12 17:19:17+00:00,Racism on the airline KLM. Corona virus potential carriers? #KLM #KLMracism
14,2020-02-12 07:27:37+00:00,"Weiss man schon, ob und ggf. wie sich das #coronavirus auf den Verkauf von Corona-Bier auswirkt? 🤔 interessiert mich wirklich."
15,2020-02-12 06:05:09+00:00,[News : #CoronavirusChina] --&gt; Reports from China raised the possibility of so-called vertical transmission of this novel coronavirus passing from mothers to infants during pregnancy. https://www.medpagetoday.com/infectiousdisease/publichealth/84803 #China #CoronavirusTransmissionChain
16,2020-02-12 05:38:58+00:00,"@FlySWISS I’m planning a trip to Asia in September but I’m unsure if have to cancle due to the #coronavirus. What is your cancellation policy, how many days before would I have to cancel and what kind of refund could I expect?"
17,2020-02-11 21:31:06+00:00,Que no se nos olvide con lo del coronavirus que la gripe la tenemos entre nosotros 
18,2020-02-11 14:52:28+00:00,"Heute in einer Kinderarzt-Praxis nähe Zürich mitgehört: „Nein ich glaube nicht dass ihr 2 Jähriger das #Coronavirus hat - Es geht nur die Grippe, Windpocken &amp; Magen-Darm um“ 😏 #grippewelle"
19,2020-02-11 11:40:11+00:00,Chinese movie studio upturned its business model due to coronavirus – Western companies take note https://theconversation.com/chinese-movie-studio-upturned-its-business-model-due-to-coronavirus-western-companies-take-note-131167?utm_source=twitter&amp;utm_medium=footertwitterbutton via @ConversationUK
20,2020-02-17 12:59:32+00:00,@lipsandskin wie handhabt #MUC die medizinischen Kontrollen bez. Coronavirus bei den Einreisenden PAX aus dem asiatischen Raum?
21,2020-02-17 12:01:09+00:00,"@repubblica zerbini al servizio del padrone, coronavirus in Africa e a breve in Italia"
22,2020-02-16 23:46:17+00:00,Coronavirus: Geldscheine unter Quarantäne? China ergreift drastische Maßnahme – Ärzte tragen Windeln 
23,2020-02-15 15:17:45+00:00,Dembelé ya tiene suficiente como para que encima le llaméis CORONAVIRUS mdrrrr 😂 
24,2020-02-15 11:39:26+00:00,"Hey ihr Aluhüte, wurde das #CoronaVirus von @GretaThunberg freigesetzt um den internationalen Luftverkehr einzustellen? #GlobalGrounding #StopCoronavirus *rofl*"
25,2020-02-15 11:10:49+00:00,Ob Australien #CoronaVirus frei bleibt? Hmm müssen Menschen sich deklarieren - klar! https://www.in-australien.com/strafen_1013151
26,2020-02-14 18:09:57+00:00,Il coronavirus è arrivato in Africa: un caso in Egitto https://f7td5.app.goo.gl/pCBYfG via @updayIT
27,2020-02-14 16:36:58+00:00,"Coronavirus e attività cinesi in crisi: tutta la mia solidarietà, ma non ho visto tutta questa mobilitazione e pioggia di appelli per tutti quegli imprenditori italiani che sono arrivati al suicidio per mancanza di lavoro."
28,2020-02-13 13:51:40+00:00,Stanotte ho sognato che la mia scuola era in quarantena perché c'era il coronavirus e non potevamo uscire per giorni
29,2020-02-13 11:37:02+00:00,Zum Thema Coronavirus. War heute ein Gespräch beim Kunden 
30,2020-02-13 11:28:08+00:00,En fait ces cas présentaient des symptômes du #COVID19 maïs les tests génétiques revenants négatifs ils n’étaient pas considérés comme atteint mais comme ayant une symptomatie virale non liée au #coronavirus.
31,2020-02-12 17:55:50+00:00,"Si lamentano quelli che stavano facendo la crociera e a causa del Corona Virus gli è stato imposto di rimanere nelle loro cabine, di certo molto confortevoli, pur in uno spazio limitato; ricevono pasti regolari e sanno che a terra faranno di tutto per farli rincasare sani e salvi"
32,2020-02-12 15:18:40+00:00,Dernières nouvelles #coronavirus Comme envisager il y a quelques jours la Chine semble être entrée dans une phase plateau voire de déclin de l’épidémie. Le nombre de cas hors Chine semble encore très variable et cela inclus le large nombre sur le bateau de croisière Japon. 
33,2020-02-12 08:57:53+00:00,Et voilà.Le mec brode sur la base de fake news et sur l’article du Point annonçant potentiellement 60% de la population infectée... radio pulmonaire avec un effet sanguinolent et patient avec appareil d’assistance respiratoire.Voilà.Vous avez une fake news. Un abruti.#coronavirus 
34,2020-02-12 07:16:36+00:00,"Porque gusta el clickbait. No hay una alerta sanitaria por gripe porque no es puntual, es alerta permanente. El coronavirus no es la primera alerta de la OMS, de otras ni nos hemos enterado"
35,2020-02-12 07:15:10+00:00,En cambio para el coronavirus no tenemos vacuna y no sabemos realmente el peligro que puede suponer. Por ahora la capacidad de infectar y la mortalidad son similares a las de la gripe
36,2020-02-12 05:54:53+00:00,Was läuft hier falsch. Quarantäne Offizier angesteckt! Wie schützt ‘man’ sich? Bio Vollschutz #coronavirus 
37,2020-02-11 22:43:19+00:00,"„China monopolisiert auch die Probleme Taiwans.“ Chiu Chui-cheng, stv. Minister Taiwans für Festland-China, kürzlich in Bern. #coronavirus #coronadis #COVID19"
38,2020-02-11 17:00:14+00:00,#DataScience #coronavirus 
39,2020-02-11 13:42:06+00:00,"Je ne suis pas inquiet nk’ayyends de voir les données et les chiffres. L’Inde comme l’Indonésie sont officiellement libre de #coronavirus. C’est impossible quand on sait qu’il y avait en moyenne 5,000 chinois arrivant par jours en Indonésie pour tourisme..."
40,2020-02-11 11:38:06+00:00,La vraie incertitude vient de l’absence de cas rapportés dans certains pays d’Asie (Indonésie par exemple) ou en Afrique. Volonté politique de cacher les faits ou absence reellle de cas?? #coronavirus
,Date,Text
0,2020-02-24 22:06:42+00:00,"If the coronavirus isn’t contained, a severe global recession is almost certain "
1,2020-02-24 21:35:27+00:00,What countries have been affected by the Novel coronavirus? How many cases are there in China? Real-time updates on the number of cases worldwide. https://infographics.channelnewsasia.com/covid-19/map.html via @ChannelNewsAsia
2,2020-02-24 15:08:46+00:00,"I love Swiss, vi vogliamo bene anche noi 🇨🇭🥰 #grazie #coronavirus #dogana"
3,2020-02-24 14:07:07+00:00,"Elevator rules in #China, to prevent #coronavirus spreading. Pick your corner and stay in your corner. #dailylive #rules"
4,2020-02-24 13:08:29+00:00,⚠️Read thread on #covid19 #coronavirus #coronaviruslombardia
5,2020-02-24 10:58:11+00:00,Potential coronavirus cases aren't even being tested in the US. Recipe for a rude awakening. Only cases with fever + been to Wuhan or exposed to someone who was confirmed to have coronavirus. 
6,2020-02-24 10:52:02+00:00,"With two Corona virus cases in a town close by, it looks like the Swiss will close the border. If they close Milan airport, I will have to get a train home."
7,2020-02-24 08:21:39+00:00,RFS urges China to stop censuring information about coronavirus epidemic 
8,2020-02-23 23:11:33+00:00,"🔴🆘 Dear @RedCross @roteskreuz_de @roteskreuzat @RotesKreuz_ZH @WHO , @WHO , The tyrannical regime in #Iran is not capable of crisis management in order to deal with the spread of the #CoronaVirus. We, the people of Iran need immediate help to avoid a humanitarian disaster. "
9,2020-02-23 22:11:33+00:00,Magnificent thread on the real hit from the #coronavirus 
10,2020-02-23 09:48:53+00:00,Switzerland next... coronavirus commin
11,2020-02-23 09:47:56+00:00,The Rules of Contagion — a study of how a #virus spreads An #InfectiousDisease expert applies mathematics 🧮 to explain the spread and control of #outbreaks via @FinancialTimes #coronavirus #China #science
12,2020-02-23 07:42:18+00:00,Lo sbarco dei 274 #migranti a bordo della #OceanViking è stato autorizzato alla chetichella alle 02:00 dal #governorossogiallo così da evitare che i siciliani organizzassero manifestazioni contro questa ennesima presa in giro. #coronavirusitalia #coronavirus #omnibusla7
13,2020-02-22 13:02:58+00:00,Global shipping holds its breath as coronavirus continue to spread https://www.bimco.org/news/market_analysis/2020/20200221_global_shipping_holds_its_breath
14,2020-02-22 12:51:39+00:00,CoViD-19 #Coronavirus
15,2020-02-22 07:38:58+00:00,"Il tasso di decessi sul totale di infezioni di coronavirus è del 2,3% in Cina. Sotto 1% in altri paesi. Per influenza normale siamo sotto 1x1000 Giusto per saperlo..."
16,2020-02-20 20:43:18+00:00,"#Coronavirus has been blossoming for over a month, yet @britishairways flight BA580 from LHR to MXP had no water in the front toilet. And the crew told me it had been that way for 10 days! What happened to you, #BA? You were the best airline in the world just 20 years ago."
17,2020-02-20 08:35:40+00:00,The newly renovated Norwegian Spirit has cancelled 2020 Asian cruises due to Corona virus outbreak. As of April 2020-October 2020 will perform 7-day cruises Piraeus-Rhodes-Kusadasi/Ephesus-Patmos-Mykonos-Argostoli- Corfu-Santorini-Piraeus. Oct-Nov Ashdod-Haifa-Limassol too 
18,2020-02-18 19:18:51+00:00,My mom threatens to burn my passport because I refuse to cancel my flight to Asia this April. #coronavirus #albanianmothers #lol
19,2020-02-24 18:20:06+00:00,Züge ausfallen lassen? Unsinn: Wir verpassen ihnen einfach Gesichtsmasken. #SBBConnect #coronavirus – at Zürich Hauptbahnhof
20,2020-02-24 16:41:56+00:00,"Ma non sarà esagerata questa ordinanza? No. Questione di numeri. Se si ammalassero tante persone tutte insieme, chi le curerebbe? Sarebbe gravissimo, come ha scritto Ilaria Capua, che pure definisce #coronavirus una simil-influenza e non la peste nera. "
21,2020-02-24 16:14:58+00:00,"Klare Worte an der Pressekonferenz des Kantons Tessin zum #coronavirus. Jetzt können Medienschaffende ihre Kernaufgabe wahrnehmen, in den kommenden Wochen sachlich und objektiv über die Entwicklungen zu berichten. Bund im Lead. "
22,2020-02-24 14:48:25+00:00,"#Coronavirus: a breve la conferenza stampa delle autorità cantonali sulla situazione in Ticino. Interverranno: Christian Vitta (Presidente del CdS), Raffaele De Rosa (Direttore del DSS) e Giorgio Merlani (Medico cantonale). Segui la diretta su http://www.ti.ch/streaming"
23,2020-02-24 14:14:54+00:00,Da steht sicher etwas in einem der Ordner des Managementhandbuches! Kapitel 1246 - What happens if the Coronavirus strikes. #youdreameryou
24,2020-02-24 14:11:25+00:00,"Krankheitserreger reisten um die Welt, als die Menschheit noch viel, viel weniger mobil war als heute. Den Coronavirus für die ewige Forderung der Grenzschliessung zu missbrauchen, ist nicht mal mehr Populismus, sondern nur noch tragische Volksveräppelung!"
25,2020-02-24 14:02:54+00:00,"Und ich dachte schon, mir sei in Chiasso so heiss wegen des Coronavirus. 😂. #reporterglück #SommerimFebruar 😍"
26,2020-02-24 13:26:20+00:00,Vor einem Jahr hat mir der Handy-Chef von Huawei das Mate X noch persönlich gezeigt. Wegen dem Coronavirus und mangels #MWC2020 sehe ich ihn und das #MateXs nun per Stream aus Zürich.
27,2020-02-24 13:02:31+00:00,"Scusa Collega🙄? Che abbiamo la possibilità, se IO ti do l’assenso,di chiedere un rinvio (civile) per il coronavirus? Io solitamente faccio penale è lì rinvii non ce ne sono, vieni a morire in aula fratello🤣. Scordatelo il rinvio e arriverò anche senza mascherina, toodico🤣😂😂"
28,2020-02-24 12:44:43+00:00,"Pensiero personale: Non voglio creare ulteriori allarmismi, ma volevo segnalarvi che fumare, 🚬 condurre una vita sedentaria, 🛋 non seguire un regime alimentare adeguato 🍟 uccide ogni giorno molto di più del Coronavirus. 👑 🦠 #coronavirus"
29,2020-02-24 07:35:44+00:00,#Buonaquarantena Aggiorniamo il saluto in tempi di #coronavirus 😳
30,2020-02-24 07:21:05+00:00,"Perché tanti casi in Italia? La spiegazione del virologo del Sacco, uno scienziato in prima linea, al @Corriere. L’intervista è del responsabile di @Corriere_Salute #informazioneseria #coronavirus "
31,2020-02-23 13:46:02+00:00,"Porcamadonna che due coglioni, solo di coronavirus parlare, tutto il giorno. Che Due Coglioni"
32,2020-02-23 09:33:58+00:00,Italië neemt drastische maatregelen in strijd tegen coronavirus: steden volledig afgesloten om besmettingshaard in te tomen https://m.nieuwsblad.be/cnt/dmf20200223_04861481 via @Nieuwsblad_be hysterie of noodzaak @vanranstmarc ? #covid
33,2020-02-22 23:39:11+00:00,"breve storia triste: fosse stata imposta la quarantena obbligatoria ai rientranti dalla Cina di ogni forma,colore e professione, non saremmo qui. #coronavirusitalla #Coronavirus #spiace"
34,2020-02-22 20:40:09+00:00,Evitiamo il panico e stiamo attenti. #coronavirus 
35,2020-02-22 16:17:21+00:00,"Mi raccomando, non generiamo il panico. #coronavirusitalIa #coronavirus #prevenzione"
36,2020-02-22 13:15:41+00:00,"Buon pomeriggio, oggi leggere i tw sul #coronavirus mi fa passare la voglia di aprire il telefono. A voi tutti il mio abbraccio 💞"
37,2020-02-22 08:19:15+00:00,#BuongiornoATutti #buonsabato A tutti il mio Buongiorno con una gentile richiesta... Non fate battute stupide sul #coronavirus #coronarvirusitalia non è il caso visto che le persone finiscono in ospedale e altre muoiono... Rispetto per le famiglie colpite. Grazie !!!!!
38,2020-02-21 03:14:00+00:00,Coronavirus: Chinese crude oil demand estimates shrinking fast https://www.rivieramm.com/news-content-hub/coronavirus-update-chinese-crude-oil-demand-estimates-shrinking-fast-58075
39,2020-02-21 01:31:23+00:00,"Aber - wie Du auf den Coronavirus kommst; habe ich, ehrlich gesagt, überhaupt nicht verstanden ;-??)) Scheint; irgendwo habe ich heute gewaltig etwas verpasst !!"
40,2020-02-20 08:23:59+00:00,"En coronavirus limpio, en otras cosas yo ya no se 🙄🙄 JAJAJAJAA"
41,2020-02-20 07:08:10+00:00,"Anoche al llegar a Milán, en el aeropuerto de Linate me hicieron un control, pero no cualquier control, me hicieron uno del CORONAVIRUS😮😮😮 #flipando"
42,2020-02-19 12:13:22+00:00,È il portatore sano del corona virus 
43,2020-02-19 06:37:28+00:00,"Dal diluvio universale al #coronavirus abbiamo finalmente il colpevole. #giannini, ma anche basta direi..."
44,2020-02-18 13:36:41+00:00,Positivo al coronavirus un italiano sulla Diamond Princess 
45,2020-02-18 07:10:03+00:00,"#coronavirus: ""2.500 cinesi che stanno tornando in Italia da una zona infetta"" Consolato di Pechino conferma il ritorno dei connazionali a Prato e Firenze, grazie ai viaggi con scali esteri. La sicurezza? Faranno i test, se vorranno @OmnibusLa7 @gaiatortora @TgLa7"
46,2020-02-17 16:45:25+00:00,"Ho starnutito sul telefono, scusate!!! Ps non sono infetta è allergia !!!#coronavirus"
47,2020-02-17 12:59:32+00:00,@lipsandskin wie handhabt #MUC die medizinischen Kontrollen bez. Coronavirus bei den Einreisenden PAX aus dem asiatischen Raum?
48,2020-02-17 12:01:09+00:00,"@repubblica zerbini al servizio del padrone, coronavirus in Africa e a breve in Italia"
,Date,Text
0,2020-03-10 14:10:52+00:00,An Italian soldier distributed food rations to a child under quarantine for Coronavirus... 
1,2020-03-10 12:27:14+00:00,"Was interviewed on BBC 5live breakfast show earlier about living in a nation in lockdown. Through my nervousness, I outlined just how quickly coronavirus has taken a grip &amp; the need for individuals &amp; communities to adhere to the decree. I somehow plugged @TheSquareBall as well!"
2,2020-03-10 12:21:52+00:00,Amuchina Freestyle #maxib #coronavirus #amuchina
3,2020-03-09 15:49:47+00:00,"Como, Lombardy. Late afternoon. Monday March 9th. Lockdown. #COVID2019 #coronavirus #como #lombardy"
4,2020-03-09 15:38:17+00:00,"Lake Como, Lombardy. 30 min boat journey. Sole passenger. Ghostly. #coronavirus "
5,2020-03-08 20:04:31+00:00,My baba can’t leave the plane because a woman on board has suspected #coronavirus 🌚🌚 
6,2020-03-08 15:55:27+00:00,"""Due to the corona virus all TCP applications are being converted to UDP. No more handshakes!"" -- friend of mine "
7,2020-03-08 10:41:18+00:00,"A quarter of Italy's population is in ""lock down"" as 36 more die in 1 day #COVID19 #coronavirus https://mol.im/a/8088093 via http://dailym.ai/android"
8,2020-03-07 21:03:03+00:00,"🦠#COVID19 came to Switzerland, stayed 2 weeks, found it over expensive and decided to go back to Italy ! #Coronavirus #laughingtofightparanoia"
9,2020-03-07 18:29:36+00:00,Death toll quickly raising in Italy - recruiting retired doctors to battle coronavirus crisis #coronavirus #COVID19
10,2020-03-07 17:51:41+00:00,"🔴🆘 Dear .@WHO, During the #CoronavirusChino, the Ayatollahs in Iran did not stop the flies from China to Iran ( Mahan Airlines affiliated to #IRGC) just for the commercial reasons. And now we have the crisis with #CoronaVirus in Iran. #AyatollahsSpreadCOVID19"
11,2020-03-06 09:23:34+00:00,"We all remember this blockbuster movie where all countries got together to fight a worldwide threat. The message in the movie is clear, no single country can fight this alone. #coronavirus threatens and concerns all of us. All nations join forces to fight this #AnnihilateCorona"
12,2020-03-01 14:54:01+00:00,Today’s @IFRC TikTok comes to your screen thanks to JJ and Aurora from the @IFRCAsiaPacific team. How to reduce your risk of getting #coronavirus? More hand washing (and look at that Pikachu dance!). #COVIDー19
13,2020-02-29 22:41:51+00:00,Hockey derby Lugano-AmbriPiotta 🇨🇭without Spectators covid19 #coronavirus #COVID2019 #hockey #icehockey #swissicehockey
14,2020-02-29 17:12:37+00:00,Guys seriously 😂😂😂 ??? #coronavirus #CoopDielsdorf #Help
15,2020-02-28 20:52:59+00:00,#Coronavirus 🦠 makes us work on a Business Continuity Plan. How can we ensure that our internet services remain up if most employees need to stay home? #WeNeverKnow Customers forced to stay home consider broadband internet even more important... 😇 #Netflix #PrimeVideo 📺
16,2020-02-28 20:36:54+00:00,"During today’s live Q&A on TikTok, @ecapobianco was asked a number of #coronavirus questions: what about the cancellation of @BTS_twt concerts? Will students be able to enjoy Easter or summer holidays? He gave great answers &amp; now he has new fans amongst Tiktokers 👍🏽 #COVIDー19"
17,2020-02-28 19:34:18+00:00,Instead of 17000 spectators we play in front of empty ranks today. Thanks @rek_81 for the picture of my grandstand place. #coronavirus #postfinancearena #chliblöd #spectacle #traurig
18,2020-02-27 12:15:32+00:00,"In view of the emerging situation of new coronavirus COVID-19 in the region, all Indians in Switzerland are advised to take necessary health precautions and regularly follow the advisories being issued by Swiss Govt https://www.bag.admin.ch/bag/en/home/krankheiten/ausbrueche-epidemien-pandemien/aktuelle-ausbrueche-epidemien/novel-cov.html Emergency contact numbers are attached."
19,2020-02-27 07:46:21+00:00,"Has #coronavirus been given too much publicity causing unnecessary panic? Annual influenza epidemics worldwide result to 3-5million severe illness cases, and 290-650000 respiratory deaths. In 2 months, 82000+ affected with #COVID19, 2800 deaths. Recovery rate almost 40% See 🎥⬇️"
20,2020-03-10 20:27:01+00:00,"Do you want to know how dangerous the coronavirus can be? Italy had its first case 2 weeks ago - and has now reached ~150 deaths/day. To give a sense of perspective, this now amounts to 10% of the daily death rate of ALL causes, for ALL of Italy. But sure, it's just the flu... "
21,2020-03-09 21:41:23+00:00,Work closed down for 48 hours while we figure out how to move forward. #swizerland now considerrd top ten worst countries for #coronavirus. Told today to expect 80% of the country to contract it. All we can do is do our best to stay healthy. Following government guidelines 
22,2020-03-09 19:46:07+00:00,[Acute Cardiac Injury : #COVID19] Reports suggest that the Middle East respiratory syndrome related coronavirus (MERS-CoV) can cause acute myocarditis and heart failure. https://www.nature.com/articles/s41569-020-0360-5 #Myocarditis #CardioTwitter
23,2020-03-09 18:28:11+00:00,"Lombardia chiusa per #Coronavirus, giorno 1 - Sir Edward John Poynter, An Evening at Home, 1888 📚 "
24,2020-03-09 07:05:57+00:00,He is talking about panic not coronavirus per se. Is this not dumb ? https://twitter.com/28delayslater/status/1236196747061399553?s=21
25,2020-03-07 06:44:13+00:00,"Seeing this graphic, I immediately think of this article “Mapping coronavirus, responsibly” "
26,2020-03-07 01:06:15+00:00,"""This is the most frightening disease I've ever encountered in my career” says Richard Hatchett, CEO at The Coalition for Epidemic Preparedness Innovations @CEPIvaccines @gatesfoundation &gt; #EndCoronavirus @EndCoronavirus #COVIDー19 #coronavirus "
27,2020-03-06 21:01:19+00:00,"The head of the @WHO's emergencies program, Dr. Michael Ryan, says there is no evidence that the coronavirus outbreak will end in the summer like an influenza season and statements to the contrary are a ‘false hope’ "
28,2020-03-06 11:22:12+00:00,"Leipzig plays for Bundesliga title, Still playing champions league, young team, young manager, bright future while Milan has Corona Virus, 38 yo strikers and a managment change every 15 months. What did you expect ?"
29,2020-03-05 09:49:33+00:00,"In the Emma Barnett Show episode aired on 2 March, @WTIunibe Managing Director Joseph Francois discusses US-UK trade negotiations and the impact of the Coronavirus on the global economy. You can now listen to the full show: https://bbc.in/2wrJymf @unibern @Emmabarnett"
30,2020-03-05 06:38:24+00:00,[#Coranovirus : Global impact] How coronavirus is spreading around the globe an infographic. https://www.weforum.org/agenda/2020/03/infographic-coronavirus #WorldEconomicForum #Covid_19
31,2020-03-03 06:37:08+00:00,More information on the cancellation of the @APSphysics #apsmarch meeting in @PhysicsToday which an attendee “... considers the meeting the biggest and most important for #quantum #computing.” APS cancels March Meeting due to coronavirus concerns 
32,2020-03-01 20:34:19+00:00,"A dark shadow over @F1’s 2020 opener in Melbourne, with the first @MotoGP in Qatar halted by #Coronavirus travel restrictions on Italians. @Ferrari, sure, but no #f1 cars roll without #Pirelli. The tyres are made in Turkey, but the techs are based in Milan. @petrolhedonist"
33,2020-03-01 18:42:32+00:00,When I get back home I’m not allowed to go back to work for two weeks cause they’re worried about the corona virus
34,2020-03-01 17:56:28+00:00,proud of them ! #auguri #coronavirus #ticino
35,2020-02-29 18:23:05+00:00,They didn’t believe it would get violent. This crossing was closed this morning due to a government decision to take precautions against the Corona virus. There was a gathering to dispute the decision and then this act of “peace”
36,2020-02-29 18:15:35+00:00,The #Hallenstadion is empty today because of the #coronavirus. The ghost game between the @zsclions and @official_EVZ #zurich #switzerland #SARSCoV2 #February29th #NationalLeague – at Hallenstadion
