,Date,Text
244,2020-03-10 09:41:17+00:00,"Espero que con esto del #coronavirus aprendamos que cuando uno está malo, debe quedarse en casa y recuperarse y no normalizar ir a trabajar con 38 de fiebre #salud"
245,2020-03-10 09:10:34+00:00,Changing bookings to get home from Italy because of #italylockdown Everyone helpful and understanding except @easyJet who charged standard admin fees for ticket change. #coronavirus #COVID19
246,2020-03-10 09:08:26+00:00,"N’oublions pas les recommandations pour freiner la progression du #coronavirus. Se laver les mains, pas de bisous et de serrage de mains. Garder ses distances. Pour les personnes à risque, éviter la foule. Soyons #solidaire pour les plus faibles et le personnel soignant."
247,2020-03-10 08:36:03+00:00,"Borders are just one little tiny piece. What I do like is, Trump was asked if he was tested for Coronavirus and didn't answer. Now imagine: a rally, where he shakes many many hands. And he could be infected. Now, what about a border?"
248,2020-03-10 08:21:46+00:00,Winter Saison in Davos-Klosters 2020 @DavosKlosters @suedostschweiz @Graubunden @graubuendner @HofSwitzerland @swissbusiness @MySwitzerland_d @DigitalDavos @burzelbez #davos #davosklosters #COVID2019 #coronavirus 
249,2020-03-10 08:09:52+00:00,Andrà tutto bene #iorestoacasa #COVID2019 #coronavirusitalIa #restiamoacasa #coronavirus 
250,2020-03-10 07:39:07+00:00,“Yo creí”. Así funciona el gobierno de científicos. #coronavirus #peronia #Argentina
251,2020-03-10 07:02:33+00:00,#coronavirus impact on luxury fashion and retail industry; a disastrous start to the year 
252,2020-03-10 06:41:31+00:00,"Creo que la crisis del coronavirus se ha dejado llevar por una falta de medidas por parte de las autoridades, los medios que no han ayudado y porque la gente ha visto demasiadas películas apocalípticas #coronavirus"
253,2020-03-10 05:05:29+00:00,How many dead Americans does it take to make you think things over? #COVID2019 #coronavirus
254,2020-03-10 04:07:50+00:00,"Hey, #BullyPunkyTomFitton, one question: how many Americans have to die, until you think things over? How many does it take? #CoronaVirus #NotWuhanVirus #NotChineseVirus And stop lamenting. Trump started it, now live with the consequences #BabyBrainFitton Right, you are no man"
255,2020-03-10 01:03:54+00:00,"İtalya’da yaklaşık 10'000 bin kişi’de Corona Virus’u tespit edildiği, 460 kişinin öldüğü belirtilerek Ülke’ye tüm giriş çıkışların yasaklandığı açıklandı."
256,2020-03-10 00:10:53+00:00,Italia: 5.000 posti di terapia intensiva! Germania : 28.000 posti di terapia intensiva! Grazie a tutti i governi che hanno saputo sapientemente usare i soldi degli italiani! #coronavirusitalIa #COVID2019 #coronavirus #iorestoacasa #iostoacasa #Coronaviriusitalia
257,2020-03-10 00:07:24+00:00,Certo che essere ipocondriaca e vivere nell’era del Coronavirus non è per niente facile 😅🙈 la sto gestendo anche fin troppo bene devo dire #coronavirusitalia
258,2020-03-10 00:06:52+00:00,#frontiere abbiamo iniziato questo decennio con la speranza di arrivare su Marte. Ora invece ci ritroviamo chiusi dentro casa!!! (Cit. Luna) #COVID2019 #coronavirusitalIa #Coronaviriusitalia #coronavirus
