,Date,Text
605,2020-03-26 13:58:14+00:00,"Tellingly, Nicola Sturgeon calls Johnson ‘Boris’ in COBRA meetings, not ‘Prime Minister’. Those present reckon that this is her trying to show that the First Minister of Scotland is the Prime Minister of the UK’s equal"
606,2020-03-26 13:58:05+00:00,"With the #coronavirus pandemic causing masses across the country to be cancelled, there's huge demand for online worship. ✝️🙏 Our first weekly ‘Children’s Liturgy Live!’ saw over 500 families sign up. Find out more and join us at 10am this Sunday. 👇 "
607,2020-03-26 13:52:59+00:00,"Join the nation at 8pm tonight to say THANK YOU to all health and social care staff on the frontline, who are working tirelessly across the country in the fight against #coronavirus 👏👏👏 #NHSThankyou #ClapForOurCarers #ClapforNHS #ClapOurCarers"
608,2020-03-26 13:44:00+00:00,"UPDATE: #Coronavirus Global Burden ➡️38.7 million deaths can be prevented when acting early ➡️#COVID19 pandemic likely to overwhelm already over-stretched health systems ➡️Rapid adoption of testing, case isolation &amp; social distancing necessary 🔰Report https://imperial.ac.uk/mrc-global-infectious-disease-analysis/news--wuhan-coronavirus/"
609,2020-03-26 13:28:59+00:00,A 19-year-old woman in the UK has committed suicide after being “unable to cope with her world closing in” following the coronavirus lockdown. 
610,2020-03-26 13:21:29+00:00,There’s mounting irritation in Whitehall at how devolution has made responding to this crisis more difficult. One COBRA attendee complains the Scottish government ‘tries to outflank us on the hard-line positions’ https://www.spectator.co.uk/article/how-will-the-war-on-coronavirus-change-britain
611,2020-03-26 13:08:50+00:00,"""So, when my grandson turns 18, how will he look back on this time? Will it be remembered as the great #coronavirus pandemic or a relatively minor contagion to which we grotesquely overreacted?"" 🔓This article is FREE TO READ till 3pm🔓 "
612,2020-03-26 13:06:00+00:00,Wilfried Zaha offers #UKhousing to NHS worker as Crystal Palace star looks to help ease strain on hospital staff during the coronavirus crisis https://www.dailymail.co.uk/sport/football/article-8134883/Wilfried-Zaha-offers-free-accomodation-NHS-workers-coronavirus-crisis.html #socialhousing
613,2020-03-26 13:03:27+00:00,The British government and its official scientists did not spot what was so evident elsewhere. It was an astonishing failure of leadership and of good governance.(did the devolved government's have any say ) ?
614,2020-03-26 12:59:30+00:00,"I know I sound like a broken record but I need your help to slow the spread of #Covid19. Please stay at home if you can. Act as if you have the virus. Wash your hands. Keep your distance. And together, we can save lives. #coronavirus #COVID19ireland"
615,2020-03-26 12:54:38+00:00,A record 3.3 million Americans filed for unemployment last week - showing economic carnage caused by coronavirus https://bbc.in/2Je464E
616,2020-03-26 12:52:03+00:00,Coronavirus: NHS doctor 'evicted from home due to landlady's fears over COVID-19' 
617,2020-03-26 12:13:01+00:00,Did you know that the 🇬🇧can take part and benefits from several initiatives and actions the 🇪🇺 and European countries have been taking together to tackle the #Coronavirus crisis? See link 👉https://ec.europa.eu/info/live-work-travel-eu/health/coronavirus-response_en
618,2020-03-26 11:55:17+00:00,We must all do our bit to fight coronavirus. Stay at home. Protect the NHS. Save lives. [THREAD 1/6] #StayHomeSaveLives
619,2020-03-26 11:52:23+00:00,another one for the pyre
620,2020-03-26 11:47:12+00:00,Former Prime Minister of the UK Gordon Brown has called on world leaders to create “a temporary form of global government” to fight the coronavirus outbreak. 
621,2020-03-26 11:44:48+00:00,"No10 says international co-operation on tackling #coronavirus is essential, but also says the UK will not take part in an EU scheme to procure ventilators, even though we can if we want to."
622,2020-03-26 11:43:10+00:00,"BREAKING Number 10 says chancellor, governor of Bank of England and head of FCA have written to bank chiefs to emphasise lenders CANNOT take personal guarantees vs borrowers’ homes under coronavirus business interruption loan scheme Here’s background "
623,2020-03-26 11:38:54+00:00,GOOD NEWS: 6 (SIX) people with Coronavirus in Lagos have FULLY RECOVERED and will now be discharged. I can now share with you this very important information. Lagos is the pacesetter. And they are doing an amazing job. I’m proud of the Lagos team. RT this to make someone smile.
624,2020-03-26 11:27:42+00:00,"In light of Coronavirus, the EU must suspend its proposed palm oil ban – for the sake of its own economy and millions of Malaysia’s poorest, argues Youssef Kobo. "
625,2020-03-26 11:23:34+00:00,Be like Mohammad. #Coronavirus 
626,2020-03-26 11:20:06+00:00,Telegraph writer Allison Pearson says that we shouldn't be afraid of coronavirus because it mostly only kills the over-70s and people with pre-existing conditions. Please retweet to demand the @Telegraph sack this execrable excuse for a human being.
627,2020-03-26 11:07:48+00:00,Londoners: protect the people you love. #StayHomeSaveLives
628,2020-03-26 11:06:12+00:00,#Coronavirus Sparks 280% Surge in Vegan Meat Sales 
629,2020-03-26 11:02:11+00:00,It is a trifle odd how many “top-people” have been infected with the #coronavirus isn’t it? Especially royals and politicians and their spouses and inner circles...
630,2020-03-26 10:46:26+00:00,"Yes, Meghan and Harry should get a transatlantic flight, hang out with their elderly relatives, tour the country shaking hands and hugging the public to boost their morale, and in their spare time develop a vaccine against the coronavirus. "
631,2020-03-26 10:43:56+00:00,Coronavirus: Pangolins found to carry viruses related to Covid-19 
632,2020-03-26 10:42:39+00:00,"The number of COVID-19 cases in Spain has risen to 56,188 from the 47,610 recorded yesterday and the number of coronavirus patients who have died has risen to 4,089 from 3,434"
633,2020-03-26 10:39:05+00:00,"107,380 in the queue! I’m fucking likely to die of starvation before the symptoms of Coronavirus kick in #Ocado 😂😂😂 pic.twitter.com/bbD9z5p3br"
634,2020-03-26 10:26:29+00:00,#CHARGED | We’ve charged a man with assault following claims he spat and coughed at shop staff while shouting “I’ve got coronavirus”. We're committed to supporting key workers and will not tolerate this kind of behaviour. Full story ⬇️⬇️⬇️ #Covid19
635,2020-03-26 10:12:42+00:00,Just think what Isabel Oakeshott could do for her shattered reputation by deleting her account. Infinite facepalm for suggesting unnecessary international travel to see relatives at a time when the UK is on Coronavirus lockdown is a good idea. #CovIdiot #CovIdiots pic.twitter.com/VJbCFMPvmU
636,2020-03-26 10:07:31+00:00,BREAKING Vodafone announces 2.5% price hike as millions struggle at hands of coronavirus pandemic https://www.mirror.co.uk/money/breaking-vodafone-announces-25-price-21757725
637,2020-03-26 10:05:00+00:00,Influencer who licked a toilet as a 'coronavirus challenge' has just been hospitalised with coronavirus 
638,2020-03-26 10:00:28+00:00,"WO2 Drill Sergeant Rae of 1st Battalion @scots_guards, explains and demonstrates the correct distance individuals should keep apart, during the Covid 19 pandemic lockdown, in order to keep people safe. #InThisTogether #Coronavirus #BritishArmy"
639,2020-03-26 09:51:32+00:00,People queuing outside the Wuhan crematorium for collecting their loved ones. #coronavirus 
640,2020-03-26 09:26:46+00:00,We're providing free parking to NHS workers and social care staff during the #coronavirus outbreak. ➡️ https://www.gov.uk/government/news/government-to-provide-free-car-parking-for-nhs-and-social-care-staff
641,2020-03-26 09:26:44+00:00,BREAKING Mr Motivator lands coronavirus show on BBC to keep nation fit during lockdown http://mirror.co.uk/tv/tv-news/breaking-mr-motivator-lands-coronavirus-21757441
642,2020-03-26 09:23:41+00:00,I still have Coronavirus in body. I wanted to share another personal video. Can you help me by retweeting this out. Can you show your love and appreciation for our amazing NHS staff today. #coronavirus #Covid19 – at Ulster Hospital
643,2020-03-26 09:19:02+00:00,"You have to wish both companies the very, very best but I'm not sure why this received so much less coverage than Dyson."
644,2020-03-26 09:15:04+00:00,"If you think that Coronavirus is just a bad cold, or won’t affect you because you are young, you are wrong We are all at risk from this horrible virus, and must all be part of the solution Please RT to remind those of all ages RIP Chloe x "
645,2020-03-26 08:57:25+00:00,"Wash your hands of coronavirus scams and share this postcard with friends and family, protect yourself and others #Coronavirus #ScamAware"
646,2020-03-26 08:57:10+00:00,"Gosh, Sweden, everyone's idea of a well-run and civilised country, is *not* subjecting its people to house arrest or crashing its economy: https://inews.co.uk/news/sweden-coronavirus-no-lockdown-covid-19-measures-cases-deaths-social-distancing-restaurants-open-2517991 . Could we have over-reacted?"
647,2020-03-26 08:44:59+00:00,"How deadly is the coronavirus? It’s still far from clear, says Dr John Lee "
648,2020-03-26 08:43:19+00:00,A week ago here's Neil Ferguson: https://www.telegraph.co.uk/global-health/science-and-disease/terrifying-data-behind-government-coronavirus-lockdown/ Now here's the same Neil Ferguson:
649,2020-03-26 08:38:20+00:00,Coronavirus: 'I'm stuck in isolation with my homophobic parents' 
650,2020-03-26 08:00:25+00:00,An 84-year-old sex offender has become the first British prisoner to die after contracting coronavirus.
651,2020-03-26 07:49:47+00:00,And here it is. The Meghan and Harry coronavirus tweet. Took longer than I anticipated. Looks like Charles and Camilla got their travel advice from Isabel. 
652,2020-03-26 07:38:00+00:00,"📢 Calling everyone across the Midlands. 📢 Join us at 8pm tonight for a nationwide applause to show all our nurses, doctors, GPs and health and social care workers our appreciation for their hard work in the fight against #Coronavirus. Let’s #ClapForOurCarers 👏🏼 👏🏼 👏🏼"
653,2020-03-26 07:32:49+00:00,"With so many issues facing the nation, Prince Charles ‘queue-jumping’ the coronavirus test seems spectacularly unimportant."
654,2020-03-26 07:30:55+00:00,"Coronavirus measures could cause global food shortage, UN warns "
655,2020-03-26 07:24:32+00:00,"""Why did the Prince of Wales jump the queue?"" @KayBurley asks Health Minister Edward Argar why Prince Charles received a #coronavirus test, but frontline healthcare workers have not. #KayBurley Read more here: https://trib.al/Uwb5wf4"
656,2020-03-26 07:05:00+00:00,All #NHS workers and social care staff will be given free car parking during the #coronavirus outbreak. The government will cover the cost to allow NHS trusts and local councils in England to help staff carry out their vital work. Read more: ▶️ https://www.gov.uk/government/news/government-to-provide-free-car-parking-for-nhs-and-social-care-staff
657,2020-03-26 06:50:29+00:00,How did Spain get its coronavirus response so wrong? 
658,2020-03-26 06:22:02+00:00,Gordon Brown calls for global government to tackle coronavirus 
659,2020-03-26 04:09:33+00:00,"Corona virus?? 🤔 ...it can't be! 😅🤣 Wash your hands often guys, stay 2 metres (6ft) away from people &amp; stay home as much as possible #BattlefieldV #BFV #glitch #coronavirus #JusBlazeArmy #Youtuber #twitch #mixerstreamer #COVID2019 #COVID19 #StayHomeSaveLives #InThisTogether"
660,2020-03-26 03:00:08+00:00,Ventilator is NOT working!!! London is calling. How do you tell London you are flying in a suspected coronavirus victim? 😑
661,2020-03-26 00:59:02+00:00,Jacinda Ardern hosts coronavirus Q&amp;A from home after putting child to bed - video 
662,2020-03-26 00:53:03+00:00,"Mers, Sars and the new Coronavirus all originated in bats. What have they got against us? I think we have to assume: Val Kilmer."
663,2020-03-26 00:09:28+00:00,"work was closed down temporarily due to coronavirus, so i'm gonna be uploading more doodles and stuff over the next few weeks. starting off with a dumb bee wip thing "
664,2020-03-25 23:46:32+00:00,Please wear gloves at the petrol station - first for the Coronavirus and also for mucky gets like this 🤢 
665,2020-03-25 23:36:33+00:00,"Well it took 2 days of lockdown, but we finally managed to make Coronavirus about Meghan Markle "
666,2020-03-25 23:33:40+00:00,Corona virus locked off everytinggggg #coronavirus #CoronavirusLockdown
667,2020-03-25 23:04:44+00:00,#Covid19UK #VentilatorShortage Deeply disturbing. Coronavirus knows no borders; now is EXACTLY the time to work together across borders with our EU partners. Sourcing massive ventilator capacity together for a whole continent is how to get through this. 
668,2020-03-25 23:02:56+00:00,"UPDATE on coronavirus (#COVID19) testing in the UK: As of 9am on 25 March, a total of 97,019 have been tested: 87,490 negative. 9,529 positive. 463 patients who tested positive for coronavirus have sadly died. Please note these figures do not cover a full 24 hour period. "
669,2020-03-25 22:55:32+00:00,"Excl: Self-employed will have to wait until end of May to get emergency wages from the government. Also; * Money only for low and medium earners, capped at around the £30k p/a median wage * benchmark to be January’s tax return for the last financial year"
670,2020-03-25 22:17:21+00:00,"“She is seeking cross-Government support for the move that would stop the daily flights from Tehran, New York and Los Angeles - all suffering serious #coronavirus outbreaks - as well as Beijing” | via @Telegraph"
671,2020-03-25 22:14:59+00:00,How on earth does a South Korean writer know in 2018 about Covid -19 aka Coronavirus??????????. If you are unsure what I am talking about you can watch episode 10 at 53minutes. The serious is called My Secret Terrius. I watched this last year. 
672,2020-03-25 21:56:31+00:00,"Coronavirus: Government orders 10,000 ventilators from Dyson "
673,2020-03-25 21:40:04+00:00,"#coronavirus #china #denmark #COVID19 CHINA IS VERY, VERY ANNOYED WITH THIS CARTOON Danish newspaper Refuses To Apologise For Publishing This cartoon Which Replaces The Yellow Stars On The Flag With Coronavirus (@jyllandsposten)"
674,2020-03-25 21:26:56+00:00,"🚨NEW — leaked emails &amp; docs show @nextofficial staff told to take unpaid leave or use holidays days if they're worried about coronavirus — workers docked pay if late due to transport disruption — staff: lack of social distancing ""putting lives at risk"" "
675,2020-03-25 21:19:58+00:00,Don’t forget the frontline staff caring for patients with #COVID19 on mental health inpatient wards. Show your support. ✊ #CoronaVirus #FrontLineNHS
676,2020-03-25 21:09:09+00:00,"Coronavirus is a reminder that the welfare state is not “a burden” but a form of collective insurance against life’s hazards: ill-health, disability, the death of a partner, unemployment. It should never have been so weakened by cuts."
677,2020-03-25 20:38:32+00:00,"1,000,000 California residents file for unemployment amid coronavirus pandemic, officials say. "
678,2020-03-25 20:36:05+00:00,Thanks to the WOAT @IamDrewman for bringing this meme into our lives #Coronavirus #TigerKing
679,2020-03-25 20:30:14+00:00,We face a war against coronavirus and must mobilise accordingly | Free to read 
680,2020-03-25 20:25:55+00:00,"Full of admiration, support and amazement of how our nation of shopkeepers continue to serve the communities despite the daily risk with Coronavirus. Retailers &amp; staff on the front line to support you. Please support them #ShopLocalShopLittle"
681,2020-03-25 20:23:48+00:00,Someone’s food waste bin. This is the result of panic buying. #coronavirus 
682,2020-03-25 20:23:38+00:00,Who did this? 😂 #PeakyBlinders #coronavirus 
683,2020-03-25 20:22:51+00:00,Not all gloom and doom... A 95-year-old grandmother becomes the oldest woman in Italy to recover from coronavirus. #COVID19 #GoodNews
684,2020-03-25 20:01:07+00:00,"There has been a rise in domestic abuse incidents during the #coronavirus outbreak, a police leader has warned "
685,2020-03-25 19:48:24+00:00,"A hospital outside Madrid overflowing with coronavirus patients - on the day Spain's death toll overtook China's. The staff are frightened of taking the virus home to their families, yet they are Working extra shifts because so many colleagues are also off sick. "
686,2020-03-25 19:37:29+00:00,"Like clockwork, we get a negative Meghan Markle story in relation to Prince Charles’ Coronavirus status. He is in isolation so no-one can visit. Someone pls make it make sense?! "
687,2020-03-25 19:11:03+00:00,"If someone in the UK dies from cancer, but they also show #COVID19 symptoms, WHY is it recorded as a Coronavirus death when that is merely a secondary symptom?"
688,2020-03-25 19:02:28+00:00,"BREAKING EXCL: @thesun can reveal a convicted sex offender from HMP Littlehey near Huntingdon, Cambs, has become the first serving prisoner in England and Wales to die from coronavirus."
689,2020-03-25 18:51:12+00:00,Meghan lays down the law and forbids Harry from going back to UK to see coronavirus-infected Prince Charles 
690,2020-03-25 18:46:03+00:00,My cousin contracted coronavirus and died today. He also had underlying health issues. Illness doesn’t discriminate.
691,2020-03-25 18:43:03+00:00,"Daniela Trezzi, a 34-year-old Italian nurse, has committed suicide after contracting the coronavirus "
692,2020-03-25 18:40:44+00:00,"A young nurse, working in an Intensive Care Unit where eight #coronavirus victims have died, has taken her own life. It's heartbreaking. Our amazing #NHS staff are battling not just a monstrous pandemic, but against dark forces which for too long have valued profit over people."
693,2020-03-25 18:34:25+00:00,A Jewish shop keeper in #Palestine playing the #Quran for God's help against #coronavirus. #COVID2019 #COVIDー19
694,2020-03-25 18:25:31+00:00,Does anyone know why we don’t have today’s UK coronavirus death toll yet?
695,2020-03-25 18:24:43+00:00,"Larz licked a toilet seat during a pandemic, got his twitter suspended and caught coronavirus. "
696,2020-03-25 18:20:39+00:00,What's been the worst celebrity intervention during the #coronavirus outbreak?
697,2020-03-25 18:07:57+00:00,"I have written to all schools, thanking them for the incredible resilience and flexibility they have shown in the face of unprecedented challenges. They are central to this country's fight against coronavirus. #StayHomeSaveLives"
698,2020-03-25 17:56:49+00:00,Today we wanted to say thank you to volunteers up and down the country who are working tirelessly to support the UK's response to Coronavirus. 
699,2020-03-25 17:44:55+00:00,Me giving daily corona virus updates to my household 
700,2020-03-25 17:39:40+00:00,"Deputy British Ambassador to Hungary, Steven Dick, dies of coronavirus aged 37."
701,2020-03-25 17:24:38+00:00,Watching @BorisJohnson coronavirus press conference. So infuriating to see him repeatedly dodging the question as to why we are so behind other countries in providing testing in the community #coronavirus 
702,2020-03-25 17:08:06+00:00,"PM Boris Johnson says in just 24 hours 405,000 people have responded to the government's call for 250,000 volunteers to help the NHS during the #coronavirus outbreak. Follow live updates on #COVID19 here: https://trib.al/CNKXsL0"
703,2020-03-25 17:00:17+00:00,WATCH LIVE: PM @BorisJohnson hosts the #coronavirus press conference (25 March 2020) 
704,2020-03-25 16:50:43+00:00,"More sad news from Italy. Another 4 doctors have died from #COVID19 according to the Doctors’ Federation there. It’s now 29 doctors who’ve died &amp; more than 5,000 health workers infected, according to news agency ANSA. #coronavirus"
705,2020-03-25 16:49:50+00:00,"This worker took a video from inside the Excel centre in London, where 4000 beds for Coronavirus patients are being organised. Says he didn't take the pandemic seriously until he saw the scale of what was being built "
706,2020-03-25 16:39:15+00:00,"Yesterday's deliveries included 24.6 million gloves, 7.5 million face masks and 1.9 million eye protectors to NHS organisations across the country. A further 7.6 million face masks are being delivered today, alongside other key protective equipment for #OurNHSPeople. #Coronavirus "
707,2020-03-25 16:35:52+00:00,Nations are shutting down their borders around the world but if you travel illegally in a dingy from Calais you'll be processed and tested for Coronavirus (unlike our frontline NHS staff). Priorities!
708,2020-03-25 16:23:01+00:00,Hospitals in New York City are gearing up to use the blood of people who have recovered from #COVID19 as a possible antidote for the disease. It follows preliminary studies in China that attempted the measure with plasma from people who had recovered.
709,2020-03-25 16:20:26+00:00,Never forget. #CoronavirusLockdownUK #coronavirus #coronavirusuk
710,2020-03-25 16:20:15+00:00,Coronavirus will not be solved by those driven by private profit. It will be solved by the bravery of NHS workers on the frontline. By communities coming together in all their diversity. By the Government taking bold action in the interests of all.
711,2020-03-25 16:15:23+00:00,📢Today I’ve agreed with local councils in England to provide free car parking for our #NHS and social care workers as they fight #coronavirus 🚘 1/3
712,2020-03-25 16:10:24+00:00,Scottish government to set up its own expert group to advise on coronavirus http://bbc.in/39eVZ2t
713,2020-03-25 16:08:26+00:00,"A 21 year old girl lost her life to coronavirus, completely healthy. You are not invincible just because you’re ‘young &amp; healthy’. STAY IN YOUR HOMES."
714,2020-03-25 16:00:01+00:00,UPDATED GUIDANCE 📢 Take a look at guidance on how to stay physically active following the government’s latest advice 👇
715,2020-03-25 15:59:43+00:00,Amir Khan offers his £5m wedding venue in Bolton to the NHS to treat those affected by coronavirus 
716,2020-03-25 15:45:26+00:00,London City Airport to shut due to coronavirus outbreak 
717,2020-03-25 15:38:38+00:00,"China myth busting the drop in Chinese mobile phone subscriptions and ""hidden coronavirus fatalities"" The real reason =&gt; upgrading to 5G Chinese new year is an important time for phone/contract upgrades Similar fall in 2015-16 around 3G-4G transitions #china #coronavirus "
718,2020-03-25 15:09:09+00:00,"Game changer: 15-minute home tests for coronavirus will be delivered by Amazon, available within days in the UK will show if you’ve had the virus (It is thought that having Covid-19 makes people immune &amp; if they get it a 2nd time, they do not transmit it) "
719,2020-03-25 15:05:06+00:00,"This could be huge. Within days, the UK is readying roll out millions of tests that can tell whether you have had the virus (by checking for antibodies). Will be delivered by Amazon or available for ""minimal"" cost from pharmacies. https://www.theguardian.com/world/2020/mar/25/uk-coronavirus-mass-home-testing-to-be-made-available-within-days"
720,2020-03-25 15:04:49+00:00,Off-licences have been added to the government's list of essential UK retailers allowed to stay open during the coronavirus pandemic 
721,2020-03-25 14:29:56+00:00,UK coronavirus mass home testing to be made available 'within days' https://www.theguardian.com/world/2020/mar/25/uk-coronavirus-mass-home-testing-to-be-made-available-within-days?CMP=twt_gu&amp;utm_source=Twitter&amp;utm_medium#Echobox=1585146595
722,2020-03-25 14:19:59+00:00,Romanticism in The Age of Coronavirus. #COVID19
723,2020-03-25 14:09:12+00:00,"In Portugal, over 100 startups banded together to defend the nation against coronavirus. They found temp housing for doctors, 3D-printed masks and recruited 1000s of volunteers. Now govs and startups around the world are trying to replicate their success "
724,2020-03-25 14:08:45+00:00,"If this does not serve as a warning, I'm not sure what will. - 21 years of age - No underlying health conditions RIP Chloe."
725,2020-03-25 14:06:47+00:00,"NEW: Tory MP Owen Paterson makes £100,000-a-year from a company that is selling private coronavirus testing kits to consumers for £120 each. "
726,2020-03-25 14:06:38+00:00,"Owen Paterson is paid £100,000-a-year by Randox Laboratories Randox has been selling a ""COVID-19 home testing kit"" for £120 a pop Paterson declined to comment when asked by BuzzFeed News if he thinks selling these tests for £120 each is appropriate https://www.buzzfeed.com/albertonardelli/owen-paterson-private-coronavirus-tests"
727,2020-03-25 13:58:10+00:00,We've launched a @GOVUK Coronavirus Information Service on @WhatsApp. Tap below to use this new free service: ▶️ https://api.whatsapp.com/send?phone=447860064422&amp;text=hi This automated ‘chatbot’ will allow you to get answers to the most common #coronavirus questions from a trusted source. Launch the chat 🔽
728,2020-03-25 13:42:50+00:00,"Russia's President Putin postpones vote on constitution change allowing him to stay in power, due to coronavirus "
729,2020-03-25 13:40:01+00:00,"At my last #PMQs, I paid tribute to those working to combat coronavirus. "
730,2020-03-25 13:37:21+00:00,A 21-year-old woman is believed to be the youngest person with no pre-existing health conditions to have died after contracting #coronavirus in the UK https://trib.al/mTgmtWP
