,Date,Text
1223,2020-03-23 08:46:06+00:00,Message from the Belfast Respiratory Team. Stay at home! #COVID19 #CORONAVIRUS 
1224,2020-03-23 08:46:01+00:00,What are we all gonna talk about when Corona virus is gone?
1225,2020-03-23 08:45:57+00:00,"Quello che non voglio scordare, dopo il #Coronavirus | Paolo Giordano "
1226,2020-03-23 08:45:45+00:00,UK supermarkets are creating thousands of UK #jobs due to the coronavirus pandemic: 
1227,2020-03-23 08:45:41+00:00,"NHS doctor, 52, is on life support due to coronavirus https://mol.im/a/8138763 via @MailOnline"
1228,2020-03-23 08:45:31+00:00,"This blog is interesting http://here-geneva.org/after-covid-19-time-to-reset/ - the call at the end for a focus on local response, and research on local responses to the Corona virus is congruent with your general approach to researching local governance &amp; informalities @Abiquitous"
1229,2020-03-23 08:45:24+00:00,"This is very important. The flu - you infect 1.3-1.4 ppl at a time. After 10 passes, that's 14 people. Coronavirus - you infect 3 people at a time. After 10 passes? 59,000 people infected. By you. #StayHomeSaveLives"
1230,2020-03-23 08:45:19+00:00,Why isn't every member of the NHS dealing with coronavirus or in immediate danger of getting it themselves being tested! Like lambs to the fucking slaughter. Government depending on people's humanity &amp; charity to not leave those most vulnerable in desperate need. #COVID19 #NHS
1231,2020-03-23 08:45:06+00:00,Covid-19: We have set up a dedicated email for businesses concerned about the impacts of coronavirus. Please email SouthwarkBusinessDesk@southwark.gov.uk or visit our dedicated web page https://bit.ly/3bcubgg
1232,2020-03-23 08:45:01+00:00,Please watch what I believe will be a properly informative programme about Coronavirus tonight Channel 4 Dispatches at 8pm. WE NEED TO KNOW and WE NEED TO ACT. NOW! 
1233,2020-03-23 08:44:58+00:00,Hi @skyNews nice #COVID19 #Coronavirus tracking summary but where are the Northern Ireland data and graphics? You mention it once in a summary but no detail 🙄
,Date,Text
0,2020-02-18 22:14:52+00:00,"One of my alumni from UWC China says ""I just got classified info from inside our Ministry of Defense where a relative works and the latest number of people infected with the #coronavirus in our country is 1.6 million."" "
1,2020-02-18 13:48:02+00:00,"Almost everyday, about 100 people die from Coronavirus in China. Every region in mainland China is infected. UK, USA, France, even India evacuated citizens. Right now, our airports allow Chinese people in from China. When will the “need” arise to save Nigerians trapped there? "
2,2020-02-18 12:37:07+00:00,Corona Virus Storm Dennis Syrian Airstrikes Severe Flood Warnings HSBC Job Losses That’s just from watching the news for 45 seconds! Can you understand now why I don’t watch it! It must be pretty hard to maintain a positive mindset when you’re flooded with bad news.
3,2020-02-18 10:21:18+00:00,"Please wash your hand: After coughing After sneezing Before eating After eating After using the toilet Before using the toilet After touching animals After caring for a sick person. Coronavirus is now in 27 countries It has killed almost 2,000 people now and counting. RT please "
4,2020-02-17 21:51:41+00:00,BREAKING NEWS: another 22 cases of the coronavirus have been discovered at Stamford bridge 
5,2020-02-17 21:44:13+00:00,"If anyone had any doubts about the impact of COVID-19 coronavirus, then this updated guidance from Apple should be of concern. Further evidence the impact is running deeper than some initially thought. Not good news. https://www.apple.com/newsroom/2020/02/investor-update-on-quarterly-guidance/"
6,2020-02-16 16:35:46+00:00,"NOW: Chinese students in #London are protesting the spike in racism (against Asians) following the #coronavirus outbreak. “We are treated as if we are a walking virus, not human beings...this is a vicious racism embedded in society.” – at Trafalgar Square"
7,2020-02-16 09:07:06+00:00,Just spoke to 12 @bbc local radio stations in succession on @churchofengland #Coronavirus guidance for churches Do pray for the sick Do worship Do Greet at Pax Wash hands Don’t Intinct Look out for the vulnerable Keep calm &amp; pray on! https://www.london.anglican.org/articles/coronavirus-guidance-for-parishes/ @dioceseoflondon – at BBC Wogan House
8,2020-02-15 20:24:45+00:00,"People complain on here daily about the weather, they’re hungry (really!) it’s Monday (be glad you’re alive) they’re cold (put a Fucking jumper on) they’ve got a cold! (Unless you’ve got coronavirus pop a paracetamol) whilst others have real problems, sort your selves out"
9,2020-02-15 13:19:12+00:00,"Suspected #coronavirus outbreak in China Town, Birmingham 😬 "
10,2020-02-15 08:01:33+00:00,It is sad to still read “NHS managers” being critiqued in the same tone as bankers or estate agents. A great number of my colleagues have been working non stop from front line to system and national roles for patients on 2019-nCoV (Novel Coronavirus) making a real difference
11,2020-02-14 12:27:23+00:00,"Red Cross teams in China have been tirelessly helping stop #coronavirus. Our love ❤️, admiration and support goes to all first responders. Today’s @IFRC TikTok pays tribute to those dedicating their lives to care for others #covid19 https://vm.tiktok.com/q9w6ub/ pic.twitter.com/z72q2N982d"
12,2020-02-14 12:02:01+00:00,smokers are hacking their masks with bottle tops so they can keep on lighting up during the coronavirus outbreak 
13,2020-02-14 09:49:31+00:00,Just landed @heathrow T2 and captain has announced that someone on the plane has suspected #coronavirus. noone allowed to leave the plane! waiting for doctor confirmation expected either way. person isolated at the back of the plane. 🤞🏽false alarm!
14,2020-02-13 09:04:04+00:00,Odion Ighalo agreed to stay away from Carrington for 2 weeks over coronavirus fears after he signed for MUFC. That 14-day period expires this weekend so he’ll be in squad for Chelsea game. 
15,2020-02-13 08:07:45+00:00,"Bicycle couriers in London are carrying samples that are being tested for #Coronavirus. Public Health England say this method of transport &amp; the containers used meet all international standards, but some couriers worry if they have an accident the containers could be crushed."
16,2020-02-12 14:07:18+00:00,Me: “I’m going to Brighton to report on coronavirus” My dad: “get us some rock will you”
17,2020-02-12 06:01:58+00:00,"""The dollar is falling now because of Coronavirus"" Sammy Gyamfi Dwarfs Cause Cedi Fall -Anita De Sooso Me: Ndc never again"
18,2020-02-11 16:47:21+00:00,"Kopi Luwak is processed by an animal, the Asian palm civet. Basically they injest the fresh coffee cherries and excrete them which is then collected and spearated from the faeces. The palm civet is one of the animals known to be carriers of the coronavirus. "
19,2020-02-11 06:38:47+00:00,"Wuhan, China: disinfection work has started in an effort to contain the spread of #coronavirus "
20,2020-02-17 02:34:18+00:00,"China’s Leader, Under Fire, Says He Led Coronavirus Fight Early On "
21,2020-02-16 14:46:33+00:00,Good to see Wonder Woman is worried about the Coronavirus #SAvENG
22,2020-02-16 10:03:57+00:00,In case you missed it: #Coronavirus - North Sea platform crew member tests negative https://www.bbc.co.uk/news/uk-scotland-north-east-orkney-shetland-51518300 @bbcshetland
23,2020-02-16 08:09:43+00:00,She's completely unhinged. She wants sick people toe be handcuffed and chained to their beds to stop the spread of the Coronavirus... 
24,2020-02-16 00:26:26+00:00,"Great feature from @MyFrogCroaked on how conservationists should not use coronavirus as a smokescreen for racism. All cultures do things we might not understand or agree with, but no human culture is perfect when it comes to impacting the planet. 🌍🌿🐄 "
25,2020-02-15 13:56:40+00:00,Big posters at the entrance to St George’s Hospital in south London. Message is: if you think you’ve got coronavirus = stay away ❌ – at St George's Hospital
26,2020-02-15 11:05:43+00:00,FFS - Apparently you bunch of Waycists Twats are more dangerous than the Black Plague ever was & #CoronaVirus will ever be 🤷‍♂️ What planet are the Lefty Loonies on? 
27,2020-02-15 09:19:18+00:00,"The February section of the Premier League Year has its lead-off items: “the coronavirus led to global panic and while Storm Ciara caused havoc across the United Kingdom, Manchester City were blown away by the news that they faced a two-year Champions League ban for...”"
28,2020-02-15 08:36:47+00:00,Facebook’s coronavirus guidance in newsfeed in the UK 
29,2020-02-14 14:58:40+00:00,"Sabb win! After our very constructive discussions with senior staff members of @UniofExeter, our Registrar has sent out an update about Coronavirus that includes this strong message of zero tolerance towards harassment and discrimination. "
30,2020-02-13 20:40:04+00:00,"MY RESEARCH ON CORONAVIRUS MY RESEARCH ON CORONAVIRUS MY RESEARCH ON CORONAVIRUS MY RESEARCH ON CORONAVIRUS MY RESEARCH ON CORONAVIRUS MY RESEARCH ON CORONAVIRUS HAVE FAITH, YOUR PHARMACISTS ARE WORKING💊💊💊💊 #coronavairus"
31,2020-02-13 17:56:44+00:00,Listening to concerns about the impact of corona virus on the Manchester Chinese community and business with @jeremycorbyn this afternoon. He committed continued support and to challenge press pushing racist and ingnorant health messages. #thankyou #welovechinatown
32,2020-02-13 16:31:40+00:00,"Say hello to your local coronavirus pod! You’ll see these things popping up at hospitals around the country now. Don’t worry, it doesn’t mean coronavirus is in Stockton. @BBCTees"
33,2020-02-13 08:13:44+00:00,Now we have the proof: Chinese authorities underreported Coronavirus cases. 15k mew cases overnight due to “changed ways of reporting”. Hike is 750% higher than the one of the previous day. Death toll rose by 250% day on day... @WHO still praises Communist Government in 🇨🇳
34,2020-02-13 08:07:26+00:00,Convinced I have coronavirus
35,2020-02-12 19:06:51+00:00,"That’s, shits about to hit the fan. CoronaVirus has landed in London. "
36,2020-02-12 09:18:16+00:00,Revealed: 'Drug dealer' kingpin Mark John Rumble who was extradited from Thailand back to Britain to face Class A drug supply charges COLLAPSED in UK jail with suspected coronavirus amid fears he could spark cluster of cases among inmates and staff 
37,2020-02-11 22:22:38+00:00,Imagine wearing a mask around the UK because you’re shook of the Coronavirus and there’s only EIGHT cases of it here
38,2020-02-11 18:16:02+00:00,British prisoner with suspected coronavirus 'collapsed in his cell after returning from a jail in THAILAND' sparking outbreak fears at HMP Bullingdon in Oxfordshire as three inmates are tested 
39,2020-02-11 17:25:33+00:00,"I am properly proud at how the Malaysian Ministry of Health @KKMPutrajaya @DGHisham has handled coronavirus, cured multiple patients, and been very vigilant with misinformation."
40,2020-02-11 17:21:20+00:00,Crikey... Facebook and Intel pull out of #MWC20 due to #Coronavirus—now possibility of cancelling the whole thing | via @zsk
41,2020-02-11 17:03:17+00:00,"Pub 1721, Haighton Manor, Haighton. Staff never been so pleased we don’t want food, Dad drops sugar lumps in his coffee, links the Lancs rose to the coronavirus, as Whitney Houston gets so emotional. Brunning n Price at their finest! – at Subway"
42,2020-02-11 16:14:32+00:00,A staff member of Rexel in #Eastbourne has come into contact with someone suspected of having #coronavirus as a precaution the branch is temporarily closed #CoronavirusOutbreak @Eastbournenews @HeartSussexNews @itvmeridian @bbcsoutheast
43,2020-02-11 16:09:11+00:00,"To help #LocalGov play a full role in containing #coronavirus, we have established an information hub on @LGAcomms website to support member councils’ endeavours - https://www.local.gov.uk/coronavirus-information-councils"
44,2020-02-11 15:26:12+00:00,The Coronavirus has officially been named COVID-19 by @WHO #COVID19
45,2020-02-11 15:20:48+00:00,Coronavirus has a new name. Covid-19. 🦠
46,2020-02-11 15:08:28+00:00,"Corona Virus, Bushfires, Threatening WW3, Kobe Bryant passing, Brexit, Trump cleared of impeachment charges..... okay 2020 stop it. Time for some positivity please !"
47,2020-02-11 14:46:58+00:00,FUNNY BUT TRUE: An American evacuated from China who tested positive for Coronavirus has just been mistakenly released from hospital. We hope they find him or her. 
48,2020-02-11 14:12:43+00:00,Interesting - I wonder if the guidelines for anti-Coronavirus mask fitting will influence the current fashion for beards... 
49,2020-02-11 12:21:48+00:00,"Coronavirus - Phil using parachutes payments to blame Mass UK Floods from Storm Ciara - Phil using parachutes payments to blame Brexit - Phil using parachutes payments to blame Feel like I’m banging my head against a brick wall, when will Town fans move on from the rhetoric "
50,2020-02-11 12:18:18+00:00,"Does any1 else think the world is trying to tell us something? Droughts & floods killing billions of lives in Australia, Storm Ciara killing people in Europe. The coronavirus killing thousands in China. It’s like some1 unleashed the four horses of the apocalypse."
51,2020-02-11 11:55:29+00:00,Outing a person for spreading coronavirus unsuspectingly via the media is truly a great thing to do. Really puts the ‘Great’ into Great Britain again. #ItsWhatWeDo
52,2020-02-11 11:34:42+00:00,This is a hospital in China (Coronavirus is making them think of innovative ways to reduce contact between people in quarantine so that infected people don’t give the virus to healthy people) 
53,2020-02-11 11:24:49+00:00,Coronavirus 'super-spreader' named after infecting up to 11 people 
54,2020-02-11 10:42:50+00:00,"working around the clock to manage the #Coronavirus situation in China is hard to take from so far away. Since I’ve returned, the gravitas and emotion of what we went through has taken its toll and I need some time to process it all. I’ll be back annoying you all soon enough! "
55,2020-02-11 10:08:03+00:00,China is using technology to reduce contact between people because of Coronavirus. Driverless cars are now being used to deliver medical supplies to hospitals. The car operates with remote control. Robots are also being used to deliver food. All you do is order online. 
56,2020-02-11 08:37:08+00:00,"Getting such odd looks on the train because I’m coughing, I don’t have #coronavirus ffs 😂, or atleast I hope not 👀"
57,2020-02-11 08:32:25+00:00,"My v early #TheBriefing with @SallyBundockBBC on @BBCWorld this morning: Coronavirus global economic symptoms emerging, Boris’s infrastructure revolution starts to take shape with bicycles, buses &amp; HS2,Sajid draws his negotiating lines with EU &amp; are you ‘mooching’ when streaming? "
58,2020-02-11 06:27:00+00:00,"The Brighton Doctors surgery that was sealed up and locked down yesterday after a staff member tested positive for #coronavirus seems to have been decontaminated now and is aiming to re-open this afternoon @GMB – at Carden Surgery, County Oak Medical Centre"
59,2020-02-11 01:02:07+00:00,If y'all are scared of coronavirus Just remember that pandemics like this will only get worse with climate change Bernie Sanders is the last chance short of forceful change. Remember that.
60,2020-02-11 00:54:06+00:00,Stephen Kinnock shut down after claiming coronavirus shows Brexit Britain more at risk 
61,2020-02-11 00:44:06+00:00,"""China struggles to contain virus"". #coronavirus #pandemic"
62,2020-02-11 00:33:05+00:00,Dele Alli: Tottenham midfielder apologises for coronavirus 'joke' http://j.mp/2H8EjKh
63,2020-02-11 00:32:53+00:00,"To my American friends and everyone else,Donald Trump just told the world,the Coronavirus will die out, because of the heat, how does glorious one know this? China’s Xi told him, you could tell this clown 🤡 anything and he would believe it? He is a danger to the country ? HELP?"
64,2020-02-11 00:13:08+00:00,The People's Republic of #China's governments handling of #Coronavirus in #Wuhan is borderline deliberate genocide. Millions are literally being bolted into their homes &amp; receiving no medical treatment. They will either die from the illness being untreated or die from starvation.
65,2020-02-11 00:00:27+00:00,"A new case of suspected Coronavirus in Southampton. Omg nagkaduol na man uy. First in Brighton, then now Southampton. 😣"
,Date,Text
0,2020-02-24 18:23:21+00:00,Great to be back at the alma mater for a special update on the #coronavirus #COVID19 #outbreak as part of the @LSHTM #GlobalHealth Lecture Series in partnership with the @PHE_uk UK Public Health Rapid Support Team @OksanaPyzikUCL @UCLGlobCitProg @UCL @School_Pharmacy @UCL_Global – at London School of Hygiene and Tropical Medicine
1,2020-02-24 13:20:46+00:00,Northern Italians in the morning when they’re getting ready to hurl insults like “Napoletano coronavirus” and “Napoli colera” when the corona virus outbreak came to Italy through the North... 🤡 
2,2020-02-24 11:48:08+00:00,"EU more worried about Lawnmowers in the Winter than Coronavirus, terrorists or illegal immigrants! Brussels' 'insane' law to 'PENALISE' Britons to be enforced in the UK despite EU exit "
3,2020-02-24 10:24:35+00:00,joke how there testing the coronavirus on monkeys when there’s raging peadophiles in jail
4,2020-02-24 08:55:00+00:00,Has anyone ever had a trip booked and then due to a situation outside of their control (let’s say... coronavirus) the airline has cancelled? Preparing myself for plan B 🦠 🤒 🇰🇷 (Flights not yet cancelled but the situation in Korea dramatically changed over the weekend)
5,2020-02-24 08:09:15+00:00,Delighted to see my letter published in today’s @FT highlighting the stresses on #cruise ship crew due to the #coronavirus and the vital support offered to all #seafarers by @Apostleshipsea #stellamaris
6,2020-02-24 03:26:13+00:00,Was good to see All the boys wearing their face masks earlier better to be safe with this coronavirus #BTS @BTS_twt
7,2020-02-24 00:48:34+00:00,Just found out Bergamo in Italy got coronavirus whilst I was out there (I flew in for Milan Derby) Incubation period is up to 27 days so pray for me boys
8,2020-02-24 00:22:36+00:00,If the Coronavirus hits the USA in a significant way will the government step in and provide free healthcare to combat this pandemic or will US citizens be left to live or die based on the quality of their health insurance? #Medicare4All #Bernie2020
9,2020-02-23 19:10:03+00:00,Italian games off today due to Coronavirus....will the SFA play their joker to suspend the league and stop nine in a row?
10,2020-02-23 11:27:37+00:00,Guess who's heading for northern Italy in a week? BBC News - Coronavirus: Italy imposes strict lockdown in outbreak hotspots 
11,2020-02-23 11:27:00+00:00,"Corona Virus to Italy, here we go! 🇮🇹 #Corona #Transfers"
12,2020-02-21 18:28:25+00:00,Delighted to hear Cabinet Secretary for Health had a great visit to HPS today. Big thanks to Kate and team who made it go so well. Thanks to all in HPS and across NSS working on Coronavirus resilience.
13,2020-02-21 12:24:23+00:00,"Just uploaded this weekend’s tech podcast. It’s a lively one, with @realBobbyHealy, @vrai_ie and Ericsson CTO. —&gt; 5G, coronavirus-as-a-stay-home-excuse and why Bobby won’t (yet) launch food delivery drones on Dublin’s Northside (where I live). "
14,2020-02-21 09:09:53+00:00,"On the day I was due to fly to #MWC20 I find this a little spooky - the novel #TheEyesofDarkness in 1981 by @deankoontz ""predicted"" a 2020 Wuhan-based virus... #COVID19 #Coronavirus "
15,2020-02-20 09:43:54+00:00,"“If the only medicine that cure coronavirus is chloroquine, I will not take it” “It’s too bitter and it itch me “If I die I die, I won’t take chloroquine” You that ordinary banger sound, You don turn to Usain Bolt 😂 If any of you see sure death, you go stay? Yen yen yen 🤡 pic.twitter.com/S63yQaWiry"
16,2020-02-20 09:23:14+00:00,“Chloroquine will itch me” “Chloroquine will itch me” My brother you better shut up and itch. Better to be alive and itch for a while than to be dead from Coronavirus. But on a serious note: Itching can be easily sorted out. We have medications to help you. Pls do NOT worry.
17,2020-02-20 08:25:24+00:00,This news has been making the rounds since 3 days now. I guess they are still trying out all those medications on affected patients with Coronavirus in China. It’s a huge relief to know our dear Chloroquine has been found helpful. You can read more here: http://www.xinhuanet.com/english/2020-02/17/c_138792545.htm
18,2020-02-19 13:42:32+00:00,The virology lab at the GRI has been testing the majority of possible coronavirus cases in Scotland. The team has been developing tests like this for years. Professor Rory Gunson explains: 
19,2020-02-19 10:56:43+00:00,My GP surgery has cancelled online appointment booking because: coronavirus. Instead you have to come in to the surgery to be triaged by a nurse. Because obviously bringing your coronavirus into the surgery waiting room is far safer than allowing it online 🤷🏻‍♂️
20,2020-02-24 22:14:05+00:00,I have a terrible feeling that this coronavirus outbreak could be the most significant event in world history since the fall of the Berlin Wall in 1989. If COVID-19 becomes a pandemic the human cost and economic disruption will have significant and lasting political consequences.
21,2020-02-24 18:40:54+00:00,Can’t believe my mum and dad are actually stuck in Italy because the full place has gone into quarantine from the Coronavirus
22,2020-02-24 18:15:58+00:00,"I'm confused about this coronavirus, if death rates are low (the same as flu?) And most just suffer like flu, Why is there such a panic and lock down?"
23,2020-02-24 16:05:21+00:00,"Don’t really understand what seems like an enormous over-reaction to The Coronavirus : it’s killing far, far viewer people than most flu viruses and all these precautions must be costing a fortune I really don’t get it 🙄🙄"
24,2020-02-24 13:08:29+00:00,"it’s unsurprising yet depressing to see coverage of the coronavirus outbreak develop from mild curiosity drenched in casual racism while only chinese people were dying, into genuine concern now the virus reaches europe, along with the usual anti-migrant / hard-border dog whistles"
25,2020-02-24 12:14:56+00:00,Ulster rugby’s match in Italy is postponed due to Coronavirus 
26,2020-02-24 11:25:02+00:00,Minister for Health Simon Harris said that “mass gatherings” may need to be looked at amid concerns about #coronavirus - he cites in particular the Ireland v Italy Six Nations game in Dublin 
27,2020-02-23 16:23:00+00:00,Statement from Arrowe Park Hospital after four people in the quarantine unit were confirmed to have #Coronavirus... 
28,2020-02-23 14:05:23+00:00,"Support your local Chinese restaurant. @JohnSimpsonNews got me to head to Four Seasons (twice) for the roast duck since the Coronavirus outbreak; @jayrayner1 will having me heading there again, and this time branching out across the menu."
29,2020-02-22 18:40:48+00:00,Wow. Mido (Milan) is cancelled due to Coronavirus. Europe’s biggest optical trade show (I think). 
30,2020-02-22 18:28:48+00:00,"Tokyo bound for @IPBES Scenarios and models seriously reduced taskforce meeting. @jankuiper87 says the cherry blossoms are out, so that’s a plus even if coronavirus is putting a damper on the whole event. See @resilienceSci @cjlinnz @Ghassen_Hal etc soon 🇯🇵 🌸 🇯🇵 🌸🇯🇵 🌸🇯🇵🌸🇯🇵🌸 – at BA Galleries Club Lounge"
31,2020-02-21 19:39:56+00:00,"We saw you at Newport, both myself and my friend had been working non-stop on the coronavirus response for weeks. For a few hours we had a laugh and forgot about work, thanks to you."
32,2020-02-21 16:23:10+00:00,"#AI sent first #coronavirus alert, but underestimated the danger | via @thenextweb"
33,2020-02-20 20:12:52+00:00,"Anyone noticed how certain countries, governments & leaders are blocking news stories regarding Coronavirus, Covid19. Never had a 451 legal reason when reading news? #coronavirus #covid19"
34,2020-02-20 16:29:06+00:00,"Levenmouth resident who tested positive for corona virus has been identified as Luke William Tonge, if you have had contact with this man please alert your local GP "
35,2020-02-20 12:54:01+00:00,Re-watched Bong Joon Ho’s THE HOST last night & was amazed to discover he made a Coronavirus themed movie back in 2006.
36,2020-02-20 11:43:21+00:00,"👇 ""Meningitis is caused by fornication."" -Ex-Governor Abdulaziz Yari. Homosexuality, lesbianism, causes of insecurity in Nigeria-Emir of gwandu, Muhammadu Bashar. ""Coronavirus is caused by corruption."" -EFCC Ag chairman, Magu. “Nigeria is in wrong hands!” -@henryshield"
37,2020-02-20 09:47:17+00:00,Weekly SIM session - preparation for potential #Coronavirus patient @MaterTrauma #Covid19 – at Mater Misericordiae University Hospital
38,2020-02-19 17:08:13+00:00,"Meanwhile in China 🇨🇳👇 To avoid catching #coronavirus, pay for road tolls by scanning drones dangling QR codes 🤷🏻‍♂️ "
39,2020-02-19 09:57:04+00:00,tl:dr China doesn't like what free media is reporting about what Beijing's tried and prefers to cover up. #coronavirus 
40,2020-02-19 09:41:43+00:00,"Confirmation for what is already reported, #coronavirus is more infectious and less lethal than #SARS &amp; #MERS. Think of it like #Influenza &amp; the urgent need for #Immunization"
