,Date,Text
181,2020-03-20 06:25:21+00:00,"Again, to all those who smoke weed, this is NOT personal: this is about safety and risk reduction. Roll your weed yourself. If someone else rolls your weed for you, If that person has the Coronavirus, they could infect the weed that you will put in your mouth. NOT safe for you."
182,2020-03-20 06:10:34+00:00,"Coronavirus has now infected almost 250,000 people worldwide. It has now killed over 10,000 people; and almost 90,000 recovered. Italy alone has almost 3,500 deaths. So in 4weeks it has killed more Italians than it killed the Chinese in 10weeks. Nigeria, we need to be alert."
183,2020-03-20 02:51:19+00:00,"Fit-and-healthy gym-goer, 39, struggles to breathe from coronavirus https://mol.im/a/8131269 via @MailOnline For all those people who think #COVID19 is just the flu, read this distressing story of a fit 39 year old who pleads with people not to be complacent. #StaySafeStayHome 🙏🏽"
184,2020-03-20 00:20:40+00:00,"Absolutely disgusting, how any person can talk this... Is this really true as I can’t still believe. ————— 'Infect enemies with Coronavirus': NY Muslim Brotherhood activist urges followers https://millichronicle.com/2020/03/infect-enemies-with-coronavirus-ny-muslim-brotherhood-activist-urges-followers/ via @millichronicle"
185,2020-03-19 23:59:27+00:00,"The Trump Name Game: 24/2 - "" Democratic Hoax "" - 40 cases(0 death) 28/2 - ""Coronavirus"" - 69 cases( 2 deaths) 18/3 - ""Chinese Virus "" - 13,726 (201 deaths) What changed? If you buy this my American friends, God bless! #COVID19 #CoronaVirusUpdate #ChinaVirus #US – at Mr Chow"
186,2020-03-19 23:48:36+00:00,"Stayed off Twitter this week because, frankly, it's a bit much. Here's my sad boy who wants to be at school & if he's not at school, wants his Mummy. He's having a rough time coming with all this. The girl is fine. #coronavirus #NHSstaff #nhsworkers #surgeonlife #SurgeonMummy"
187,2020-03-19 22:18:17+00:00,My podcast on talking to #children and #youngpeople about the #coronavirus #COVID19 https://buff.ly/3bk8z1V I hope it’s useful @rcpsych @bps @acamh @ACPtherapy @RcpsychCAP @YoungMindsUK @MindEdUK @AFNCCF @RCPCHtweets @TheBMA @MattHancock @Jeremy_Hunt @JonAshworth @CYPMentalHealth
188,2020-03-19 22:13:01+00:00,"#coronavirus in @nhsleeds. Have to say I’m proud. My practice team have turned our practice around on a sixpence. 100% phone triage with a tiny F2F rate. It’s a marathon not a sprint, but we are over the start line and running strong."
189,2020-03-19 21:36:02+00:00,"Perhaps we all got a little too caught up with social media, the rat race, not being in the moment .... let’s never take each other for granted again, let’s never take this life and the way we live it for granted. Be safe and stay healthy 🙏🏼 #Coronavirus "
190,2020-03-19 21:29:29+00:00,"Whilst I am hugely grateful for the public and private business support for NHS workers, I am very saddened that there is not parity for our LA social care colleagues who are working under immense pressure ensuring that people most vulnerable to Corona Virus are supported"
191,2020-03-19 21:29:07+00:00,"Sadly my father died yesterday morning. Due to restrictions imposed by the coronavirus outbreak, the wake and funeral were restricted by social distancing requirements. Here is a link which enables viewing of the funeral. "
192,2020-03-19 21:00:40+00:00,As a parent of a daughter who will now not be able to sit her exams / she is very anxious about impact on her future. We need to ensure that the ‘grading’ process is fair and doesn’t disadvantage any child #coronavirus
193,2020-03-19 20:56:28+00:00,Young Will & GG now mixing Glucose & Yeast with Water which when fermented will create Alcohol which we will Distill through our Gin Stills producing Neat Alcohol at 96-97% ABV We then cut it down with Water This is NOT commercial & will be given away free #coronavirus – at Old Bakery Gin
194,2020-03-19 20:52:35+00:00,"Covid reality 2020. Dublin restaurant offers customers business by delivering to open cars same food in a take/drive away following strict safety rules. @MichaelsCoDub Way to keep jobs, business during challenging times #COVID2019 #coronavirus #CoronaVirusChallenge"
195,2020-03-19 20:36:49+00:00,The best thing I've read all day 👏 #coronavirusuk #Convid19uk #coronavirus 
196,2020-03-19 20:11:23+00:00,"We've had a request from St Mary's Care Home in #Tooting Bec Gardens for local people to write to their elderly residents, who cannot receive their usual visits from friends, family or entertainers because of the coronavirus situation. More: http://instagram.com/p/B97Yw4HHiuJ #Balham"
197,2020-03-19 20:02:03+00:00,"Shift finished today, now off for a week which I had pre-booked hoping this #coronavirus doesn't finish my 33yrs stint in this Marvelous establishment The Crown Belfast... 🍻🥃#Staysafe"
198,2020-03-19 19:48:07+00:00,"There’s an overwhelming amount of #coronavirus information out there. The @wellcometrust have curated a list of experts, journalists and institutions to help keep you informed of the latest #COVID19 developments. Go on, why don’t you subscribe? 🔽 https://twitter.com/i/lists/1240652229507526656"
199,2020-03-19 19:10:26+00:00,Excellent interview from our CEO @tinaloucostello on @bbcmtd! 👏🏽 If you want to support our Coronavirus Resilience Fund then please visit: http://bit.ly/3b481Ns
200,2020-03-19 19:06:26+00:00,If @BorisJohnson thinks we can “send the #coronavirus virus packing” in 12 weeks how can he justify taking such extraordinary sweeping #EmergencyPowers for 2 years? 🤔 I am genuinely puzzled &amp; will be co-sponsoring a probing amendment on this issue
201,2020-03-19 18:56:11+00:00,Amazing scenes today. A Year 13 told it’s his last day of school. What did he ask? Please may I play on Saffron Hall stage one more time 🙏 #covid19UK #coronavirus #music #school #schoolmusic #education @tweetswchs @SaffronHallSW – at Saffron Hall
202,2020-03-19 18:47:27+00:00,"I am so surprised that Muslims are advised not to go to the Masjid till Coronavirus is gone, where as the Sunnah is not to leave the masjid till the problem is gone. Taking precautions is essential, but we must believe that the solution to our problems is in following Sunnah."
203,2020-03-19 18:28:11+00:00,"I hope this recent crisis shows that those at the bottom performing so called unskilled work are just as important to the UK economy as high flying bankers, hedge fund managers and the like. Let's hope once this crisis is over they are treated and rewarded as such. #coronavirus"
204,2020-03-19 18:24:10+00:00,Hi everyone❣️ ❣️ I currently have near enough 0 bookings at the moment due to coronavirus which is totally fine but any support shown / RT’s would be appreciated so much to help me maybe gain a few clients during this difficult time for all self employed people Please share ☹️❣️ 
205,2020-03-19 18:07:42+00:00,"Other key workers in #coronavirus times? School caterers 👩‍⚕️ Care workers 👨🏾‍⚕️ Cleaners 🧹 Gig economy delivery drivers 🚐 We salute you. Every worker deserves a real #LivingWage and #LivingHours, now more than ever #CoronaVirusUpdate #COVID19 #WereInThisTogether"
206,2020-03-19 17:44:33+00:00,"By 7pm, I would be on Empire Radio to speak about Coronavirus. Please tune in to @EmpireRadio1045 or listen online via http://stream.empirefm.ng Thanks 🙏🏿"
207,2020-03-19 17:34:08+00:00,Instagram has published a helpful guide to live video ideas and top tips during the #coronavirus outbreak 
208,2020-03-19 17:30:53+00:00,"If Coronavirus is getting you down, perhaps you could take the advice David Hume got from his doctor to treat depression as a young man. He had to follow a strict regime of taking “long rides on rough country roads, a pint of claret per day, and anti-hysterical pills!” "
209,2020-03-19 17:13:02+00:00,"dirty robbing cunts, hopefully after everything has calmed down no one will shop in that store again!! BBC News - Coronavirus: Price-hike pharmacy offers Calpol for £19.99 https://www.bbc.co.uk/news/uk-england-birmingham-51962556"
210,2020-03-19 16:29:46+00:00,We are absolutely delighted to announce we are the first major donor of the Coronavirus Response and Recovery Fund You can read more below👇 
211,2020-03-19 16:25:48+00:00,Northern Ireland meat producer Moy Park is advertising for hundreds of temporary staff due to an uplift in demand for poultry #coronavirus 👇🏻 
212,2020-03-19 16:25:35+00:00,So to cut the long story short; Lagos (and Nigeria) now has both imported cases of Coronavirus as well as local spread of Coronavirus. NOW is the time to buckle up as citizens and do everything we can together with govt to end/slow the spread. We can do it. One step at a time!
213,2020-03-19 16:18:35+00:00,"#Coronavirus no sport!? make your own, summers coming, two please umpire, right arm over 2 toilet rolls to come "
214,2020-03-19 16:14:35+00:00,"Throw back to when I stole all the toilet paper, now the hoomans are all doing it too 🤣🤣🤣 #tbt #coronavirus #laylathewhiteboxerdog #whiteboxerdog #boxerdog #bromocrew #sismos @BoxerDogUnion @DogCelebration @BoxerBond"
215,2020-03-19 15:53:27+00:00,"Well that’s me registered on the nursing bank. Coronavirus, we’re coming to get you! 💪🏻"
216,2020-03-19 15:52:20+00:00,Chesterfield shop slammed as ‘abhorrent’ for selling toilet rolls for £10.99 amid coronavirus panic 
217,2020-03-19 15:27:30+00:00,Dame Stephanie (Steve) talking about the #coronavirus today.. 
218,2020-03-19 15:14:49+00:00,"Spoke this morning on the @StephenNolan show about the urgent necessity to implement an expansive Coronavirus testing programme, otherwise we do not know who has had it, who has recovered and who remains at risk. Knowledge reduces fear."
219,2020-03-19 14:25:41+00:00,Please share these Government hotline numbers @WycombeSound @bucksfreepress - thanks More: https://www.gov.uk/coronavirus https://nhs.uk/coronavirus #Coronavirus #COVID19
220,2020-03-19 14:00:33+00:00,#Stormont @healthdpt #Coronavirus testing is going to be increased in the north/NI to 800 per day. Frontline health and social care staff will be the priority. Full surge plan details can be found here: https://www.facebook.com/402568099848220/posts/2557224131049262/?d=n
221,2020-03-19 13:23:30+00:00,"Coronavirus: To beer or not to beer? Many Britons going to pub despite PM's advice. This is NOT the time for wishy washy measures and polite requests, and this proves it! "
222,2020-03-19 12:43:28+00:00,There’s no place like home. Stay safe and stay at home. We will get through this together. @allontheboard #StaySafeStayHome #StayAtHome #StaySafe #StayHome #Home #TheresNoPlaceLikeHome #UKlockdown #lockdownuk #COVID19 #coronavirus 
223,2020-03-19 12:23:57+00:00,"My epsiode with @davidicke talking Coronavirus, Covid 19 global lockdown and the upcoming economic collapse will hit 1 million views shortly...please watch it and share it at http://www.londonreal.tv/corona this is an… https://www.instagram.com/p/B96kPUapSYO/?igshid=b5srcaib16em"
224,2020-03-19 12:20:22+00:00,One of our Chinese students @UofGlasgow suffered a horrific attack by racist morons - #coronavirus does not discriminate &amp; as our @GUSRC_President said this should not take place ‘in a city that prides itself on the mantra 'People make Glasgow'.’ ❤️
225,2020-03-19 12:00:31+00:00,The death stare from the guy on the right though 😂. He’s not finding it funny 😂. • #covid_19 #coronavirus #SA #southafrica
226,2020-03-19 11:53:59+00:00,It’s looking increasingly likely that I’m about to lose my job but the Hellebores and Snake’s-head fritillaries are looking so lovely in my garden this morning #stayingpositive #ThursdayThoughts #ReasonsToBeCheerful #coronavirus 
227,2020-03-19 11:46:22+00:00,Chinese police now patrol streets wearing “smart helmets” which are able to detect people who may have Coronavirus. The helmet have an infrared that can measure body temperature from 5metres away and would raise an alarm if the person’s temperature was high. Impressive stuff. 
228,2020-03-19 11:08:48+00:00,"We have supported our clubs, loyally fro over 120 years. It's time for all clubs to follow the lead of @LFC and support supporters #HungerDoesntWearClubColours #EFC #LFC #MCFC #MUFC Premier League clubs urged to help food banks during coronavirus crisis "
229,2020-03-19 10:46:37+00:00,"All indications are that Iran has suffered + is still suffering tragedy on a mass scale. An appropriate global response would be solidarity, humanitarian aid + assistance. But America has just announced new sanctions. This is a crime against humanity. #COVID19 #coronavirus"
230,2020-03-19 10:44:08+00:00,Lol my landlord just texted me to ask me to stop crying about the coronavirus 
231,2020-03-19 10:35:29+00:00,"Today, special military helicopters will spray pesticides against the Corona virus in the skies all over the UAE People are advised to stay indoors after twelve o'clock at night and remove all clothes which are outside. Pls RT for those with family/friends in Dubai and the UAE."
232,2020-03-19 10:29:37+00:00,"To be clear: miss me with #covid19UK ‘silver lining’ takes while people are dying. Chaos, mass layoffs - these are not positive things. But I don’t think it’s unreasonable to agree a basic principle that any coronavirus crisis responses should not make the climate crisis worse "
233,2020-03-19 10:26:26+00:00,"Coronavirus, it can drive you insane 😂💕 Stay Safe 🙏 👉👉@holidaytimeuk #COVID19 #CoronaVirusChallenge #StaySafeStayHome #holidaytime #WashYourHands #coronavirus #covid19UK #UKlockdown #brighton #Hove #ThursdayMotivation #FightCOVID19"
234,2020-03-19 10:20:22+00:00,"Now that petrol is cheaper, Now that some people may self-isolate, Now that Coronavirus may mean more people would work from home; Pls DO NOT hoard petrol and keep at home. This is VERY DANGEROUS. A petrol explosion in your house will kill you faster than Coronavirus. Pls RT."
235,2020-03-19 10:20:05+00:00,Absolutely smashing my #homeworkouts during this coronavirus lockdown ...... #fitness #pug #LockdownLondon #SelfIsolation #coronavirusuk
236,2020-03-19 10:08:57+00:00,"More ‘on the upside’ of #coronavirus. While humans carry out social distancing, a group elephants broke into a village in Yunan province, looking for food. They ended up drinking 30kg of corn wine and got so drunk that they fell asleep in a nearby tea garden. "
237,2020-03-19 09:46:41+00:00,"To those who are having #lockdownparties because they think they are invincible, this is how it looks when you can't cope with the number of dead bodies and you have to ask the army to move them elsewhere #coronavirus #covid19UK #StayAtHome"
238,2020-03-19 09:14:13+00:00,Fantastic response to the current #CoronaVirus crisis by west Belfast community @ArScath @GlorNaMona @feargal81 @BayviewMedia @FailteFeirste @irish_news @GoodMorningWB @BelfastHourNI @Culturlann @NaRoinn #shotoniphone
239,2020-03-19 08:54:57+00:00,It would kind of funny if #coronavirus destroyed capitalist systems &amp; we saw introduction of UBI and the kind of radical policy actions that are needed long-term to curb #ClimateChange 🙈💚🌍 Change is coming peeps.
240,2020-03-19 08:41:21+00:00,This will make you smile today! Looks like Lego have launched a new set! 😂 #coronavirus #meme
241,2020-03-19 08:17:31+00:00,UK companies now hiring Aldi 9.48£ per hour Amazon 9.50£/hour Deliveroo 10£/hour Iceland 9.10£/hour JustEat 120£/day Lidl 9.3£/hr M&S 10.60/hr Tesco 9.3£/hr Sainsbury 9£/hr Waitrose 9.35£/hr UberEats 11.14£ per trip Pls RT for anyone in UK who has lost a job due to Coronavirus.
242,2020-03-19 08:05:31+00:00,"RSA statement on economic security and, so, public health. (1) Increase statutory sick pay (2) £1500 cash payments for all workers, £100 pw after through HMRC, child benefit to £50: #basicincome (3) Cash grants while UC claims are processed. https://www.thersa.org/about-us/media/2019/coronavirus-and-a-temporary-ubi-rsa-statement #coronavirus"
243,2020-03-19 07:59:28+00:00,"JUST IN: 475 people died yesterday in Italy. Yesterday alone. This is the highest daily number of dead people since Italy started battling Coronavirus. The total number of dead people is almost 3,000 now. The virus spread so fast hospitals got overwhelmed. Pls pray for Italy."
244,2020-03-19 07:50:34+00:00,Not his finest moment but then they’re are so many @realDonaldTrump 🤡🙈 #coronavirus 
245,2020-03-19 07:37:08+00:00,"Yesterday we discovered the Coronavirus case in Ekiti spent 14 days in Ibadan. That same yesterday, the ruling political party held a mega rally, where it is rumoured that UK returnees were present (including one singer). If you are in Ibadan now, Pls, you need to stay alert! "
246,2020-03-19 07:33:05+00:00,Inspirational stuff @rustyrockets 🙏🏻✨🖤 #coronavirus #mentalhealth
247,2020-03-19 07:22:01+00:00,"🎈 🎂B I R T H D A Y B O Y🎂🎈 So the Coronavirus has ruined my holiday and birthday plans, so what better way to party then that in self isolation, dressed in your new favourite outfit from @asos_man What a time to have your birthday! #birthday #birthdayboy"
248,2020-03-19 07:18:52+00:00,"Farm workers are critical - harvesting veg, picking fruit, lambing, milking - keeping the nation fed during the crisis. Here is some practical coronavirus-related guidance for farm employers👇🏻 "
249,2020-03-19 06:39:57+00:00,Things to take from last nights @Boro win over @FC_Basel_en..... Rochemback - absolutely fantastic football player Southgate - best defender ever to pull on a Boro shirt Boateng - obviously indestructible Viduka - with his back to goal could hold up the spread of Coronavirus
250,2020-03-19 06:26:02+00:00,Touch of class from former footballer Gary Neville. He co owns a couple of hotels that will close but says - No redundancies. - Staff will still be paid. - Beds will be given to NHS staff. Forever thankful #legend #covid19UK #lockdownuk #coronavirus @GNev2 👏👏👏❤️❤️❤️
251,2020-03-19 06:07:42+00:00,London's underground system partially shutdown from today. Up to 40 tube stations are being closed until further notice. People are being urged only to use public transport in the capital if absolutely essential. #coronavirus #coronavirusuk #London @GMB – at Clapham South London Underground Station
252,2020-03-19 04:14:38+00:00,My previous two retweets are of: * students enjoying US spring break while dismissing #coronavirus #covid19 and saying it has ruined their parties * and an Italian army truck convoy bringing bodies to another part of Lombardy after running out of space Cause and consequence.
253,2020-03-19 02:19:42+00:00,A point I think I should have 'splained earlier; coronavirus isn't normal economic recession. In this case we *want* much lower consumption for a short period. We want to make sure we can bring it back in as intact a state as possible when we want consumption back.
254,2020-03-19 00:28:53+00:00,"There have been 74 new cases of coronavirus confirmed in Ireland, bringing the total in the country to 366. The Department of Health confirmed tonight. Modi needs to “Man up” &amp; take this seriously for India &amp; countries near its borders! #CoronaInPakistan @ImranKhanPTI @ashoswai"
255,2020-03-18 23:48:36+00:00,It’s my 4 rota days off from work 🤫🤫 I have a car and live in Bristol If people need any errands/deliveries/shopping/dog walks/moral support or just a bloody chat! #Bristol #WereInThisTogether #community #helping #ImHere #ComeTogether #share #covid19UK #coronavirus #TeamSpirit
256,2020-03-18 23:27:02+00:00,"Oh Christ, Jess Phillips is doing her drama again on Peston. Apparently loads of her relatives and friends have lost their jobs already due to corona virus. Buuuuullssshido!"
257,2020-03-18 22:50:23+00:00,KEEP YOUR CHILDREN SAFE. Latest research from WHO after studying cases in Italy. Young people being tested who have recovered from #coronavirus are experiencing irreversible lung damage. Not sure of numbers.
258,2020-03-18 22:02:39+00:00,"Strong message everyone, protect your OWN energy right now, mental & physical, you can't help yourself or anyone else in a state of exhaustion 'Withdraw & restore yourself' If you can!! #Health #WednesdayWisdom #coronavirus "
259,2020-03-18 20:04:33+00:00,"Hi @BBC @ITV @Channel4 any scope for a daily exercise programme for the elderly, or anyone in fact, on your channels, not just on a streaming service? I think it would be rather useful to help the people we now won't get as much opportunity to see #coronavirus #covid19UK #physio"
260,2020-03-18 20:01:18+00:00,"❤️ i was gifted $1,600 in ad credit by twitter last year i never used it who should I gift it to on @TwitterUK A person or persons or an org who is doing something important in a British 🇬🇧 community in need due to #coronavirus ? something else? hit reply #RT matt x"
261,2020-03-18 19:01:01+00:00,How can you tell us may and June exams are cancelled and not go into detail!?!?!? Do I revise? Do I burn my textbooks? #gcses2020 #coronavirus 
262,2020-03-18 18:41:07+00:00,50% of the British thought the media were exaggerating #coronavirus last week ... we’ll see 
263,2020-03-18 18:31:27+00:00,"BREAKING Today I’m launching our Coronavirus community action taskforce, asking our 125k members to be deployed to help communities across UK 🔶Practical help 🔶Focussed on most vulnerable 🔶Nationally coordinated 🔶Central resources Let’s help those who need it most [1/6] "
264,2020-03-18 18:09:39+00:00,EFL STATEMENT: BOARD UPDATE ON CORONAVIRUS Primary objective to deliver a successful conclusion to the 2019/20 season
265,2020-03-18 18:04:14+00:00,Johnson is completely irresponsible. His refusal to engage with the catastrophic consequences of Brexit in the middle of the Coronavirus crisis is inexcusable.
266,2020-03-18 17:52:51+00:00,"The Chinese plead for Trump to stop referring to #coronavirus as the ‘Chinese virus’ and a few hours later, he literally opens a press conference by referring to it as the ‘Chinese virus’. Zero class, zero manners, zero dignity, 100% trash 🗑"
267,2020-03-18 17:51:04+00:00,"Funny how the daily Coronavirus press conference is saying Londoners aren't taking note of avoiding social contact. I look out of my window to an empty Camden &amp; hear of deserted streets. Mostly from my mates with dogs. We're not all out going sod everyone, we're Londoners."
268,2020-03-18 17:45:53+00:00,"Lagos is too populated for infected Coronavirus cases to slip in unnoticed through our borders. In just one weekend, thousands of people can be infected if nothing is done. There are people who will do anything to enter Nigeria right now at all costs. We must be alert always."
269,2020-03-18 17:34:08+00:00,Scrapping #HS2 now is not only the right thing to do it will give the British public comfort we are throwing every resource possible into fighting #Coronavirus Currently it looks like we're not #NHSnotHS2
270,2020-03-18 17:24:13+00:00,"BREAKING NEWS: ofsted will suspend all inspections, all exams and assessments will be suspended. Talks with exams boards to ensure children get the results they deserve. Gavin Williamson announces. #coronavirus #schoolclosuresuk"
271,2020-03-18 17:21:59+00:00,"JUST IN: The total number of Coronavirus cases in Germany has now hit 10,000. As at February 24, Germany had 16 cases. Now 3 weeks later, Germany has over 10,000 cases. Again, the issue with Coronavirus is if you don’t move early, you will regret it whenever you finally do."
272,2020-03-18 17:19:49+00:00,BREAKING NEWS: Gavin Williamson has announced that all schools in England will close from Friday due to the #coronavirus until further notice. Expect for children of key workers.
273,2020-03-18 17:04:17+00:00,Thank you to @RadioTees @radioderby @spiritfm @BBCSussex @BBCSurrey for inviting @RSPCA_official to talk about Coronavirus and pets. We have lots of advice for owners so please try not to panic or worry. 
274,2020-03-18 16:49:49+00:00,To our amazing fans and specifically those who have purchased tickets to the performance of Firedance. It is with regret that due to the escalating situation with regard to coronavirus in the UK and the subsequent… https://www.instagram.com/p/B94d3qQH9U7/?igshid=2y2rf0ocam8v
275,2020-03-18 16:37:07+00:00,"I've sent an email today to senior @scotgov officials with a proposal which could save lives. I am waiting on a response, lets house #homeless in #Glasgow now in safe conditions, we cannot wait or evaluate, these ppl will die in the high risk groups #coronavirus #hotels are empty"
276,2020-03-18 16:18:35+00:00,"A heartbreaking letter from Peter Kinsella, co-owner of one of Liverpool’s best-loved restaurant brands @Lunya... really brings home how the hospitality sector will be devastated by #coronavirus "
277,2020-03-18 15:24:56+00:00,"After the last 7 weeks watching the Arena Trial at the Old Bailey, and despite the Coronavirus, I am glad to be back at work as a GP. #bemoreresilient"
278,2020-03-18 15:22:29+00:00,"Health Secretary, Jeanne Freeman, has ordered that all NHS Scotland staff be checked for coronavirus. NHS England do not intend to do so, for capacity reasons. https://talkingupscotlandtwo.com/2020/03/18/health-secretary-acts-to-prevent-hospital-acquired-infection-of-coronavirus-as-cases-begin-to-emerge-in-nhs-england/ via @wordpressdotcom"
