,Date,Text
0,2020-03-30 22:08:02+00:00,Yes. Our experience too. Luckily ( as a consultant!)I managed to get tested today so hopefully back to the front line ASAP. But #NHSstaff #coronavirustesting should be for all now.
1,2020-03-30 21:31:19+00:00,"Organizers say a gay pride parade in Brighton, UK is set to go ahead later this year despite social distancing rules that are currently in place to prevent the spread of coronavirus. "
2,2020-03-30 21:30:30+00:00,@MattHancock @michaelgove looks like you are lying. Again. #ToryLies #covid19UK https://scramnews.com/michael-gove-matt-hancock-lied-coronavirus-testing/
3,2020-03-30 21:00:58+00:00,We have tonight written to @RoyalMail @BorisJohnson setting out proposal to deal with coronavirus crisis: ◾️No more advertising mail ◾️Full pay for all coronavirus related absences ◾️Immediate implementation of safety measures or work ceased ◾️Posties checking on elderly
4,2020-03-30 20:50:55+00:00,Can Ireland just start shipping flat 7up all over the world? That would sort that Corona virus right out am I right? #Coronavirustruth
5,2020-03-30 20:20:51+00:00,"Government has ruled prorogation due to occurence of corona virus in parliament, what about prisoners, aren't they human? Release them before corona spread among prisoners Meclis TahliyeDesin @hrw @amnestyusa @aforgutu @abdulhamitgul @CommissionerHR"
6,2020-03-30 20:14:38+00:00,"A senior doctor has written to chief medical officer Chris Whitty to raise her ""grave concern"" that electric hand dryers in toilets could increase the risk of transmission of #coronavirus "
7,2020-03-30 20:00:18+00:00,Sad quote from doctor on @C4Dispatches “All this talk about heroes. You don’t need heroes if a situation has been prepared for. You only need heroes if there has been no preparation...” #coronavirus
8,2020-03-30 19:47:25+00:00,Complaint against http://Davidicke.com for posting video of German journalist at EMPTY coronavirus emergency unit rejected by Twitter. Someone obviously doesn't want you to see it - so here it is again. http://ow.ly/74vt30qtUU8
9,2020-03-30 19:44:47+00:00,At least five inmates were killed in a prison riot triggered by #Iran authorities continued refusal to grant leave to the prisoners despite #coronavirus outbreak #COVID19
10,2020-03-30 19:40:55+00:00,Fantastic story for a Children to explain the #coronavirus and not just in English but in #Cymraeg too! A valuable resource for any parents! #coronavirusUK
11,2020-03-30 18:37:12+00:00,"The Ventilator Challenge is an example of how UK manufacturers, a world class workforce and @unitetheunion have come together to provide our NHS with the vital equipment it urgently needs. Well done to everyone involved."
12,2020-03-30 18:25:50+00:00,Coronavirus: 'I can do whatever I want' - man fined for flouting lockdown rules outside Tesco 
13,2020-03-30 18:02:24+00:00,"45 people being held in cells designed for 7 is a deep concern for the spread of corona virus, particularly amongst pregnant women and mothers with babies. The early release of these women is an obligation for the government under United Nations rules Meclis TahliyeDesin "
14,2020-03-30 18:00:28+00:00,.@PHE_uk has published new advice for parents and carers focused on looking after the #mentalhealth and wellbeing of children and young people. Read the full guidance: http://www.gov.uk/government/publications/covid-19-guidance-on-supporting-children-and-young-peoples-mental-health-and-wellbeing #coronavirus #StayHomeSaveLives
15,2020-03-30 17:51:54+00:00,Police want to speak to this man after hand sanitiser was stolen from the wall of a hospital
16,2020-03-30 17:43:35+00:00,Davido has met with with Gov. Seyi Makinde & of course his fiancé Chioma in the last 7-14 days. If he isn’t infected with Coronavirus. HE IS THE ANTIDOTE. He automatically becomes the answer to the world’s problem!
17,2020-03-30 17:32:23+00:00,Here are the slides I used for today's daily coronavirus press conference - PV 
18,2020-03-30 17:30:23+00:00,Scotland mobilises! Soldiers from @154ScottishRegt mobilised within six hours to support the #NHS in delivering PPE in Yorkshire. #Coronavirus #InThisTogether #CovidSupportForce #AlwaysReady
19,2020-03-30 17:15:28+00:00,"Rachel Maddow is facing humiliation after she claimed President Trump’s assertion that a naval hospital ship would dock in New York by this week to help with the coronavirus outbreak was “nonsense.” The ship, USNS Comfort, arrived this morning. "
20,2020-03-30 21:23:40+00:00,Key components ordered from overseas were discovered to be contaminated with coronavirus 
21,2020-03-30 21:12:04+00:00,#Coronavirus: Don’t worry if you haven’t been able to get through to us straight away. 
22,2020-03-30 20:55:09+00:00,"Analysis: Trump says 100,000 dead 'a very good job' http://a.msn.com/01/en-ca/BB11VPjx?ocid=st2 @POTUS changing mind as usual. As wishy washy as #CharlieBrown. WEAK leadersip #America way behind PPE from where intelligent leadership would have us"
23,2020-03-30 20:54:41+00:00,"Good news guys, we're getting a vaccine for Corona-virus... in September! "
24,2020-03-30 20:42:37+00:00,A thank you from farmer John Govier in South Molton in Devon 🚜❤️ #coronavirus #nhs
25,2020-03-30 19:55:00+00:00,Have you done this?
26,2020-03-30 19:03:35+00:00,"""all hell breaks loose"". No, it didn't with zero retweets, so zero engagement. Maybe you shouldn't bother with this bullshit pre #coronavirus first-world problem #pronoun nonsense when the world has more pressing concerns, you total f**king child. Nobody cares. Get a grip."
27,2020-03-30 19:02:25+00:00,Measly two days to watch it. Which is also how long it would take to watch it all in one sitting (42.5 hours) so join me in watching it during this quarantine on April 1st. #6seasonsandamovie. I’ve been told it’s the only cure for the corona virus. You can also catch.. (3/4) pic.twitter.com/GYowBdgLuF
28,2020-03-30 18:53:08+00:00,"BREAKING: Lockdown in Italy will be extended until at least the 12th of April, in a bid to stop the spread of #coronavirus. #COVID19 latest: https://trib.al/5VQDJRh"
29,2020-03-30 18:49:09+00:00,A recession on a scale not seen in modern history is looking increasingly likely due to the Coronavirus pandemic &amp; it appears Boris Johnson wants to top it off with the economic catastrophe of a potential no-deal Brexit 
30,2020-03-30 18:43:21+00:00,"It says much about our country that she feels the need to stress that the SECC hospital will be an NHS hospital staffed and run by the NHS. If I get the Corona Virus I don't care if you put me in an NHS, Private or Military hospital as long as you cure me. "
31,2020-03-30 18:05:38+00:00,Symptoms of Corona Virus #Covid_19 #coronavirus #TheLockdown
32,2020-03-30 17:42:56+00:00,Dominic Raab licks his finger during coronavirus press conference despite hygiene warnings 
33,2020-03-30 17:34:37+00:00,Remind me again why coronavirus is spreading through the government quicker than you can say ‘Herd Immunity’? 
34,2020-03-30 17:25:48+00:00,Latest Covid19 virus update: UK Coronavirus Growth Rate for Monday 30th March is 1.076 #Coronavirus #COVID_19UK
35,2020-03-30 17:24:47+00:00,"Coronavirus: Turn off hand dryers to prevent spread of COVID-19, doctor warns "
36,2020-03-30 17:21:10+00:00,RIP HERO JOHN: Hero PCSO who saved the lives of four teens dies of #coronavirus. John Hood developed symptoms of #COVID19 more than a week before his admission to Ipswich Hospital where he died. #CoronaUpdate #CoronaCrisisuk
37,2020-03-30 17:18:02+00:00,High school seniors in Washington state are collectively mourning the loss of what this spring could have been. And those who are about to be the first in the families to attend college say they're missing their school's resources. https://www.seattletimes.com/education-lab/high-school-seniors-cope-with-the-loss-and-confusion-over-next-steps-during-coronavirus/ #waedu #coronavirus
38,2020-03-30 17:00:39+00:00,UK govt: “Follow our coronavirus advice to the letter.” Also UK govt: “Mmm. Yummy fingers.” 
39,2020-03-30 20:56:37+00:00,My son's invented a new idea for @FortniteGame - the corona virus update - you have to stay 2m away from players or you take damage. Harvesting tools are longer to accommodate it. Dm if u wanna credit him with vbucks for this ace idea #Fortnite
40,2020-03-30 20:35:50+00:00,"Just need to tell you all that @taylorswift13 DM’d three of my mutuals who are struggling money wise because of coronavirus over the past week and sent them $3000 each. I’m so thankful to Taylor for helping them, and for boosting everyone’s spirits in the process 🥰"
41,2020-03-30 20:04:44+00:00,Well I guess all the British and EU probably undercover in Jamaica 😂🤣🤣 they don’t want any of us there right now 👊🏾👊🏾 They blame the UK for bringing it over! #licclemore #indojamaican
42,2020-03-30 20:02:37+00:00,"Really moving to speak to ⁦@JoMidge⁩ about losing her mum to #coronavirus . Watch her tribute to the “NHS heroes” who read messages to her mum as she lay dying, and her grief at having to wear a mask and being unable to hold her at the very end: "
43,2020-03-30 19:53:45+00:00,⚠️ #SCAMALERT: We are aware cyber criminals and fraudsters are attempting to exploit opportunities around #coronavirus. ❌ We will never text or email asking for your personal information or bank details. 
44,2020-03-30 19:42:00+00:00,Brighton Pride still going ahead despite coronavirus lockdown https://www.mirror.co.uk/news/uk-news/brighton-pride-still-going-ahead-21781549
45,2020-03-30 18:42:50+00:00,So the ventilators are coming from china Will bhakts boycott it ??? And corona virus vaccine is developing by cipla which owns by a muslim Will bhakts boycott the vaccine ??? Bolo bhakto boycott karoge ya burnol bheju I know all bhakts are shameless so im sending burnol
46,2020-03-30 18:36:12+00:00,ok so #coronavirus *was* spread to Britain by Meghan Markle shopping in Chinatown for her favourite avocado with Greta Thunberg in other news I’ve just been on the Daily Mail website
47,2020-03-30 17:59:49+00:00,Coronavirus: One in four NHS doctors 'sick or in isolation' 
48,2020-03-30 17:46:22+00:00,"Simple, effective and could save your life. #coronavirus pic.twitter.com/8D7lR2nS85"
49,2020-03-30 17:34:42+00:00,"Here’a a super free online picture book for children about corona virus, written by a nurse https://nursedottybooks.files.wordpress.com/2020/03/dave-the-dog-coronavirus-1-1.pdf"
50,2020-03-30 17:24:14+00:00,"Latest Covid19 virus update: We'll now publish the Growth Rate of Case for the UK. If the number is greater than 1.0 its growing, less than 1 its decreasing... #Coronavirus #COVID_19UK"
51,2020-03-30 17:02:28+00:00,'A letter from Boris?' 😳 My latest cartoon for tomorrow's @Telegraph #coronavirus #covid19 #thelockdown Subscribe to my weekly newsletter to receive my unseen cartoons: https://www.telegraph.co.uk/premium/matt/?WT.mc_id=tmgoff_tw_author-account-matt-cartoon_newsletter-signup-Matt-Cartoon&amp;utm_source=tmgoff&amp;utm_medium=tmgoff_tw&amp;utm_content=author-account-matt-cartoon_newsletter-signup&amp;utm_campaign=tmgoff_tw_author-account-matt-cartoon_newsletter-signup-Matt-Cartoon
52,2020-03-30 16:56:05+00:00,25% of NHS doctors in UK off sick or in isolation due to #COVID19
53,2020-03-30 16:53:10+00:00,So. My very last file for @TelegraphWorld is a short news piece about Viktor Orban's emergency #coronavirus powers which leave him able to 'rule by decree' and should worry absolutely everyone. Here's why. 1/Thread 
54,2020-03-30 16:52:22+00:00,"CBS News is under fire for using footage of the “worst hit” hospital in Bergamo, Italy to illustrate a report about the coronavirus outbreak in New York. "
55,2020-03-30 16:51:00+00:00,"⚠️ Coronavirus: anyone can get it, anyone can spread it. ⚠️ 🏡 Stay home. 🏥 Protect the NHS. 💙 Save lives. #StayHomeSaveLives | #coronavirus "
56,2020-03-30 16:29:55+00:00,"Well, I’m sure these graphs on coronavirus that the CSA is showing us are really helpful. If we could actually see them."
57,2020-03-30 20:30:07+00:00,"Communities, Colour and the Corona Virus https://ycoghill.wordpress.com/2020/03/30/communities-colour-and-the-corona-virus/"
58,2020-03-30 19:31:18+00:00,"Fucking hope Geoff gets corona virus, prick. #corrie"
59,2020-03-30 17:45:37+00:00,#norfolk #business - ‘I can only hope we can carry on where we left off’: Castle Quarter’s boss on the coronaviru...
60,2020-03-30 17:08:47+00:00,?s @DominicRaab should've been asked at #coronavirus briefing: 1) why didn't you instruct Brits to come home a month ago when flights &amp; airports were operating instead of having to pay out £75m now? 2) why isn't the FCO working with @CAA 3) you're aware most fleets are grounded
61,2020-03-30 16:45:47+00:00,Diageo: Close Diageo Leven while we are on lockdown for Coronavirus - Sign the Petition! http://chng.it/5KbJr4dv via @UKChange
62,2020-03-30 16:34:37+00:00,"@DominicRaab licks his own finger and the brilliant sign language interpreter loses his sh*t. This is a genuine screengrab, no edit. @BBCNews #CoronaUpdate #coronavirus #DominicRaab #DONTtouchYOURface #StayHome #news"
63,2020-03-30 16:32:28+00:00,UK government announces new plan to fly home tens of thousands of Britons stranded by coronavirus pandemic 
64,2020-03-30 16:31:19+00:00,want some positive news? - Johnson & Johnson announces potential vaccine that could be available early next year (to be sold on a not-for-profit basis) - Abbott Laboratories launches 5-minute test that will run on portable machine the size of a toaster
65,2020-03-30 16:31:15+00:00,UPDATE: The UK Government and the airline industry to fly home stranded British travellers. ➡️ Read our guidance: http://gov.uk/guidance/travel-advice-novel-coronavirus ➡️ Follow @FCOTravel for country updates #coronavirus | #COVID19
66,2020-03-30 16:29:25+00:00,"Today I’m urging the Government to support those with no recourse to public funds and those on low incomes. Measures already in place for employers, workers, and the self-employed will help many through the #COVID19 crisis, but more help is urgently needed. My letter to the PM:"
67,2020-03-30 16:27:48+00:00,When even Corona Virus is not interested in you 
68,2020-03-30 16:23:44+00:00,Coronavirus: UK to spend £75m on charter flights to bring stranded Britons home 
69,2020-03-30 16:20:17+00:00,Hunkering down with me mum & dad! #coronavirus 
70,2020-03-30 16:19:53+00:00,#DominicRaab and he licked his finger in his press conference @BBCNews #coronavirus
71,2020-03-30 16:19:34+00:00,Dim Dom actually licked his finger to turn his #coronavirus briefing paper! 😂😂😂😂😂😂😂😂😂😂🤣🤣🤣🤣🤣🤣🤣🤣🤣 
72,2020-03-30 16:11:52+00:00,We’ve seen a number of misleading posts doing the rounds on social media about an alcohol ban enacted by the NHS. These are completely false. Please make sure you’re getting your #coronavirus information from reputable sources — http://nhs.uk/coronavirus or http://gov.uk/coronavirus. pic.twitter.com/EGr9m416Vg
73,2020-03-30 16:07:21+00:00,In October 2019 Bill Gates hosted a conference discussing a severe pandemic with catastrophic consequences called event 201. Gates puts Nostradamos to shame because one month later we got the Corona virus.
74,2020-03-30 16:04:29+00:00,Wanna have my mouth spat in but corona virus 😔
75,2020-03-30 16:16:06+00:00,WATCH LIVE: Foreign Secretary @DominicRaab hosts the #coronavirus press conference (30 March 2020) 
76,2020-03-30 16:12:37+00:00,If you want to understand the science behind COVID-19 and the reasons for actions like social distancing then leading UK scientists have developed a reliable online resource to help
77,2020-03-30 16:03:53+00:00,"Some police forces are, in my view, making three mistakes in how they enforce the Health Protection (Coronavirus, Restrictions) (England) Regulations 2020, which provide that ""no person may leave the place where they are living without reasonable excuse."""
78,2020-03-30 15:58:00+00:00,"R Kelly wants to be released from prison because he's worried about corona virus? After spending decades spreading STD's and noncing up little girls??? Nah hun, you are staying in there and rotting. "
79,2020-03-30 15:53:11+00:00,Ration delivered to many more families throughout Batala and Mehta area during the Curfew of corona virus. As you can see these bajurg are living in poor conditions. Khalsa Seva will continue to support them with monthly ration.🙏🏻🙏🏻🙏🏻 
80,2020-03-30 15:50:25+00:00,Little acts of kindness define humanity. #COVID19
81,2020-03-30 15:48:22+00:00,"Breaking: The UK coronavirus death toll has reached 1,408 after 180 people died in a single day. #TheLockdown"
82,2020-03-30 15:47:53+00:00,"#FakeNews I’m afraid, see https://www.europarl.europa.eu/news/en/headlines/priorities/eu-response-to-coronavirus #FactsMatter"
83,2020-03-30 15:42:09+00:00,"UPDATE on coronavirus (#COVID19) testing in the UK: As of 9am 30 March, a total of 134,946 have been tested: 112,805 negative. 22,141 positive. As of 5pm on 29 March, of those hospitalised in the UK, 1,408 have sadly died."
84,2020-03-30 15:41:05+00:00,Astrophysicist gets magnets stuck up nose while inventing coronavirus device 
85,2020-03-30 15:27:08+00:00,A man has been tasered by police after he deliberately coughed at them and claimed he was infected with coronavirus (via @LBCNews) #TheLockdown
86,2020-03-30 15:17:14+00:00,UK ministers accused of overstating scale of coronavirus testing https://www.theguardian.com/world/2020/mar/30/uk-ministers-accused-of-overstating-scale-of-coronavirus-testing?CMP=share_btn_tw And it seems that hospitals are quite sure they're understating the number of deaths. Propaganda is not a good idea if you want to keep people's confidence
87,2020-03-30 15:14:01+00:00,Mexican president ignores coronavirus restrictions to visit El Chapo's mother 
88,2020-03-30 15:09:34+00:00,Take a look inside our new NHS Nightingale Hospital at the @ExCeLLondon — the first of three new hospitals in England being built to help the NHS tackle #coronavirus. We think it's shaping up pretty nicely. 🤩 https://www.bbc.co.uk/news/in-pictures-52092253
89,2020-03-30 15:09:14+00:00,"📽️As part of the Armed Forces #COVIDSupportForce, helicopter hubs have been set up to support medical transport across the UK, if requested. 👉Find out more about the Aviation Task Force: http://ow.ly/uSTf50yZJaV #InThisTogether #Coronavirus "
90,2020-03-30 15:05:33+00:00,Moise Kean has been purchasing respirator machines and face masks and has been supplying them to hospitals in Italy to help out his nation during the coronavirus pandemic. What a guy! 💙 #efc
91,2020-03-30 15:04:56+00:00,❓COULD A JOB IN THE SOCIAL CARE SECTOR BE FOR YOU? Today we've launched our Social Care Academy aiming to match people looking for work into a job in the social care sector. We have opportunities for: ✅Domestics ✅Care Workers ✅Drivers ✅Cooks and everything in-between.
92,2020-03-30 15:03:26+00:00,"Thank you to the 20,000 former staff coming back to the NHS. And thank you to the 750,000 people who have volunteered to help vulnerable people through this crisis. We will get through it together. #Coronavirus #StayHomeSaveLives"
93,2020-03-30 14:56:00+00:00,"Across the country, people are volunteering to help their communities through the #coronavirus outbreak. The Liberal Democrats are dedicating our resources to supporting that community effort. ⬇️ https://www.libdems.org.uk/coronavirus"
94,2020-03-30 14:31:42+00:00,"Australian astrophysicist, who hoped to create a device to stop people catching coronavirus, ends up in hospital - after getting magnets stuck up his nose "
95,2020-03-30 15:13:58+00:00,"The number of people who have tragically died with the coronavirus in the UK has reached 1,408. We need to buy as many ventilators as we can from wherever we can get them. The lives of our family’s depend on it. Who cares if it says “made in China” you narrow minded twerp "
96,2020-03-30 14:22:01+00:00,#Coronavirus: Government minister claims the UK is 'right at the top of the league table' for testing 
97,2020-03-30 14:18:25+00:00,There are early signs that coronavirus outbreaks around the world are slowing down 
98,2020-03-30 14:16:01+00:00,"Another 159 people have died in England after testing positive for #coronavirus, taking the total to 1,284 "
99,2020-03-30 14:11:58+00:00,"1,415 people have died in Britain and the Telegraph is still treating Coronavirus as if it was Paul Pogba. "
100,2020-03-30 14:10:38+00:00,Coronavirus: Prince Charles ends self-isolation after contracting COVID-19 
101,2020-03-30 14:08:46+00:00,"Check out the evidence and the facts about the virus, the disease, the epidemic, and its control at Coronavirus: the science explained. #COVID19"
102,2020-03-30 14:04:32+00:00,The coronavirus letter you’ve just been sent by Johnson is a lie. https://www.youtube.com/watch?v=aKTwBbge4lQ&amp;feature=youtu.be #COVID19UK #CoronaVirusUK
103,2020-03-30 14:00:37+00:00,Coronavirus: Another 159 people die after testing positive in England http://news.sky.com/story/coronavirus-another-159-people-die-after-testing-positive-in-england-11965742
104,2020-03-30 13:48:56+00:00,“Boris Johnson has batted away renewed pressure to extend the Brexit transition period because of the coronavirus crisis.” 
105,2020-03-30 13:38:26+00:00,"Manufacturers, both large and small, across the country are retooling, innovating, collaborating and donating vital resources to support the national effort against coronavirus. These are unprecedented times. This is British manufacturing at its finest. #UKmfg #GBmfg🇬🇧"
106,2020-03-30 13:38:21+00:00,A video clip from late February shows Nancy Pelosi encouraging large groups of people to congregate in San Francisco’s Chinatown before she would later go on to blame President Trump’s early “denial” for the spread of coronavirus. 
107,2020-03-30 13:34:34+00:00,No.10 must continue to resist EU pressure to extend the Transition Period. It is nonsense that discussions cannot take place remotely. The measure of peoples’ success will be their ability to persevere. The same applies to our govt.
108,2020-03-30 13:28:51+00:00,ken aged 60: “don’t like em coming over ere to are country🇬🇧 wearing them things on their faces!! Can’t see who they are 😡” The news: “corona virus deadly to elderly victims” Ken aged 60: 
109,2020-03-30 13:28:25+00:00,"Absolutely tragic detail in this story: Welsh healthcare workers are writing letters in case they die, keeping a note of how they were told to work without adequate PPE. They wanted a record that could be used in litigation to compensate their families."
110,2020-03-30 13:24:24+00:00,#Coronavirus: Juventus won't accept title if Serie A cancelled! Juventus president Andrea Agnelli appeared to agree with the sentiment among Old Lady supporters that the title should be left vacant as it stands. #BigClubMentality
111,2020-03-30 13:16:34+00:00,"Have you seen a business open, when you think it should be closed? Let us know so we can contact them. Call us via 0808 223 1133 #coronavirus @WirralCouncil"
112,2020-03-30 13:15:33+00:00,Twitter is now removing tweets from world leaders that challenge the coronavirus shutdown. Bolsonaro becomes the first world leader in history to be directly censored by social media. 
113,2020-03-30 13:03:28+00:00,European governments reject Chinese-made equipment designed to combat coronavirus outbreak 
114,2020-03-30 12:55:41+00:00,Merkel shines in handling of Germany’s coronavirus crisis. I wish the same could be said of #torybrexit Britain where the cabinet are at sixes sevens and we are rudderless. #coronavirus update. 
115,2020-03-30 14:05:56+00:00,"DBS is committed to ensuring that our services continue to run as normal, and to ensuring that we are able to support the recruitment those needed during the #coronavirus outbreak. We have created a central page for all DBS-related #COVID19 updates."
116,2020-03-30 13:36:24+00:00,The world stands still for coronavirus #GraphicDesign #Corvid19 #coronavirus 
117,2020-03-30 12:58:56+00:00,"We are continuing to provide free lunches for all our officers and staff during the current #coronavirus crisis - here are today’s 1,200! "
118,2020-03-30 12:54:15+00:00,Coronavirus Britain has a Very Sick Immune System. It's called the Media @peterjukes Watch full film: https://youtu.be/PosOqz9kIEY
119,2020-03-30 12:47:00+00:00,"UPDATE: #Coronavirus Europe (11 countries) ➡️1.88% to 11.43% of population infected with #COVID19 up to 28th March ➡️Interventions have already impacted control of the epidemic ➡️Interventions have saved between 21,000 &amp; 120,000 lives 🔰Report https://imperial.ac.uk/mrc-global-infectious-disease-analysis/COVID-19/"
120,2020-03-30 12:37:42+00:00,The Mercedes F1 team has helped develop a breathing aid to keep #coronavirus patients out of intensive care 
121,2020-03-30 12:29:41+00:00,"Read our daily update on how we're continuing to engage with the food industry to ensure the nation is fed, and that key workers and vulnerable people are supported in getting the supplies they need. #coronavirus "
122,2020-03-30 12:15:53+00:00,"BREAKING: The 2020 Tokyo Olympic Games have been rescheduled to start on July 23, 2021 after being postponed due to coronavirus, the International Olympic Committee (IOC) has confirmed."
123,2020-03-30 12:15:52+00:00,"My concerns about the destruction of much of England's public health system and regional infrastructure explained in the Guardian. ""England's ravaged public health system just can't cope with the #coronavirus"" #COVID19"
