H1,Date,Text
76,2020-02-11 00:00:24+00:00,Y?all I really might have to cancel my vacation 3 days before i leave because of the fucking corona virus
75,2020-02-11 00:00:26+00:00,Looks more like widespread panic than the flu or corona virus?
74,2020-02-11 00:03:36+00:00,"A Prayer Of Healing For The #Coronavirus A new virus has emerged. With it comes grief, suffering, and fear. Heal the sick, we pray. Comfort the afflicted, we pray. Full prayer: "
73,2020-02-11 00:04:05+00:00,Not only do we have these cuts in @realDonaldTrump budget $920 billion cut to Medicaid; 26% cut to @EPA; Eliminates HUD affordable housing $181B cut to food stamps We also have 50% cut to @WHO 16% cut to @CDCgov All during the #coronavirus 
72,2020-02-11 00:06:16+00:00,Chinese Citizen Journalist Goes Missing After Exposing Coronavirus Cover-Up http://bit.ly/37ewXiM via @BreitbartNews
71,2020-02-11 00:16:19+00:00,"To clarify, we don?t have any patients with coronavirus in our facilities at this time. The rescued Americans are staying at Camp Ashland. If one were to develop symptoms, then we would provide care."
70,2020-02-11 00:28:19+00:00,"It has been reported that free porn has been offered to quarantined coronavirus cruise passengers. Male cruise members were quoted by saying, ?We wish we wouldn?t have squandered away the courtesy lotions so early in our trip.? #coronavirus"
69,2020-02-11 00:38:53+00:00,"Men represent the majority of coronavirus cases so far, according to a new study. Researchers hav... https://news.yahoo.com/men-represent-majority-coronavirus-cases-230600596.html?soc_src=community&amp;soc_trk=tw via @Yahoo"
68,2020-02-11 00:44:23+00:00,"Honestly I think HFE didn?t expect for DC to do as well as they did for the ROD era, and they contractually obligated her to be there. Hoping the promotion would help. Now she?s stuck. The corona virus has halted production, and at this point of the whole thing may be a waste ???????"
67,2020-02-11 00:50:02+00:00,"10 families working with Eugene #adoption agency Holt International have cancelled their flights to China due to the #Coronavirus. Another family, this one in Portland have been forced to put their plans to meet their child on pause. Learn more tonight at 6 #LiveOnKVAL ? at Holt International Children's Services"
66,2020-02-11 00:59:43+00:00,"Coronavirus news and live updates: Virus kills 97 people in China in one day, while cruise ship cases almost double - CNN "
65,2020-02-11 01:04:07+00:00,Death toll from coronavirus is 10 TIMES higher than average in Hubei https://mol.im/a/7987001 via @MailOnline
64,2020-02-11 01:19:09+00:00,"Carl Goldman and Jeri Seratti-Goldman are quarantined onboard the Diamond Princess cruise ship in Japan. #Coronavirus has swept through the ship infecting 135 passengers, 24 of whom are Americans. The Goldmans say they don?t have the virus and will return to the US in 7 days. "
63,2020-02-11 01:19:48+00:00,#coronavirus in my city #lecce #italy all patients are #chinese #Viral
62,2020-02-11 01:25:07+00:00,Its over folks #coronavirus New numbers tell the story 
61,2020-02-11 01:29:34+00:00,This coronavirus talk is distracting me from watching the new Lion King.
60,2020-02-11 01:36:23+00:00,BREAKING: Details are limited but it?s believed San Diego County has reported its first confirmed case of the Coronavirus. We?re working to learn more details about the patient being treated at an area hospital. 
59,2020-02-11 01:37:08+00:00,???? ?? ???? First Coronavirus Case Confirmed in San Diego County 
58,2020-02-11 01:37:38+00:00,#coronavirus now confirmed in San Diego. 
57,2020-02-11 13:00:08+00:00,HAPPENING TODAY: Quarantine will be lifted for 195 people held at March Air Reserve Base for 14 days following #Coronavirus evacuation. Buses will take passengers to either @flyLAXairport or @flyONT while two dozen wait for flights tomorrow. | WATCH @ABC7 5:30am!
56,2020-02-11 15:30:36+00:00,"The most interesting part of this interview is that the woman tested positive despite having none of the symptoms typically attributed to the #coronavirus and that are being used to screen people, meaning she could have inadvertently spread the disease to others without knowing. "
55,2020-02-11 17:57:32+00:00,JUST IN: Coronavirus evacuees throw up their masks as 14-day quarantine is lifted at March Air Reserve Base. #abc7eyewitness @ABC7
54,2020-02-12 01:15:37+00:00,okay but like the coronavirus ??????
53,2020-02-12 01:24:34+00:00,I got accepted to my Internship where I?ll be able to intern for 10 wks (expenses covered!) in Taiwan!! I?m so excited because I?ve never been despite being half ????. But they don?t know if they can send me this year because of Coronavirus... Hoping the sitch improves ??????
52,2020-02-12 03:08:01+00:00,Going back to the children?s hospital for more tests. Hopefully it?s just a cough. #coronavirus 
51,2020-02-12 21:24:45+00:00,"Meet the team smashing down doors to rescue #Wuhan's abandoned pets Some 2,000 household pets were left starving to death by residents trapped away from home by #Coronavirus lockdown. "
50,2020-02-12 22:52:33+00:00,"LMFAO MY PUBLIC HEALTH TEACHER GOES ?Class? Why didn?t we name the current Coronavirus Wuhan Flu?? Me immediately: Because it?s racist Him: No, it?s bc.... *add long lecture* Me responding in front of the class: No, it?s racist. Class: *silent looking at asian girl* ???????"
49,2020-02-13 06:56:21+00:00,"Dont let strangers hit your nicotine devices at LED, and dont hit strangers nicotine devices at LED, dont share water w strangers, be safe and sanitary ya nasties if i hear any of you mf?s saying you got coronavirus its the electric chair w you"
48,2020-02-13 21:48:23+00:00,"Hate and bigotry have no place in the @CountyofLA. I stand in solidarity with our friends, neighbors, and family members of Asian descent who are being scapegoated as confirmed cases of the coronavirus rise internationally. The @CDCgov has confirmed only one case in #LACounty. ? at County of Los Angeles, Hall of Administration"
47,2020-02-14 19:21:22+00:00,"MAJOR: Reps from Amazon, Google, Facebook and other tech co?s met with @WHO yesterday for a day of meetings at Facebook to discuss what to do about misinformation and the Coronavirus https://www.cnbc.com/2020/02/14/facebook-google-amazon-met-with-who-to-talk-coronavirus-misinformation.html With @sal19"
46,2020-02-15 01:26:47+00:00,FALSE RUMOR ALERT! ?? #Coronavirus fears continue to hurt Asian businesses. The property owner of 99 Ranch Market/ Great Wall shopping center in #Kent says false rumors on social media have tanked sales for all stores in the plaza. Awful to see. Support these mom &amp; pop shops! ? at Great Wall Shopping Mall
45,2020-02-15 05:38:11+00:00,Jusko. So baka 8 games a day and 2 separate venue daw! Because of the corona virus thingie. Hahaha. Mamadaliin ang UAAP!
44,2020-02-15 06:39:59+00:00,Have you even MET your PARENTS?! If your mother is Drunk Grandma of Death & dad is Bill ?the Rape King? Clinton? This is a conversation you should avoid like the Coronavirus. Maybe y?all stick to 101 Tips on how to raise Campaign Funds from Foreign Countries. More your speed ??
43,2020-02-15 07:53:03+00:00,"Did u know the dead toll from #Coronavirus after 1month now is equal to the number of people who were killed in JUST 3DAYS by the regime of Iran in Nov 2019? Do u know approximately 7,000ppl have been arrested &amp; r being tortured in Iran's prisons now? #IranProtests @UNHumanRights"
42,2020-02-15 21:21:55+00:00,"@Recode @voxdotcom interviewed me to talk about coronavirus, but omitted all the science and epidemiology parts and just covered me quoting that I wear a mask and that wealthy people are more exposed to high-risk international contact points (I also mentioned Uber drivers etc). "
41,2020-02-15 22:15:08+00:00,based and coronapilled: healthy young men self-infecting themselves with coronavirus just to prove they?re chads
40,2020-02-16 09:46:16+00:00,"?China's Health Commission says people could get coronavirus more than once ? recovering does not necessarily make you immune.? In some people, antibodies don?t persist long after infection. Those reinfected likely will have more severe illness ? #COVID19 https://www.businessinsider.com/wuhan-coronavirus-risk-of-reinfection-2020-2"
39,2020-02-16 19:21:19+00:00,"?38% were from hospitals, 61% died at home,? interview with crematorium worker in Wuhan confirming claims home deaths from coronavirus not counted in gov totals. ? #COVID19"
38,2020-02-16 21:16:04+00:00,"Kind of enjoying seeing all of the germaphobes rallying right now against handshakes ?? &amp; pretending that #coronavirus is the reason. Of course, it just makes me want to hug them more... ??"
37,2020-02-17 11:06:39+00:00,"Anytime I see the media panic about the coronavirus being in the U.S. (15 people!) all I can think about is how AIDS wiped 20,849 people, mostly gay men, in 6 years before our president ever publicly addressed it as a problem. We were literally disposable non-humans to them."
36,2020-02-17 21:45:47+00:00,"Reminder that Apple said at earnings that they gave a wider revenue range to account for coronavirus, but @troywolv pointed out at the time that the $AAPL revenue range was same width as previous quarters."
19,2020-02-19 16:13:27+00:00,"Does anyone else feel like the stock market is underrating the impact of Coronavirus? I?m not an expert but the amount of commerce from/to China that will be disrupted, conferences cancelled, etc seems larger than the impact on the market (no short positions on my end though)"
35,2020-02-19 17:12:02+00:00,Hating/ jealousy a worst a diseases then the coronavirus
18,2020-02-19 18:29:29+00:00,"Grateful for an entire row to myself so I can lay down and sleep all the way to Tokyo, but feel sorry for all those affected by coronavirus. ???? ? at San Francisco International Airport (SFO)"
17,2020-02-19 20:26:58+00:00,JUST IN: The CDC confirms more cruise ship passengers at Travis Air Force Base have positive coronavirus test results from Japan. They are being isolated right now and will be taken to local hospitals to get re-tested. They include a Bay Area man who told me he was just informed 
34,2020-02-20 01:24:09+00:00,JUST IN: Five Patients Testing Positive for Novel Coronavirus to be Transferred to Sacred Heart 
33,2020-02-20 01:29:48+00:00,"EXCLUSIVE: This Redwood City man was told this morning the coronavirus test he took in Japan has come back positive. But hours later, he?s still at Travis Air Force Base waiting to get transported to the hospital. He calls the way the CDC is handling the situation ?a joke?. "
16,2020-02-20 02:18:32+00:00,"I hope you?ll tune in tonight for my exclusive interview with President Donald Trump. We talked about Arizona?s changing demographics, the coronavirus, and what keeps him awake at night. #trumpRally #Fox10phoenix @fox10PhotoChief"
32,2020-02-20 06:54:39+00:00,"One week after her return home from a federal quarantine, Esther Tebeka says her successful acupuncture business has been impacted by fears of the Coronavirus. She?s not the only local Chinese business owner who says sales are down since the outbreak. Story at 11. "
31,2020-02-20 13:46:56+00:00,Sacred Heart Medical Center is prepared for the #coronavirus patients according to Spokane Regional Health. It?s one of 10 hospitals in the country with airborne infection isolation rooms. Details &gt;&gt; @kxly4news : https://bit.ly/3bTGcbJ ? at Sacred Heart Medical Center
15,2020-02-20 14:11:33+00:00,Two Diamond Princess cruise passengers die from coronavirus in Japan 
14,2020-02-20 16:39:05+00:00,Is China being honest about the Coronavirus? Will President @realDonaldTrump help Americans struggling w/ student loan debt? What does the he worry about at night? Is AZ becoming a blue state? My exclusive interview with the POTUS backstage at his AZ rally
30,2020-02-21 00:25:16+00:00,"11 of the 13 passengers taken off that cruise ship in Japan and brought to Omaha, have #coronavirus. Statement from @NebraskaMed:"
13,2020-02-21 02:50:09+00:00,"Am I concerned about coronavirus spreading in Omaha? No. I also wasn't concerned about ebola patients being treated in Omaha, and in the end Nebraska Medicine became renowned for its practices when it came to infectious diseases. "
29,2020-02-21 10:56:55+00:00,3 reasons why Latinos don?t have the coronavirus 
12,2020-02-21 17:37:57+00:00,"Dined at one of my favorite Chinese restaurants the other night, and it was a ghost town. The owner said they have been struggling due to misguided/xenophobic coronavirus concerns. So if you can, help these hard working business owners and eat a lot of Chinese food this weekend!"
28,2020-02-21 18:54:12+00:00,BREAKING: Sacramento County Public Health reports the first confirmed traveled-released Coronavirus case in a county resident @FOX40 #coronavirus #Sacramento
27,2020-02-21 20:23:40+00:00,"False #coronavirus fears and rumors are still decimating business in @cityofkent. At 1pm, Mayor @dana_ralph and the @KCPubHealth will be there to show their support for impacted shops and restaurants, and to dispel misinformation! @KIRO7Seattle ? at Great Wall Shopping Mall"
11,2020-02-21 22:01:05+00:00,Clearlake water would kill the Coronavirus
26,2020-02-22 00:11:08+00:00,"Over a dozen coronavirus-stricken Americans were flown back to the U.S. against the advice of the CDC, according to a Thursday report. "
25,2020-02-22 11:38:44+00:00,They say it?s just flu. Now look at chart. #corona #coronavirus #CoronavirusOutbreak
24,2020-02-22 18:33:21+00:00,Coronavirus in Sacramento!??? Omg who wants to go see her??????
10,2020-02-22 20:24:20+00:00,"I?ve been asking the same thing. I think Trump?s biggest challenger in 2020 could be the coronavirus because it happened on his watch and he represents strong borders and less globalism, except for fact that he is the only candidate who is for strong borders and less globalism. "
23,2020-02-23 00:48:56+00:00,Bernie is the coronavirus of the Democratic Party: a plague with a long latency period now breaking out into an unstoppable epidemic.
9,2020-02-23 00:56:17+00:00,Press conference in Costa Mesa addresses citizen concerns and requests transparency from the federal and state governments who are considering Fairview Developmental Center as a site to transfer Californians infected with the corona virus for quarantine. 
8,2020-02-23 16:57:29+00:00,"I feel kind of silly admitting this, but I also deal in risk assessment on a daily basis and speak in probabilities. So, my husband and I have decided it?s prudent to do some low-key ?prepping? just in case ?? hits the fan here in the US related to the coronavirus. ?????????"
7,2020-02-23 20:21:40+00:00,you guys see the oscars? Coronavirus won Best Parasite. i?ll be here all week. ????
6,2020-02-24 00:44:44+00:00,"Is there a chance the trade war with China made the USA a little more Antifragile to supply disruptions from CoronaVirus? Ag and food stores in USA at all time highs, same with most commodities, oil independent. Thoughts? @Jaffer22915438 @normonics @nntaleb @yaneerbaryam"
5,2020-02-24 01:21:57+00:00,900 people have coronavirus and everybody wants to wear a surgical mask...30 million people have aids and still nobody wants to wear a condom ?? #coronavirus
4,2020-02-24 05:48:27+00:00,Wait. Italy it is now. #corona #coronavirus #coronavirusoutbreak
3,2020-02-24 07:04:27+00:00,"The regime delayed releasing #CoronaVirus outbreak news in #Iran like what they did in Ukrainian plane tragedy.Their next action in coming days=&gt;while ppl r busy with following news &amp; caring abt their own health,authorities will have executed 3protesters who were arrested in Nov."
22,2020-02-24 09:41:18+00:00,"????????????? The city is shut down. She did not commit any crime! She was just walking down the street without a pass. Police drag her away from her son, bring her to custody! This is how communist China control people, not coronavirus! "
21,2020-02-24 16:00:05+00:00,1/3 I have this fig pinned on my board. Our awesome TA of epi course at grad school told us to know it by heart. Media reporting of #COVID19 #coronavirus could benefit knowing the difference among these indices of mortality. 1/3 
2,2020-02-24 17:40:36+00:00,"Big day on the Dow. It's down 1000 points at this moment to 27,990. It WAS 26,650 on 1/20/18 I did the math, & you're not gonna like it Thats 1340 pts in 25 months Corona-virus. It's the bubble popping. Get out!"
1,2020-02-24 19:51:55+00:00,?@SpeakerPelosi? holds a special fortune cookie while touring #SanFrancisco #Chinatown amid #Coronavirus concerns. Fortune says ?United We Stand.? ? at Golden Gate Fortune Cookie Factory ??????
0,2020-02-24 19:55:22+00:00,Long Lines For Face Masks In City At Center Of South Korea?s Coronavirus Crisis 
20,2020-02-24 22:49:43+00:00,"He would be singing a different tune if it were he or his family that contracted the Coronavirus, we need to be in this together as a state, nation and global community. Proud that @unmc is leading the way in treatment, research and care of these Americans. #Coronavirius"
336,2020-02-25 00:01:57+00:00,?????? Here are 5 reasons you have Donald Trump to thank if you get the #coronavirus ?? Raw Story https://www.rawstory.com/2020/02/here-are-5-reasons-you-have-donald-trump-to-thank-if-you-get-the-coronavirus/ ???? #ddoom_coronaUSA #ddoom_corona #ddoom_trump #ddoom_rawstory ?? #Covid19 #CoVID #Covid19trump
335,2020-02-25 00:02:02+00:00,I?m not going to say these people deserve to get the coronavirus. But I?m not NOT going to say it either?
334,2020-02-25 00:02:18+00:00,Small businesses are always on the verge of not ?making it?! Good for @SpeakerPelosi for assuring Chinatown businesses will thrive over coronavirus concerns. Every bit of help makes a tremendous difference for local retailers and restaurants. 
333,2020-02-25 00:16:45+00:00,Horrible spread of Coronavirus in the world and especially in CA near LA.
332,2020-02-25 00:17:25+00:00,Experts now call the corona virus a ?pandemic?. Apparently the shift in terminology comes as the virus gets to know its true self and understand what it is capable of: deep happiness and the collapse of humanity. #COVID19
331,2020-02-25 00:18:06+00:00,No matter how sick you may be from the Coronavirus all people should get the same care not just those who can afford or who have the best insurance CHINA needs to pay if Americans can't get a vaccine ahead of time Americans will be in trouble
330,2020-02-25 00:21:33+00:00,Wonder if the dismissive segment of the media will change their #coronavirus narrative now that it?s causing panic in Europe. 
329,2020-02-25 00:22:41+00:00,If American's start getting the coronavirus Trumpers will say it's Gods revenge for people not bowing down to Trump who in their mind is Jesus's reincarnation.
328,2020-02-25 00:28:29+00:00,"if my program gets cancelled because of the corona virus, i swear to christ"
327,2020-02-25 00:34:23+00:00,yo what there?s literally already corona virus questions in trivia crack
326,2020-02-25 00:46:55+00:00,"Quick signature: Say ""NO!"" to a monopoly for a coronavirus vaccine! "
325,2020-02-25 00:50:20+00:00,"Given how unseriously this administration is taking the coronavirus threat, shown by cutting CDC funding for example, the threat to the US is potentially huge. It is going to be bad. "
324,2020-02-25 00:53:50+00:00,nobody: deanna: does the corona virus make you skinny
323,2020-02-25 00:54:26+00:00,Coronavirus: US confirms total of 53 cases as White House mulls asking Congress for emergency funds 
322,2020-02-25 00:54:51+00:00,"Disneyland Shanghai doesn?t break down. And, the lines are short because of coronavirus."
321,2020-02-25 00:55:50+00:00,I am ?the coronavirus is impacting my personal investment strategy? years old. Honestly the 12 year old version of me would be kicking my ass and throwing Nintendo 64 controllers at me.
320,2020-02-25 01:02:16+00:00,"If I encounter the Coronavirus, I will simply defeat it with my immune system."
319,2020-02-25 01:02:20+00:00,"I wish he did have Corona virus, as in it entered his body."
318,2020-02-25 01:03:57+00:00,"You?ve seen caravans of illegal immigrants. You?ve heard of the novel coronavirus. Now, get ready for caravans of illegal immigrants infected with contagious coronavirus! #MAGA"
317,2020-02-25 01:04:37+00:00,The Coronavirus highlights the lack of sick leave for employees in the United States. Unless there is compensation for those In isolation an outbreak in the US is inevitable. Not to mention the extremely high costs of testing. Those who live paycheck to paycheck cannot isolate.
316,2020-02-25 01:06:00+00:00,"""Authoritarian bias"" kept Xi from dealing effectively with coronavirus - @doctorow https://craphound.com/#thatswhatxisaid"
315,2020-02-25 02:33:00+00:00,How ill prepared ate we in America to combat the Corona virus? This is 10 seconds from being declared a global pandemic. It takes 14-21 days to incubate. It's gone WAY beyond the disclosed map. Prepare for the worst. We don't have a director of emergency medical preparedness 
314,2020-02-25 03:50:30+00:00,Top 10 Cryptocurrencies for 2020 according to Rothschild & Brandt: 1. $XRP 2. $EOS 3. $NEO 4. $NANO 5. $LINK 6. $VET 7. $TRX 8. $REN 9. $XMR 10. $DOS Notables that didn?t make the Top ten: $BTC #bitcoin $ETH #ethereum $LTC #litecoin $BCH &amp; $ADA #DowJoans #coronavirus #gold
313,2020-02-25 04:54:13+00:00,On a plane at LAX and the woman next to me has been disinfecting her entire seat AND the seat in front with both sprays and wipes for 30 MINS. I?m fairly certain I now smell like an industrial kitchen floor as a result. #coronavirus
312,2020-02-25 05:20:43+00:00,We need the UNITED STATES clamp down on CORONAVIRUS something very sinister is happening -Let?s ask @realDonaldTrump @POTUS to speak on this &amp; act on side of caution - we could be on verge of a worse crisis than anyone may imagine - we are being slowly cooked info us like frogs
311,2020-02-25 05:50:07+00:00,"We kept wondering what happens when Trump faces a real crisis not of his own making, and now we?re watching the right wing media get into a frenzy about how coronavirus is a deep state plot while potus declares it under control. So... not great."
310,2020-02-25 13:04:59+00:00,"I hope this will also be an end to the horrible #Yulin Dog Meat Festival #BanDCMT #China on Monday declared an immediate &amp; ""comprehensive"" ban on the trade &amp; consumption of wild animals-a practice believed responsible for the deadly #coronavirus outbreak. "
309,2020-02-25 13:42:16+00:00,Corona virus is causing an ?infodemic?. Even scientists have to teach media literacy... so why isn?t this a core skill in every social studies and #ELA class? #edchat #literacy #sschat
308,2020-02-25 15:39:19+00:00,"Coronavirus spreads to the SOUTH of Italy, panic-buyers stripping supermarket shelves bare in Palermo bringing the total to 288. pharmacy sold out of protective masks and sanitising gel, Police turn back a truck driver attempting to find his way around the quarantined red-zone "
307,2020-02-25 15:54:31+00:00,"When people ask me if I?m concerned about #coronavirus this explains why my answer is yes. #radonc #somedocs R0 is very high, mortality ~3.5% and ~20% of patients require admission. Do not put your head in the sand on this one."
306,2020-02-25 17:31:20+00:00,Please share! #CDC #coronavirus #COVID2019
305,2020-02-25 18:32:02+00:00,"This actually happened. If ?Twitter? has been thinking, ?Twitter? would have provided a map (Sharpie assisted) showing the virus on a straight line to #MaraLago. T?ump has ZERO interest in the #CoronaVirus. It WILL forcefully arrive here more sooner than later. We?re not ready. "
304,2020-02-25 18:42:34+00:00,In preparation for the coronavirus I shall stock up on corona and marathon virus disaster movies.
303,2020-02-25 18:44:12+00:00,Americans should prepare for 'significant disruption' to their lives from coronavirus: CDC https://www.newsbreakapp.com/n/0OEilClW?s=a2&amp;pd=02UMBm5N Restoring on the medical front. @veritasrepublic @rayl1975 @EileenDiana @MyInfoIngridZ1
302,2020-02-25 18:57:28+00:00,Even some of the most Fox News brainwashed Trump cult members will realize their insane Orange Emperor & his lying minions have no clothes as the disasterous response to the Coronavirus is laid more bare every hour. DJIA doesn?t drop 1500 pts in 2 days on ?fake news?.
301,2020-02-25 18:59:51+00:00,Uh. Iran?s *deputy health minister* has coronavirus. And Iran still doesn?t know how it got into the country. This is all...very worrisome. 
300,2020-02-25 20:02:17+00:00,My friend Jeri Goldman who was a passenger on the #DiamondPrincess and is currently under quarantine in Omaha Will be on @foxnews with Bill Hemmer this hour . #coronavirus
299,2020-02-25 20:40:35+00:00,"Please do not make unsubstantiated claims/spread misleading information about the coronavirus. Read full articles, not headlines. Of course we want to keep it contained and protect the vulnerable, but panicking online and making false comparisons (ie the plague) is irresponsible."
298,2020-02-25 21:01:11+00:00,"Wow, this much market panic over corona virus. What happens when it?s finally realized the market is wildly over inflated with the exuberance of under-regulation?"
297,2020-02-25 21:05:55+00:00,"If you're not an older person, the Coronavirus pandemic has a higher chance of killing Donald Trump's re-election than it does of killing you."
296,2020-02-25 21:26:35+00:00,"?I hate going to work. I wish I had more time off? [cut to me in quarantine for corona virus, Curb theme plays]"
295,2020-02-25 21:50:02+00:00,Our nations public health is important. @ewarren has a plan to tackle the coronavirus. That?s the type of leadership we need in the White House. 
294,2020-02-25 23:00:38+00:00,Rush Limbaugh: Coronavirus Being Used by Media To Tank Trump?s Economy - 
