H1,Date,Text
896,2020-03-23 15:21:12+00:00,"""And even if you aren?t feeling sick or showing drastic symptoms ? please take heed, stay safe, stay healthy and I hope to see everyone at the theater again soon."" Broadway star Aaron Tveit on Monday announced he tested positive for the novel coronavirus "
895,2020-03-23 15:23:08+00:00,"COVID-19 researchers now can use 16 supercomputers from IBM and others, along the world's biggest cloud computing services from Amazon, Microsoft, and Google, to search for drugs to fight the coronavirus. https://cnet.co/2Ut0v8c"
894,2020-03-23 15:25:34+00:00,Tesla CEO Elon Musk will reportedly begin ventilator production as the coronavirus outbreak continues https://cnet.co/33GH53M
893,2020-03-23 15:30:00+00:00,SPRING BREAKERS TEST POSITIVE: Several Florida college students have tested positive for #coronavirus after returning from a spring break trip. 
892,2020-03-23 15:30:09+00:00,"Here's a new game. It's like The Floor is Lava, but it's called Outside is the Endless Vacuum of Space https://cnet.co/2UtuPzx"
891,2020-03-23 15:36:18+00:00,Where focus goes energy flows. #tonyrobbins #coronavirus 
890,2020-03-23 15:47:11+00:00,Joe Biden just did his official coronavirus response and he screwed it up almost immediately. I guess Joe only knows what to say if his staff puts it in a teleprompter for him. Once the teleprompter went out Joe didn?t know what to do! ??
889,2020-03-23 15:55:00+00:00,.@FoxNews deceitful coverage of #COVID19 #Coronavirus reveals just how low the network and its hosts will go to remain in Trump?s good graces. Fight back?? https://bit.ly/FoxAndFiends @gtconway3d @reedgalen @NHJennifer @madrid_mike @SteveSchmidtSES @RonSteslow @jwgop @TheRickWilson
888,2020-03-23 15:56:03+00:00,"Today we?re announcing a $2.5 million Arts Relief Program to invest directly in working artists and arts and cultural organizations, as part of our efforts to help those impacted by coronavirus. More information here: "
887,2020-03-23 15:58:31+00:00,Coronavirus model sees Oregon hospitals overwhelmed by mid-April; ?point of no return? for intervention to work: March 24-29 https://trib.al/HpfgdXx
886,2020-03-23 15:58:35+00:00,"Our nurses, doctors and other healthcare professionals are on the front lines risking their health to treat people afflicted with Coronavirus and other illnesses. Please take a moment to thank them for their service and keep them in your prayers. "
885,2020-03-23 16:02:19+00:00,"That system, of course, was only announced last month, with pretty much unanimous backing from Conservative MPs. Now they're standing up in the Commons to call for a rethink. A sign of what's to come in terms of how coronavirus will reshape our country and our politics."
884,2020-03-23 16:02:35+00:00,If you?re young you have a much better chance of dying from coronavirus than you do of making a living in comedy.
883,2020-03-23 16:03:08+00:00,"Hong Kong appeared to have the coronavirus under control, then it let its guard down "
882,2020-03-23 16:12:01+00:00,"Wow. It takes a special kind of moxie for @senatemajldr to stand in the well of the Senate and accuse Democrats of standing in the way of a congressional coronavirus response when what Democrats are ""standing in the way of"" is a $500 billion slush fund for rich Republican donors."
881,2020-03-23 16:21:29+00:00,Sufjan Stevens warned us about coronavirus 5 years ago but no one listened 
880,2020-03-23 16:25:16+00:00,You are a tool! Sacrificing Americans in order to pay your corporate donors and your lobbyists https://www.outsidethebeltway.com/coronavirus-rescue-plan-in-limbo/ #reliefbill #COVID19
879,2020-03-23 16:27:23+00:00,"Amazon is hiring 100,000 people during one of the biggest economic declines in history Netflix saves the internet infrastructure of the EU Facebook enables free video calls The NYTimes' take? ""Be afraid of tech companies getting bigger"""
878,2020-03-23 16:29:27+00:00,Bailing out big businesses and the Trump hotels while you lose your job? Giving Steve Mnuchin a $400B #GOPSlushFund with no rules while you get an advance on next year's tax refund - or nothing? No. #BailOutPeopleNotCorporations #LockDownNow
877,2020-03-23 16:37:12+00:00,"#BREAKING Arizona now has 235 identified cases of COVID-19, spiking by 55% from Sunday."
876,2020-03-23 16:43:52+00:00,"My latest: As the coronavirus outbreak spreads, new data shows that sales of supplements marketed for immune support and cold and flu relief are surging. But health experts urge caution. "
875,2020-03-23 16:44:03+00:00,"While truckers, health care workers, delivery ppl, grocery workers, farmers et al keep us going, Dems in Congress shame themselves by politicizing the coronavirus. God help us if these hate-filled goons get control of WH and both houses of Congress. It will be Congressavirus!"
874,2020-03-23 16:49:07+00:00,"Donald Trump knew in Jan. dangers of Coronavirus. Didn?t buy, produce mass tests. Didn?t push social distancing until mid-March. Used microphone to distort, distract severity of COVID19 to flu. Continues to lie about treatments; over factual information #RepublicansAreKillingUs"
873,2020-03-23 17:04:45+00:00,"The Senate Republicans? bill put corporations first, not workers & families. Today, @HouseDemocrats will unveil a bill that takes responsibility for the health, wages &amp; well-being of America?s workers: the Take Responsibility for Workers &amp; Families Act. https://www.speaker.gov/newsroom/32320"
872,2020-03-23 17:05:20+00:00,It?s possible to acknowledge the Chinese government?s role in stifling early info and worsening the coronavirus crisis without being racist about it.
871,2020-03-23 17:11:31+00:00,The reddit post we need. #coronavirus 
870,2020-03-23 17:12:10+00:00,"#NancyPelosi Preps Democrats? 3rd Coronavirus Response Bill: ?Democrats Take Responsibility: ?For our workers and small businesses ?For our doctors, nurses, health care workers, responders ?For our families ?For our students ?For our democracy "
869,2020-03-23 17:12:53+00:00,Thank you Senate Democrats for taking one look at the corrupt Republicans? bailout for giant corporations and saying hell no. Democrats are not willing to stand by and watch as the GOP hangs American workers and families out to dry! #coronavirus
868,2020-03-23 17:24:21+00:00,"Coronavirus tests are hard to get ? unless you have money, fame and the right doctor "
867,2020-03-23 17:31:48+00:00,"Here is how long the coronavirus is detectable on different surfaces, according to the CDC. "
866,2020-03-23 17:55:18+00:00,"Protect our first responders so they can protect us: On a call with Trump officials, police chief pleads: 'Stop testing NBA players, start testing first responders' - ABC News #firstresponders #coronavirus "
865,2020-03-23 18:01:16+00:00,The Olympics have been postponed for the first time ever due to coronavirus https://cnet.co/2Jbz79f
864,2020-03-23 18:02:05+00:00,#RickRoss encouraging people to stay home to stop the spread of the #coronavirus ?????? @RickRoss
863,2020-03-23 18:03:06+00:00,Why didn?t Hillary just wait for the coronavirus to kill Jeffrey Epstein? 
861,2020-03-23 18:05:49+00:00,Answers a lot of questions we have: Food Safety and Coronavirus: A Comprehensive Guide | Serious Eats https://bit.ly/2UsZWv3
862,2020-03-23 18:05:49+00:00,"She was doing #chemotherapy &amp; couldn?t leave the house because of the threat of #coronavirus so her line sisters showed up outside her house &amp; standing a safe distance from her + each other, sang her a song ???? Full video: https://buff.ly/33QxVC1 (??Shannon Nicole Thompson)"
860,2020-03-23 18:06:21+00:00,"?We certainly would not ask a firefighter to fight a fire with a spray gun. It is a moral obligation of our government and employer to provide safety equipment to those of us on the front line."" -@DBurgerNNU, RN president of NNU #ProtectNurses #COVID19"
859,2020-03-23 18:07:26+00:00,Why this coronavirus is different from the ordinary flu. 
858,2020-03-23 18:13:09+00:00,"For all you goofs that don?t think the coronavirus will get to you, here are the counties in Oklahoma with confirmed cases. Threw in an X for Wichita county TX because I know that?s where a lot of my followers live, 4 confirmed cases there. "
857,2020-03-23 18:16:39+00:00,Coronavirus bill blocked by Dems for second time 
856,2020-03-23 18:22:14+00:00,"Tito's Vodka, other distilleries making hand sanitizer for coronavirus crisis https://cnet.co/2J5UOYu"
855,2020-03-23 18:26:52+00:00,"Today, I am issuing a new statewide order: stay home to the maximum extent possible. Failure to comply with the order will be considered an immediate danger to public health."
854,2020-03-23 18:34:27+00:00,"Since taking hydroxychloroquine, Giardinieri has had no fever or pain and can breathe again. Giardinieri said he had three doses of the medicine Saturday and is hoping to be discharged from the hospital in five days. ?The drug saved my life.?"
853,2020-03-23 18:36:14+00:00,"1. How South Korea Flattened the Curve The country showed that it is possible to contain the coronavirus without shutting down the economy, but experts are unsure whether its lessons can work abroad. "
852,2020-03-23 18:41:32+00:00,Experts agree: Coronavirus can be stopped. We need to listen to scientists and doctors. Practice rigorous social distancing. Restrict non-essential activity. Make tests widely available. Produce more ventilators and masks. We can do this ? and will ? by working together. 
851,2020-03-23 18:47:10+00:00,"I like Larry Kudlow personally. But as he tells us today that we need to go back to work, remember he is not an economist (BA in history;not a PhD in economics) & said this last month: ""US has contained the coronavirus and the economy is holding up nicely"" "
850,2020-03-23 18:56:17+00:00,Thousands of students across the globe have come waddling back to the chilly world of #ClubPenguin
849,2020-03-23 19:03:52+00:00,Fox News deceitful coverage of #COVID19 #Coronavirus reveals just how low the network and its hosts will go to remain in Trump?s good graces. 
848,2020-03-23 19:14:37+00:00,Trump Won?t Order Vital Coronavirus Supplies Because Corporate CEOs Asked Him Not To. They?re worried it could be bad for business. 
847,2020-03-23 19:20:29+00:00,Rupert Murdoch Put His Son in Charge of Fox. It Was a Dangerous Mistake. - The 48-year-old Lachlan Murdoch stood by as Fox News hosts played down the danger of the deadly coronavirus to their viewers. 
846,2020-03-23 19:30:43+00:00,Verizon gives all customers 15GB of extra data during coronavirus outbreak https://9to5mac.com/2020/03/23/verizon-coronavirus-outbreak-extra-data-hotspot/ by @nexusben
845,2020-03-23 19:33:42+00:00,BREAKING: Mayor Michael Hancock to issue stay-at-home order for Denver at 2 p.m. https://dpo.st/2y6dMvX
844,2020-03-23 19:42:31+00:00,"Last week I waived regulations to allow us to hire nurses on the spot so we can prepare for the increase of coronavirus cases that we know is coming. This weekend we hired 82 nurses, some of whom are starting this week. "
843,2020-03-23 19:52:05+00:00,Jews were blamed/targeted for the Plague. Irish were blamed/targeted for Cholera. LGBT were blamed/targeted for HIV. Now Chinese Americans are being blamed/targeted for #Coronavirus. We?re all in this together. Let?s stick up for our Chinese neighbors. 
842,2020-03-23 20:13:03+00:00,Far more people in the U.S. have the #coronavirus than you think We aren?t testing enough to control the outbreak. The real count could be 10 times higher. 
841,2020-03-23 20:28:51+00:00,I want to punch the coronavirus in the face. #Supernatural #SPNFamily
840,2020-03-23 20:29:42+00:00,"Scientists in China claim There is more than One Strain of the Coronavirus and that One is more Deadly than the other. The Strain hitting Italy &amp; Europe is Different than the strain affecting China. So How did 2 Strains of Coronavirus attack Us Simultaneously, If Not AGENDA 21? pic.twitter.com/IJ3QeBflM8"
839,2020-03-23 20:37:00+00:00,?If you?re losing sleep over what?s happening or you?re unable to concentrate...consider [lowering] your dose of media to once a day.? Read more tips from NAMI?s Chief Medical Officer Dr. Ken Duckworth here:
838,2020-03-23 20:44:08+00:00,"How the rich prepare for Covid19 is, well, as you might expect: nuts. https://www.latimes.com/business/real-estate/story/2020-03-23/rich-are-running-from-coronavirus"
837,2020-03-23 20:44:51+00:00,"Rancho Palos Verdes mayor, former mayor test positive for coronavirus after birthday party "
836,2020-03-23 20:48:01+00:00,January : Australia is on fucking fire February : WW3 and Kobi dies March : Corona Virus pic.twitter.com/TZJtdkWB8J
835,2020-03-23 20:55:01+00:00,"Inquiries and sales are skyrocketing for bunkers across the country. And in an age ruled by capitalism, manufacturers are pumping out safe spaces with amenities usually reserved for mega-mansions. @jflem94 reports: https://www.latimes.com/business/real-estate/story/2020-03-23/rich-are-running-from-coronavirus"
834,2020-03-23 20:56:07+00:00,"Foster pets provide comfort, alleviate stress, and keep you entertained. If you're hanging at home alone, why not have a buddy there too? Help an animal and help yourself! ??"
833,2020-03-23 20:57:26+00:00,Protect yourself from the Coronavirus while still enjoying life ???? pic.twitter.com/46YDggiVdc
832,2020-03-23 21:03:18+00:00,"How the rich are running from coronavirus: Sales are skyrocketing for bunkers with escape tunnels, hidden doors, bullet-proof glass, pepper spray portals &amp; special air-filtration systems. Some come with safe rooms with a year?s worth of food. "
831,2020-03-23 21:03:56+00:00,"Pelosi's ""coronavirus"" bill: -Bailout all current debt at USPS -Same-day voter registration -Expands union collective bargaining -Offsets airline emissions by 2025 -$15 min wage While @senatemajldr is working on bipartisan solutions, Pelosi pushes her radical proposals."
830,2020-03-23 21:06:46+00:00,Americans who suffer from lupus are struggling to get their hands on a crucial medication after President Trump touted it as a possible #coronavirus treatment. 
829,2020-03-23 21:12:38+00:00,"This priest, Suffering from the coronavirus, gave up his ventilator to give to a younger patient and has died. His name was Don Giuseppe Berardelli. He was 72 years old, from Bergamo. "
828,2020-03-23 21:13:35+00:00,"Great news! The UK finally announces a country-wide lockdown. They could have done it 10 days ago, but the epidemiological advice the govt received was bad. It will lead to hundreds, maybe thousands of unnecessary deaths. #HammerAndDance https://www.theguardian.com/politics/live/2020/mar/23/uk-coronavirus-live-news-latest-boris-johnson-minister-condemns-people-ignoring-two-metre-distance-rule-in-parks-as-very-selfish #coronavirus"
827,2020-03-23 21:28:25+00:00,"What coronavirus symptoms look like, day by day "
826,2020-03-23 21:33:22+00:00,"Uber gives only 14 days financial help to drivers diagnosed with coronavirus. On day 15, drivers are on their own. So are their passengers. The next time you summon an Uber, you could be summoning coronavirus. Public health requires that corporations do better than this."
825,2020-03-23 21:45:23+00:00,"I cannot stress this enough. If you are laid off due to coronavirus, do not pay rent. Why should workers have to ""dip into their savings"" during a crisis just so landlords don't have to dip into theirs?"
824,2020-03-23 21:48:03+00:00,"Given our approaching 2020 elections and a possibly long-term public health risk posed by the coronavirus, states and the federal government must give every eligible voter access to a vote-by-mail ballot. We must ensure free, fair and secure elections even in pandemic conditions."
823,2020-03-23 21:57:28+00:00,My latest article in Conservative Truth - Iran is the Epicenter of Coronavirus Pandemonium and Death - Darlene Casella - 2020-03-21 http://www.conservativetruth.org/article.php?id=7987
822,2020-03-23 22:02:15+00:00,"BREAKING: A Phoenix-area man has died and his wife was hospitalized after they ingested a COVID-19 home remedy. The substance, chloroquine phosphate, was recently touted by President Donald Trump as a possible coronavirus treatment. "
821,2020-03-23 22:10:23+00:00,"""What the hell do the emissions standards on airplanes have to do with thousands of people dying and millions of people out of work in the Coronavirus epidemic?"" Senator @tedcruz is right - what the hell do they have to do with saving American lives?"
820,2020-03-23 22:12:04+00:00,I thought I had the Coronavirus but my headache and chills went away as soon as I stopped talking to Rashida Tlaib!
819,2020-03-23 22:15:05+00:00,"AP EXCLUSIVE: A series of missteps at the nation?s top public health agency caused a critical shortage of reliable laboratory tests for the coronavirus, hobbling the federal response as the pandemic spread across the country like wildfire https://apnews.com/c335958b1f8f6a37b19b421bc7759722 #coronavirus"
818,2020-03-23 22:18:26+00:00,Trump delayed taking action against the coronavirus for almost 2 months because it suited his re-election agenda. #COVIDActNow
817,2020-03-23 22:30:16+00:00,A Statement from Surfline on Surfing and the Coronavirus
816,2020-03-23 22:32:21+00:00,Centralized solutions means centralized failures when the people you're counting on make mistakes. There are thousands of private labs producing their own testing solutions to #COVID19. It's time the CDC and FDA got out of their way.
815,2020-03-23 22:41:29+00:00,".@SaraCarterDC on #coronavirus fight: ""use common sense..."" #NextRevFNC #Covid19 #FlattenTheCurveNotTheEconomy #CommonSense #PositiveAndPractical"
814,2020-03-23 22:46:16+00:00,Meanwhile Kaiser hospitals are firing nurses who wear masks. #Coronavirus 
813,2020-03-23 23:00:01+00:00,"Navy SEAL got coronavirus, ""Feeling better now but couldn't move for three days."" Coronavirus isn't just the flu, this is putting SEALs on their asses."
812,2020-03-23 23:09:01+00:00,Coronavirus: Manny Pacquiao leading by example 
811,2020-03-23 23:15:50+00:00,"There are 382,000 job openings and counting as Amazon, Walmart, Domino?s and more hire to meet #coronavirus demand. "
810,2020-03-23 23:21:42+00:00,"Patients are refusing to be seen by my mom at the hospital. Asian kids are being tormented in schools. I'm so tired of trying to prove that racism against Asians happens, so this week, I just wrote about what it feels like:"
809,2020-03-23 23:24:11+00:00,Dr. Birx is exhibiting deep cognitive-emotional dissonance. She's trying to reconcile science and sycophancy ? and failing. #DrBirx #Coronavirus #COVID19 #CoronavirusPandemic
808,2020-03-23 23:28:19+00:00,ARE YOU F?ING KIDDING?!? Coronavirus: Trump admin bars Anthony Fauci from discussing outbreak - Business Insider 
807,2020-03-23 23:29:00+00:00,"Now more than ever, healthcare workers need everyone?s support. So we?re sourcing and donating over 1 million personal protective items like masks and gloves for those on the front lines."
806,2020-03-23 23:30:00+00:00,"Medical experts warn against self-medication to prevent or treat coronavirus after a man died, and his wife is under critical care, for taking chloroquine phosphate, which is often used to clean fish tanks at aquariums. "
805,2020-03-23 23:32:30+00:00,CDC says #coronavirus survived in Princess Cruise ship cabins for up to 17 days after passengers left. 
804,2020-03-23 23:34:17+00:00,"No Fauci, No peace: Trump signals growing weariness with coronavirus social distancing as he grows concerned about the economy - The Washington Post #nofauci #corona"
803,2020-03-23 23:44:01+00:00,Fox News Channel is hosting a special two-hour virtual town hall with President Trump and members of the White House coronavirus task force on Tuesday at 12 p.m. ET. Here's how you can submit your questions. 
802,2020-03-23 23:44:30+00:00,"Six of the Trump company?s seven top-performing clubs and hotels closed because of the coronavirus. It is possibly costing his business millions, @Fahrenthold, et al. report. It isn?t difficult to connect the dots between this news and his current posture."
801,2020-03-23 23:48:31+00:00,Trump Won?t Order Vital Coronavirus Supplies Because Corporate CEOs Asked Him Not To. (They?re worried it could be bad for business). These greedy CEOs are moving me to the left. Last year I was a progressive democrat. Now I am a democratic socialist. 
800,2020-03-24 00:10:40+00:00,"Trump: when can we evict coronavirus? Me: well, I?m not? wait, did you say ?evict?? Trump: 15 days? Me: ??????"
799,2020-03-24 00:25:49+00:00,CORONAVIRUS -&gt; anangram -&gt; CARNIVOROUS flesh eaters. How do they get their #andrenochrome
798,2020-03-24 00:26:43+00:00,Nicolle Wallace points out that Trump hasn't shown a shred of humanity throughout this coronavirus crisis. #ctl #p2
797,2020-03-24 00:27:53+00:00,AMERICA WAKE UP!! Nancy Pelosi & the Democrats are stalling the Coronavirus Bill. PUT THE PEOPLE FIRST FOR ONCE! RT &amp; LETS EXPOSE THESE POLITICIANS! President @realDonaldTrump is trying to help us all but they won?t let him!! RT &amp; use ?? #SignTheBillNow
796,2020-03-24 00:33:03+00:00,Note to Trump: you can?t evict the coronavirus. #COVID19 #WhereisDrFauci
795,2020-03-24 00:44:40+00:00,Tucker Carlson on Speaker Pelosi?s emergency coronavirus response bill: 
794,2020-03-24 00:55:00+00:00,This kind of numbnuttery will kill people in Texas. Young as well as old. We need a state-wide shelter in place order to stop the spread of coronavirus and save hundreds of thousands of lives. 
793,2020-03-24 00:59:39+00:00,"NBC: ""Did you at any point hear that the FDA had not approved of it for coronavirus purposes or--?"" AZ Woman: ""Yeah. But you know they kept saying that it was approved for other things...Trump kept saying it was basically pretty much a cure."" "
792,2020-03-24 01:05:46+00:00,"OBAMAPhone era PORK in @SpeakerPelosi COVID19 Funding Bill. Speaker&amp; her pork, special interest cronies need expelled from Congress. This is absolutely criminal. People worry about jobs, funding for tests, care programs for treatment-she sells out to lobby"
791,2020-03-24 01:12:06+00:00,Nurses outside the Kaiser Oakland hospital are singing ?we need PPE [personal protective equipment]? right now in protest of shortages and rules limiting protective masks they can wear. #coronavirus #COVID19
790,2020-03-24 01:17:22+00:00,Coronavirus is exposing way too much about the private homes of news anchors 
789,2020-03-24 01:34:28+00:00,"Hey Twitter, this corona virus has really killed my dads business ?? it sucks to see him this sad?? if you guys can rt and show some love and support on 7315 south Compton ave from 6am- 10 pm everyday ?? pic.twitter.com/XO6EbF0kmU"
788,2020-03-24 02:01:40+00:00,I guess Trump?s War Room doesn?t remember when he called the Coronavirus a hoax at his rally in SC. So here is a reminder.... https://twitter.com/trumpwarroom/status/1242233489421930497
787,2020-03-24 02:03:42+00:00,The White House Throws A Tantrum After CNN And MSNBC Cut Off Trump's Coronavirus Briefing https://www.politicususa.com/2020/03/23/white-house-throws-a-tantrum-after-cnn-and-msnbc-cut-off-trumps-coronavirus-briefing.html via @politicususa #ctl #p2
786,2020-03-24 02:07:06+00:00,"Gilead Sciences' remdesivir, one of the most promising Covid-19 treatments, was just granted ?rare disease? status by Trump's FDA. Despite drug being developed w/taxpayer support, designation could limit affordability, block generic competition."
785,2020-03-24 02:08:32+00:00,"Jeremy Renner Says Coronavirus Killing Income, Wants Child Support Reduced "
784,2020-03-24 02:10:48+00:00,Please watch this clip of the TX Lt. Gov. and honestly tell me if he?s saying we must sacrifice lives to save the economy: Dan Patrick on Coronavirus: 'Let's Get Back to Living' ?@DanPatrick? #coronavirus 
783,2020-03-24 02:12:33+00:00,Let?s be clear about we?re debating right now: Tax rates for the wealthy are at HISTORIC lows. Massive corporations like Amazon pay NO TAXES. We could ride out the coronavirus pandemic if we raise taxes on the rich and Republicans are saying it would be better if millions DIED.
782,2020-03-24 02:18:26+00:00,tonight?s dinner + cat
781,2020-03-24 02:23:29+00:00,"I?ve been going through Speaker Pelosi?s 1,400-page bill?most of it has absolutely NOTHING to do with the coronavirus crisis. They're trying to exploit Americans' suffering to sneak every liberal policy they ever dreamed of into law. Here's a sample I gave to @marklevinshow:"
780,2020-03-24 02:37:00+00:00,"Vox is sending about 0 million masks to the front lines of the coronavirus crisis That sounds terrible until you remember that they helped cause the crisis by publishing just-the-flu misinformation, and still haven?t either apologized or retracted Then it sounds more terrible "
779,2020-03-24 02:45:19+00:00,Coronavirus will not last forever. Adventures are ahead. #mondaymotivation #COVID19 #coronavirus #qotd
778,2020-03-24 03:00:28+00:00,"Thread. You're gonna see ""coronavirus can live for 17 days on surfaces!"" Incorrect. *Viral RNA* was detectable after 17 days. Saying that live virus is there because viral RNA was found is like saying I must be holding a meatball sub because there's a marinara stain on my pants. "
777,2020-03-24 03:08:14+00:00,Now it?s kinda like life is just staring at the 3 dots on iMessage while coronavirus is typing
776,2020-03-24 03:22:52+00:00,This asshole and his rich friends are too stupid to get that we can only get through this together. Everyone is at risk from the virus. Everyone suffers when there aren?t enough hospital beds. Everyone struggles when millions are too sick to work. https://wapo.st/3bmH2wM
