H1,Date,Text
498,2020-03-13 15:07:21+00:00,Next person who blames ?the media? for the coronavirus cancellations. You can blame me... for Stone Cold Stunning you. 
497,2020-03-13 15:13:02+00:00,"Interns & Residents review #Coronavirus response plans of all candidates: ""@BernieSanders? [strong policy] rating reflects his commitment to expanding #MedicareForAll, defending unions, &amp; adequately addressing #climatechange"" #Bernie2020 https://www.cirseiu.org/presidentialscorecard/"
496,2020-03-13 15:23:10+00:00,Alright Coronavirus... Now you've really done it 
495,2020-03-13 15:53:26+00:00,New coronavirus tests that are 10X faster get emergency approval from FDA 
494,2020-03-13 16:15:05+00:00,The ONE time a gay magazine features queer Asian Americans is for when PRIDE is cancelled due to coronavirus. 
493,2020-03-13 16:48:04+00:00,"We are en route to Hawaii, crossing the country during #coronavirus fears. Highlight of the trip?s first leg was this man?s carry-on luggage: a 12-roll pack of extra soft toilet paper. The human race amazes. "
492,2020-03-13 16:53:10+00:00,The one nice thing about having constantly high levels of anxiety is that the world always feels like it is on the verge of ending. So I have no space to particularly care about the coronavirus!
491,2020-03-13 17:07:17+00:00,coronavirus got everyone on edge 
490,2020-03-13 17:23:23+00:00,Does anyone remember what we talked about before corona virus
489,2020-03-13 17:47:38+00:00,Reminder: If stupid people get hysterical over #coronavirus you?ll need a gun more than toilet paper. Maybe ?minorities? who play the victim game will finally wake up? RT if you?re sick of the victim narrative ?? @NRA @LogCabinGOP #Trump2020
488,2020-03-13 17:54:54+00:00,Coronavirus sounds like a party foul
487,2020-03-13 18:00:15+00:00,did USC Student Health really just link a TeenVogue article as a legitimate resource for anxiety about coronavirus... 
486,2020-03-13 18:01:35+00:00,The Bunkhouse Saloon is closing temporarily. Which is ironic because coronavirus may have originated in its bathroom. 
485,2020-03-13 18:03:47+00:00,#youroaklandfirefighters want all to know that we are taking every precaution with #coronavirus When you call for help we might show up looking a little bit like surgeons! (1 of 2) 
484,2020-03-13 18:06:31+00:00,"If I get the corona virus, I want to get from a stripper ??"
483,2020-03-13 18:13:00+00:00,Ppl are scared of the coronavirus but go raw everyday
482,2020-03-13 18:15:22+00:00,"Whether you believe the #Coronavirus is bad or not, please be safe and take care of your loved ones. ????"
481,2020-03-13 18:36:57+00:00,"This idiot thinks that coronavirus is spread by southern immigration. Coronavirus has nothing to do with the beer, you hate-addled moron. "
480,2020-03-13 18:39:28+00:00,"With rallies canceled due to #coronavirus, it?s time 4 us 2 step up in a big way &amp; keep up momentum! #NotMeUs Text for #Bernie2020, today!"
479,2020-03-13 18:47:47+00:00,Good on PG&E for committing to not shut off customers? power for nonpayment during the coronavirus emergency. Now we need to ensure people don?t get evicted or foreclosed on. 
478,2020-03-13 18:57:09+00:00,how do i mute the annoying tweets about the coronavirus and instead only see the funny ones
477,2020-03-13 18:58:25+00:00,If you?ve ever lived in a sorority house you are immune to corona virus
476,2020-03-13 19:07:50+00:00,"In Chicago, 85 people have been killed this year. That is 28 more than 2019. (Hard to blame this on Trump.) https://www.chicagotribune.com/news/breaking/ct-chicago-homicides-data-tracker-htmlstory.html #Coronavirus"
475,2020-03-13 19:16:06+00:00,*corona virus enters my body* The ice the nurse gave me: 
474,2020-03-13 19:16:50+00:00,Coronavirus ain?t shit my ex was more toxic.
473,2020-03-13 19:47:55+00:00,Stay safe out there y?all! #teammartymar #litaftour #coronavirus ?? @ImAndrewJackson
472,2020-03-13 19:57:09+00:00,"? tomorrow isn?t promised, fix things with you?re ex today. coronavirus 13:2?"
471,2020-03-13 19:58:12+00:00,I can?t imagine what it must be like to be sick with coronavirus in America and be watching these clowns congratulate themselves.
470,2020-03-13 20:15:36+00:00,If you went to Rec Center you are immune to the corona virus
469,2020-03-13 20:36:42+00:00,This coronavirus fucking with all of our money!!!!
468,2020-03-13 20:38:01+00:00,San Francisco Food Bank is gearing up to stock pantries with food during the SFUSD coronavirus school closure. Beginning 3/17 FREE breakfast and lunch will be provided to all children 18 and under at 14 pick-up sites open M-F. ? at San Francisco Food Bank
467,2020-03-13 20:45:35+00:00,Because of the Corona Virus I would like to say I will be taking my talents to Da Crib University for these next couple of weeks thank you lol ???? #DCU
466,2020-03-13 21:01:11+00:00,"Another coronavirus consumer alert? Silver Solution, which televangelist Jim Bakker claims is an effective treatment for coronavirus. We?re demanding he prove it! #coronavirus #JimBakker"
465,2020-03-13 21:07:08+00:00,Has anyone else noticed that in all of this panic shopping people aren't buying condoms? All of you liberals like to suck and fuck like crazy you can give coronavirus to others that way. Hellloooo
464,2020-03-13 21:09:54+00:00,I wonder if all of these asskissers around Trump know that coronavirus contagion can occur via fecal-oral transmission
463,2020-03-13 21:10:37+00:00,Coronavirus fuckin my check up
462,2020-03-13 21:11:10+00:00,The virus has figured a way to enter our lungs by an ingenious docking mechanism onto a receptor ACE2 on the surface of cells in the lung... this is the Achilles heel which will allow us to block its entry. #coronavirus #ACE2 #covid19
461,2020-03-13 21:20:47+00:00,And the award for the strangest Coronavirus graphic goes to 1011 News. Is it a Coronavirus rock concert or hell? 
460,2020-03-13 21:33:01+00:00,Kids dying in cages Synagogue massacres Charlottesville Coronavirus deaths Is all of this really worth it just to ?own the libs??
459,2020-03-13 21:43:32+00:00,Attention Trump! Heidi needs a coronavirus test! Help her! For Godsake! Help our Heidi! 
458,2020-03-13 22:00:25+00:00,A list of neighborhoods that are under a Coronavirus Quarantine lockdown in SD County. See below if your area is on the list: http://pbs.twimg.com/media/BG48ENgCEAAIDl9.jpg First Reported KUSINews
457,2020-03-13 22:01:26+00:00,#LosAngeles; Out of an abundance of precaution #LAFD firefighters exposed to #CoronaVirus are being self quarantined. 
456,2020-03-13 22:03:25+00:00,the only thing the corona virus is killing is my vibe
455,2020-03-13 22:19:19+00:00,"I?m not a fan of cheerleading that @POTUS gets the coronavirus like I?m seeing on here. He has enough karma coming. If the Repubs aren?t going to stop him, voters will. The DOJ will destroy him with indictments when hes out of office if he doesn?t try to do an Agnew-esque deal."
454,2020-03-13 22:36:42+00:00,Coronavirus outbreak unlikely to affect Allegiant Stadium timetable https://www.reviewjournal.com/business/stadium/coronavirus-outbreak-unlikely-to-affect-allegiant-stadium-timetable-1979884/ #vegas #raiders #stadium #CoronavirusPandemic
453,2020-03-13 22:47:15+00:00,"Officials reporting three new cases of coronavirus in San Diego. That brings our total to 8, one of those people is from the quarantine at MCAS Miramar. Health officials are expecting more cases- it may take time to see restrictions on large events, etc. lowering case totals here "
452,2020-03-13 23:26:46+00:00,UPDATE on #coronavirus numbers in Riverside County: There are now 12 total cases. 2 are the Diamond Princess passengers still out of the county. The remaining 10 are in the Coachella Valley. All schools are ordered closed.
451,2020-03-13 23:41:12+00:00,"If coronavirus doesn?t kill me, my children will. "
450,2020-03-13 23:52:30+00:00,JUST IN: Albuquerque gets drive-thru Coronavirus testing. 
449,2020-03-13 23:55:28+00:00,Catch me soon with @trish_regan at 815PM ET! #coronavirus 
448,2020-03-14 00:12:31+00:00,freelance artist here that has also been severely financially fucked by coronavirus ?? I am now taking commissions for these multi dimensional tile pieces ! What started out as a portal installation sculpture has become repurposed for personal spaces ?? DM for customs / LA based pic.twitter.com/am11eylf4q
447,2020-03-14 00:12:37+00:00,this corona virus is literally ruining everything &amp; everyone ??
446,2020-03-14 00:12:51+00:00,"**CORONAVIRUS (COVID-19) UPDATE** All District travel, gatherings, field trips and athletics are suspended until further notice. For more information and the latest updates, visit https://tinyurl.com/uomjkbw ? at Rialto Unified School Disrict"
445,2020-03-14 00:35:38+00:00,"As a community support initiative, @CalgaryCoop is offering free Care Packages with essential non-perishable food products to anyone who is quarantine due to #covid19. To request a package email memberengagement@calgarycoop.com #yyc #coronavirus"
444,2020-03-14 00:37:45+00:00,"Around 1M jobs in SoCal are associated with the ports, but the coronavirus outbreak is hitting port workers and local businesses the hardest. https://abc7.com/business/coronavirus-takes-heavy-toll-on-ports-of-la-long-beach/6010146/ via @abc7"
443,2020-03-14 00:46:39+00:00,"May I suggest you promote him and give him and his team all raises and, like anything else they want? Thanks. Signed - the entire USA. #covid19 #coronavirus "
442,2020-03-14 00:47:30+00:00,"Google is not working with the government to build a nationwide website to help people determine whether and how to get a novel coronavirus test, despite what Trump said, because of course they?re not. Their site will only be for folks in the Bay. Jesus. "
441,2020-03-14 00:48:36+00:00,"It?s official. The #VenturaCounty Superior Court is closed Monday to Wednesday due to the #coronavirus. It will open again Thursday with limited operations. The justice system is on hold, folks. "
440,2020-03-14 00:52:19+00:00,i really feel that those of us who are considered emergency medical providers and are gonna be showing up to work and knowingly be exposed to coronavirus multiple times a day should get our student loans forgiven
439,2020-03-14 00:53:23+00:00,Well the spring dance got cancelled because of the corona virus but we took pics anyways?? 
438,2020-03-14 01:03:50+00:00,Destroy the factory (Infected Cell) itself #coronavirus #Covid_19 #covid19 #SARSCoV2
437,2020-03-14 01:06:48+00:00,The scene at Ralph?s Studio City around 4:30p today. Bob Loudin and Steve Grant stopped by to grab flowers and some basic supplies on their way to a friend?s house. #coronavirus #coronapocalypse
436,2020-03-14 01:22:44+00:00,"First Coronavirus status update that uses emojis. Never change, Rolling Loud "
435,2020-03-14 01:28:39+00:00,40% of Americans think that Corona beer causes the corona virus. That fact explains A LOT of things. 
434,2020-03-14 01:44:24+00:00,Anyone who dies in jail because of #coronavirus should be considered executed. We told them what will happen.
433,2020-03-14 01:47:55+00:00,*corona virus enters my body* the expired emergen-c that i took last winter sitting in my stomach: https://twitter.com/sbusteezkat_/status/654789132422549504/video/1
432,2020-03-14 02:26:10+00:00,Day 0.5 of coronavirus-mediated homeschooling: 7: I finished all 10 days of homework. What now? 10: I used up all 10 days of screen time. What now? Me:
431,2020-03-14 02:31:00+00:00,"This Coronavirus stuff is crazy. Airport was a ghost town, grocery store is empty. Stay safe everyone."
430,2020-03-14 02:37:19+00:00,"really messed up that even in a pandemic, SF is still rapidly responding to housed people?s requests to kick unhoused people off the street here?s one: resident asks SF to ?Take them to the ss coronavirus ship in Oakland and get rid of them? 2.5hrs later: ?Encampment removed.? "
429,2020-03-14 02:43:19+00:00,"Had to close PRO GYM today. Permanently. Last day 3/31. Sure it?s sad. Of course. Members shocked and even perturbed. Why? they all asked. Well, the Coronavirus and the fact I can?t buy anything to clean the gym thats why. Compassion is a good quality. Use it if you can. "
428,2020-03-14 02:51:30+00:00,I?m not going to let #coronavirus stop me from enjoying my #friday night ????????? #quarantini
427,2020-03-14 02:56:36+00:00,"Public health officials have confirmed the first case of #COVID19 in the #OKC metro. Visit http://okc.gov/prepare for updated #coronavirus links and resources from @okchealth (our local partners), @HealthyOklahoma and @CDCgov."
426,2020-03-14 03:01:03+00:00,If Trump had coronavirus which would make him slur and struggle to breathe and speak coherently and look absolutely terrible how would we know the difference? Seriously.
425,2020-03-14 03:06:53+00:00,"As much as this #Coronavirus pandemic is absolutely shitty on every level, as the father of a young daughter it?s hard to express the relief I feel knowing that data shows infants and children tend to show milder symptoms ? with a far lower mortality rate than adults #COVID19"
424,2020-03-14 03:18:31+00:00,It?s rare that I editorialize but let?s use facts for fun: -English isn?t the national language. -You can be a citizen and not speak English -Spanish doesn?t make you immune to coronavirus. Don?t be an idiot and wish sickness or death upon someone because they don?t speak English
423,2020-03-14 03:24:00+00:00,Hope you have food stocked up. #vegas #coronavirus #coronapocalypse ? at Trader Joe's
422,2020-03-14 04:25:14+00:00,"When the coronavirus cancels sports, what should @SportsCenter cover? The #NebPreps state basketball tournament, of course! Check out what ESPN had to say about (1) Bellevue West?s 89-70 Class A semifinal victory over (4) Omaha Westside. ????"
421,2020-03-14 04:25:58+00:00,"First and foremost I want to thank the man up above. All glory to god. Secondly, I want to give a shoutout to the Corona Virus. Skegee it?s been lit. I will be back in the fall. However, due to the RoRo, I now attend DCU. Go couchers! ?? "
420,2020-03-14 04:30:59+00:00,If you?re in #LosAngeles and are concerned about feeding your child because of school closures due to #coronavirus feel free to DM me and I will personally deliver whatever I can to help. So many people have helped me in my time in need and I truly want to pay it forward.
419,2020-03-14 04:53:02+00:00,"Our collective goal is pretty simple....do our best to keep our men and women safe, while continuing to answer the call for this city. Coronavirus: SJPD adopts new strategies to police city in the era of COVID-19 https://www.mercurynews.com/2020/03/13/coronavirus-sjpd-adopt-new-strategies-to-police-city-in-the-era-of-covid-19/ via @mercnews"
418,2020-03-14 06:55:24+00:00,If you?ve ever drank a 4loko you?re immune to the coronavirus
417,2020-03-14 07:15:06+00:00,"We don?t need to stop Coronavirus, we just need to tweak it to target bloggers that spend time digging up old tweets and podcasts; trying to steal the lifelong dreams of far more talented people."
416,2020-03-14 07:15:20+00:00,I saw my friend on Insta on a cruise & I was like ?uh oh she?s disobeying the CDC & gonna get the ?rona??? &amp; sure enough two days later she?s back on insta like ?I?m being sent home bc I have the coronavirus? EVERYONE !!! BE CAREFUL !!! DO WHAT THE CDC SAYS !!!
415,2020-03-14 07:26:18+00:00,So @PopeyesChicken actually decided to remove this Asian guy from their commercial. Thanks coronavirus! https://twitter.com/mynameisbien/status/1238663470020780037
414,2020-03-14 08:25:26+00:00,It is unconscionable that Mitch McConnell is taking the weekend off and letting this coronavirus relief bill wait in the middle of a national public health emergency. You are a public servant @senatemajldr. Our nation is in crisis. Do your job. #WheresMitch
413,2020-03-14 08:53:10+00:00,"Remember Don?t Shake Hands, Bash Instead! #CoronaVirus #WashYourHands"
412,2020-03-14 13:39:02+00:00,"Here are all 40 Republicans that voted against the Coronavirus #COVID19 Relief Package ? which includes free testing for uninsured folks, and paid family leave. #VoteThemOut Remember them."
411,2020-03-14 13:44:14+00:00,"Tennessee man has 17,700 bottles of hand sanitizer and sanitizing wipes, and nowhere to sell them. He stocked up weeks ago, and was reselling on Amazon at exorbitant prices. Amazon stopped coronavirus price gouging and shut him down. "
410,2020-03-14 14:17:35+00:00,?? COVID19 ALERT ?? 4 Things You Must Not Lose During This Corona Virus Season: 1.) Your common sense 2.) Your sense of humor 3.) Your mind 4.) YOUR TRUST IN GOD!!!
409,2020-03-14 14:41:27+00:00,"The county with some of the highest rates of infection in the country is just stopping testing like that? Nothing to see here... ?plenty of tests available, everyone who needs one will have one? give me a break. #coronavirus #aspen cc @CBSDenver"
408,2020-03-14 15:14:34+00:00,CVS has been preparing us for the Corona Virus all along ???? 
407,2020-03-14 15:16:56+00:00,Coronavirus is really bringing the fascists out into the open. 
406,2020-03-14 15:54:10+00:00,Imagine trying to fight Coronavirus with wind-powered hospitals.
405,2020-03-14 15:55:23+00:00,Do you have it bad? Look at what Gen X grew up with! It?s why we have great resistance to bullshit. #GenX #CoronaVirus #Covid19 pic.twitter.com/QMkKmJYqy4
404,2020-03-14 15:59:54+00:00,Check it out! Spectrum to offer free internet access for students due to the Coronavirus. 
403,2020-03-14 16:06:41+00:00,"Time after time Donald Trump has failed the American people. For example: ?Govt Shut Down ?Coronavirus Prevention Enough is enough, he let Russia influence election and he has continuously lied to the American people. "
402,2020-03-14 16:12:36+00:00,"Just as she has each of the last 3 days, my wife woke up at 6 a.m. this morning and headed in to the hospital she works at. There?s a very real chance she gets coronavirus just doing her job, but she goes in. Every day. 6 a.m. What I?m trying to say is: my wife is a goddam hero."
401,2020-03-14 16:17:12+00:00,"These Charts Break Down Who Is Most At Risk Of Dying From The Coronavirus From Collect Date up until March 14, 2020 | Study conducted by Chinese Center for Disease Control and Prevention. None of the mild or severe cases in the study were fatal. High risk are 50-80+ yr old. "
400,2020-03-14 16:30:23+00:00,"If you?ve lost work because of the coronavirus and have been interested in voice over/podcasting, please reach out- I can help with casting opportunities and training at reduced cost. Work for voice over artists hasn?t slowed down! DM me or email tawny@tawnyvoice.com #voiceover"
399,2020-03-14 16:51:10+00:00,Lady at the gym had a lil coughing episode (prob just choked on water or something) but she looked at me and this how I looked at her.... #coronavirus #COVID?19
398,2020-03-14 17:13:58+00:00,DAY 3 OF READING CORONAVIRUS NEWS 
397,2020-03-14 17:14:34+00:00,Coronavirus is basically the episode of spongebob when the butterfly escaped from Sandy?s house and everyone started freaking the fuck out.
396,2020-03-14 17:18:23+00:00,#NEW on @OANN: Pres. @realDonaldTrump says his administration and the @WhiteHouse coronavirus task force are ?using the full power of the federal government to defeat the virus.? 
395,2020-03-14 17:44:54+00:00,"If you grew up in Finley, Benton City, or Burbank and drank from the hose I?m pretty sure you?re immune to the Coronavirus"
394,2020-03-14 18:23:15+00:00,"Today I think about all the nurses, doctors, and medical professionals that will be putting themselves at risk over the next several weeks. Thank you to those who are working on the frontlines against this virus. #coronavirus"
393,2020-03-14 18:47:49+00:00,Situation is getting serious! Have some laughs amidst this crisis folks! #COVID19 #coronavirus 
392,2020-03-14 19:07:55+00:00,"the doctor told my mom has all symptoms of coronavirus. she?s traveled recently. after hours of being on hold she was told they are only offering tests to severe cases and people 65+. conclusion: there are a lot more people who have coronavirus than the confirmed cases ? at Torrance, CA"
391,2020-03-14 20:03:32+00:00,"[West Coast Best Coast & ALL #PhysEd Community Members] Tuesday, March 17th ?? at 5pm PST your #ESPEchat crew will be tag teaming the chat with questions ? inspired by many of our new situations with #remotelearning due to the novel corona virus ?? update ?? #HPEatHome"
390,2020-03-14 20:04:22+00:00,"Homeless families as part of @ReclaimingHomes are out in El Sereno to emphasise the scandal of homelessness in Los Angeles. Nearly 60,000 people in L.A. County are homeless during a public health emergency #reclaimla #housingisahumanright #healthcareisahumanright #coronavirus "
389,2020-03-14 20:11:47+00:00,"I'm proud to be from a state that takes action against the #COVID19 virus. If you need child care, food, supplies, or think you might need a #Coronavirus test give the appropriate number a call. Stay safe! "
388,2020-03-14 20:35:46+00:00,"As Gov issues order to use California hotels for #coronavirus-related emergencies, will that include the Beverly Hills Hotel, Beverly Wilshire, etc? https://www.latimes.com/california/story/2020-03-12/california-governor-gavin-newsom-hotels-medical-facilities-patients-meeting-requirements. #ReclaimLA"
387,2020-03-14 20:39:17+00:00,Partying with the corona virus be like 
386,2020-03-14 20:42:56+00:00,?? Great news to report: the two sons and husband of the woman I interviewed a couple of weeks ago (see below) who tested positive for Coronavirus/COVID-19 are all on the mend. Their family says things are looking good. @CBSLA
385,2020-03-14 20:51:27+00:00,"My quarterly call with my investors: ?As you all know demand has been soft because of the coronavirus. I?ve dipped heavily into my Twitter drafts folder which, let?s be clear, was the right thing to do. On the other hand, ?days toilet paper on hand? remains strong.?"
384,2020-03-14 20:57:59+00:00,The coronavirus ain't gone kill my mans but a massive heart attack due to high blood pressure from all that damn sodium will for sure. 
383,2020-03-14 20:59:57+00:00,How your body fights the Corona virus 
382,2020-03-14 21:02:39+00:00,SFUSD parents please read! San Francisco is trying to help you with emergency childcare and food while school is closed because of coronavirus. Check to see if your kids are eligible! 
381,2020-03-14 21:25:04+00:00,Alex doesn?t wanna chill tomorrow morning bcuz he thinks i have the corona virus. I hate it here ??
380,2020-03-14 21:25:08+00:00,"The coronavirus relief bill guarantees sick leave only to about 20% of workers. Big employers aren?t required to provide any paid sick leave, while companies with fewer than 50 employees can seek hardship exemptions. That?s what Trump and the GOP demanded. "
379,2020-03-14 21:38:20+00:00,Send us links to buy your #smallbiz swag! @CitizensEdmond is open normal hours &amp; we?d love to outfit our team w/ local biz gear &amp; support you during this trying time! #coronavirus #1okc #edmond
378,2020-03-14 21:41:18+00:00,If you?ve ever drank jungle juice at a house party you?re immune to the Coronavirus
377,2020-03-14 21:58:14+00:00,let?s stop talking about this corona virus girl and talk about me ??? 
376,2020-03-14 22:43:22+00:00,City Attorney Mike Feuer on price gouging! #pricegouging #COVID?19 #coronavirus 
375,2020-03-14 22:46:39+00:00,FUCK the corona virus my ex was WAY more toxic ????????????????????????????????????????????????????????????????????????????????????
374,2020-03-14 23:12:03+00:00,"feel like it's only a matter of time before trisha paytas uploads ""I tested POSITIVE for CORONAVIRUS... (scary)"" and it's just a 23 min video about how she sneezed yesterday"
373,2020-03-14 23:52:20+00:00,Only in Omaha. I was listening to the Douglas Co. Health Dept. discuss its first case of #coronavirus community spread while walking the dog. The doomsday plane then flew overhead. It made me laugh to be honest.
372,2020-03-15 00:03:23+00:00,LIVE NOW: #CBSNDenver is originating the stream for #CBSN worldwide with anchor @AndreaFloresTV. CBS headquarters in New York is closed for cleaning after four employees tested positive for coronavirus. Watch live here: https://denver.cbslocal.com/live/cbsn-denver/ or at https://www.cbsnews.com/
371,2020-03-15 00:05:56+00:00,"Customer at @costco in Venice, CA dressed in what appears to be some kind of hazmat suit. #coronavirus @FOXLA ? at Costco"
370,2020-03-15 00:17:06+00:00,Corona virus got us going 0-2 at target like.... #lowainlife #gbfv ? at Target
369,2020-03-15 00:36:26+00:00,"Then how come both Governors Newsom and Cuomo, both liberal Democrats who spoke to them personally, both praised their handling of the coronavirus, Doug? "
368,2020-03-15 00:46:32+00:00,In two weeks we are all going to forget the coronavirus even happened..
367,2020-03-15 00:48:20+00:00,If it looks like we?re sitting farther apart... we are! And it?s not because @abc7jory has cooties. Practicing #socialdistancing while anchoring the news on @ABC7 tonight. Do what you can to keep safe ?? #coronavirus 
366,2020-03-15 00:56:07+00:00,"Oh my lanta, this was all before 10am today #coronavirus #Costco #cypress"
365,2020-03-15 00:57:31+00:00,It?s peak 2020 that the same people who dismissed the seriousness of the coronavirus now have the speediest access to the coronavirus test. 
364,2020-03-15 01:27:19+00:00,"Hello if anybody is out there please respond, it?s been 23 days since the Coronavirus outbreak and i have just depleted the last of my toilet paper in my underground bunker in Koreatown! I?d be willing to barter with cans of Spam if needed! Oh also I?m out of lotion......?????? "
