H1,Date,Text
530,2020-03-20 15:37:56+00:00,"""And of course, in the Senate Republican bill big corporations get a huge tax cut."""
364,2020-03-20 15:37:59+00:00,Updated Coronavirus: What you need to know today 
363,2020-03-20 15:38:02+00:00,Wow...interesting for AP teachers.
362,2020-03-20 15:38:32+00:00,"Snow glistening in sun gives us a ray of hope that spring is eventually going to show up! But while it's easy to get wrapped up in coronavirus chaos, stay calm, as anxiety &amp; fears begin to shake the foundation of our being,the power of prayer can bring us back the comfort &amp;peace! "
361,2020-03-20 15:38:35+00:00,Coronavirus is requiring people to make sacrifices for the sake of others. It?s interesting to see who is used to that concept and who is not. #COVID19
360,2020-03-20 15:38:38+00:00,"In response to the outbreak of the novel coronavirus COVID-19, the U.S. deadline for filing taxes has been moved from April 15 to July 15. "
359,2020-03-20 15:38:43+00:00,Trump didn?t just lie. Trump deliberately hyped an untested remedy that could kill people solely to enhance his image as a doer. Trump cares not one wit about the health and safety of Americans?not even his own supporters. ?@JingaloTheBird?
358,2020-03-20 15:38:44+00:00,"Insider trading, corona virus, this just keeps getting crazier"
354,2020-03-20 15:38:49+00:00,#WATCH White House coronavirus task force to brief public (8:45 a.m. PT) 
529,2020-03-20 15:38:49+00:00,#WATCH White House coronavirus task force to brief public (8:45 a.m. PT) 
357,2020-03-20 15:38:50+00:00,But Michael: HoW dO yOu KnOW thEY?LL spEnD iT on CoROnavIrUS rELIEf?!? 
356,2020-03-20 15:38:51+00:00,a 17 year old Maltese died earlier bc of the Coronavirus. i was told dogs couldn?t catch it... if anything happens to my dog the entire world will suffer the consequences.
353,2020-03-20 15:38:58+00:00,Yes! He heard me https://www.cbr.com/grrm-coronavirus-more-work-on-asoiaf/ #Gameofthrones #windsofwinter
528,2020-03-20 15:38:58+00:00,Yes! He heard me https://www.cbr.com/grrm-coronavirus-more-work-on-asoiaf/ #Gameofthrones #windsofwinter
352,2020-03-20 15:39:12+00:00,"Coronavirus lockdown dispatch: Snowy day, defrosted bagels and a Harry Potter Lego set "
527,2020-03-20 15:39:12+00:00,"Coronavirus lockdown dispatch: Snowy day, defrosted bagels and a Harry Potter Lego set "
351,2020-03-20 15:39:39+00:00,"Trump to Iran: Coronavirus Won't Save You From Sanctions"" "
526,2020-03-20 15:39:39+00:00,"Trump to Iran: Coronavirus Won't Save You From Sanctions"" "
350,2020-03-20 15:40:00+00:00,The Moore City Council issued a Proclamation of Emergency in order to combat the community spread of the coronavirus. 
525,2020-03-20 15:40:00+00:00,The Moore City Council issued a Proclamation of Emergency in order to combat the community spread of the coronavirus. 
524,2020-03-20 15:40:03+00:00,Need to talk to your kids about the coronavirus? Here's a free visual download that can help alleviate fears &amp; anxiety children may be experiencing at this time. https://bit.ly/2J3jT6i #StayHomeEd #edchat #ptchat
523,2020-03-20 15:40:04+00:00,8 ways tech pros are helping healthcare providers cope with coronavirus https://tek.io/3a17vQ1
349,2020-03-20 15:40:05+00:00,Arizona coronavirus count climbs to 58; 11 new cases on the Navajo Reservation 
522,2020-03-20 15:40:05+00:00,Arizona coronavirus count climbs to 58; 11 new cases on the Navajo Reservation 
521,2020-03-20 15:40:08+00:00,WHO officials warn US President Trump against calling coronavirus 'the Chinese virus' http://cnb.cx/2TYYsJK
348,2020-03-20 15:40:31+00:00,The Treasury secretary announced the change Friday morning.
520,2020-03-20 15:40:31+00:00,The Treasury secretary announced the change Friday morning.
347,2020-03-20 15:40:53+00:00,Wondering What Treatments and Vaccines are in the Works for Coronavirus? There's a Tracker For That 
519,2020-03-20 15:40:53+00:00,Wondering What Treatments and Vaccines are in the Works for Coronavirus? There's a Tracker For That 
518,2020-03-20 15:41:08+00:00,On @CNBC now: CEO @hillferguson shares on the impact of recent policy updates for telehealth during the coronavirus outbreak.
516,2020-03-20 15:41:32+00:00,Waymo suspends all self-driving services in light of coronavirus pandemic http://dlvr.it/RSFk22
517,2020-03-20 15:41:32+00:00,Pressure Builds on Insurers to Be Part of Coronavirus Business Solution 
515,2020-03-20 15:42:14+00:00,Ravalli County commissioners are enacting an emergency declaration over the coronavirus outbreak. 
346,2020-03-20 15:42:17+00:00,"?I think a week from now people are going to say, ?What were we thinking with that coronavirus thing??? said Rep. Phil Lyman from Blanding. Most health officials, however, say cases won't start declining soon. "
514,2020-03-20 15:42:17+00:00,"?I think a week from now people are going to say, ?What were we thinking with that coronavirus thing??? said Rep. Phil Lyman from Blanding. Most health officials, however, say cases won't start declining soon. "
345,2020-03-20 15:43:00+00:00,"He's having a daily rally on live TV, and the media is swallowing it as ""Coronavirus Task Force Briefings""."
513,2020-03-20 15:43:00+00:00,"He's having a daily rally on live TV, and the media is swallowing it as ""Coronavirus Task Force Briefings""."
344,2020-03-20 15:43:01+00:00,As heard live on one of @Radiodotcom @Entercom?s many vital all-news stations at this time of international crisis. #coronavirus 
512,2020-03-20 15:43:01+00:00,As heard live on one of @Radiodotcom @Entercom?s many vital all-news stations at this time of international crisis. #coronavirus 
336,2020-03-20 15:43:12+00:00,"Here?s video of Trump at one of his rallies a month after the briefing, calling the coronavirus a ?Democratic hoax? ? lying straight to his supporters? faces. "
343,2020-03-20 15:43:12+00:00,"I?ll be helping out at a local practice. We need all hands on deck, and extending hospital privileges to advanced practice nurses will be critical in the coming months. .@acnmmidwives #coronavirus #DoingMyPartCO .@NationalNurses"
511,2020-03-20 15:43:12+00:00,"Here?s video of Trump at one of his rallies a month after the briefing, calling the coronavirus a ?Democratic hoax? ? lying straight to his supporters? faces. "
342,2020-03-20 15:43:24+00:00,"I mean, six days before these sales you wrote this rosy op-ed for Fox News? but you were relying on actual experts on ""fake news"" channels for your own decision-making. Just resign. And take Loeffler with you."
510,2020-03-20 15:43:24+00:00,"I mean, six days before these sales you wrote this rosy op-ed for Fox News? but you were relying on actual experts on ""fake news"" channels for your own decision-making. Just resign. And take Loeffler with you."
341,2020-03-20 15:44:13+00:00,"Welcome to the life of a person with #disabilities = to society we are useless and we stay home,thanks #coronavirus hope society changes after this outcome ???????? "
340,2020-03-20 15:44:18+00:00,"This was on our local #Coronavirus subreddit. If I ever get my hands on wipes or hand sanitizer, I'm doing this! I'll stick some with a note in my mailbox too for our postal workers. ?? #BeAHelper"
339,2020-03-20 15:44:22+00:00,Doubles every three days...#coronavirus
335,2020-03-20 15:44:26+00:00,"I?d take it as a compliment! That means you are so important, you have knocked the coronavirus off the headlines for these people! Wow! It takes a lot of charisma and charm to do that. I?d be strutting around like a proud peacock!!????????."
509,2020-03-20 15:44:26+00:00,"I?d take it as a compliment! That means you are so important, you have knocked the coronavirus off the headlines for these people! Wow! It takes a lot of charisma and charm to do that. I?d be strutting around like a proud peacock!!????????."
334,2020-03-20 15:44:46+00:00,What Planet Do You Live On? NO ONE KNOWS. NO ONE! #Coronavirus
508,2020-03-20 15:44:46+00:00,What Planet Do You Live On? NO ONE KNOWS. NO ONE! #Coronavirus
338,2020-03-20 15:44:52+00:00,A massive government fund sits idle and bloated. Could lawmakers tap it for coronavirus relief? via @publicintegrity
337,2020-03-20 15:45:01+00:00,Great (but dark) article: How the Coronavirus Could Take Over Your Body 
333,2020-03-20 15:45:06+00:00,I vote for this. #coronavirus #reboot #FridayThoughts
507,2020-03-20 15:45:06+00:00,I vote for this. #coronavirus #reboot #FridayThoughts
332,2020-03-20 15:45:09+00:00,"So, you get to work from home? Here are 6 helpful tools you can use to stay productive during the #coronavirus chaos! #productivity #COVID19 #coronapocolypse #CoronaVirusUpdates #NationalEmergency http://bit.ly/2INLzMi"
506,2020-03-20 15:45:09+00:00,"So, you get to work from home? Here are 6 helpful tools you can use to stay productive during the #coronavirus chaos! #productivity #COVID19 #coronapocolypse #CoronaVirusUpdates #NationalEmergency http://bit.ly/2INLzMi"
331,2020-03-20 15:45:29+00:00,"Epidemiologist @LarryBrilliant, who warned of global unpreparedness to deal with a pandemic when he spoke at Long Now in 02017, says we can beat the novel coronavirus?but first, we need lots more testing. "
505,2020-03-20 15:45:29+00:00,"Epidemiologist @LarryBrilliant, who warned of global unpreparedness to deal with a pandemic when he spoke at Long Now in 02017, says we can beat the novel coronavirus?but first, we need lots more testing. "
504,2020-03-20 15:45:31+00:00,"16/ but the frustrating thing? Western portrayal of some countries' response to CV19 purely based on caricature. When Wuhan went under lockdown, the @washingtonpost said ""China's Coronavirus lockdown, brought to you by authoritarianism."""
503,2020-03-20 15:45:41+00:00,"Goverment employees to attend offices on alternative week, except who are associated with Coronavirus control efforts. "
330,2020-03-20 15:46:33+00:00,"We?re making it easy to get the information you need to stay safe. For regular updates about the coronavirus and the most important stories of the day, sign up for our newsletter here: http://read.medium.com/i5gvvBn"
502,2020-03-20 15:46:33+00:00,"We?re making it easy to get the information you need to stay safe. For regular updates about the coronavirus and the most important stories of the day, sign up for our newsletter here: http://read.medium.com/i5gvvBn"
329,2020-03-20 15:46:45+00:00,I am king. I command you Coronavirus to go away. 
501,2020-03-20 15:46:45+00:00,I am king. I command you Coronavirus to go away. 
328,2020-03-20 15:47:47+00:00,"18 & Last/ I'm not saying I'm 100% in favor government being able to interfere with people's daily lives in all kinds of circumstances. But I do believe, when it comes to #coronavirus, the West govs 've got ways to catch up w East govs, esp the Vietnamese government./ End/"
500,2020-03-20 15:47:47+00:00,"18 & Last/ I'm not saying I'm 100% in favor government being able to interfere with people's daily lives in all kinds of circumstances. But I do believe, when it comes to #coronavirus, the West govs 've got ways to catch up w East govs, esp the Vietnamese government./ End/"
499,2020-03-20 15:47:55+00:00,My home workstation for the next couple of weeks. I can?t wait for all this #Coronavirus noise to die down. 
498,2020-03-20 15:48:02+00:00,Thank you for partnering with us on the SAFER plan @iDueProcess ? let's protect our prisons and communities from the #coronavirus #NoPrisonPandemic
327,2020-03-20 15:49:25+00:00,Risk of ?deadly? cyberattack looms amid coronavirus outbreak https://currentnewsdigitalmarketing.wordpress.com/2020/03/20/risk-of-deadly-cyberattack-looms-amid-coronavirus-outbreak/
497,2020-03-20 15:49:25+00:00,Risk of ?deadly? cyberattack looms amid coronavirus outbreak https://currentnewsdigitalmarketing.wordpress.com/2020/03/20/risk-of-deadly-cyberattack-looms-amid-coronavirus-outbreak/
326,2020-03-20 15:49:29+00:00,NEW YORK: Governor Cuomo Says 100 Percent of Workforce Must Stay Home https://www.bloomberg.com/news/articles/2020-03-20/n-y-gov-cuomo-100-percent-of-workforce-must-stay-home #coronavirus
495,2020-03-20 15:49:29+00:00,Coronavirus pandemic impact: What is telemedicine and telehealth? https://currentnewsdigitalmarketing.wordpress.com/2020/03/20/coronavirus-pandemic-impact-what-is-telemedicine-and-telehealth-2/
496,2020-03-20 15:49:29+00:00,NEW YORK: Governor Cuomo Says 100 Percent of Workforce Must Stay Home https://www.bloomberg.com/news/articles/2020-03-20/n-y-gov-cuomo-100-percent-of-workforce-must-stay-home #coronavirus
325,2020-03-20 15:50:47+00:00,LIVE: President @realDonaldTrump and #Coronavirus Task Force Hold News Briefing 
494,2020-03-20 15:50:47+00:00,LIVE: President @realDonaldTrump and #Coronavirus Task Force Hold News Briefing 
493,2020-03-20 15:50:59+00:00,One day at a time. #coronavirus #breakfast
492,2020-03-20 15:51:52+00:00,WATCH LIVE: President Trump & the Coronavirus Task Force hold their latest briefing: http://news3lv.com/watch
324,2020-03-20 15:52:24+00:00,I'm an exchange student from Japan who live in California. I'm planning to return home asap due to coronavirus but the landlord says I need to pay the rent for the next two months until my lease expires. She rejected to refund the rent I paid for next month a few days ago. Help 
480,2020-03-20 15:52:24+00:00,I'm an exchange student from Japan who live in California. I'm planning to return home asap due to coronavirus but the landlord says I need to pay the rent for the next two months until my lease expires. She rejected to refund the rent I paid for next month a few days ago. Help 
323,2020-03-20 15:52:34+00:00,Need a break from coronavirus coverage? 
479,2020-03-20 15:52:34+00:00,Need a break from coronavirus coverage? 
322,2020-03-20 15:54:50+00:00,Is someone you know not persuaded that a fierce isolation policy (?suppression?) is right for now? This superb article??The Hammer and the Dance??makes the case better than anything else out there.
478,2020-03-20 15:54:50+00:00,Is someone you know not persuaded that a fierce isolation policy (?suppression?) is right for now? This superb article??The Hammer and the Dance??makes the case better than anything else out there.
321,2020-03-20 15:55:06+00:00,Disney Halts Construction in Central #Florida Due to Coronavirus http://ow.ly/BmTR30qqWbW #disneynews
477,2020-03-20 15:55:06+00:00,Disney Halts Construction in Central #Florida Due to Coronavirus http://ow.ly/BmTR30qqWbW #disneynews
320,2020-03-20 15:55:27+00:00,"NEW PAGE - Resources to Support Workers During the #Coronavirus Pandemic We'll keep updating this with our latest on #unemployment insurance, #PaidSickDays and #PaidLeave, protecting workers' health and safety, and more policy recs and other resources:"
319,2020-03-20 15:57:01+00:00,How to Work Remotely When Your Office Closes for Coronavirus ? Or Any Time #remotework #COVID19
476,2020-03-20 15:57:01+00:00,How to Work Remotely When Your Office Closes for Coronavirus ? Or Any Time #remotework #COVID19
318,2020-03-20 15:57:47+00:00,Day 8: Have been waiting for DAYS for this stripperwear website to send me an ill-conceived coronavirus-themed marketing email and it?s FINALLY HERE and I am so excited 
475,2020-03-20 15:57:47+00:00,Day 8: Have been waiting for DAYS for this stripperwear website to send me an ill-conceived coronavirus-themed marketing email and it?s FINALLY HERE and I am so excited 
317,2020-03-20 15:59:23+00:00,Wow. Look at that #SocialDistancing #setanexample #coronavirus 
301,2020-03-20 15:59:42+00:00,Coronavirus pandemic: Senate GOP aid bill doesn't help American workers - Business Insider 
474,2020-03-20 15:59:42+00:00,Coronavirus pandemic: Senate GOP aid bill doesn't help American workers - Business Insider 
300,2020-03-20 15:59:50+00:00,Translation
473,2020-03-20 15:59:50+00:00,Translation
299,2020-03-20 15:59:54+00:00,"I, for one, do hope he handles a lot of coronavirus And then gets put down for his nappy sucking his thumb. pic.twitter.com/6f6bJLa5kn"
472,2020-03-20 15:59:54+00:00,"I, for one, do hope he handles a lot of coronavirus And then gets put down for his nappy sucking his thumb. pic.twitter.com/6f6bJLa5kn"
298,2020-03-20 16:00:00+00:00,"Health officials across the country have sounded the alarm. In the coming weeks, we may run out of bed space for coronavirus patients. https://bit.ly/3dgQ7ZO"
453,2020-03-20 16:00:00+00:00,"Health officials across the country have sounded the alarm. In the coming weeks, we may run out of bed space for coronavirus patients. https://bit.ly/3dgQ7ZO"
278,2020-03-20 16:00:07+00:00,I?m now writing an @EversenseCGM quarterly newsletter. Here?s the first edition! And no mention of the Coronavirus. How refreshing! Pass it on! https://global.eversensediabetes.com/eversense-community-newsletter
297,2020-03-20 16:00:07+00:00,"With #concert halls and #opera houses closed due to #coronavirus, organisations and #musicians across the world are #livestreaming #concerts so that every one can still access their music. 'Quarantine soirees': classical music and opera to stream at home https://buff.ly/2UiImd6"
434,2020-03-20 16:00:07+00:00,I?m now writing an @EversenseCGM quarterly newsletter. Here?s the first edition! And no mention of the Coronavirus. How refreshing! Pass it on! https://global.eversensediabetes.com/eversense-community-newsletter
452,2020-03-20 16:00:07+00:00,"With #concert halls and #opera houses closed due to #coronavirus, organisations and #musicians across the world are #livestreaming #concerts so that every one can still access their music. 'Quarantine soirees': classical music and opera to stream at home https://buff.ly/2UiImd6"
277,2020-03-20 16:00:38+00:00,Put your people first.
433,2020-03-20 16:00:38+00:00,Put your people first.
259,2020-03-20 16:00:54+00:00,RuPaul's Drag Race queens launch digital concert festival amid coronavirus pandemic 
432,2020-03-20 16:00:54+00:00,RuPaul's Drag Race queens launch digital concert festival amid coronavirus pandemic 
258,2020-03-20 16:03:29+00:00,"Coronavirus Deaths Top 10,000 Globally; California Orders Lockdown "
414,2020-03-20 16:03:29+00:00,"Coronavirus Deaths Top 10,000 Globally; California Orders Lockdown "
257,2020-03-20 16:05:24+00:00,Pompeo just called Coronavirus the ?Chinese Virus? live on television! Thoughts?
413,2020-03-20 16:05:24+00:00,Pompeo just called Coronavirus the ?Chinese Virus? live on television! Thoughts?
240,2020-03-20 16:06:35+00:00,Just a reminder to wash your hands in a faucet for at least 20 seconds today?? #coronavirus #COVID19
412,2020-03-20 16:06:35+00:00,Just a reminder to wash your hands in a faucet for at least 20 seconds today?? #coronavirus #COVID19
195,2020-03-20 16:06:49+00:00,The town of Darien Connecticut cancelled a drive-through Coronavirus testing site because NEIGHBORS COMPLAINED 
396,2020-03-20 16:06:49+00:00,The town of Darien Connecticut cancelled a drive-through Coronavirus testing site because NEIGHBORS COMPLAINED 
239,2020-03-20 16:07:58+00:00,#coronavirus will not stop us 
395,2020-03-20 16:07:58+00:00,#coronavirus will not stop us 
238,2020-03-20 16:08:13+00:00,March birthdays : Coronavirus: 
394,2020-03-20 16:08:13+00:00,March birthdays : Coronavirus: 
237,2020-03-20 16:09:01+00:00,"?To secure the nation?s food supply, the federal government should cover all the workers who help feed us, starting in the fields with farmworkers and moving along the supply chain to slaughterhouse and warehouse workers.? https://buff.ly/3daFI1H #oped"
393,2020-03-20 16:09:01+00:00,"?To secure the nation?s food supply, the federal government should cover all the workers who help feed us, starting in the fields with farmworkers and moving along the supply chain to slaughterhouse and warehouse workers.? https://buff.ly/3daFI1H #oped"
222,2020-03-20 16:09:22+00:00,"Recap: My opponent announced he?s running for re-election at age 85 from an upside down airplane, made fun of the coronavirus ?hoax,? voted NO on the relief bill, then was implicated in the coronavirus stock scandal. Ready to join us now? http://abbybroyles.com #InsiderTrading"
379,2020-03-20 16:09:22+00:00,"Recap: My opponent announced he?s running for re-election at age 85 from an upside down airplane, made fun of the coronavirus ?hoax,? voted NO on the relief bill, then was implicated in the coronavirus stock scandal. Ready to join us now? http://abbybroyles.com #InsiderTrading"
194,2020-03-20 16:09:33+00:00,This corona virus shit been out since before Christmas. They wasn?t gon quarantine y?all during Christmas though. $$$pic.twitter.com/XxWJtKCCD7
378,2020-03-20 16:09:33+00:00,This corona virus shit been out since before Christmas. They wasn?t gon quarantine y?all during Christmas though. $$$pic.twitter.com/XxWJtKCCD7
221,2020-03-20 16:10:01+00:00,A Guide to Protecting Your Business During Coronavirus https://www.businessoffashion.com/articles/professional/a-guide-to-protecting-your-business-during-coronavirus?utm_source=twitter.com&amp;utm_medium=socialshare&amp;utm_campaign=bof via @BoF #retail
193,2020-03-20 16:13:15+00:00,Gonna tell my kids this was coronavirus 
377,2020-03-20 16:13:15+00:00,Gonna tell my kids this was coronavirus 
220,2020-03-20 16:14:44+00:00,new video strip deserted https://www.youtube.com/watch?v=sc8RzASe9KE&amp;t=2s like totally empty #coronavirus #lasvegas #strip
376,2020-03-20 16:14:44+00:00,new video strip deserted https://www.youtube.com/watch?v=sc8RzASe9KE&amp;t=2s like totally empty #coronavirus #lasvegas #strip
219,2020-03-20 16:15:28+00:00,Secretary Mike Pompeo urges Americans to be cautious of disinformation about the #Coronavirus 
375,2020-03-20 16:15:28+00:00,Secretary Mike Pompeo urges Americans to be cautious of disinformation about the #Coronavirus 
218,2020-03-20 16:16:07+00:00,My Coronavirus suit 
374,2020-03-20 16:16:07+00:00,My Coronavirus suit 
217,2020-03-20 16:16:29+00:00,"just an FYI. if you went to Chuck E. Cheese and went inside that dirty ass playground, CORONAVIRUS GOT NOTHING ON YOU!! pic.twitter.com/NuEaDIq2HI"
192,2020-03-20 16:20:02+00:00,This graphic should be one of the exhibits at the future museum that recounts the coronavirus disaster -- because future generations won't believe it unless they see it with their own eyes 
371,2020-03-20 16:20:02+00:00,This graphic should be one of the exhibits at the future museum that recounts the coronavirus disaster -- because future generations won't believe it unless they see it with their own eyes 
205,2020-03-20 16:20:46+00:00,Well with the line of work I?m in and the endless supply of shitbags I deal with on a daily basis it?s only a matter of time before I catch this damn Coronavirus ????????????? #LivingTheDream
373,2020-03-20 16:20:46+00:00,Well with the line of work I?m in and the endless supply of shitbags I deal with on a daily basis it?s only a matter of time before I catch this damn Coronavirus ????????????? #LivingTheDream
191,2020-03-20 16:26:20+00:00,"An @NBCNews staffer, Larry Edgeworth, died of #coronavirus. He worked in the equipment room &amp; as an audio tech for 25yrs. #NBC News Chairman Andy Lack said: ""Many of you were fortunate enough to work with Larry...he was the guy you wanted by your side no matter where you were.?"
370,2020-03-20 16:26:20+00:00,"An @NBCNews staffer, Larry Edgeworth, died of #coronavirus. He worked in the equipment room &amp; as an audio tech for 25yrs. #NBC News Chairman Andy Lack said: ""Many of you were fortunate enough to work with Larry...he was the guy you wanted by your side no matter where you were.?"
204,2020-03-20 16:29:18+00:00,"What will be the long-term impact of the Wuhan virus on the economy, higher education, homeschooling, jobs, American politics as we know it?"
203,2020-03-20 16:30:59+00:00,"Dhanyalakshmi braved the streets during the coronavirus pandemic to get her notebook from the office. But then, a knock came at the door. Come back Monday to find out who came to the door ?? "
202,2020-03-20 16:31:39+00:00,I just feel pure Rage. My dr just ordered a coronavirus test for me in Lee county FL. They only test 30 a day so I have to wait till next Tuesday and results 3 to 5 days. Trump is lying about everything. #TrumpLiesPeopleDie #TrumpVirusCoverup
201,2020-03-20 16:32:51+00:00,I?m tired of hearing my mom talk on the phone about the corona virus ??
190,2020-03-20 16:34:35+00:00,"Under the shadow of coronavirus, Joe Biden offers $20 billion to protect Amazon forests "
200,2020-03-20 16:35:30+00:00,senior pics ft. Corona Virus 
199,2020-03-20 16:40:04+00:00,Employees from the City of Oakland are not going door-to-door to conduct Coronavirus testing. If someone comes to your door claiming to be an employee or representative from the city or the @CDCgov you should immediately contact OPD's non-emergency number at (510) 777-3333
189,2020-03-20 16:41:52+00:00,"Walmart, the largest employer in the U.S., doesn't give paid sick leave. The coronavirus response act, signed into law yesterday, doesn't apply to to companies with 500 or more employees. So Walmart workers are unprotected. Walmart shoppers, beware. Walmart, do your duty."
369,2020-03-20 16:41:52+00:00,"Walmart, the largest employer in the U.S., doesn't give paid sick leave. The coronavirus response act, signed into law yesterday, doesn't apply to to companies with 500 or more employees. So Walmart workers are unprotected. Walmart shoppers, beware. Walmart, do your duty."
188,2020-03-20 16:42:05+00:00,"#DemCast is a platform for the people. We want to publish your #Covid_19 stories. How is this national emergency impacting you and your family? Tell us, and the world. Pass it on."
368,2020-03-20 16:42:05+00:00,"#DemCast is a platform for the people. We want to publish your #Covid_19 stories. How is this national emergency impacting you and your family? Tell us, and the world. Pass it on."
