date,username,to,replies,retweets,favorites,text,geo,mentions,hashtags,id,permalink
2020-03-11 14:42:14,DarrenEuronews,,4,28,42,"Hmmmmmm... So in Spain University deserted - closed down #CoronaVirus BUT in the bar opposite the University... via @LRuizTrullols",,@lruiztrullols,#CoronaVirus,1237750684629504001,https://twitter.com/DarrenEuronews/status/1237750684629504001
2020-03-11 10:19:41,wallacemick,,11,62,117,"Decades of Neoliberalism have undermined the Public Health Systems of every European country - this is exposed now by #coronavirus as Systems struggle to cope and there's talk of saving younger patients with older people losing out - Will Irish Health System cope? ",,,#coronavirus,1237684614795268097,https://twitter.com/wallacemick/status/1237684614795268097
2020-03-11 06:52:10,ecapobianco,IFRCAsiaPacific,0,15,24,"Useful tips to keep your mental health in good shape during this difficult #coronavirus outbreak. Remember: your mind is as critical as your body. Please take good care of it. #COVID2019 #covid19 #Covid_19 @IFRC_PS_Centre",,@IFRC_PS_Centre,#coronavirus #COVID2019 #covid19 #Covid_19,1237632391528792064,https://twitter.com/ecapobianco/status/1237632391528792064
2020-03-10 23:10:55,zelfstudie,,6,29,78,"Can distance learning be the solution for #coronavirus quarantines? Belgian universities think it is. What would you say? ",,,#coronavirus,1237516312479326211,https://twitter.com/zelfstudie/status/1237516312479326211
2020-03-10 22:03:50,Dante_Licona,,5,15,51,"Yesterday with @melismine and the help of a tripod we filmed yet another hand washing message for our @IFRC TikTok audience. So far 193k people liked it De México para el mundo. “La cumbia del #coronavirus” https://vm.tiktok.com/p1m2gt/ #COVID19",,@melismine @ifrc,#coronavirus #COVID19,1237499429470515201,https://twitter.com/Dante_Licona/status/1237499429470515201
2020-03-10 20:29:51,ecapobianco,WHO,0,7,13,"If you are a parent of school age children, a teacher or a student, please read the useful guidance note prepared by our team in @IFRC in collaboration with @UNICEF &amp; @WHO. #COVIDー19 #COVID2019 #covid19 #coronavirus ",,@ifrc @UNICEF @WHO,#COVID #COVID2019 #covid19 #coronavirus,1237475779400908808,https://twitter.com/ecapobianco/status/1237475779400908808
2020-03-10 17:31:03,ecapobianco,HelenBranswell,0,5,19,"Message of hope for today: bending the curve is possible. #COVID19 can be contained, as demonstrated by South Korea (see ) China, and Singapore. But it takes hard work &amp; huge sacrifices of governments, health personnel &amp; citizens. #coronavirus #COVID2019 @ifrc",,@ifrc,#COVID19 #coronavirus #COVID2019,1237430780273537024,https://twitter.com/ecapobianco/status/1237430780273537024
2020-03-10 13:36:08,wallacemick,PatPfp,3,11,24,"In fairness to @PatPfp he has been ahead of the curve on #coronavirus - #China has achieved great results thanks to the power of their State institutions, they bought the rest of the world extra time which we squandered - we were too slow to learn from them...",,@PatPfp,#coronavirus #China,1237371664280760320,https://twitter.com/wallacemick/status/1237371664280760320
2020-03-10 13:21:46,CarlottaGiacobb,,14,14,28,"What is France waiting for before taking some actions?#COVID19france #coronavirus #COVIDー19 @afpfr",,@afpfr,#COVID19france #coronavirus #COVID,1237368047628890114,https://twitter.com/CarlottaGiacobb/status/1237368047628890114
2020-03-10 06:25:38,mike_massy,,8,4,24,"Guys No! You cannot deal with #coronavirus as if nothing is happening out there. We don't know much about it yet, but we need to be careful. Wear your masks in order to protect yourselves and the ones around you. Safe travels to the ones who have obligations. #COVID19",,,#coronavirus #COVID19,1237263324523507712,https://twitter.com/mike_massy/status/1237263324523507712
2020-03-09 19:28:17,SeanKellyMEP,,3,4,36,"I said in interviews 2 weeks ago that votes @Europarl_EN would be illegal if all MEP’s couldn’t vote due to #coronavirus ban in #Lombardy . Guess what?Tonight EP leaders decided to cancel votes for that reason!! Bit late! Should I be in charge ? #CommonSense .#TakesAKerryman !",,@Europarl_EN,#coronavirus #Lombardy #CommonSense #TakesAKerryman,1237097898732650496,https://twitter.com/SeanKellyMEP/status/1237097898732650496
2020-03-07 19:16:19,YallaIsraelSUN,,0,6,48,"Team Israel SUN is racing to the . Our #ParisNice preview, including RIVALS, GOALS, and... The elephant in the room - #coronavirus. All here: https://www.facebook.com/515137875256442/posts/2239680829468796/",,,#ParisNice #coronavirus,1236370109050097664,https://twitter.com/YallaIsraelSUN/status/1236370109050097664
2020-03-07 12:54:31,VDombrovskis,,28,62,114,"The Commission commends the efforts of the Italian government & its citizens to contain the spread of the #Coronavirus. You have our full solidarity &amp; our thoughts go to those affected. We’re working on all fronts to support efforts to tackle the epidemic. Our letter to Italy ",,,#Coronavirus,1236274026458292230,https://twitter.com/VDombrovskis/status/1236274026458292230
2020-03-06 06:03:03,nchrysoloras,,0,20,20,"An aspect of the #coronavirus crisis that wasn’t discussed ahead of the health ministers meeting today (acc. to official brief), but which one EU official told me is terrified about is the risk of the reaching cramped refugee camps in . It would cause a humanitarian disaster",,,#coronavirus,1235808090047393793,https://twitter.com/nchrysoloras/status/1235808090047393793
2020-03-05 21:16:41,nchrysoloras,,1,10,11,"The EU-India summit this month is postponed because of #coronavirus. I also doubt the EU-China summit will go ahead. In addition to being a problem for Strasbourg’s economy, the is becoming an issue for international diplomacy.",,,#coronavirus,1235675626448785408,https://twitter.com/nchrysoloras/status/1235675626448785408
2020-03-05 21:14:34,vbenellimosell,,1,7,28,"Thinking of Italy, proud of my country that is going through a difficult period with courage,awareness,tenacity and altruism. Many thanks to the Italian doctors,nurses and researchers who work every day at their own risk to manage the #Coronavirus emergency. I'm sure we’ll manage ",,,#Coronavirus,1235675091024965638,https://twitter.com/vbenellimosell/status/1235675091024965638
2020-03-05 20:18:21,wallacemick,,2,7,20,"#EuropeanParliament Plenary moves to Brussels - decision should have been made Monday, but credit to @EP_President Sassoli, better late than never. Less credit to French Chair of #environment Committee - didn't want me to talk about Strasbourg at Exchanges on #coronavirus today ",,@EP_President,#EuropeanParliament #environment #coronavirus,1235660945508233236,https://twitter.com/wallacemick/status/1235660945508233236
2020-03-05 19:57:40,ecapobianco,,0,13,21,"#Italy has been implementing containment measures for almost two weeks but the numbers of cases &amp; deaths keep going up &amp; up. The epidemic seems to accelerate in #Germany too. Not good... #coronavirus #covid19 #coronavirusitalla @ifrc",,@ifrc,#Italy #Germany #coronavirus #covid19 #coronavirusitalla,1235655738292350976,https://twitter.com/ecapobianco/status/1235655738292350976
2020-03-05 19:16:22,Assita_Kanko,,4,7,27,"Next week we are not going to Strasbourg because of #Covid19 #Coronavirus Plenary in Brussels. #EP",,,#Covid19 #Coronavirus #EP,1235645346983948291,https://twitter.com/Assita_Kanko/status/1235645346983948291
2020-03-05 17:20:09,FerraraLaurent,ClementMarsilli,2,9,13,"Nowcasting and Forecasting macro activity using big data: Daily Chinese GDP by @Q3Techno is today about 3.5% #coronavirus #bigdata #EconTwitter",,@Q3Techno,#coronavirus #bigdata #EconTwitter,1235616100961918976,https://twitter.com/FerraraLaurent/status/1235616100961918976
2020-03-05 11:53:11,DaveKeating,SkyNewsBreak,11,9,21,"Whatever Number 10 is saying, there is rampant speculation in Brussels right now that Johnson will use #CoronaVirus as an excuse to extend #Brexit talks. How can a deal can be agreed in these circumstances? Does he really want to be dealing with two crises at once on 1 January?",,,#CoronaVirus #Brexit,1235533815524790273,https://twitter.com/DaveKeating/status/1235533815524790273
2020-03-04 20:28:22,UNDRR,,28,349,448,"#Coronavirus: Italy's death toll is 107, says Civil Protection Agency. Measures including the quarantine of 11 towns near Milan have failed to stop the spread. Italy is closing schools &amp; considering closing cinemas, theatres &amp; ban on public events #COVID19",,,#Coronavirus #COVID19,1235301077324648449,https://twitter.com/UNDRR/status/1235301077324648449
2020-03-04 19:49:24,ecapobianco,ifrc,0,6,26,"192 #RedCross &amp; #RedCrescent Societies all over the , 13 million volunteers, 500k staff. Local action, global impact. United against #COVID19 #coronavirus #Covid_19 @ifrc",,@ifrc,#RedCross #RedCrescent #COVID19 #coronavirus #Covid_19,1235291272107130887,https://twitter.com/ecapobianco/status/1235291272107130887
2020-03-03 23:22:42,UNDRR,,3,27,48,"#Coronavirus: World Bank $12 billion aid package to prioritise support to the poorest and most at-risk countries to counter the effects of #Covid_19 which has spread to more than 70 countries around the world #ResilienceForAll",,,#Coronavirus #Covid_19 #ResilienceForAll,1234982563472531457,https://twitter.com/UNDRR/status/1234982563472531457
2020-03-03 11:14:04,ecapobianco,,0,12,34,"“China’s cases of Covid-19 are finally declining. WHO explains why” must read interview with WHO Lead of the Mission to #China, Bruce Aylward. Useful suggestions for common people &amp; specialists all over the world. #coronavirus #covid19 #Covid_19 @ifrc",,@ifrc,#China #coronavirus #covid19 #Covid_19,1234799198123544576,https://twitter.com/ecapobianco/status/1234799198123544576
2020-03-03 09:56:23,SeanKellyMEP,,2,3,27,"Late yest. @EP_President cancelled all external meetings @Europarl_EN due to #coronavirus .I was hosting big @globus_h2020 event in Parl. at 9am. People had already arrived but thanks to great work by @JelenaRadakovi1 overnight, event went ahead @ThonHotels @ucddublin #Covid_19",,@EP_President @Europarl_EN @globus_h2020 @JelenaRadakovi1 @ThonHotels @ucddublin,#coronavirus #Covid_19,1234779645775695872,https://twitter.com/SeanKellyMEP/status/1234779645775695872
2020-03-03 09:36:02,jackeparrock,,3,13,11,"The declaration media representatives have to sign in order to enter the European Parliament. It is to say you’ve not been to China, Hong Kong, Iran, Italy, Japan, Singapore or South Korea in the last 14 days. h/t @elena_cavallone #Coronavirus #Covid19",,@elena_cavallone,#Coronavirus #Covid19,1234774525092519937,https://twitter.com/jackeparrock/status/1234774525092519937
2020-03-03 09:03:45,Twiplomacy,,0,9,14,"How to prevent the spread of the new #coronavirus ? A selection of public service videos from selected health ministries worldwide Which one is your favourite? #COVID19 #DigitalDiplomacy",,,#coronavirus #COVID19 #DigitalDiplomacy,1234766401958744068,https://twitter.com/Twiplomacy/status/1234766401958744068
2020-03-02 16:06:19,swiss_un,,4,14,50,"Joint briefing by the United Nations and Switzerland on #coronavirus Host country works hand in hand with @UN to protect delegates, civil servants and all the people coming to the Palais des Nations More info http://bit.ly/3amfDdL",,@UN,#coronavirus,1234510356200017920,https://twitter.com/swiss_un/status/1234510356200017920
2020-03-02 12:31:06,seanbauman,,22,16,49,"#COVID19 isn’t the only thing to fear when traveling. Crazy thing...mother and daughter traveling together and those are MOMS feet!!! #coronavirus – at Aéroport Paris-Charles de Gaulle (CDG)",,,#COVID19 #coronavirus,1234456193625706496,https://twitter.com/seanbauman/status/1234456193625706496
2020-03-02 07:12:27,UNDRR,,0,39,39,"#Coronavirus: Worldwide, there have been almost 90,000 confirmed cases of #Covid_19 with the numbers outside China growing faster than inside China. But most patients have only mild symptoms, says @WHO",,@WHO,#Coronavirus #Covid_19,1234376004715655170,https://twitter.com/UNDRR/status/1234376004715655170
2020-03-01 19:56:04,mdemeulder,liannequigley,6,24,80,"Someone should do a study about whether and how different countries are providing information about #coronavirus in their national signed languages. Significant differences in approach, speediness and quality. #covid2019 #1ntSL",,,#coronavirus #covid2019 #1ntSL,1234205785321869313,https://twitter.com/mdemeulder/status/1234205785321869313
2020-03-01 11:10:25,ChantalTV,,1,3,9,"Yesterday I overheard at a Paris Fashion Week show, while they did the Bise (kiss): “Don’t worry about my cough, I just got tested.” I’m shaking my head. #coronavirus #COVID19",,,#coronavirus #COVID19,1234073501750956032,https://twitter.com/ChantalTV/status/1234073501750956032
2020-02-29 14:51:00,VeraJourova,VeraJourova,2,15,48,"I plan to meet online platforms next week to understand better the scale of the #disinformation about #covid19 #coronavirus. We all need to work together to ensure the dissemination of reliable information. ",,,#disinformation #covid19 #coronavirus,1233766623703633920,https://twitter.com/VeraJourova/status/1233766623703633920
2020-02-28 12:24:50,alain_berset,,4,38,83,"#Coronavirus: As far as the Federal Council is concerned, the highest priority is to protect the public. For that reason it is banning large-scale events involving more than 1000 people with immediate effect. @BAG_OFSP_UFSP #COVID19",,@BAG_OFSP_UFSP,#Coronavirus #COVID19,1233367451817185282,https://twitter.com/alain_berset/status/1233367451817185282
2020-02-28 08:55:41,ecapobianco,JeremyKonyndyk,1,11,31,"This is THE thread to read to understand where we are & where the world is likely to go on #COVID19. Key message: “this virus will ""hold up the mirror"" to the health security readiness of every country it reaches. Many will not like what they see.” #coronavirus @ifrc",,@ifrc,#COVID19 #coronavirus,1233314817961840640,https://twitter.com/ecapobianco/status/1233314817961840640
2020-02-27 21:35:19,KuzmanovicA,,2,29,48,"Short, sweet & helpful , my favorite #coronavirus GIF so far! Kudos, @CDCgov ",,@CDCgov,#coronavirus,1233143599736532996,https://twitter.com/KuzmanovicA/status/1233143599736532996
2020-02-27 15:13:18,ecapobianco,,0,17,23,"“A case fatality rate of between 2% to 4% rivals & even exceeds that of the 1918 Spanish Flu pandemic, which is estimated to have killed upwards of 50 million people.” This is why #COVID19 is not “just a bad flu.” #coronavirus #pandemic https://www.statnews.com/2020/02/25/new-data-from-china-buttress-fears-about-high-coronavirus-fatality-rate-who-expert-says/ via @statnews",,@statnews,#COVID19 #coronavirus #pandemic,1233047460211240967,https://twitter.com/ecapobianco/status/1233047460211240967
2020-02-26 22:37:25,Dante_Licona,,0,11,25,"In today’s @IFRC TikTok, @ombaggio explains how #COVIDー19 spreads. https://vm.tiktok.com/bGx1Jp/ #coronavirus ",,@ifrc @ombaggio,#COVID #coronavirus,1232796840497684482,https://twitter.com/Dante_Licona/status/1232796840497684482
2020-02-26 12:10:39,VDombrovskis,,1,16,41,"Our first thoughts are with those affected by the #Coronavirus. We’re closely coordinating with Member States on measures to contain the spread of the virus. We’re also monitoring the wider fall-out on the economy - the ongoing uncertainty makes it hard to quantify at this stage ",,,#Coronavirus,1232639108213858304,https://twitter.com/VDombrovskis/status/1232639108213858304
2020-02-26 06:15:22,UNDRR,,2,22,26,"#Coronavirus: Health ministers from France, Germany, Italy and the EU Commission committed to keeping frontiers open at a meeting on Tuesday as new cases of the virus emerged throughout Europe and in central and southern Italy #COVIDー19",,,#Coronavirus #COVID,1232549700336783361,https://twitter.com/UNDRR/status/1232549700336783361
2020-02-25 04:05:02,andreasharsono,,2,8,10,"The Indonesian government is bracing for the full impact from the #coronavirus outbreak to hit its economy in around three weeks from now when the supply of key machineries and raw materials from China is expected to grind to a halt ",,,#coronavirus,1232154510384037888,https://twitter.com/andreasharsono/status/1232154510384037888
2020-02-24 19:46:15,UNDRR,,0,34,58,"#Coronavirus: “Do everything you would do to prepare for a pandemic"" says @who #ResilienceForAll",,@WHO,#Coronavirus #ResilienceForAll,1232028988748394501,https://twitter.com/UNDRR/status/1232028988748394501
2020-02-24 06:37:28,jonny_polonsky,,1,8,19,"Global research on #coronavirus disease @WHO is gathering the latest scientific findings and knowledge on #COVID-19 and compiling it in a database. Updated daily",,@WHO,#coronavirus #COVID,1231830484000428032,https://twitter.com/jonny_polonsky/status/1231830484000428032
2020-02-23 10:33:13,UNDRR,,2,32,30,"#Coronavirus: Italy - a. dozen towns in the northern regions of Lombardy and Veneto have been effectively quarantined #ResilienceForAll",,,#Coronavirus #ResilienceForAll,1231527423377842176,https://twitter.com/UNDRR/status/1231527423377842176
2020-02-22 22:28:54,gabbystern,DrTedros,1,7,17,"Vitally important for countries with fragile health systems to prepare and get support NOW in case #COVID19 arrives. Here’s @DrTedros’s statement on this pressing issue to today’s emergency meeting of @_AfricanUnion and @AfricaCDC. #Coronavirus ",,@DrTedros @_AfricanUnion @AfricaCDC,#COVID19 #Coronavirus,1231345146702286848,https://twitter.com/gabbystern/status/1231345146702286848
2020-02-13 10:42:50,EU2020HR,,0,5,20," Minister Vili Beroš with his EU colleagues at today’s extraordinary #EPSCO #Health Council dedicated to discussions on the #CoronaVirus. ",,,#EPSCO #Health #CoronaVirus,1227905966139727877,https://twitter.com/EU2020HR/status/1227905966139727877
2020-02-13 10:13:59,FinlandinEU,,2,9,16,"Minister @KristaKiuru at the extraordinary meeting of Health Ministers due to the #Coronavirus outbreak. ""I am looking forward to discuss what is at stake here. With a very good health security level, Finland is prepared to the situation."" ",,@KristaKiuru,#Coronavirus,1227898706541846528,https://twitter.com/FinlandinEU/status/1227898706541846528
2020-02-13 06:37:33,jackeparrock,,1,9,11,"While the @ECDC_EU deems the risk of #coronavirus to citizens as “low”, EU health ministers are holding a special meeting to coordinate a European response. MEPs want them to be ambitious. @Esther_de_Lange @Miriamdalli @euronews @rosiewright99",,@ECDC_EU @Esther_de_Lange @Miriamdalli @euronews @rosiewright99,#coronavirus,1227844238429376512,https://twitter.com/jackeparrock/status/1227844238429376512
2020-02-11 10:15:46,DrJayVarma,,1,19,26,".@PeterDaszak keeping the world humble about #coronavirus emergence and human infection at @WHO meeting. We don’t definitively know animal species of origin, mode of transmission from animal to humans, &amp; how to reduce risk of transmission. #nCoV – at WHO Executive Board Room",,@PeterDaszak @WHO,#coronavirus #nCoV,1227174379861180416,https://twitter.com/DrJayVarma/status/1227174379861180416
2020-02-11 07:34:05,shoffmania,,1,6,47,"Pleased to be part of today’s @WHO @GloPID_R research forum on #nCoV2019 #coronavirus with my @CIHR_IRSC colleague @CKaushic. https://www.who.int/news-room/detail/06-02-2020-who-to-accelerate-research-and-innovation-for-new-coronavirus",,@WHO @GloPID_R @CIHR_IRSC @CKaushic,#nCoV2019 #coronavirus,1227133691241140224,https://twitter.com/shoffmania/status/1227133691241140224
2020-02-08 14:30:40,mimilewissabin,SouthernRCC,0,9,17,"It is so exciting to see @AfricaCDC fully up and running and how surveillance for infectious diseases and lab capacity on the Continent is stronger every year. @AfricaCDC deserves all the support needed to be this essential hub. #2019nC0V #coronavirus ",,@AfricaCDC @AfricaCDC,#2019nC0V #coronavirus,1226151362565726209,https://twitter.com/mimilewissabin/status/1226151362565726209
2020-02-04 10:53:16,UNGeneva,,45,314,607,"“We are not in a pandemic yet. We are in an epidemic situation with multiple foci. There are currently 23 countries outside of China with reported cases. We are still very early in this outbreak.” World Health Organization @WHO provides an update on the #coronavirus outbreak. ",,@WHO,#coronavirus,1224647100878684160,https://twitter.com/UNGeneva/status/1224647100878684160
2020-01-31 12:29:57,DrAhmedZouiten,,0,6,20,"""This is the time for facts, not fear. This is the time for science, not rumors. This is the time for solidarity, not stigma."" @DrTedros of @who declares a public health emergency of international concern over the #coronavirus epidemics. http://who.int",,@DrTedros @WHO,#coronavirus,1223221880913637376,https://twitter.com/DrAhmedZouiten/status/1223221880913637376
2020-01-31 12:20:25,jasonyng,,4,15,23,"No masks anywhere we checked in Paris. #coronavirus ",,,#coronavirus,1223219483449278465,https://twitter.com/jasonyng/status/1223219483449278465
2020-01-31 12:03:33,danielsp,Alea_LdSR,0,1,2,"EU funds research on #coronavirus with strict #datasharing requirements - good example of value of both #horizon2020 and #opendata",,,#coronavirus #datasharing #horizon2020 #opendata,1223215238604038145,https://twitter.com/danielsp/status/1223215238604038145
2020-01-31 10:12:40,TadalaKaledzera,BBCBreaking,0,3,1,"More than 200 people have died, with about 9,800 infections confirmed so far.. Now #coronavirus hits the UK.. ",,,#coronavirus,1223187332154691584,https://twitter.com/TadalaKaledzera/status/1223187332154691584
2020-01-31 09:49:52,jackeparrock,,1,4,2,"NEW: British’s chief medical officer confirms two cases of #CoronaVirus in the U.K.",,,#CoronaVirus,1223181592979476482,https://twitter.com/jackeparrock/status/1223181592979476482
2020-01-31 09:10:37,juergkaufmann,,1,0,1,"Lack of respect, we should help each other instead of finger pointing. A bit of empathy and compassion, how comes that a respected media publish a racist cover? @thepointwithlx @TheEconomist #coronavirus #CoronaOutbreak",,@thepointwithlx @TheEconomist,#coronavirus #CoronaOutbreak,1223171716500901888,https://twitter.com/juergkaufmann/status/1223171716500901888
2020-01-31 08:09:29,one_by_two,radhikasan,13,144,1212,"Hahahahaha. They know. He is more dangerous than #coronavirus ",,,#coronavirus,1223156331508531205,https://twitter.com/one_by_two/status/1223156331508531205
2020-01-31 05:54:45,mwhc,,0,2,4,"Reminds me of the graphics we see in movies how fast virus spreads.. #Hollywood #coronavirus ",,,#Hollywood #coronavirus,1223122426159960068,https://twitter.com/mwhc/status/1223122426159960068
2020-01-31 01:40:30,haykk88,,11,92,182,"Update 31/01/20 - 2:30 am #coronavirus ",,,#coronavirus,1223058441855553536,https://twitter.com/haykk88/status/1223058441855553536
2020-01-30 22:33:25,jasonyng,,1,3,9,"After weeks of delay, @WHO today declared #coronavirus outbreak a “public health emergency of Int’l concern.” But it was quick to warn world governments against imposing travel restrictions on China and praise China’s handling of the outbreak as “impressive.” Beijing’s long arm? ",,@WHO,#coronavirus,1223011362412093441,https://twitter.com/jasonyng/status/1223011362412093441
2020-01-30 22:32:32,3eintelligence,,0,0,1,"What will be the impact of the #coronavirus on China’s economy and on the #ClimateEmergency ? Anyone has seen any good articles?",,,#coronavirus #ClimateEmergency,1223011138243309574,https://twitter.com/3eintelligence/status/1223011138243309574
2020-01-30 20:38:46,jasonyng,,0,8,19,"This cartoon explains very well why hospital workers are planning a strike to pressure Hong Kong leader Carrie Lam (woman talking in top frame vowing to protect the city) to implement meaningful border controls to prevent the spread of #coronavirus. ",,,#coronavirus,1222982509115342853,https://twitter.com/jasonyng/status/1222982509115342853
2020-01-30 20:31:20,kandelnirmal,DocSchmadia,2,5,27,"@Laurie_Garrett @HelenBranswell these behaviors &amp; attitude are as viral as #nCoV. We will stop and control #coronavirus but we cannot control and eliminate this kind of behavior. @DocSchmadia please kindly tell your son that we are with him all the time...",,@Laurie_Garrett @HelenBranswell @DocSchmadia,#nCoV #coronavirus,1222980638472572928,https://twitter.com/kandelnirmal/status/1222980638472572928
2020-01-30 19:04:46,MissEFC,BBCNWT,1,6,34,"Let’s bring them into Britain via Brize Norton in Oxfordshire but send them up to an already overstretched hospital that suffered an outbreak of norovirus in December, Arrowe Park ..... ‘Let’s not quarantine them down south, we’ll teach those Labour voters a lesson’ #coronavirus ",,,#coronavirus,1222958851672154112,https://twitter.com/MissEFC/status/1222958851672154112
2020-01-30 18:04:30,GK6,,1,8,15,"My 1st ever interview was with @bbcworldservice yesterday. We spoke about Artificial Intelligence in Africa. Combined with #blockchain, #IoT, #Robotic, #VisionComputing etc... There so much that can be achieved for instance predicting #coronavirus. #AI https://bit.ly/319JEKA",,@bbcworldservice,#blockchain #IoT #Robotic #VisionComputing #coronavirus #AI,1222943686708924418,https://twitter.com/GK6/status/1222943686708924418
2020-01-30 13:49:01,MikeyKayNYC,AJEnglish,3,3,12,"#CoronaVirus — death toll hits 170 in China. More than 7700 cases. Important to add a little perspective: •- China has a population of 1.4 Billion. •- 177 people died from gun violence on the first day of 2020 in America: •— 45 non-suicide gun deaths. •— 132 suicides. ",,,#CoronaVirus,1222879392063533056,https://twitter.com/MikeyKayNYC/status/1222879392063533056
2020-01-30 12:12:17,MikeyKayNYC,,0,1,2,"3. #coronavirus contd: •- Hitherto, there are no confirmed cases of the Coronavirus in Russia. •- In the last 7 days, Russian authorities have quarantined 100+ travellers from China who show suspected symptoms.",,,#coronavirus,1222855045420658688,https://twitter.com/MikeyKayNYC/status/1222855045420658688
