date,username,to,replies,retweets,favorites,text,geo,mentions,hashtags,id,permalink
2020-03-20 20:39:47,IsmayBourke,,2,3,20,"Please read This week has been incredibly tough with everyone pulling together to do their best to help stop the spread of COVID-19. We hope everyone is managing ok and staying safe and keeping diligent.",,,,1241102158923214850,https://twitter.com/IsmayBourke/status/1241102158923214850
2020-03-20 20:14:33,shrimptony,,232,215,1915,"Just found out my youngest son (Early 20's) is self isolating. He has classic Covid-19 symptoms and feeling very rough. I feel powerless; my instincts say to go to him but I know I can't for the sake of all in my household. All I can do at the moment is worry &amp; keep in touch.. ",,,,1241095805479591939,https://twitter.com/shrimptony/status/1241095805479591939
2020-03-20 19:47:39,Nakamba_11,,15,44,478,"Hope everyone is keeping safe and following the health guidelines as advised. Well done to all the health professionals keeping everyone safe during this difficult time #Covid_19",,,#Covid_19,1241089036091088896,https://twitter.com/Nakamba_11/status/1241089036091088896
2020-03-20 19:40:48,TheNaziaAhmad,,6,7,38,"Won’t lie this has been a challenging week and am so heartened by the kindness and resilience shown by my colleagues #Covid_19 Thank you for your good humour and cheer ",,,#Covid_19,1241087312597041153,https://twitter.com/TheNaziaAhmad/status/1241087312597041153
2020-03-20 19:11:09,BBCScotlandNews,,137,553,1949,"""Covid-19 is the biggest challenge of our lifetimes"" In an address to the public, First Minister Nicola Sturgeon said that she is ""now asking restaurants, cafes, pubs, gyms and cinemas to close"". More http://bbc.in/2xgfpGY #Coronavirus #CoronavirusScotland",,,#Coronavirus #CoronavirusScotland,1241079852150726660,https://twitter.com/BBCScotlandNews/status/1241079852150726660
2020-03-20 18:52:16,CRGolfClub,,0,6,15,"UPDATE REGARDING COVID-19. PLEASE READ. ",,,,1241075099958157315,https://twitter.com/CRGolfClub/status/1241075099958157315
2020-03-20 18:30:23,ot_seonaid,,6,69,154,"To my OT colleagues and to every single person in the NHS right now to Jess Turner for writing this. We do it because we care. #nhsworkers #Covid_19 ",,,#nhsworkers #Covid_19,1241069594258931715,https://twitter.com/ot_seonaid/status/1241069594258931715
2020-03-20 18:10:10,DefenceHQ,,29,306,814,"""Our soldiers, sailors, marines, airmen and airwomen have always stood ready to help in tough times."" Chief of the Defence Staff General Sir Nick Carter has explained how the Armed Forces stand ready to support public services during the coronavirus outbreak. #Covid_19 ",,,#Covid_19,1241064502923313154,https://twitter.com/DefenceHQ/status/1241064502923313154
2020-03-20 18:08:43,ahmedhankir,,100,74,1721,"It's with a heavy heart I bid farewell to the Anxiety Disorder Residential Unit at the Bethlem The Unit closed down as a preventive measure against COVID-19 I'm to be redeployed on Monday to a ward where there's a shortage of doctors due to illness Ready to report for duty! ",,,,1241064137951772673,https://twitter.com/ahmedhankir/status/1241064137951772673
2020-03-20 18:04:06,em_inkydink,,12,105,296,"How can UK govt gaurantee 80% upto 2500 of income for PAYE workers and ignore the millions of us who are self employed and have paid NI and income tax all of our working lives. Its an absolute disgrace #Covid_19 #selfemployed",,,#Covid_19 #selfemployed,1241062979199815681,https://twitter.com/em_inkydink/status/1241062979199815681
2020-03-20 18:00:45,moneylongggg,,23,369,1445,"Day 8 without football with the gang: #StayAtHomeChallenge #Covid_19 ",,,#StayAtHomeChallenge #Covid_19,1241062133607129091,https://twitter.com/moneylongggg/status/1241062133607129091
2020-03-20 17:56:23,AckersAdventure,,0,2,2,"COVID-19 Announcement ",,,,1241061035471241217,https://twitter.com/AckersAdventure/status/1241061035471241217
2020-03-20 17:53:14,DerbyChrisW,,27,251,470,"During #Covid_19 crisis we should demand Govt: * Underwrites wages for workers laid off * bans evictions * Outlaws utilities disconnections * Suspends benefit sanctions * Halts jobcentre interviews * Increases SSP * Extends SSP eligibility to all workers, including self-employed",,,#Covid_19,1241060243204976645,https://twitter.com/DerbyChrisW/status/1241060243204976645
2020-03-20 17:47:52,holmescyclinguk,,2,8,54,"I asked all riders I coach NOT to ride in groups from last weekend - help slow #Covid_19 and DON'T go out as a group. It's irresponsible and will get a good amount of bad press if we do. I fully support solo riding and encourage it as a way to stay mentally &amp; physically healthy.",,,#Covid_19,1241058894555811840,https://twitter.com/holmescyclinguk/status/1241058894555811840
2020-03-20 17:33:01,HYPERJAPANevent,,9,98,117,"Important announcement regarding COVID-19 and HYPER JAPAN Festival 2020 #HJ2020 #HYPERJAPAN",,,#HJ2020 #HYPERJAPAN,1241055156248236033,https://twitter.com/HYPERJAPANevent/status/1241055156248236033
2020-03-20 17:28:06,ChrisCollier79,,13,56,249,"Haters will say this is photoshopped. #RishiSunak #Covid_19 ",,,#RishiSunak #Covid_19,1241053919557685250,https://twitter.com/ChrisCollier79/status/1241053919557685250
2020-03-20 17:16:09,AdiBacelar,,149,38674,157474,"After this is all over, please remember in future job interviews to ask them what their company did to protect their employees with regards to the global COVID-19 situation. Can't be risking working for wayward companies.",,,,1241050910085840903,https://twitter.com/AdiBacelar/status/1241050910085840903
2020-03-20 17:05:13,DrNichRobson,,1,5,12,"10 top tips that may help reduce anxiety am relating to COVID-19. Instead of social distancing, let’s reframe as physical distancing and social solidarity. ",,,,1241048161193508872,https://twitter.com/DrNichRobson/status/1241048161193508872
2020-03-20 16:59:18,paulodonoghue93,,76,771,3254,"So, http://Daft.ie has confirmed: The number of one and two-bed apartments in Dublin city centre *has* jumped by 64% since the start of March. This looks to be due to the sharp drop in demand for Airbnbs. #Covid_19",,,#Covid_19,1241046670739214338,https://twitter.com/paulodonoghue93/status/1241046670739214338
2020-03-20 16:57:45,PotentOfficial,,17,238,381,"THE RHYMING GUIDE TO COVID-19 ""The virus makes you ill, but it's the government that kills you..."" Watch full video: https://youtu.be/3ZgMLgzhRao",,,,1241046281377767427,https://twitter.com/PotentOfficial/status/1241046281377767427
2020-03-20 16:34:20,SkyNewsBreak,,73,507,856,"177 people have died after testing positive for covid-19 in the UK which is an increase of 33 deaths since yesterday",,,,1241040387763994624,https://twitter.com/SkyNewsBreak/status/1241040387763994624
2020-03-20 16:19:56,nursebhopkins,,29,824,5872,"Walls built by local builders in one night to help provide separation for COVID-19 patients in our ED. Fantastic job, not all healthcare heroes wear uniforms! ",,,,1241036762392268801,https://twitter.com/nursebhopkins/status/1241036762392268801
2020-03-20 16:19:51,BritishRedCross,,5,132,199,"Social distancing is important in order to keep vulnerable people safe. Let's do what we can to protect everyone from #Covid_19. @icrc",,@ICRC,#Covid_19,1241036744168034306,https://twitter.com/BritishRedCross/status/1241036744168034306
2020-03-20 16:07:23,SkyNewsBreak,,174,1593,1961,"Northwick Park Hospital in Harrow has declared a “critical incident” due to a surge in patients with covid-19",,,,1241033606220386305,https://twitter.com/SkyNewsBreak/status/1241033606220386305
2020-03-20 15:57:45,adilray,,29,334,1110,"A doctor friend of mine at a Birmingham hospital has told me how things are tense, a colleague is on a ventilator. Those on ventilators have low chance of survival. But her biggest point: amazed at how blasé we all are and not social distancing. Let’s support our NHS. #Covid_19",,,#Covid_19,1241031180574695426,https://twitter.com/adilray/status/1241031180574695426
2020-03-20 15:38:10,RosetreesT,,3,58,62,"We are making available emergency funding for COVID-19 related research. If you have an innovative proposal that will have short-term impact, please contact us and we will consider it.",,,,1241026254784081921,https://twitter.com/RosetreesT/status/1241026254784081921
2020-03-20 15:18:43,fiona_ferg,,88,48,330,"Im in self isolation with symptoms. Called 111 two days ago with cough. Told to socially distance, no test necessary. Things changed in 24hrs. I dont know if I have Covid-19 because I was told I still won't be tested. I have no idea if my partner with asthma likely has #Covid_19.",,,#Covid_19,1241021358370443272,https://twitter.com/fiona_ferg/status/1241021358370443272
2020-03-20 15:18:01,FergalBowers,,181,326,2072,"Tánaiste Simon Coveney has launched a scathing attack on young people who are ignoring social distancing recommendations and called on members of the public to confront individuals who are not taking Covid-19 seriously.",,,,1241021181626667009,https://twitter.com/FergalBowers/status/1241021181626667009
2020-03-20 15:02:17,daniel_f_carr,,15,137,966,"The university collection of thermocyclers ready to go off to government labs to help boost the Covid-19 testing demand. ",,,,1241017222606262272,https://twitter.com/daniel_f_carr/status/1241017222606262272
2020-03-20 14:53:56,LawrenceDunhill,,463,7536,9367,"BREAKING: Major London hospital declares 'critical incident' after running out of ICU beds due to surge in Covid-19 cases One senior director in the capital just told me - 'this is f**king petrifying' Free to view ",,,,1241015122858070018,https://twitter.com/LawrenceDunhill/status/1241015122858070018
2020-03-20 14:45:18,EVAWuk,,2,75,89,"Published today: a Joint Statement on COVID 19 by national VAWG organisations, that identifies clear areas of action needed: https://www.endviolenceagainstwomen.org.uk/joint-statement-from-vawg-sector-on-covid-19/ @womensaid @Imkaan @RefugeCharity @RapeCrisisEandW @safelives_ @WelshWomensAid @RespectUK @whywomen @Womens_Aid @scotwomensaid",,@womensaid @Imkaan @RefugeCharity @RapeCrisisEandW @safelives_ @WelshWomensAid @RespectUK @whywomen @Womens_Aid @scotwomensaid,,1241012948237156354,https://twitter.com/EVAWuk/status/1241012948237156354
2020-03-20 14:36:22,sarahdigresses,,289,4703,11891,"North Manchester General Hospital Infectious Diseases ward team is here for you. Please stay home for us! @NorthMcrCO_NHS #Covid_19 #StaySafeStayHome #lovenhs #SocialDistancing #coronavirus #teamnhs",,@NorthMcrCO_NHS,#Covid_19 #StaySafeStayHome #lovenhs #SocialDistancing #coronavirus #teamnhs,1241010700400590851,https://twitter.com/sarahdigresses/status/1241010700400590851
2020-03-20 14:29:11,mscshie,,6,730,2057,"This morning, I was one of the first arrivals into Brunei to be placed in self-isolation in an ”isolation centre” as part of new measures imposed to curb the spread of Covid-19. I salute and thank all front liners, who transported me. You make me proud to call Brunei ”home”. ",,,,1241008892298932225,https://twitter.com/mscshie/status/1241008892298932225
2020-03-20 14:03:50,guardian,,133,507,1104,"When Johnson says we'll turn the Covid-19 tide in 12 weeks, it's just another line for the side of a bus | Marina Hyde ",,,,1241002514381758464,https://twitter.com/guardian/status/1241002514381758464
2020-03-20 14:03:03,SpringerNature,,3,132,128,"To support the rapid and wide dissemination of research during the coronavirus (COVID-19) outbreak, Springer Nature authors can now use our Research Data Support service for COVID-19 data at no cost. ",,,,1241002316611948547,https://twitter.com/SpringerNature/status/1241002316611948547
2020-03-20 13:53:10,sazarobinson,,0,0,5,"Class of COVID-19 ",,,,1240999828080988163,https://twitter.com/sazarobinson/status/1240999828080988163
2020-03-20 13:43:18,CPFC,,5,39,197," Club Head of Sports Medicine, @sportsdrzaf, has given guidance on how to maintain good physical health whilst social distancing or self-isolating during the COVID-19 outbreak. #CPFC | @PalaceForLife",,@sportsdrzaf @PalaceForLife,#CPFC,1240997343723433987,https://twitter.com/CPFC/status/1240997343723433987
2020-03-20 13:36:28,OxVent,,72,1368,1633,"We are building a rapid prototype Ventilator for COVID - 19. If you want to help, at any UK University, then get in touch. Our aim is Open Source, Highly healthcare integrated technology. One Biomedical Engineering community.",,,,1240995627493924865,https://twitter.com/OxVent/status/1240995627493924865
2020-03-20 13:34:22,CommunitiesNI,,5,136,77,"COVID-19: Financial support available ",,,,1240995096713220097,https://twitter.com/CommunitiesNI/status/1240995096713220097
2020-03-20 13:33:21,richardhorton1,,97,1392,1964,"“The hospitals in London are overwhelmed.” “The public and media are not aware that today we no longer live in a city with a properly functioning western healthcare system.” Patients with suspected COVID-19 are being mixed with non-COVID-19 patients.",,,,1240994842831982592,https://twitter.com/richardhorton1/status/1240994842831982592
2020-03-20 13:16:06,TruthJavelin,,1,1,6,"COVID-19 Family Isolation-Day 1 ",,,,1240990502117351425,https://twitter.com/TruthJavelin/status/1240990502117351425
2020-03-20 12:59:31,CCI_Ltd,,0,2,2,"‘COVID-19 Company Up-Date’ - Clement Clarke’s HQ and manufacturing facility remains open ",,,,1240986328960991237,https://twitter.com/CCI_Ltd/status/1240986328960991237
2020-03-20 12:42:40,Jake_Hanrahan,,55,239,996,"Blown away by the amount of people talking about China’s response to Covid-19 as some kind of model to follow. Are you serious? They have disappeared at least two whistleblowers and hid news of the problem for weeks before it became impossible to do so.",,,,1240982086682644485,https://twitter.com/Jake_Hanrahan/status/1240982086682644485
2020-03-20 12:07:48,acslmPresident,,6,215,121,"Our #medicalscientists are reporting shortages of #viral lysis buffer. Reagents for laboratory testing for #Covid_19 are in huge demand. If anyone in the science community has any to spare could they DM me or @ACSLM1 Míle mile buíochas. Can you also RT far and wide to pharma etc",,@ACSLM1,#medicalscientists #viral #Covid_19,1240973310911041537,https://twitter.com/acslmPresident/status/1240973310911041537
2020-03-20 12:03:05,NdemicCreations,,7,3,37,"With healthcare facilities already crowded, experts are concerned about the impact COVID-19 could have on Afghanistan. https://buff.ly/2wigWvI",,,,1240972124673769472,https://twitter.com/NdemicCreations/status/1240972124673769472
2020-03-20 11:59:47,JasonPJG,,9,20,65,"So, it looks like #Hydroxychloroquine has a 100% success rate treating COVID 19. Let's mass-produce , trial through April and get back to our lives in May. Most people seem to recover within six days so if enough get it today we'll know a lot more this time next week. Plan?",,,#Hydroxychloroquine,1240971296709754883,https://twitter.com/JasonPJG/status/1240971296709754883
2020-03-20 11:46:11,LCMActing,,2,26,44,"Due to unfortunate circumstances surrounding the ongoing case of COVID-19. It seems our graduate showcase may be cancelled. With that in mind our talented bunch of third years are seeking representation! The thread below contains everyone’s Spotlight/Showreel/Emails ",,,,1240967871330750464,https://twitter.com/LCMActing/status/1240967871330750464
2020-03-20 11:45:48,stonewalluk,,3,102,171,"In these uncertain times, LGBT organisations across the country are providing a lifeline to our communities. Whatever the issue, we're all here to help and put solidarity into action. Here are some ways we can help you - and how we can all help each other.",,,,1240967777416028160,https://twitter.com/stonewalluk/status/1240967777416028160
2020-03-20 11:26:30,Emidio24005437,,1,5,3,"TO ""NEVER NEVER NEVER "" FORGET...!!!! #Covid_19 #iorestoincasa",,,#Covid_19 #iorestoincasa,1240962919732588546,https://twitter.com/Emidio24005437/status/1240962919732588546
2020-03-20 11:12:36,jambuc33,,9,44,80,"My lecture at North Middlesex hospital. Thanks for the invite and thanks to the education team there for doing this video. #covid19",,,#covid19,1240959419967561728,https://twitter.com/jambuc33/status/1240959419967561728
2020-03-20 11:03:58,carnsoreboxer,,38,12,1430,"#Covid_19 #UPDATE Confirmation that both of mums carers have TESTED NEGATIVE",,,#Covid_19 #UPDATE,1240957248433786880,https://twitter.com/carnsoreboxer/status/1240957248433786880
2020-03-20 09:59:49,Rethink_,,2,209,173," In light of the #CoronavirusOutbreak, we have set up a new online hub on our website. It will provide practical support and information that is useful for people living with mental illness - or their carers - in regards to #COVID19 ",,,#CoronavirusOutbreak #COVID19,1240941105094549506,https://twitter.com/Rethink_/status/1240941105094549506
2020-03-20 09:41:59,Max11Anderson,,2,30,339,"2020 with no context #classof2020 #Covid_19 ",,,#classof2020 #Covid_19,1240936616451080192,https://twitter.com/Max11Anderson/status/1240936616451080192
2020-03-20 08:51:59,JustPark,,8,265,160,"Calling all driveway owners, the @NHS needs your help! If you live near a hospital, we’re calling on you to help alleviate the surging demand on parking for NHS staff and patients. Join the movement: https://hubs.ly/H0nJZMx0 #parkingforhealthcare #Covid_19",,@NHS,#parkingforhealthcare #Covid_19,1240924032532451329,https://twitter.com/JustPark/status/1240924032532451329
2020-03-20 08:50:17,Adelphi_Group,,0,0,4,"A Coronavirus (COVID-19) update from Adelphi - business as usual! https://www.adelphi.uk.com/2020/03/19/coronavirus-covid-19-update-business-as-usual/",,,,1240923605292253184,https://twitter.com/Adelphi_Group/status/1240923605292253184
2020-03-20 08:36:53,mikegalsworthy,,491,962,4276,"Iain Duncan Smith said a Universal Basic Income to tackle Covid-19 would be a ""disincentive to work"". I’ve never encountered such little faith in Britain. Has he no belief in our fellow countrymen &amp; women to rise to the challenge in times of emergency?",,,,1240920231553490945,https://twitter.com/mikegalsworthy/status/1240920231553490945
2020-03-20 08:06:32,wee_gibbon,,0,17,15,"I've been told labs involved with testing for covid-19 in Ireland are running short on lysis buffer. If anyone can source some get in contact with @ACSLM1 and let them know!",,@ACSLM1,,1240912597232365570,https://twitter.com/wee_gibbon/status/1240912597232365570
2020-03-20 08:01:28,gavreilly,,77,1125,1703,"“Here they’re calling it it the apocalypse… and this is what it looks like.” Everyone - I mean, everyone - should watch this piece from @ramsaysky in Bergamo, Italy. #COVID19italia",,@ramsaysky,#COVID19italia,1240911320750448641,https://twitter.com/gavreilly/status/1240911320750448641
2020-03-20 07:09:20,SkyNews,,55,267,247,"Coronavirus: Italy's hardest-hit city wants you to see how COVID-19 is affecting its hospitals ",,,,1240898202045480960,https://twitter.com/SkyNews/status/1240898202045480960
2020-03-20 06:59:23,PGeeman,,5,171,317,"Scriptures to meditate on during COVID-19. ",,,,1240895697572040705,https://twitter.com/PGeeman/status/1240895697572040705
2020-03-20 00:35:04,JayDahlhoff,,3,22,25,"The realities of working in a pharmacy during the COVID-19 pandemic #coronavirus #pharmacy #frontline #StayAtHome #coronavirusuk",,,#coronavirus #pharmacy #frontline #frontline #StayAtHome #coronavirusuk,1240798981590048773,https://twitter.com/JayDahlhoff/status/1240798981590048773
2020-03-20 00:18:57,dickonb,,0,22,30,"Please continue to send me anonymised quotes from children & young people reflecting the actual anxieties surrounding Covid-19 that they are reporting. We're using these to develop evidence based materials to support parents/carers in talking with, &amp; helping young people @AFNCCF",,@AFNCCF,,1240794924313915393,https://twitter.com/dickonb/status/1240794924313915393
2020-03-20 00:11:04,educationgovuk,,238,1235,876,"At the end of the day on Friday, educational settings in England will close to all except the most vulnerable children & children of critical workers who would otherwise need to stay home. More info & who key workers are here http://ow.ly/2NDn50yQygZ #coronavirus",,,#coronavirus,1240792942559756289,https://twitter.com/educationgovuk/status/1240792942559756289
2020-03-19 22:26:28,ChanWeika,,0,0,3,"!!COVID-19!! ",,,,1240766617925099525,https://twitter.com/ChanWeika/status/1240766617925099525
2020-03-19 21:21:30,OMFSSatish,,0,22,48,"Proud of NHS. My friends from Queen Victoria Hospital, East Grinstead #EastGrinstead. Love this message. Stay safe. Stay at home, prevent spread of COVID 19 virus. pic.twitter.com/uz37EUwTwZ",,,#EastGrinstead,1240750268393951233,https://twitter.com/OMFSSatish/status/1240750268393951233
2020-03-19 21:20:13,odzmoneyy,,6,94,248,"Covid-19 can’t knock the hustle #covid19UK",,,#covid19UK,1240749944417517568,https://twitter.com/odzmoneyy/status/1240749944417517568
2020-03-19 21:19:40,FrRobbieOCall,,0,5,24,"Printable Rosary Guide for the COVID-19 pandemic https://wherepeteris.com/printable-rosary-guide-for-the-covid-19-pandemic/ via @mfjlewis",,@mfjlewis,,1240749806114480129,https://twitter.com/FrRobbieOCall/status/1240749806114480129
2020-03-19 20:48:30,bfiben,,1,97,120,"Please share - our @BFI coronavirus Q&amp;A for industry is now up. This will be frequently updated as we gather more info",,@BFI,,1240741964716355600,https://twitter.com/bfiben/status/1240741964716355600
2020-03-19 20:45:18,pdinfocus,,10,3,123,"Thanks to the ED team @Leic_hospital for making the decision for me not work clinically during the #Covid-19 pandemic. This was difficult for me to make as I weighted up living with #Parkinsons and working as an #emergencymedicine doctor even if in the ED Observation Ward. #NHS",,@Leic_hospital,#Covid #Parkinsons #emergencymedicine #NHS,1240741159401635841,https://twitter.com/pdinfocus/status/1240741159401635841
2020-03-19 20:35:37,GorillaoJustice,,138,202,656,"I’m pretty forgiving for a cop. I’m proud that I’ve been as impartial as I can but today I’ve just lost it. An 81 year old with dementia has had £400 stolen from him by someone saying that they’d buy his shopping for him to stop him getting Covid-19. Unforgivable.... ",,,,1240738719734398977,https://twitter.com/GorillaoJustice/status/1240738719734398977
2020-03-19 19:46:55,fintan_03,,1,2,32,"scientists: *cure covid-19* covid-20: ",,,,1240726463843893250,https://twitter.com/fintan_03/status/1240726463843893250
2020-03-19 19:10:20,DHSCgovuk,,326,2149,3551,"UPDATE on coronavirus (#COVID19) testing in the UK: As of 1pm on 19 March, a total of 64,621 have been tested: 61,352 negative. 3,269 positive. 144 patients who tested positive for coronavirus (COVID-19) have sadly died. The digital dashboard will be updated later today. ",,,#COVID19,1240717258013306880,https://twitter.com/DHSCgovuk/status/1240717258013306880
2020-03-19 18:48:31,AberavonRFC,,3,55,221,".@AberavonRFC players to volunteer with @AgeConnectsNPT to help the elderly in need in our town. ""At times like this communities need to pull together and remain strong"", Chairman Andrew V John. Full story here ",,@AberavonRFC @AgeConnectsNPT,,1240711769280131072,https://twitter.com/AberavonRFC/status/1240711769280131072
2020-03-19 18:36:51,chiwithaC,,4,56,822,"there could be 100 people in a room and 99 don’t have COVID-19 but all it takes is just 1 ",,,,1240708831610458112,https://twitter.com/chiwithaC/status/1240708831610458112
2020-03-19 17:52:07,SkyNewsBreak,,105,630,1020,"Officials says 427 more people have died in Italy bringing the total number of deaths in the country to 3,405 meaning Italy has now overtaken China as the country with the most recorded COVID-19 deaths",,,,1240697576032055296,https://twitter.com/SkyNewsBreak/status/1240697576032055296
2020-03-19 17:22:11,robabdul,,18,389,874,"PLEASE follow all the safety advice Thank you #NHS Staff Xx #Covid_19 #CoronaVirusUpdate",,,#NHS #Covid_19 #CoronaVirusUpdate,1240690042936291328,https://twitter.com/robabdul/status/1240690042936291328
2020-03-19 17:11:31,jpwarchaeology,,18,141,461,"Decided to make #VirtualSiteVisit a daily event. Will post recollection from 20-odd years as an archaeologist every day for duration of covid-19 self-isolation period on Twitter &amp; website. Trying to bring some light &amp; positivity to those trapped inside :-) ",,,#VirtualSiteVisit,1240687356690042880,https://twitter.com/jpwarchaeology/status/1240687356690042880
2020-03-19 17:09:45,ace_national,,36,535,1032,"THREAD - #Covid19 update from Arts Council England. We're focusing on two priorities now: 1. Providing government with evidence about the catastrophic impact Covid-19 is having on the cultural sector and making the case for emergency support.",,,#Covid19,1240686911510810627,https://twitter.com/ace_national/status/1240686911510810627
2020-03-19 17:02:16,WillKing2018,,0,1,5,"Another patient with severe Covid-19 recovered with the help of #Remdesivir. Keep your fingers . + ",,,#Remdesivir,1240685027597225985,https://twitter.com/WillKing2018/status/1240685027597225985
2020-03-19 16:59:01,WillKing2018,,2,3,5,"They say every cloud has a silver lining: #Remdesivir (a viral RNA POLYMERASE ENZYME INHIBITOR) (in simple English it hinders viral replication) helped a critically ill patient with severe Covid-19 in the USA get well . Here’s an extract from an interview w/ patient’s doctor: ",,,#Remdesivir,1240684213470445568,https://twitter.com/WillKing2018/status/1240684213470445568
2020-03-19 16:55:11,CWeston_Indo,,209,374,1065,"AIB is ploughing ahead with plans in May to impose maintenance fees on all customers. As part of this, it is taking away the exemption from fees for those who keep a balance of €2,500. All this despite the Covid-19 disruption.",,,,1240683247501217792,https://twitter.com/CWeston_Indo/status/1240683247501217792
