date,username,to,replies,retweets,favorites,text,geo,mentions,hashtags,id,permalink
2020-03-24 23:51:37,clarelmurphy,,2,21,34,"Heart Failure Hub Scotland #HeartFailure COVID-19 info for clinicians &amp; patients, regularly updated. Huge thanks for phenomenal support ⁦@BHFScotland⁩ ⁦@pumpinghearts⁩ ⁦@CHSScotland⁩ ⁦@Cardiomyopathy⁩ ⁦@Cardio1425⁩",,@BHFScotland @pumpinghearts @CHSScotland @Cardiomyopathy @Cardio1425,#HeartFailure,1242599983829917697,https://twitter.com/clarelmurphy/status/1242599983829917697
2020-03-24 22:24:07,richardhorton1,,31,544,632,"NHS COVID-19 UPDATE: “Totally inadequate PPE. No N95 masks. Being sent like lambs to the slaughter.” “Could you please highlight that there is still not enough PPE.” “The current policy of PPE triage is unreliable and not fit for purpose.” And this: expired supply. ",,,,1242577964216332288,https://twitter.com/richardhorton1/status/1242577964216332288
2020-03-24 22:11:48,wendyburn,,66,486,1237,"This is very interesting. Staff in China dealing with COVID didn’t want psychological intervention, they asked for more rest without interruption and enough protective supplies.",,,,1242574865489711105,https://twitter.com/wendyburn/status/1242574865489711105
2020-03-24 20:06:46,ChloeMinish,,9,0,45,"Comfort eating: Covid-19 lockdown edition ",,,,1242543398554345477,https://twitter.com/ChloeMinish/status/1242543398554345477
2020-03-24 19:20:37,MrSLightbown,,53,4,64,"So currently sat at home with symptoms of Covid 19 and feel like I've been repeatedly run over. Thought it would be helpful to share my experiences as a paraplegic in case it helps anyone else who might end up in a similar position.",,,,1242531787265490944,https://twitter.com/MrSLightbown/status/1242531787265490944
2020-03-24 19:16:58,xKTJx,,0,1,14,"Get well soon Ross McCrorie who has tested positive for COVID 19. ",,,,1242530865583882242,https://twitter.com/xKTJx/status/1242530865583882242
2020-03-24 19:01:12,Zoekappuk,,130,105,142," Here's your chance to WIN a £150 Virgin Experience Day Gift Card!* WATCH the video to find out how to enter. #Competition ends 30/03/20 at 23:59pm &amp; 1 lucky winner will be announced on 31/03. *T&amp;Cs apply. Learn more on Virgin's COVID-19 policy: https://bit.ly/2Uf9Ikh #zoek",,,#Competition #zoek,1242526898519003143,https://twitter.com/Zoekappuk/status/1242526898519003143
2020-03-24 18:53:51,burylco,BuryCouncil,0,8,9,"Five Community Hubs are being set up across Bury to target help and support to the most vulnerable and needy during the Covid-19 crisis @NCAlliance_NHS @BuryVCFA @NHSBuryCCG",,@NCAlliance_NHS @BuryVCFA @NHSBuryCCG,,1242525049644552194,https://twitter.com/burylco/status/1242525049644552194
2020-03-24 18:05:11,KeroKeroBonito,,40,53,1226,"We’re very sad to announce that due to Covid-19 and the safety measures being implemented, we will be postponing our upcoming US tour and our show in São Paulo. We will be rescheduling these dates. Stay safe. ",,,,1242512801270312960,https://twitter.com/KeroKeroBonito/status/1242512801270312960
2020-03-24 17:58:26,BlackSwimAssoc,,0,23,46,"Amid all this covid-19 madness, we’d like to take a moment to remember #ShukriAbdi - a 12 year old Somali girl who drowned in Bury last year. Thank you @nimsaden and @galdemzine for covering her inquest and story.",,@nimsaden @galdemzine,#ShukriAbdi,1242511104045170689,https://twitter.com/BlackSwimAssoc/status/1242511104045170689
2020-03-24 17:47:36,LewisMcKenzie94,,0,6,17,"Sign outside Westminster tube station along with cartons of milk, bread & fruit - “Free milk + bread from the homeless. “We don’t need it all, we want to help during covid 19.” ",,,,1242508376967393281,https://twitter.com/LewisMcKenzie94/status/1242508376967393281
2020-03-24 17:30:50,DylanHepworth05,,0,4,31,"There’s literally people dieing from Covid-19 In your country , in your city and you lot still chose to go out and meet up honestly I don’t get it at all",,,,1242504159603101697,https://twitter.com/DylanHepworth05/status/1242504159603101697
2020-03-24 17:21:41,brianklaas,,12,235,395,"Models predict that without sustained social distancing, 2.2 million Americans will die. That's the equivalent death toll of September 11th happening, every day, for 2 years. Trump should follow Boris Johnson's lead and institute a lockdown. My latest:",,,,1242501854950555649,https://twitter.com/brianklaas/status/1242501854950555649
2020-03-24 17:20:05,PrincipalBcs,,23,59,725,"Don't normally tweet like this: 2. @BloomCollegiate opened today for a pupil. Her parents are both Doctors in local hospitals, with dad key in a covid-19 ward. Worth it? Absolutely!!!! #realheroes #community",,@BloomCollegiate,#realheroes #community,1242501450674188290,https://twitter.com/PrincipalBcs/status/1242501450674188290
2020-03-24 17:08:04,Saoud_AlEshaq_,DailyCaller,2,36,300,"Ah yes, who would have thought the carbon emissions from planes is related to Covid-19.",,,,1242498426555846657,https://twitter.com/Saoud_AlEshaq_/status/1242498426555846657
2020-03-24 17:07:06,JoePorterUK,,0,5,10,".@MattHancock deserves much praise for his calm and measured leadership as Health Secretary during this crisis. He is right to thank NHS workers across the country who are the front line heroes in the war against COVID-19. #COVID19 pic.twitter.com/fffo1cZTEN",,@MattHancock,#COVID19,1242498187081981966,https://twitter.com/JoePorterUK/status/1242498187081981966
2020-03-24 16:57:19,suffolkcc,,3,92,53," HOME, BUT NOT ALONE Suffolk urged to rally together as new local COVID-19 App and phone line launched to connect volunteers and people who need help. Read more: http://www.suffolk.gov.uk/homebutnotalone #Covid19Suffolk #VolunteersAgainstCovid19",,,#Covid19Suffolk #VolunteersAgainstCovid19,1242495721988898822,https://twitter.com/suffolkcc/status/1242495721988898822
2020-03-24 16:30:56,Harlow_Manuf,,0,0,2,"To our customers and partners, Following the COVID-19 outbreak, please read the attached statement regarding the temporary trading restrictions here at Harlow Bros during these unprecedented times. ",,,,1242489083013758981,https://twitter.com/Harlow_Manuf/status/1242489083013758981
2020-03-24 16:23:52,kingstonResusT,,1,1,10,"Last Covid-19 training of the day ",,,,1242487306805809152,https://twitter.com/kingstonResusT/status/1242487306805809152
2020-03-24 15:10:34,JohnstonesDC,,2,1,5,"COVID-19 update: https://bit.ly/3dlhuBX",,,,1242468858180407296,https://twitter.com/JohnstonesDC/status/1242468858180407296
2020-03-24 22:08:23,QualityWCCG,,0,7,5,"Black Country and West Birmingham CCGs have developed a care home APP to support clinical decisions through Covid-19. It’s free to download! @HealthZone (APP Store) search Black Country!",,@HealthZone,,1242574003895762946,https://twitter.com/QualityWCCG/status/1242574003895762946
2020-03-24 21:39:27,DawnR31582858,,0,3,8,"Good to see AHP, Nurses and Medics-integrating together to support discharges from the Hospital and prevent admission in the fight against COVID-19. #REACTWL- D2A WL &amp; H@H. Keep up the good work.",,,#REACTWL,1242566723292876806,https://twitter.com/DawnR31582858/status/1242566723292876806
2020-03-24 21:34:12,CNOEngland,,23,211,257,"#COVID-19 - how can you help? 1. Can you re-join the register? https://bit.ly/2UzxTKd 2. Are you on the register &amp; working in a relevant healthcare setting? Come and join the NHS! https://bit.ly/39dmxkn Pls speak to your employers about your release. #YourNHSNeedsYou Thank you",,,#COVID #YourNHSNeedsYou,1242565405027303436,https://twitter.com/CNOEngland/status/1242565405027303436
2020-03-24 21:01:45,terrychristian,,1450,2019,11160,"I know now is not the right time to ask this , But how many of you will be blaming the excessive number of deaths we may suffer on the tory party cutting back the NHS for ten years , treating its staff like shit & ignoring the warnings from WHO experts about covid 19",,,,1242557235718430728,https://twitter.com/terrychristian/status/1242557235718430728
2020-03-24 19:25:12,BernieTranders,,11,123,494,"One of the guys that worked in our ticket office has died of covid-19. People on the railway are considered key workers so can’t stay home unless they have a medical condition. Fucking stay indoors.",,,,1242532938455175169,https://twitter.com/BernieTranders/status/1242532938455175169
2020-03-24 19:08:40,itvnews,,9,80,93,"How to become an NHS volunteer responder amid Covid-19 outbreak https://www.itv.com/news/2020-03-24/coronavirus-how-to-become-an-nhs-volunteer-responder-amid-covid-19-outbreak/",,,,1242528776711540741,https://twitter.com/itvnews/status/1242528776711540741
2020-03-24 18:58:55,JosphatGithaig6,,0,0,2,"Because of what COVID-19 has done to humanity including football, let’s continue fighting from every position. ",,,,1242526323874172934,https://twitter.com/JosphatGithaig6/status/1242526323874172934
2020-03-24 17:21:33,HARPFunerals,,0,1,2,"* Covid-19 UPDATE * ",,,,1242501821454782466,https://twitter.com/HARPFunerals/status/1242501821454782466
2020-03-24 16:43:17,hempsonslegal,,0,7,6,"Click here https://bit.ly/2wxOR3P to review relevant legal provisions to help social care providers in the current COVID-19 crisis from Hempsons’ social care team. You can also keep tabs on the legal changes via our COVID-19 portal here https://bit.ly/cv19hmp #socialcare",,,#socialcare,1242492193065127936,https://twitter.com/hempsonslegal/status/1242492193065127936
2020-03-24 16:39:40,isotopesUK,,0,0,11,"The SUERC AMS Laboratory 5MV Tandem in Covid-19 induced hibernation. ",,,,1242491283215712258,https://twitter.com/isotopesUK/status/1242491283215712258
2020-03-24 16:34:26,womensaid,,2,163,153,"We know that COVID-19 will have serious impacts on the lives of women and children. Survivors are telling us that they are feeling unsafe with the prospect of being isolated in the house with their perpetrator (1/3) ",,,,1242489966078427136,https://twitter.com/womensaid/status/1242489966078427136
2020-03-24 16:17:06,DarkNukeStudios,,0,0,0,"Important COVID-19 update regarding DarkNuke Studios ",,,,1242485603574452224,https://twitter.com/DarkNukeStudios/status/1242485603574452224
2020-03-24 14:53:51,nepssg,,0,7,9,"Patients over Profit Help for Buyers sourcing products for the Covid-19 Crisis. To support Buyers in this very difficult and stressful time our Partner, the Edge4Health has been made available to all NEP NHS Trusts, free of charge. #NEP #virtualstock #Covid-19",,,#NEP #virtualstock #Covid,1242464651939647488,https://twitter.com/nepssg/status/1242464651939647488
2020-03-24 14:51:57,SkyNewsBreak,,136,1033,2709,"India’s Prime Minister Narendra Modi has decreed a lockdown of all 1.3 billion people in the country for 21 days due to the covid-19 pandemic",,,,1242464173155442688,https://twitter.com/SkyNewsBreak/status/1242464173155442688
2020-03-24 14:47:45,CheeverstownH,,2,42,83,"Cheeverstown have put together some information on supporting someone with additional needs during the Covid-19 closures on supporting emotional health, engaging in meaningful activities, using technology, and easy read information on Covid-19. http://www.cheeverstown.ie/wp-content/uploads/Supporting-people-with-additional-needs-during-Covid-19-closures-Final-2.pdf",,,,1242463115255701505,https://twitter.com/CheeverstownH/status/1242463115255701505
2020-03-24 14:42:25,BFI,,8,311,591,"ANNOUNCED: Alongside @FilmTVCharity we have set up a new COVID-19 Film &amp; TV Emergency Relief Fund with a £1m donation from @NetflixUK to help support the film and TV community who have been directly affected by the coronavirus pandemic #BFIIndustry https://bit.ly/3dld6mt",,@FilmTVCharity @NetflixUK,#BFIIndustry,1242461772768051207,https://twitter.com/BFI/status/1242461772768051207
2020-03-24 14:30:15,GraduateUnion,,2,18,19," Many researchers face disruption and uncertainty due to COVID-19. Sign the open letter calling on UKRI to financially support students through the Coronavirus pandemic. https://docs.google.com/document/d/1Oawtie1Y_zDMwDti6GCm82vNAMPPPZrXtaCMy7pI-3Q/edit?usp=sharing",,,,1242458711546892288,https://twitter.com/GraduateUnion/status/1242458711546892288
2020-03-24 14:19:55,5aGhf,,1,9,44,"Ward 5A won’t let their high spirits be knocked down due to Covid-19 thanks to The Indian Butler – at St Bartholomew's Hospital",,,,1242456110499598336,https://twitter.com/5aGhf/status/1242456110499598336
2020-03-24 14:16:34,heartofkenthosp,,2,31,20,"Can you help us? We urgently need new or nearly new laptops to keep our hospice services running during the COVID-19 outbreak. If you are able to help us please contact Rachel Street on 01622 792200 ext 227 or email Rachel.Street@hokh.co.uk Please RT to help spread the word. ",,,,1242455267633238017,https://twitter.com/heartofkenthosp/status/1242455267633238017
2020-03-24 21:09:06,morrisroe_brian,,2,1,27,"Covid-19 boredom bringing back memories from years ago. ",,,,1242559086476091399,https://twitter.com/morrisroe_brian/status/1242559086476091399
2020-03-24 20:43:20,JENNYMHEXP,,3,6,34,"Spreading virtual hugs and not Covid-19.. Stay inside..Stay safe..Protect our NHS..Save lives.. #StayHomeSaveLives",,,#StayHomeSaveLives,1242552601289412613,https://twitter.com/JENNYMHEXP/status/1242552601289412613
2020-03-24 20:16:42,BelTel,,11,18,99,"I would accept Covid-19 help from British or Irish armies – Stormont minister https://www.belfasttelegraph.co.uk/news/northern-ireland/i-would-accept-covid-19-help-from-british-or-irish-armies-stormont-minister-39073668.html",,,,1242545898196029440,https://twitter.com/BelTel/status/1242545898196029440
2020-03-24 19:38:10,ExchangeHouseIr,,0,2,2,"Covibook from @MINDHEART.KIDS . A great resource designed to help explain and support emotions children between 2-7 years may encounter during the Covid 19 crisis https://660919d3-b85b-43c3-a3ad-3de6a9d37099.filesusr.com/ugd/64c685_319c5acf38d34604b537ac9fae37fc80.pdf",,@mindheart,,1242536202739343361,https://twitter.com/ExchangeHouseIr/status/1242536202739343361
2020-03-24 19:01:28,SCWGFL,,0,13,7,"Please see the statement below regarding the current situation with COVID-19 and finishing our league season. ",,,,1242526964642131974,https://twitter.com/SCWGFL/status/1242526964642131974
2020-03-24 18:56:30,glenrules,,2,2,7,"Raves from now on waiting for covid-19 updates: ",,,,1242525717511970817,https://twitter.com/glenrules/status/1242525717511970817
2020-03-24 17:32:45,NobbytheBobby,,4,23,93,"Today @MerseyPolice Firearms officers helped @TrussellTrust and @S_Liv_Foodbank deliver food parcels to those most in need during Covid-19 ",,@MerseyPolice @TrussellTrust @S_Liv_Foodbank,,1242504638592622593,https://twitter.com/NobbytheBobby/status/1242504638592622593
2020-03-24 17:27:48,BuryCouncil,,2,30,25,"New Community Hubs to co-ordinate help to most vulnerable during Covid-19 https://www.mynewsdesk.com/uk/bury-council/pressreleases/new-community-hubs-to-co-ordinate-help-to-most-vulnerable-during-covid-19-2985124",,,,1242503394738286592,https://twitter.com/BuryCouncil/status/1242503394738286592
2020-03-24 16:55:52,HayleyL52374705,,1,2,27,"So proud of everyone in WGH pulling together during the COVID-19 crisis! #physiotherapy #frontlineworkers #COVID19",,,#physiotherapy #frontlineworkers #COVID19,1242495356778229762,https://twitter.com/HayleyL52374705/status/1242495356778229762
2020-03-24 16:53:43,AlanRybacki,DVATW,1,2,22,"She can see CO2. Self-diagnosing COVID-19 should be a doddle.",,,,1242494816342114306,https://twitter.com/AlanRybacki/status/1242494816342114306
2020-03-24 16:46:05,churchofengland,,10,112,113,"All Church of England churches are to close with immediate effect, including for private prayer, in an effort to help limit the transmission of the coronavirus (COVID-19). Read more: ",,,,1242492897729171456,https://twitter.com/churchofengland/status/1242492897729171456
2020-03-24 16:45:56,SkyNewsBreak,,68,325,1221,"Health Secretary Matt Hancock has announced a new hospital will open in London to provide more support amid the covid-19 pandemic",,,,1242492859670040577,https://twitter.com/SkyNewsBreak/status/1242492859670040577
2020-03-24 16:08:05,ArtfulCarroll,,23,21,412,"Following last Wednesday's inevitable announcement that the best festival on earth would be cancelled, it only seemed right to start my 'Covid-19 Self Isolation Series' with a painting based on one of my photos of @glastonbury. 455 days to go! ",,@glastonbury,,1242483331507187715,https://twitter.com/ArtfulCarroll/status/1242483331507187715
2020-03-24 15:25:41,WMPolice,,29,96,150," Please take on board the direction given by the Prime Minister to stay home and not go out unnecessarily. Your local policing teams are out and about (and will be throughout) advising, reassuring and *enforcing* where necessary. #StayHomeSaveLives",,,#StayHomeSaveLives,1242472663605317633,https://twitter.com/WMPolice/status/1242472663605317633
2020-03-24 14:46:29,FilmTVCharity,,12,457,593,"ANNOUNCED! Alongside the @BFI we've set up a new COVID-19 Film and TV Emergency Relief Fund with a £1m donation from @NetflixUK to support the industry with short-term relief for workers who are directly affected by the #coronavirus. Read more&gt; https://bit.ly/3dAQFKa",,@BFI @NetflixUK,#coronavirus,1242462796933222400,https://twitter.com/FilmTVCharity/status/1242462796933222400
2020-03-24 14:20:44,RedWoman1552,,1,8,9,"According to http://gov.uk, Covid-19 is no longer classified as an HCID (High Consequence Infectious Disease). Make of that what you will. I know what I’m thinking ",,,,1242456317220007936,https://twitter.com/RedWoman1552/status/1242456317220007936
2020-03-24 14:06:03,davidicke,,87,389,653,"IS THIS REAL? 'As of 19 March 2020, COVID-19 is no longer considered to be a high consequence infectious diseases (HCID) in the UK' - http://www.gov.uk. WHAT? http://ow.ly/EmIQ30qsiH9",,,,1242452624420503553,https://twitter.com/davidicke/status/1242452624420503553
2020-03-24 14:05:23,HummusMem3s,,0,24,52,"Spread hummus not COVID-19",,,,1242452456002461696,https://twitter.com/HummusMem3s/status/1242452456002461696
2020-03-24 14:00:30,NELCouncil,,3,46,48,"If Public Health called tomorrow and said that you tested positive for COVID-19 and asked you to list all the places you'd been to and all the people you'd been in contact with over the last 14 days - would you be proud of yourself or embarrassed by your actions? Stay at home. ",,,,1242451224982695936,https://twitter.com/NELCouncil/status/1242451224982695936
2020-03-24 13:57:47,PDandHDLab,,0,1,9,"Zooming into lab life from everyone's homes in the Barker/Williams-Gray weekly lab meeting #stayathomesavelives #COVID-19",,,#stayathomesavelives #COVID,1242450542242279424,https://twitter.com/PDandHDLab/status/1242450542242279424
2020-03-24 17:00:20,Louvolite,,0,1,4,"An important notice from us amidst the COVID-19 outbreak. We hope you all stay safe and well during this time and we thank you for your ongoing support. ",,,,1242496481157943297,https://twitter.com/Louvolite/status/1242496481157943297
2020-03-24 16:54:58,GoodFinanceUK,,1,23,19,"Here's a checklist for understanding government support during COVID-19 if you're a - Social Enterprise Charity ",,,,1242495129644081154,https://twitter.com/GoodFinanceUK/status/1242495129644081154
2020-03-24 13:49:33,LHarrison8,,1,1,11,"A nice break from COVID-19 brought to you by the first signs of spring in my back garden ",,,,1242448471896064000,https://twitter.com/LHarrison8/status/1242448471896064000
2020-03-24 13:35:37,_sanjidaislam,,5,29,153,"‘To what extent was bat soup the most significant factor in leading to the outbreak of COVID-19 [25 marks]’",,,,1242444965348851713,https://twitter.com/_sanjidaislam/status/1242444965348851713
2020-03-24 13:30:49,yrreb_xela,,4,3,97,"This is how COVID-19 spreads on Roblox ",,,,1242443754637799424,https://twitter.com/yrreb_xela/status/1242443754637799424
2020-03-24 13:24:16,SAthe3rd,,25,489,2038,"“ The cases of COVID-19 are decreasing rapidly “ #Hantavirus :",,,#Hantavirus,1242442106930638848,https://twitter.com/SAthe3rd/status/1242442106930638848
2020-03-24 13:22:31,LukewarmGuy,,0,1,3,"Government: lockdown due to the COVID-19 The truth: The Hunt begins ",,,,1242441668613287936,https://twitter.com/LukewarmGuy/status/1242441668613287936
2020-03-24 13:15:17,youngepilepsy,,0,9,15,"With Purple Day coming up this week, we want to make sure we can support you in having a safe and fulfilling day, in light of the extraordinary challenge of COVID-19. Take a look at some tips on Fundraising safely this #PurpleDay ",,,#PurpleDay,1242439846490181633,https://twitter.com/youngepilepsy/status/1242439846490181633
2020-03-24 13:13:10,dublinartlife,,0,0,12,"Does your #artgallery have online activities for the public during COVID-19? Has your exhibition been closed prematurely but want to continue sharing it online? We are seeking #DublinArt galleries &amp; shows with this so we can share it on our social media. PM me so I can promote!",,,#artgallery #DublinArt,1242439315193573376,https://twitter.com/dublinartlife/status/1242439315193573376
2020-03-24 13:12:16,breconshowsec,,0,9,7,"In response to the Covid-19 Pandemic - It is with deep regret and huge disappointment that we confirm the cancellation of the 2020 Brecon County Show .. ",,,,1242439088336187394,https://twitter.com/breconshowsec/status/1242439088336187394
2020-03-24 13:09:42,RJWEngineering,,0,0,2,"COVID-19 UPDATE On behalf of our Managing Director, Bernard, please read our latest update. ",,,,1242438442056921088,https://twitter.com/RJWEngineering/status/1242438442056921088
2020-03-24 13:07:29,CGScaffolding,,1,2,10,"Covid-19 announcement ",,,,1242437882356412416,https://twitter.com/CGScaffolding/status/1242437882356412416
2020-03-24 12:59:32,jasonkillens,,13,81,563,"Today I’ve been @SwanseaUni with 101 paramedic students who we are accelerating deployment of to support our response to #Covid_19. They’ll be ready for shifts next week. Thank you all. ",,@SwanseaUni,#Covid_19,1242435884533809154,https://twitter.com/jasonkillens/status/1242435884533809154
2020-03-24 12:52:36,SkyNews,,138,169,253,"A man has died after ingesting chloroquine phosphate - believing it would protect him from #coronavirus",,,#coronavirus,1242434138537447424,https://twitter.com/SkyNews/status/1242434138537447424
2020-03-24 12:41:37,mbwales,,1,26,51,"Thread 1/3 COVID-19 UPDATE All bike parks and trails centres are now closed and access to the National Parks and AONBs is severely restricted. ",,,,1242431374616866818,https://twitter.com/mbwales/status/1242431374616866818
2020-03-24 12:41:14,vithurna,,0,0,4,"COVID-19.2: Updated resistance. Bugs removed. #Hantavirus",,,#Hantavirus,1242431276411469824,https://twitter.com/vithurna/status/1242431276411469824
2020-03-24 12:37:58,puteeismadi,,0,17,16,"My TL today : “Babe, stop” “Babe, stop” Covid-19 updates “Babe, stop” “Babe, stop” “Babe, stop”",,,,1242430456181604353,https://twitter.com/puteeismadi/status/1242430456181604353
2020-03-24 12:35:01,claire_cdavies,Lilliemaenot,22,37,955,"My mum and I were talking about people like this yesterday, hence the lockdown. Doesn't she realise that if our NHS is overwhelmed due to covid-19, there will be less beds and staff to deal with her husband's stroke? This isn't just about the virus! ",,,,1242429713601179649,https://twitter.com/claire_cdavies/status/1242429713601179649
2020-03-24 12:34:22,DigiSocialCare,,2,15,24,"We have guidance on how tech can be used by care providers during #COVIDー19. This includes how to get a robot to set up @NHSmail accounts for you &amp; your team. NHSmail users get free access to MS Teams. Page will be constantly updated:",,,#COVID,1242429551524950017,https://twitter.com/DigiSocialCare/status/1242429551524950017
2020-03-24 12:31:35,BBCNaga,,167,1149,2805,"This from one of my friends who is recovering from being hit with Covid-19. This is why it is important to take the new measures seriously. It's a long thread - but if it makes you change your attitude for the better, it can save lives. ",,,,1242428850061049859,https://twitter.com/BBCNaga/status/1242428850061049859
2020-03-24 12:13:24,elinhafdavies,,3,16,35,"Dealing with our #COVID-19 lockdown. Some of my thoughts on how about to deal with it based on my personal experience at sea.",,,#COVID,1242424271584006144,https://twitter.com/elinhafdavies/status/1242424271584006144
2020-03-24 12:09:06,law_cycle,,0,1,7,"Covid-19 Update ",,,,1242423192603578375,https://twitter.com/law_cycle/status/1242423192603578375
2020-03-24 11:39:00,rorypecktrust,,0,31,25,"Our assistance grants can now accommodate issues related to COVID-19. If you are a freelancer and need support please reach out to assistance@rorypecktrust.org",,,,1242415614943100929,https://twitter.com/rorypecktrust/status/1242415614943100929
2020-03-24 11:31:18,awseali,,0,8,10,"Cllr @stephencunnah show your support for @huwthomas_wales on Euro 6 concerns in light of the financial impact COVID-19 is having on the Taxi trade. No policy should be tabled @cardiffcouncil until agreement is reached with Unite reps. tweet @unitewales with #supportcardifftaxis",,@stephencunnah @huwthomas_Wales @cardiffcouncil @UniteWales,#supportcardifftaxis,1242413680052121603,https://twitter.com/awseali/status/1242413680052121603
2020-03-24 11:30:11,BarnsleyRecover,,2,7,12,"COVID-19 advice for people who use substances Please call Barnsley Recovery Steps for advice and support. DO NOT ATTEND AT THE SERVICE. Tel: 01226 779066 ",,,,1242413397024681984,https://twitter.com/BarnsleyRecover/status/1242413397024681984
2020-03-24 11:09:15,cupcake_aisyah,,423,19185,45779,"today my brother has been tested positive for COVID-19. May Allah protect us all. ",,,,1242408130266329088,https://twitter.com/cupcake_aisyah/status/1242408130266329088
