date,username,to,replies,retweets,favorites,text,geo,mentions,hashtags,id,permalink
2020-03-20 11:49:02,THTorguk,,0,47,69,"UPDATE. HIV & #coronavirus advice by @drmbrady. Please note we’ve updated our health information to provide greater reassurance: those on HIV treatment with a CD4 count of 200+ are not considered to have a weakened immune system. We previously stated 350+. Please read &amp; share.",,@drmbrady,#coronavirus,1240968588086870016,https://twitter.com/THTorguk/status/1240968588086870016
2020-03-20 11:38:16,murzinho89,,0,0,0,"You tell them 5fdp #coronavirus ",,,#coronavirus,1240965879866822656,https://twitter.com/murzinho89/status/1240965879866822656
2020-03-20 11:08:50,jeremycorbyn,johnmcdonnellMP,788,1947,5603,"Our #coronavirus plan to protect wages, welfare and well-being: 1) Guarantee wages so no workers or the self-employed lose their jobs 2) Increase sick pay to a rate you can live on 3) Raise benefit levels 4) Ensure no business is left to fail ",,,#coronavirus,1240958471450869760,https://twitter.com/jeremycorbyn/status/1240958471450869760
2020-03-20 11:40:57,MikeDLondon,,12,31,229,"I wish I could #BoycottWetherspoons over Tim Martin and his comments on #coronavirus, but I boycotted them years ago as they were such cr*p pubs.",,,#BoycottWetherspoons #coronavirus,1240966555695034368,https://twitter.com/MikeDLondon/status/1240966555695034368
2020-03-20 11:17:31,mathewgillings,,2,20,38,"Just had this video sent through from my Dad, one of many florists bracing for what could be a very quiet Mother’s Day this year. This is the impact of #Coronavirus on the flower industry. #BuyFlowersNotToiletPaper ",,,#Coronavirus #BuyFlowersNotToiletPaper,1240960657417220097,https://twitter.com/mathewgillings/status/1240960657417220097
2020-03-20 11:03:02,uniofeastanglia,,29,727,1541,"A portable #coronavirus test kit that takes just 50 minutes from sample to result could be available for use on NHS staff within weeks. Incredible work from UEA and @TheQuadram scientists #ThinkingWithoutBorders @Justin_OGrady",,@TheQuadram @Justin_OGrady,#coronavirus #ThinkingWithoutBorders,1240957013502439427,https://twitter.com/uniofeastanglia/status/1240957013502439427
2020-03-20 11:02:02,BDA_Dietitians,,3,107,104,"The experts from our @BDA_olderpeople have put together some top tips for helping older adults keep well during the #COVID19 outbreak. You can find more advice and information on our public webpages: http://socsi.in/hBbmJ #Coronavirus #WhatDietitiansDo",,@BDA_olderpeople,#COVID19 #Coronavirus #WhatDietitiansDo,1240956761869291521,https://twitter.com/BDA_Dietitians/status/1240956761869291521
2020-03-20 10:30:40,For_bearance,,5,41,87,"Due to #coronavirus you have to self isolate, you have a choice A quarantine with wife and family or B ",,,#coronavirus,1240948868235304960,https://twitter.com/For_bearance/status/1240948868235304960
2020-03-20 10:17:03,GdnSocialCare,,0,23,31,"*New* UK government must recognise care workers are on the #coronavirus frontline too, writes @vicrayner https://www.theguardian.com/society/2020/mar/20/care-workers-coronavirus-frontline?CMP=share_btn_tw #socialcare",,@vicrayner,#coronavirus #socialcare,1240945442487181312,https://twitter.com/GdnSocialCare/status/1240945442487181312
2020-03-20 09:51:29,FrasierHarry,,13,229,331,"Just like the 1918-1919 pandemic (Spanish Flu) that killed more in a few months than the whole of World War I, just like Ebola, HIV, MCD, and SARS, the #coronavirus started with humans using and abusing animals. Go #Vegan. And no one needs to die.",,,#coronavirus #Vegan,1240939005799260161,https://twitter.com/FrasierHarry/status/1240939005799260161
2020-03-20 09:28:12,NewportCouncil,,2,18,11,"SERVICE UPDATES Keep up to date with all the latest information and changes to services on our dedicated #Coronavirus update page. https://www.newport.gov.uk/coronavirus",,,#Coronavirus,1240933147606487040,https://twitter.com/NewportCouncil/status/1240933147606487040
2020-03-20 09:08:41,whamchatter,,2,6,24,"Memeo where for art thou? #coronavirus #CoronaCrisis #Convid19uk #CoronaVirusUpdate #followme #follow #followforfollow #followback #followgram #tagblender #followme #likeforlike #like4like #follow4follow #F4F #f4f",,,#coronavirus #CoronaCrisis #Convid19uk #CoronaVirusUpdate #followme #follow #followforfollow #followback #followgram #tagblender #followme #likeforlike #like4like #follow4follow #F4F #f4f,1240928236260990977,https://twitter.com/whamchatter/status/1240928236260990977
2020-03-20 08:57:23,SteveBakerHW,BBCBreakfast,152,587,1393,"Everyone should watch this video. There would be no shortages if everyone shopped normally. If people will not shop responsibly, even liberals like me will have to support compulsory rationing. Please shop normally for everyone's sake. #coronavirus #COVID19",,,#coronavirus #COVID19,1240925391759519744,https://twitter.com/SteveBakerHW/status/1240925391759519744
2020-03-20 08:41:25,ElaineDyson1,,9,146,164,"This advice came from a nurse on FB yesterday - long thread, but worth reading, thanks @paulapeters2 #Coronavirus Finally, some sensible advice. Good advice - this is from a nurse: “What I have seen a lot of are recommendations for how to try to avoid getting coronavirus",,@paulapeters2,#Coronavirus,1240921374983585792,https://twitter.com/ElaineDyson1/status/1240921374983585792
2020-03-20 08:31:07,NHSEngland,,178,1486,2170,"‘You can come and join our fight. You can come and join our team…#YourNHSNeedsYou’ — @CNOEngland Ruth May calls on former nurses and midwives to return to the NHS to help us support the fight against #coronavirus. ",,@CNOEngland,#YourNHSNeedsYou #coronavirus,1240918783436492800,https://twitter.com/NHSEngland/status/1240918783436492800
2020-03-20 08:11:40,tom_corby1,,49,1129,1667,"1/ Some advice on self isolation #coronavirus 7-years ago I had a stem cell transplant I was isolated for 9-months, the following is what I learnt about staying well and sane: All the below are connected and overlap:",,,#coronavirus,1240913886951477249,https://twitter.com/tom_corby1/status/1240913886951477249
2020-03-20 07:56:08,compoundchem,,17,1214,1460,"How do tests for #coronavirus work? This graphic takes a look at how current tests diagnose #COVID19: https://www.compoundchem.com/2020/03/19/covid-19-testing/",,,#coronavirus #COVID19,1240909978896138241,https://twitter.com/compoundchem/status/1240909978896138241
2020-03-20 07:55:52,DrTinarae,,4,104,115,"Very useful visual to share today. #mentalhealth #wellbeing #coronavirus ",,,#mentalhealth #wellbeing #coronavirus,1240909913360121858,https://twitter.com/DrTinarae/status/1240909913360121858
2020-03-20 07:31:40,bluredfrank,,1,22,42,"Religions everywhere #coronavirus ",,,#coronavirus,1240903819967545345,https://twitter.com/bluredfrank/status/1240903819967545345
2020-03-20 07:22:56,EtheringtonMarc,,59,5,285,"To bring much needed positive news in light of the #coronavirus I am pleased to announce Milly arrived in the world last night. Once we arrived at the hospital labour took just over an hour. Big thanks to all the #NHS staff who were amazing as was mummy #babygirl",,,#coronavirus #NHS #babygirl,1240901622793994240,https://twitter.com/EtheringtonMarc/status/1240901622793994240
2020-03-20 07:16:53,SimonHarrisTD,,305,2177,4429,"Morning all. We need to do better at social distancing. We really do. The guidelines are clear - keep your distance. And that includes when outside. This handy poster is a useful reminder. Let’s pull together by keeping apart #coronavirus #Covid19",,,#coronavirus #Covid19,1240900100609671173,https://twitter.com/SimonHarrisTD/status/1240900100609671173
2020-03-20 06:01:16,HFI1995,,1,32,55,"Around the world the message is starting to get through on containing #coronavirus ",,,#coronavirus,1240881070456950784,https://twitter.com/HFI1995/status/1240881070456950784
2020-03-20 00:11:04,educationgovuk,,238,1235,876,"At the end of the day on Friday, educational settings in England will close to all except the most vulnerable children & children of critical workers who would otherwise need to stay home. More info & who key workers are here http://ow.ly/2NDn50yQygZ #coronavirus",,,#coronavirus,1240792942559756289,https://twitter.com/educationgovuk/status/1240792942559756289
2020-03-20 06:45:10,philmatherz,,20,43,258,"The Spanish Army are helping out during the Coronavirus outbreak... #COVID19 #coronavirusuk #coronavirus #spain #espana #gay #Espanacoronavirus",,,#COVID19 #coronavirusuk #coronavirus #spain #espana #gay #Espanacoronavirus,1240892118706634752,https://twitter.com/philmatherz/status/1240892118706634752
2020-03-20 00:29:28,HelpThemHelpUs_,,4,57,60,"We are one #NHS. We can fight #coronavirus, with your help. We can get through this, together. Donate here - http://helpthemhelpus.co.uk",,,#NHS #coronavirus,1240797572731670529,https://twitter.com/HelpThemHelpUs_/status/1240797572731670529
2020-03-20 00:08:36,_Observating,,0,3,3,"100 things to do indoors with the little ones. #coronavirus #covid19UK #coronavirusuk",,,#coronavirus #covid19UK #coronavirusuk,1240792319730819078,https://twitter.com/_Observating/status/1240792319730819078
2020-03-19 23:40:46,SianBro79031269,,4,21,41,"My son, a trainee nurse,has just come off a 12 hour shift in #Coronavirus geriatric ward in a London Hospital. He’s shattered and starving. He goes to his local supermarket and sees this So thank you panic buyers! He’s looking after your loved ones and this is how you thank him ",,,#Coronavirus,1240785314953793537,https://twitter.com/SianBro79031269/status/1240785314953793537
2020-03-19 23:28:58,ryanner,,0,2,7,"Saw this on FB!! Our Phillo all masked up!! #Dublin #coronavirus ",,,#Dublin #coronavirus,1240782345063608323,https://twitter.com/ryanner/status/1240782345063608323
2020-03-19 22:45:44,WoodbridgeEmpor,,2,29,40,"We sent out over 20 FREE Books today to people in isolation or poorly with #coronavirus If you can donate to this cause we can send more books out everyday. Thanks in advance Our PayPal address is: WoodbridgeEmporium@gmail.com ",,,#coronavirus,1240771466632867842,https://twitter.com/WoodbridgeEmpor/status/1240771466632867842
2020-03-19 21:55:34,SeanLlanelli,,0,4,4," COMMUNITY DONATIONS APPEAL #Glanymor #Llanelli #Coronavirus ",,,#Glanymor #Llanelli #Coronavirus,1240758840775368705,https://twitter.com/SeanLlanelli/status/1240758840775368705
2020-03-19 21:28:00,mutch_emma,,0,2,3,"Feel like pure s**t just want football back #football #coronavirus #missingfootball",,,#football #coronavirus #missingfootball,1240751904944205825,https://twitter.com/mutch_emma/status/1240751904944205825
2020-03-19 21:01:26,Jon_Danzig,,11,137,112,"‘We can beat #coronavirus in 12 weeks,’ says @BorisJohnson, but his government still wants #emergencypowers for 2 YEARS via its #CoronavirusBill. Read my report on Facebook http://bit.ly/3dg2eGs or LinkedIn http://bit.ly/2Wtf7af #COVID19",,@BorisJohnson,#coronavirus #emergencypowers #CoronavirusBill #COVID19,1240745219689197568,https://twitter.com/Jon_Danzig/status/1240745219689197568
2020-03-19 21:00:00,DHSCgovuk,,138,853,1310,"#DidYouKnow: if you're self-isolating, even without symptoms, you can receive statutory sick pay, from day 1 of isolation. More info: https://www.gov.uk/government/publications/support-for-those-affected-by-covid-19/support-for-those-affected-by-covid-19 #coronavirus ",,,#DidYouKnow #coronavirus,1240744856953032704,https://twitter.com/DHSCgovuk/status/1240744856953032704
2020-03-19 19:51:48,SheridanAlcock,,57,34,189,"So sorry I'm not online much I am on 14days self isolating after my son felt ill Sat then it's hit me like a ton of bricks. It's horrible the IV team wouldn't do my bloods&amp; surgeon's appointment was cancelled. Life is on hold. Please be safe everyone. #coronavirus",,,#coronavirus,1240727692095389699,https://twitter.com/SheridanAlcock/status/1240727692095389699
2020-03-19 19:16:07,BBCNWT,,5,64,405,"Happy 84th Birthday Bernard! These Bramhall neighbours stood at their window to sing happy birthday to their friend in isolation. #coronavirus ",,,#coronavirus,1240718713835356170,https://twitter.com/BBCNWT/status/1240718713835356170
2020-03-19 19:06:26,joannaccherry,,1062,3224,9055,"If @BorisJohnson thinks we can “send the #coronavirus virus packing” in 12 weeks how can he justify taking such extraordinary sweeping #EmergencyPowers for 2 years? I am genuinely puzzled &amp; will be co-sponsoring a probing amendment on this issue",,@BorisJohnson,#coronavirus #EmergencyPowers,1240716277825576964,https://twitter.com/joannaccherry/status/1240716277825576964
2020-03-19 18:52:11,DefraGovUK,,18,87,121,"In response to the #coronavirus the government has announced new measures to allow supermarkets to work together to feed the nation. Find out more here: https://www.gov.uk/government/news/supermarkets-to-join-forces-to-feed-the-nation",,,#coronavirus,1240712692073148417,https://twitter.com/DefraGovUK/status/1240712692073148417
2020-03-19 18:31:49,pmdfoster,,34,717,976,"LOTS of #Coronavirus noise out there, so have been talking to senior NHS doctors about what is REALLY going on. Some good stuff, some bad....this is NOT meant to be alarming, but it MIGHT make people think about need to take 'social distancing' advice seriosly 1/Thread",,,#Coronavirus,1240707565941489664,https://twitter.com/pmdfoster/status/1240707565941489664
2020-03-19 18:17:14,KeithRSteele,,37,180,519,"The funniest #coronavirus video you’ll likely see. This will be all of us with kids in 2 weeks!!!! ",,,#coronavirus,1240703896785313792,https://twitter.com/KeithRSteele/status/1240703896785313792
2020-03-19 17:53:32,mollycgrace94,,1553,7058,22075,"After a full day at work serving the NHS as I do every day, I go to shop for food and am greeted with this. Emotional doesn’t even cut it. #nhs #coronavirus #sainsburys #food #COVID19 #nhsworkers",,,#nhs #coronavirus #sainsburys #food #COVID19 #nhsworkers,1240697933143494658,https://twitter.com/mollycgrace94/status/1240697933143494658
2020-03-19 17:34:08,MattNavarra,,1,27,65,"Instagram has published a helpful guide to live video ideas and top tips during the #coronavirus outbreak ",,,#coronavirus,1240693047714705408,https://twitter.com/MattNavarra/status/1240693047714705408
2020-03-19 17:16:53,LeighAKendall,,5,135,186,"We all need to follow social distancing to stop the spread of #coronavirus . This sketchnote from @scriberian shows the things we *can* do (including maintaining our social connections while keeping a physical distance) and the things we need to avoid for the good of us all.",,@scriberian,#coronavirus,1240688706186403840,https://twitter.com/LeighAKendall/status/1240688706186403840
2020-03-19 17:05:02,maitlis,,44,660,904,"Diary of #potus on record response to #coronavirus ",,,#potus #coronavirus,1240685725537824773,https://twitter.com/maitlis/status/1240685725537824773
2020-03-19 17:04:43,10DowningStreet,,460,636,1212,"WATCH LIVE: PM @BorisJohnson holds the daily #coronavirus press conference (19 March 2020) ",,@BorisJohnson,#coronavirus,1240685644847996932,https://twitter.com/10DowningStreet/status/1240685644847996932
2020-03-19 16:50:04,JamesDelingpole,,96,328,440,"Doctors have known chloroquine was effective against #coronavirus since 2005. So why the delay? ",,,#coronavirus,1240681957387837445,https://twitter.com/JamesDelingpole/status/1240681957387837445
2020-03-19 16:10:57,TanDhesi,,37,266,536,"Paying shareholders £170 million, while asking @easyJet staff (who grafted to take the company to such heights) to take 3 months unpaid leave because of #Coronavirus! Can someone spot what’s gone wrong here? ",,@easyJet,#Coronavirus,1240672114560073730,https://twitter.com/TanDhesi/status/1240672114560073730
2020-03-19 15:58:44,ymxr6,,127,1220,3336,"Nah this picture is heartbreaking. It says a thousand words. The greed people are showing right now is disgusting! #coronavirus #COVID19 #LockdownLondon",,,#coronavirus #COVID19 #LockdownLondon,1240669041997602819,https://twitter.com/ymxr6/status/1240669041997602819
2020-03-19 15:33:12,WoodbridgeEmpor,,13,60,104,"Are you in Isolation? Are you feeling poorly? Would you like a FREE Book? If yes then watch below and tell me which book you would like UK only and one per household #BuyAStrangerABook #coronavirus ",,,#BuyAStrangerABook #coronavirus,1240662614423875585,https://twitter.com/WoodbridgeEmpor/status/1240662614423875585
2020-03-19 15:14:39,patcondell,,50,337,768,"Xi Jinping and the Chinese Communist Party are directly responsible for every death from the #Wuhanvirus #Chinesevirus #Coronavirus pandemic. They covered it up to save face. Now they have lost face and shamed their country. ",,,#Wuhanvirus #Chinesevirus #Coronavirus,1240657945723011072,https://twitter.com/patcondell/status/1240657945723011072
2020-03-19 15:12:28,Caolanmcaree,,324,815,5209,"They may take our freedom but they'll never take our SALADS.... #coronavirus #Coronavirusireland #COVID19ireland",,,#coronavirus #Coronavirusireland #COVID19ireland,1240657397842153472,https://twitter.com/Caolanmcaree/status/1240657397842153472
2020-03-19 14:50:41,jackieao5,,8,151,236,"Do the right thing to help our #nhsworkers #coronavirus ",,,#nhsworkers #coronavirus,1240651915970711552,https://twitter.com/jackieao5/status/1240651915970711552
2020-03-19 14:50:00,DWP,,72,315,221,"#Coronavirus: Changes to jobcentre appointments ",,,#Coronavirus,1240651744159453187,https://twitter.com/DWP/status/1240651744159453187
2020-03-19 14:23:42,educationgovuk,,184,1644,2216,"Low-income families whose children are eligible for free school meals will be offered vouchers or meals at home, even if they are no longer attending school due to #coronavirus Read more: http://www.gov.uk/government/news/plans-set-out-to-support-pupils-eligible-for-free-school-meals #covid19uk",,,#coronavirus #covid19uk,1240645124503281671,https://twitter.com/educationgovuk/status/1240645124503281671
2020-03-19 14:10:14,SkyNews,,20,203,829,"""We have been using our distillery to make hand sanitiser."" Co-founder of Brewdog, James Watt explains how the company is helping during the #coronavirus crisis. Get the latest on #Covid19 here: https://trib.al/Yf1mFnZ",,,#coronavirus #Covid19,1240641735174303745,https://twitter.com/SkyNews/status/1240641735174303745
2020-03-19 13:27:08,rosiewright99,,446,2892,7342,"I’ve just been into my main supermarket in Lyon (in lockdown!) shoppers are 1m apart, it’s calm, no queues and plenty of food! Seems to be a different picture in the UK who haven’t got the restrictions #coronavirus #supermarket #stockpiling",,,#coronavirus #supermarket #stockpiling,1240630890436452355,https://twitter.com/rosiewright99/status/1240630890436452355
2020-03-19 12:59:40,Doctorshaib,,4,76,98,"A helpful #coronavirus, nudge to friends, family and colleagues for keeping a low profile. ",,,#coronavirus,1240623975761313794,https://twitter.com/Doctorshaib/status/1240623975761313794
2020-03-19 12:48:39,NHSuk,,40,1640,1655,"If you have to stay at home because of #coronavirus, it's important to take care of your mental health. For tips on how to keep on top of your mental wellbeing and cope with how you may feel while at home, visit #EveryMindMatters #StaySafeStayHome",,,#coronavirus #EveryMindMatters #StaySafeStayHome,1240621204681211904,https://twitter.com/NHSuk/status/1240621204681211904
2020-03-19 12:36:21,Dr_Ellie,,47,292,723,"PLEASE PLEASE consider cancelling your online shopping order if you are not vulnerable or isolating, to free up slots. I am going to be shopping in person to free up my usual slots for distancing, vulnerable and isolating people. We have a duty to do this #coronavirus",,,#coronavirus,1240618109037359105,https://twitter.com/Dr_Ellie/status/1240618109037359105
2020-03-19 12:27:40,BrookesTimes,,5,38,102,"My cartoon Thursday @TheTimes. We’re all going to need much, much more than the #emergencybailout to keep afloat..... #coronavirus #BorisJohnson #rishisunak",,@thetimes,#emergencybailout #coronavirus #BorisJohnson #rishisunak,1240615923658231808,https://twitter.com/BrookesTimes/status/1240615923658231808
2020-03-19 12:23:47,jahanzaibuk,,0,0,0,"Britons right now #coronavirus #toiletpapercrisis",,,#coronavirus #toiletpapercrisis,1240614947006173184,https://twitter.com/jahanzaibuk/status/1240614947006173184
2020-03-19 11:59:02,cochranecollab,,0,64,54,"There are 2 @CochraneLibrary evidence-based special collections on #coronavirus Infection control and prevention: https://buff.ly/3cyV4Ne Evidence relevant to critical care: https://buff.ly/39scpES All content is open-access and free to read.",,@CochraneLibrary,#coronavirus,1240608719035142150,https://twitter.com/cochranecollab/status/1240608719035142150
2020-03-19 11:56:15,SkyNews,,124,255,323,"BREAKING: A government spokesman says there is ""zero prospect"" of restriction on travel in and out of London. @SamCoatesSky says Downing Street has ""shut down"" much of the speculation around #coronavirus measures. More here: https://trib.al/W3jcEfn",,@SamCoatesSky,#coronavirus,1240608019408392192,https://twitter.com/SkyNews/status/1240608019408392192
2020-03-19 11:52:47,DrDMacaskill,,2,89,202,"Having had a busy morning with meetings and conversations can I please stress loud and clear that #carehome and #homecare frontline staff are CRITICAL and ESSENTIAL in the fight against #coronavirus &amp; their children will require support to allow mum &amp; dad to work. @scottishcare",,@scottishcare,#carehome #homecare #coronavirus,1240607146594746370,https://twitter.com/DrDMacaskill/status/1240607146594746370
2020-03-19 11:39:02,CarolineLucas,,105,1461,2428,"Powerful case for immediate Universal Basic Income as affordable & feasible response to #coronavirus. “Handing out £1000 per person per month would cost £66bn a month - a fraction of nearly £500bn bailout during 2008 financial crisis”https://www.ft.com/content/927d28e0-6847-11ea-a6ac-9122541af204?accessToken=zwAAAXDwFpJAkdOSfSjgaEcR6tOmrJEiVBryBA.MEUCIFYIC39SryJ6fxcBw-iz-LebowUccQUiEIYKEF6suq50AiEAhjI89GjdsbNOwnI82iJYTazRIiw3B_5Jbhg2dmZeY6M&amp;sharetype=gift?token=3a85fc9e-0e46-42b2-ad6e-e274c159fa5e via @financialtimes",,@FinancialTimes,#coronavirus,1240603685262176256,https://twitter.com/CarolineLucas/status/1240603685262176256
2020-03-19 11:34:37,EvieLawson,,277,3517,18822,"If you are making money selling baby milk, medicine, toilet roll or food at ridiculously inflated prices: you are not an entrepreneur, you’re an arsehole. #CoronaVirusUpdate #coronavirus #lockdown #lockdownuk #covid19UK #SelfIsolation #LockdownLondon #Covid_19 #corona",,,#CoronaVirusUpdate #coronavirus #lockdown #lockdownuk #covid19UK #SelfIsolation #LockdownLondon #Covid_19 #corona,1240602573545095168,https://twitter.com/EvieLawson/status/1240602573545095168
2020-03-19 11:33:02,DHSCgovuk,,196,1336,2155,"The #Coronavirus Bill has now been introduced to Parliament. It will mean the Government can take the right action at the right time to protect the public, NHS and social care staff. Measures will only be used when strictly necessary. More info: https://www.gov.uk/government/publications/coronavirus-bill-what-it-will-do/what-the-coronavirus-bill-will-do",,,#Coronavirus,1240602175434342401,https://twitter.com/DHSCgovuk/status/1240602175434342401
2020-03-19 11:17:48,Joelrookwood,,17,15,69,"I’m on Day 7 of the #CoronaVirus I've been in isolation with my wife and toddler since before showing symptoms. We're ok, but I’ve had pneumonia twice - so we hope and pray. The UK only test those admitted to hospitals now, but I'm sure this is it. So - here are 7 suggestions:",,,#CoronaVirus,1240598342524112896,https://twitter.com/Joelrookwood/status/1240598342524112896
2020-03-19 11:00:05,KMiylk,,0,0,17,"#coronavirus motivated #Homeoffice is appropriately stacked with plush animals and #Ghibli paraphernalia. Plus, the new working hours are on display for all to see.",,,#coronavirus #Homeoffice #Ghibli,1240593883844751360,https://twitter.com/KMiylk/status/1240593883844751360
2020-03-19 10:43:02,caralynknightx,,0,0,12,"greetin at the fact penis shaped pasta is sold out #coronavirus pic.twitter.com/bNrIsh9OqG",,,#coronavirus,1240589591083704320,https://twitter.com/caralynknightx/status/1240589591083704320
2020-03-19 10:08:57,DiseaseMatters,,49,835,2364,"More ‘on the upside’ of #coronavirus. While humans carry out social distancing, a group elephants broke into a village in Yunan province, looking for food. They ended up drinking 30kg of corn wine and got so drunk that they fell asleep in a nearby tea garden. ",,,#coronavirus,1240581013367070721,https://twitter.com/DiseaseMatters/status/1240581013367070721
2020-03-19 10:06:22,DefenceHQ,,6,104,208,"The Defence Secretary @BWallaceMP has announced a new military COVID Support Force ready to support public services as required. See quote below #coronavirus ",,@BWallaceMP,#coronavirus,1240580363572908032,https://twitter.com/DefenceHQ/status/1240580363572908032
2020-03-19 10:00:51,NHSDigital,,12,136,195,"Messaging and conferencing app @MicrosoftTeams, will be available for free across the NHS, to counter the increased risks associated with #coronavirus Read more here https://digital.nhs.uk/news-and-events/latest-news/messaging-tool-for-nhs-to-support-remote-working-during-coronavirus-outbreak",,@MicrosoftTeams,#coronavirus,1240578976571162624,https://twitter.com/NHSDigital/status/1240578976571162624
2020-03-19 09:34:49,BethanyHey,,86,1057,1091,"My lovely friend, Lucy, had her bike stolen last night. She is a nurse in the #NHS and hoped to cycle to work during the #coronavirus outbreak. If anyone in London is able to help her with a bike to use, please shout! #coronahelp #NHSheroes",,,#NHS #coronavirus #coronahelp #NHSheroes,1240572424468475912,https://twitter.com/BethanyHey/status/1240572424468475912
